,Article,Date,Symbol,Time,Title,Url
76,"  (Adds Abbvie, Allergan, TRW Auto, Telefonica, Bingham McCutchen, Fred's, GTECH, Slovak Telekom, Cliffs Natural, Rosneft, Woolworths, Koncar, Dong Energy ; updates Fiat Chrysler)July 17 The following bids, mergers, acquisitions and disposals were reported by 2000 GMT on Thursday:** Shire Plc and U.S. drugmaker Abbvie Inc  plan to announce a $53 billion merger as soon as Friday morning, two people said.** Allergan Inc, trying to fend off a hostile takeover bid from Valeant Pharmaceuticals International Inc , has thrown up obstacles to a special shareholders meeting, its biggest investor said.** German car parts maker ZF Friedrichshafen AG can raise its bid for U.S.-based TRW Automotive Holdings Corp  to as much as $13 billion, Bloomberg reported, citing people with knowledge of the matter.** Telefonica's move to reduce its stake in Italian rival Telecom Italia may help the Spanish phone group appease regulators over competition concerns in Brazil and possibly accelerate consolidation in that market.** In the latest sign of financial pressures in the legal industry, the 123-year-old Boston law firm Bingham McCutchen is seeking a merger with another top U.S. firm and has reached out to at least four in the past three months, sources told Reuters.** Private equity firm Sycamore Partners is in talks with regional discount store operator Fred's Inc about a potential takeover, according to people familiar with the matter.** Italian-regulated gaming company GTECH is backing its $4.7 billion cash and stock acquisition of U.S.-based International Game Technology with a $10.7 billion bridge loan.** The Slovak government has mandated JP Morgan and Citigroup to advise on the sale of its 49 percent stake in Slovak Telekom, a unit of Deutsche Telekom, a spokeswoman said.** Casablanca Capital LP said two independent proxy advisory firms have recommended shareholders of Cliffs Natural Resources Inc vote in favor of the hedge fund's bid to replace a majority of the miner's board members.** Morgan Stanley does not believe new U.S. sanctions on Russian oil company Rosneft will affect a pending deal between the two companies, the bank's chief financial officer said. ** South Africa's Woolworths cleared the final hurdle to its $2 billion takeover of David Jones after an Australian court gave the upscale clothing and food retailer the green light on Thursday.** The Croatian government said it would sell a minority stake in electrical firm Koncar to raise funds for overhauling the newest European Union member's sole fertilizer plant Petrokemija.** Fiat Chrysler has denied a magazine report saying it's in merger talks with Volkswagen, while the German carmaker said it had no takeovers on its agenda.** Denmark's Dong Energy has agreed to divest 50 percent of a German offshore wind farm project to a group of Danish pension funds, a sale that would free up capital to expand its offshore wind business.** U.S. investment fund Blackstone Group LP paid 3.615 billion euros ($5 billion) for a portfolio of home loans belonging to Spain's bailed-out Catalunya Banc, the lender said on Thursday.** Japan's biggest trading house Mitsubishi Corp  has submitted a non-binding bid to buy Murphy Oil Corp's  Malaysian oil and gas assets valued at about $2.5 billion, a person familiar with the matter told Reuters. ** Hyundai Motor Group on Thursday expressed interest in buying the site of Korea Electric Power's Seoul headquarters, which real estate analysts said could fetch at least 3 trillion won ($2.91 billion).** Britain's Vodafone and its Greek business partner Wind have offered to buy the shares they don't already own in Forthnet, a small Greek internet, telephony and pay television provider, Forthnet said on Thursday.** General Electric Co is in talks to sell its century-old household appliances business for as much as $2.5 billion, Bloomberg reported, citing people familiar with the matter.** Australia's New South Wales state government is evaluating bids for two power stations it hopes will sell for at least A$1 billion ($937.3 million), a spokeswoman said on Thursday.** John Malone's cable group Liberty Global Plc  has bought a 6.4 percent stake in ITV from BSkyB .The sale, at a price of 481 million pounds ($824 million), may also indicate that BSkyB is looking to raise cash to push ahead with its own expansion plans after it opened talks this year to buy Rupert Murdoch's Sky Italia and Sky Deutschland. Goldman Sachs placed 190 million shares in ITV at 190 pence ($320) each on Thursday, in a transaction linked to Liberty Global's acquisition of a stake in the British broadcaster, traders said.** German engineering group Siemens has been preparing an offer to acquire U.S.-based compressor and turbine maker Dresser-Rand, German magazine Manager Magazin reported on Thursday, citing sources close to Siemens.** Hong Kong-based private equity firm Gaw Capital Partners is among several parties that have submitted binding bids for a controlling stake in South Korea's Parnas Hotel Co Ltd, three people with direct knowledge of the matter said.The deal is seen worth around 600-800 billion won, two of the people said.** Shareholders of Hyundai Logistics Co, a unit of South Korean conglomerate Hyundai Group, signed a contract to sell a 600 billion won stake in the unit to Japanese financial firm Orix Corp, the group said on Thursday.** Switzerland's Novartis and German investment company BWK are selling their stakes in medical skin patch maker LTS Lohmann to fellow shareholder Dievini Hopp BioTech, having failed to find a third-party buyer for the business.** Brazil's state-controlled oil company Petrleo Brasileiro SA is in talks to sell the 40 percent stake it owns of a Brazilian natural gas distributor to electricity holding company Cia Energtica de Minas Gerais SA.** South Korean steelmaker Posco said on Thursday it will pursue the sale of three units including a liquefied natural gas (LNG) terminal in order to improve its financial structure.** Love Culture Inc on Wednesday filed for Chapter 11 bankruptcy, becoming the latest women's apparel retailer to seek protection from creditors, and said it may be sold after having received interest from possible buyers.** Cyprus-based Golboot Holdings, a firm controlled by Goldman Sachs Group Inc, sold 11.8 million shares, or a 1.91 percent stake, in Indian auto maker Mahindra and Mahindra Ltd via a block deal on the BSE exchange.** The Carlyle Group LP raised about $78 million by selling its entire stake in India's Repco Home Finance Ltd , exchange data showed, making a near nine-fold return on its six-year old investment.($1 = 0.74 Euros)  ($1 = 0.58 British Pounds)  ($1 = 1028.95 Korean Won)  ($1 = 1.07 Australian Dollars)(Compiled by Ankit Ajmera and Amrutha Gayathri in Bangalore)",2014-07-17,ABBV,"Thu Jul 17, 2014 | 4:04pm EDT",Deals of the day- Mergers and acquisitions,http://www.reuters.com//article/deals-day-idUSL4N0PS2C220140717?type=companyNews
77,"   By Olivia Oran and Soyoung Kim  Shire Plc and U.S. drugmaker Abbvie Inc plan to announce a $53 billion merger as soon as Friday morning, two people said on Thursday.Dublin-based Shire, which sells drugs for rare diseases, said earlier this week it was ready to recommend a deal to shareholders after AbbVie increased its offer. AbbVie, which is based in Chicago and makes top-selling arthritis drug Humira, boosted its bid for Shire to 53.20 pounds per share on Sunday. Shire has rejected four previous bids.The people cautioned the deal could still take longer to complete and the deadline for an offer could be extended.  Under British takeover rules AbbVie has until July 18 to announce a firm offer for Shire, extend the deadline for an offer, or walk away. AbbVie is eager to buy Shire both to reduce its U.S. tax bill by moving its tax base to Britain - a tactic known as inversion - and to diversify its drug portfolio. AbbVie currently generates nearly 60 percent of its revenue from Humira, the world's top-selling medicine, which loses U.S. patent protection in late 2016. AbbVie's move is the second attempt by a U.S. drugmaker to buy a London-listed rival after Pfizer Inc's $118 billion pursuit of AstraZeneca Plc failed in May over price. Reuters reported on Saturday that Shire had asked AbbVie to sweeten its offer to near 53 pounds per share so it could recommend the deal. Shire confirmed the news on Monday.  Representatives for Shire and AbbVie declined to comment. (This version of the story corrects paragraph 7 to show failed bid for AstraZeneca happened in May not June) (Reporting by Olivia Oran. Editing by Andre Grenon)",2014-07-17,ABBV,"Thu Jul 17, 2014 | 4:00pm EDT","Shire, AbbVie to announce $53 billion merger by Friday: sources",http://www.reuters.com//article/us-shire-abbvie-sale-idUSKBN0FM27220140717?type=companyNews
78,"  (Corrects paragraph 7 to show failed bid for AstraZeneca happened in May not June))By Olivia Oran and Soyoung KimJuly 17 Shire Plc and U.S. drugmaker Abbvie Inc plan to announce a $53 billion merger as soon as Friday morning, two people said on Thursday.Dublin-based Shire, which sells drugs for rare diseases, said earlier this week it was ready to recommend a deal to shareholders after AbbVie increased its offer. AbbVie, which is based in Chicago and makes top-selling arthritis drug Humira, boosted its bid for Shire to 53.20 pounds per share on Sunday. Shire has rejected four previous bids.The people cautioned the deal could still take longer to complete and the deadline for an offer could be extended. Under British takeover rules AbbVie has until July 18 to announce a firm offer for Shire, extend the deadline for an offer, or walk away.AbbVie is eager to buy Shire both to reduce its U.S. tax bill by moving its tax base to Britain - a tactic known as inversion - and to diversify its drug portfolio. AbbVie currently generates nearly 60 percent of its revenue from Humira, the world's top-selling medicine, which loses U.S. patent protection in late 2016. AbbVie's move is the second attempt by a U.S. drugmaker to buy a London-listed rival after Pfizer Inc's $118 billion pursuit of AstraZeneca Plc failed in May over price.Reuters reported on Saturday that Shire had asked AbbVie to sweeten its offer to near 53 pounds per share so it could recommend the deal. Shire confirmed the news on Monday.Representatives for Shire and AbbVie declined to comment.    (Reporting by Olivia Oran. Editing by Andre Grenon)",2014-07-17,ABBV,"Thu Jul 17, 2014 | 3:50pm EDT","CORRECTED-UPDATE 1-Shire, AbbVie to announce $53 bln merger by Friday -sources",http://www.reuters.com//article/shire-abbvie-sale-idUSL2N0PS1P820140717?type=companyNews
79,"  (Corrects 6th paragraph to show Pfizer's failed bid for AstraZeneca happened in May not June)By Olivia Oran and Soyoung KimJuly 17 Shire Plc and U.S. drugmaker Abbvie Inc plan to announce a $53 billion merger as soon as Friday morning, two people said on Thursday.Dublin-based Shire, which sells drugs for rare diseases, said earlier this week it was ready to recommend a deal to shareholders after AbbVie increased its offer. AbbVie, which is based in Chicago and makes top-selling arthritis drug Humira, boosted its bid for Shire to 53.20 pounds per share on Sunday. Shire has rejected four previous bids. Under British takeover rules AbbVie has until July 18 to announce a firm offer for Shire, extend the deadline for an offer, or walk away.AbbVie is eager to buy Shire both to reduce its U.S. tax bill by moving its tax base to Britain - a tactic known as inversion - and to diversify its drug portfolio. AbbVie currently generates nearly 60 percent of its revenue from Humira, the world's top-selling medicine, which loses U.S. patent protection in late 2016. AbbVie's move on Shire is the second attempt by a U.S. drugmaker to buy a London-listed rival after Pfizer Inc's  $118 billion pursuit of AstraZeneca Plc failed in May over price.Representatives for Shire and AbbVie declined to comment.    (Reporting by Olivia Oran. Editing by Andre Grenon)",2014-07-17,ABBV,"Thu Jul 17, 2014 | 1:41pm EDT","CORRECTED-Shire, AbbVie to announce $53 billion merger by Friday -sources",http://www.reuters.com//article/shire-abbvie-sale-idUSL2N0PS1HD20140717?type=companyNews
80,"   By Paul Sandle | LONDON  LONDON U.S. drugmaker AbbVie Inc bought Dublin-based Shire Plc on Friday in a 32 billion pound ($54.7 billion) deal that will allow it to slash its tax bill by relocating to Britain.The London-listed company, which makes expensive medicines to treat rare diseases, fought off four earlier bids from AbbVie until the U.S. firm raised its price to 52.48 pounds per share - made up of 24.44 pounds in cash and 0.8960 new AbbVie shares.Chicago-based AbbVie is buying Shire to cut both its U.S. tax bill and its reliance on arthritis drug Humira, the world's top selling medicine which loses U.S. patent protection in 2016. AbbVie, which generates nearly 60 percent of its revenue from Humira, had until Friday to announce a firm offer for Shire, extend the deadline or walk away under UK takeover rules.It now plans to create a company listed in New York, incorporated in Jersey, the Channel Islands, and tax-domiciled in Britain, which will pay an effective tax of about 13 percent by 2016, sharply lower than its current rate of about 22 percent, making the deal one of the biggest driven by the tactic known as tax inversion.America's Pfizer Inc tried to pull off the same trick earlier this year when it made a bid for Britain's AstraZeneca plc though its $118 billion deal was rejected.Calls for political action to stop tax inversion deals are growing in the United States. U.S. Treasury Secretary Jacob Lew urged Congress this week to take steps to discourage companies moving their tax domiciles aboard, saying ""economic patriotism"" was needed.AbbVie's chairman and chief executive Richard Gonzalez said he thought the debate would be more appropriately shifted to tax reform and making companies more competitive in the global economy. U.S. companies cannot move overseas earnings back into the country for acquisitions or investment without losing part of it to the taxman. ""Companies like ours need access to our global cash flows to be able to make investments all around the world, but specifically to be able to make investments in the United States, and today we at a disadvantage versus many of our foreign competitors,"" he said.However, he added, tax cutting was not the main objective of the Shire deal.""It's not the primary rationale for this,"" he told analysts on a conference call, explaining that the combined group would have leadership positions in immunology, rare diseases, neuroscience, and metabolic and liver diseases, as well as a best-in-class product development platform, a stronger pipeline and better R&D capabilities.The merged group will also have more firepower for acquisitions, he said, particularly to bolster the rare disease business, the foundations of which were built on acquisitions by Shire. RAISED GUIDANCE Shire's board had said on Monday it was ready to recommend the higher offer from AbbVie, signaling the end of a lengthy courtship. AbbVie's agreed price represents a premium of about 53 percent to Shire's share price on May 2, the last business day before AbbVie's first offer, which was rebuffed by Shire.Shares in Shire, which will own about 25 percent of the combined group, closed 3.9 percent higher at 49.96 pounds, while AbbVie was up 2.1 percent to $54.65 at 1615 GMT.Gonzalez said Shire Chief Executive Flemming Ornskov, whose tenure at the drugmaker was marked by earnings upgrade after earnings upgrade, would stay on, initially to help with integration and then to head a dedicated rare disease division.Separately, Shire raised its earnings guidance for the year on Friday, to low-to-mid 30 percent growth, from mid-to-high 20 percent growth. The company, which also produces hyperactivity drug Vyvanse, reported record revenue of $1.5 billion for its second quarter and a 42 percent jump in its preferred earnings measure of non-GAAP adjusted earnings per ADS to $2.67. Shire was advised by Goldman Sachs, Morgan Stanley, Deutsche Bank, Evercore and Citi, while AbbVie was advised by J.P.Morgan.($1 = 0.5847 British Pounds) (Editing by Sophie Walker)",2014-07-18,ABBV,"Fri Jul 18, 2014 | 7:04pm EDT",U.S. drugmaker AbbVie finally wins Dublin's Shire with $55 billion deal,http://www.reuters.com//article/us-abbvie-shire-idUSKBN0FN0X620140718?type=companyNews
81,"  * FTSE 100 closes up 0.2 pct at 6,749.45 points* Shire rises after agreeing takeover by Abbvie* ITV also up on bid speculation* Shooting-down of airliner weighs on sentimentBy Sudip Kar-GuptaLONDON, July 18 Drugmaker Shire and TV group ITV nudged up Britain's stock market, enabling it to recover from earlier losses caused by concerns about Ukraine, after an airliner was shot down in the violence-ridden region. The blue-chip FTSE 100 index, which had been in negative territory for much of the day, staged a late rally to close up by 0.2 percent, or 11.13 points, at 6,749.45 points on Friday.Global stock markets had slumped on Thursday after the shooting-down over eastern Ukraine of a Malaysia Airlines Boeing 777 with 298 people on board. World leaders demanded an international investigation into the plane crash, which could mark a turning point in the worst crisis between Russia and the West since the Cold War if it convinces reluctant Europeans to get behind tougher sanctions on Russia long sought by the United States.However, a rally in Shire enabled the FTSE 100 to come off its earlier intraday lows. Shire rose nearly 4 percent, adding the most points to the FTSE, after U.S. rival Abbvie  agreed a $55 billion deal to take it over.Merger speculation also lifted ITV by 3.8 percent, after cable group Liberty Global's decision to buy BSkyB's  6.4 percent stake in ITV boosted prospects of a wider bid. In spite of the worries about the Ukraine conflict, some traders have said that corporate takeover activity, and the fact that equities offer better returns than bonds or cash, should enable stock markets to rally into the end of 2014.""The geopolitical situation is quite jittery at the moment, but everybody is looking at the dip as a buying opportunity,"" said Novum Securities' technical analyst Adrian Slack.Others, however, were more circumspect.""We were buying the dips up until the plane crash. We are now a bit cautious and will not be taking new positions going into the weekend,"" said Mark Ward, head of trading at Sanlam Securities.   (Additional reporting by Andrew Winterbottom and Tricia Wright; Editing by Mark Heinrich)",2014-07-18,ABBV,"Fri Jul 18, 2014 | 12:00pm EDT",Shire and ITV lead late rally for UK's FTSE,http://www.reuters.com//article/markets-britain-stocks-idUSL6N0PT4FS20140718?type=companyNews
82,"   By Alasdair Reilly | LONDON  LONDON U.S. drugmaker AbbVies (ABBV.N) 32 billion pounds acquisition of Dublin-based Shire Plc (SHP.L) is backed with a 13.5 billion pounds ($23.03 billion) bridge loan, according to the company's filing with the Securities and Exchange Commission in the US. JP Morgan is the sole arranger and underwriter of the bridge loan, which is expected to be refinanced with up to 15.5 billion pounds of senior unsecured bonds that AbbVie is planning to issue to cover the cash element of the acquisition.AbbVie bought Shire on Friday in a $54.7 billion deal that will allow it to slash its tax bill by relocating to Britain.  The bridge loan comprises a loan of up to 9.1 billion pounds with a 364-day maturity, a 3.2 billion pounds loan with a 364-day maturity, and a 1.2 billion pounds facility with a maturity of 60 days. The financing pays an interest margin of 62.5 basis points (bps) to 150bps over Libor, depending on rating of the merged company after the acquisition.  There is also an initial commitment fee of 10bps on undrawn amounts, which can ratchet in a range from 6bps to 17.5bps, depending on the company's public debt rating after the acquisition.AbbVie is being encouraged to refinance the debt quickly by a duration fee of 50bps, which is payable 90 days after closing. This rises to 75bps 180 days after closing and to 100bps 270 days after closing. Shire was advised by Goldman Sachs, Morgan Stanley, Deutsche Bank, Evercore and Citigroup, while AbbVie was advised by J.P. Morgan.($1 = 0.5861 British Pounds) (Editing by Tessa Walsh)",2014-07-18,ABBV,"Fri Jul 18, 2014 | 10:57am EDT",AbbVies Shire merger backed with 13.5 billion pound bridge loan,http://www.reuters.com//article/us-loans-abbvie-idUSKBN0FN1UU20140718?type=companyNews
83,"   By Alasdair Reilly | LONDON, July 18  LONDON, July 18 U.S. drugmaker AbbVie's  32 billion pounds acquisition of Dublin-based Shire Plc  is backed with a 13.5 billion pounds ($23.03 billion) bridge loan, according to the company's filing with the Securities and Exchange Commission in the US.JP Morgan is the sole arranger and underwriter of the bridge loan, which is expected to be refinanced with up to 15.5 billion pounds of senior unsecured bonds that AbbVie is planning to issue to cover the cash element of the acquisition.AbbVie bought Shire on Friday in a $54.7 billion deal that will allow it to slash its tax bill by relocating to Britain. The bridge loan comprises a loan of up to 9.1 billion pounds with a 364-day maturity, a 3.2 billion pounds loan with a 364-day maturity, and a 1.2 billion pounds facility with a maturity of 60 days. The financing pays an interest margin of 62.5 basis points (bps) to 150bps over Libor, depending on rating of the merged company after the acquisition.There is also an initial commitment fee of 10bps on undrawn amounts, which can ratchet in a range from 6bps to 17.5bps, depending on the company's public debt rating after the acquisition. AbbVie is being encouraged to refinance the debt quickly by a duration fee of 50bps, which is payable 90 days after closing. This rises to 75bps 180 days after closing and to 100bps 270 days after closing.Shire was advised by Goldman Sachs, Morgan Stanley, Deutsche Bank, Evercore and Citigroup, while AbbVie was advised by J.P. Morgan. ($1 = 0.5861 British Pounds)   (Editing by Tessa Walsh)",2014-07-18,ABBV,"Fri Jul 18, 2014 | 10:53am EDT",RLPC-AbbVie's Shire merger backed with 13.5 bln stg bridge loan,http://www.reuters.com//article/loans-abbvie-idUSL6N0PT4FK20140718?type=companyNews
84,"  * FTSE 100 flat* Shire rises after agreeing takeover by Abbvie* Shooting down of passenger plane hits sentimentBy Sudip Kar-GuptaLONDON, July 18 A rise in drug maker Shire  propped up Britain's stock market on Friday, cushioning it to an extent from concerns about the conflict in Ukraine, where a passenger plane was shot down over the rebel-controlled east. The blue-chip FTSE 100 index was flat at 6,737.92 points going into the close of the trading day.Global stock markets had slumped on Thursday after the shooting down of a Malaysian airliner with 298 people on board.World leaders demanded an international investigation into the plane crash, which could mark a turning point in the worst crisis between Russia and the West since the Cold War if it convinces reluctant Europeans to get behind tougher sanctions on Russia long sought by the United States. However, a rally in Shire enabled the FTSE 100 to come off its earlier intraday lows.Shire rose 3.3 percent, adding the most points to the FTSE, after U.S. rival Abbvie agreed a $55 billion deal to take it over. In spite of the worries about the Ukraine conflict, some traders have said that corporate takeover activity, and the fact that equities offer better returns than bonds or cash, should enable stock markets to rally into the end of 2014.""The geopolitical situation is quite jittery at the moment, but everybody is looking at the dip as a buying opportunity,"" said Novum Securities' technical analyst Adrian Slack.Others, however, were more circumspect.""We were buying the dips up until the plane crash. We are now a bit cautious and will not be taking new positions going into the weekend,"" said Mark Ward, head of trading at Sanlam Securities.   (Additional reporting by Andrew Winterbottom and Tricia Wright; Editing by Kevin Liffey)",2014-07-18,ABBV,"Fri Jul 18, 2014 | 10:17am EDT",Shire rally props up UK's FTSE,http://www.reuters.com//article/markets-britain-stocks-idUSL6N0PT3RR20140718?type=companyNews
85,"  LONDON Pharmaceutical firm AbbVie's (ABBV.N) chairman and chief executive said tax benefits were not the main reason it bought London-listed Shire (SHP.L).Richard Gonzalez told analysts on a conference call on Friday that tax was ""clearly a benefit"", but it was not the primary rationale behind the $55 billion deal, adding that the tie-up had compelling financial and strategic attractions. AbbVie will cut its tax level to about 13 percent after it re-domiciles in Britain following the deal.    (Reporting by Paul Sandle; Editing by Pravin Char)",2014-07-18,ABBV,"Fri Jul 18, 2014 | 9:51am EDT",AbbVie CEO says tax is not primary reason for buying Shire,http://www.reuters.com//article/us-abbvie-shire-ceo-idUSKBN0FN1O220140718?type=companyNews
86,"  LONDON, July 18 Pharmaceutical firm AbbVie's  chairman and chief executive said tax benefits were not the main reason it bought London-listed Shire.Richard Gonzalez told analysts on a conference call on Friday that tax was ""clearly a benefit"", but it was not the primary rationale behind the $55 billion deal, adding that the tie-up had compelling financial and strategic attractions.  AbbVie will cut its tax level to about 13 percent after it re-domiciles in Britain following the deal.    (Reporting by Paul Sandle; Editing by Pravin Char) ",2014-07-18,ABBV,"Fri Jul 18, 2014 | 9:47am EDT",AbbVie CEO says tax is not primary reason for buying Shire,http://www.reuters.com//article/abbvie-shire-idUSL6N0PT43220140718?type=companyNews
