,Article,Date,Symbol,Time,Title,Url
146,"  LONDON Oct 24 Pharmaceutical firm Shire  raised its guidance for full-year earnings on Friday, underlining its strong prospects as a standalone company after AbbVie Inc officially ditched its $55 billion purchase of the group on Tuesday.Dublin-based Shire, which produces drugs to treat hyperactivity and rare diseases, posted a 60 percent jump in third-quarter earnings per ADS to $2.93 on revenue up nearly a third at $1.6 billion.It said it now expected to deliver earnings growth in the high 30 percent range for the full year, up from its expectations in July of growth in the low-to-mid 30 percent range. AbbVie walked away from the deal after the U.S. Treasury department tightened its rules to curtail companies doing deals that would allow them to redomicile overseas to cut corporate tax rates. In its initial defence against a takeover, Shire had said it planned to double sales to $10 billion by 2020, $7 billion of which would come from its existing products and $3 billion from its pipeline. (Reporting by Paul Sandle; editing by Kate Holton)",2014-10-24,ABBV,"Fri Oct 24, 2014 | 7:13am EDT",Jilted Shire raises guidance again after Q3 earnings jump,http://www.reuters.com//article/shire-results-idUSFWN0SJ00X20141024?type=companyNews
147,"   By Ransdell Pierson  Pharmacy benefit manager Express Scripts Holding Co said it may quickly change its preferred drug formulary to favor an expected new hepatitis C drug from AbbVie if it is clinically equivalent and less costly than Gilead Science Inc's $84,000 Sovaldi and $94,500 Harvoni treatments.Sovaldi, with its price tag of $1,000 a pill, has become a lightning rod in a debate over the high cost of specialty drugs, despite its cure rate of more than 90 percent and gentle side effect profile.""The cost of it is unsustainable for many of our plans,"" Steve Miller, chief medical officer of Express Scripts, told analysts on a conference call on Wednesday, referring to Sovaldi. The drug had third quarter sales of $2.8 billion even though it was only approved in December.Harvoni, approved this month by U.S. regulators, combines Sovaldi with another Gilead drug and is expected to dominate treatment of the liver disease that affects an estimated 3 million Americans.    Miller said Sovaldi's cost is particularly hitting state prisons and Medicaid, the insurance program for the indigent funded jointly by states and the federal government, because those populations have high rates of infection with the hepatitis C virus. Express Scripts said U.S. regulators by December could approve AbbVie's product, which combines three drugs into a single pill.""(We) are hoping they take a different approach when it comes to pricing,"" Miller said.But Adelle Infante, an AbbVie spokeswoman, said no price has  been disclosed for her company's drug, which does not yet have a name. The suburban Chicago drugmaker is hoping it will be approved this year. Gilead officials could not immediately be reached for comment.The AbbVie product, like Harvoni, would not need to be taken with interferon, a harsh injectable drug that for years had been part of a standard regimen for the disease, which can quietly harm or destroy the liver over a period of decades. Should the AbbVie drug be deemed clinically equivalent but less costly than Sovaldi and Harvoni, Express Scripts spokesman Brian Henry said the Gilead drugs could be given lower priority on its drug formulary, or be removed from it. Express Scripts is the largest U.S. pharmacy benefit manager.  It administers drug benefits for employers and health plans and also runs large mail order pharmacies.Shares of Gilead, which on Tuesday reported a more than tripling of net profit for the third quarter, were down 3.6 percent in afternoon trading. (Reporting by Ransdell Pierson; Editing by David Gregorio)",2014-10-29,ABBV,"Wed Oct 29, 2014 | 2:01pm EDT",Express Scripts says AbbVie drug could displace Sovaldi on formulary,http://www.reuters.com//article/us-express-scr-abbvie-gilead-sciences-idUSKBN0II20M20141029?type=companyNews
148,"   By Ransdell Pierson  Oct 29 Pharmacy benefit manager Express Scripts Holding Co said it may quickly change its preferred drug formulary to favor an expected new hepatitis C drug from AbbVie if it is clinically equivalent and less costly than Gilead Science Inc's $84,000 Sovaldi and $94,500 Harvoni treatments.Sovaldi, with its price tag of $1,000 a pill, has become a lightning rod in a debate over the high cost of specialty drugs, despite its cure rate of more than 90 percent and gentle side effect profile.""The cost of it is unsustainable for many of our plans,"" Steve Miller, chief medical officer of Express Scripts, told analysts on a conference call on Wednesday, referring to Sovaldi. The drug had third quarter sales of $2.8 billion even though it was only approved in December.Harvoni, approved this month by U.S. regulators, combines Sovaldi with another Gilead drug and is expected to dominate treatment of the liver disease that affects an estimated 3 million Americans. Miller said Sovaldi's cost is particularly hitting state prisons and Medicaid, the insurance program for the indigent funded jointly by states and the federal government, because those populations have high rates of infection with the hepatitis C virus.Express Scripts said U.S. regulators by December could approve AbbVie's product, which combines three drugs into a single pill.""(We) are hoping they take a different approach when it comes to pricing,"" Miller said. But Adelle Infante, an AbbVie spokeswoman, said no price has  been disclosed for her company's drug, which does not yet have a name. The suburban Chicago drugmaker is hoping it will be approved this year.Gilead officials could not immediately be reached for comment. The AbbVie product, like Harvoni, would not need to be taken with interferon, a harsh injectable drug that for years had been part of a standard regimen for the disease, which can quietly harm or destroy the liver over a period of decades.Should the AbbVie drug be deemed clinically equivalent but less costly than Sovaldi and Harvoni, Express Scripts spokesman Brian Henry said the Gilead drugs could be given lower priority on its drug formulary, or be removed from it.Express Scripts is the largest U.S. pharmacy benefit manager.  It administers drug benefits for employers and health plans and also runs large mail order pharmacies.Shares of Gilead, which on Tuesday reported a more than tripling of net profit for the third quarter, were down 3.6 percent in afternoon trading.   (Reporting by Ransdell Pierson; Editing by David Gregorio)",2014-10-29,ABBV,"Wed Oct 29, 2014 | 1:59pm EDT",Express Scripts says AbbVie drug could displace Sovaldi on formulary,http://www.reuters.com//article/express-scr-abbvie-gilead-sciences-idUSL1N0SO1FW20141029?type=companyNews
149,"  LONDON U.S. law firm Gardy & Notis, a shareholder rights advocate, said on Wednesday it was investigating AbbVie (ABBV.N) and its officers over statements made in connection with the drugmaker's failed move to buy Dublin-based Shire (SHP.L).Gardy & Notis said it was asking investors to get in touch if they had lost money after buying Shire American Depository Receipts between June 20 and Oct. 14.    AbbVie Chief Executive Richard Gonzalez told investors in July that expected tax benefits were ""not the primary rationale"" for the combination but, in reality, the law firm said tax was a critical factor. The U.S. firm ditched the planned $55 billion takeover after the U.S. government announced a change in treatment of so-called tax inversions, sending Shire shares into a tailspin.    (Reporting by Ben Hirschler; Editing by Greg Mahlich)",2014-10-29,ABBV,"Wed Oct 29, 2014 | 10:29am EDT",U.S. law firm says investigating AbbVie over collapsed Shire deal,http://www.reuters.com//article/us-shire-m-a-abbvie-idUSKBN0II1HK20141029?type=companyNews
150,"  LONDON Oct 29 U.S. law firm Gardy & Notis, a shareholder rights advocate,  said on Wednesday it was investigating AbbVie and its officers over statements made in connection with the drugmaker's failed move to buy Dublin-based Shire.Gardy & Notis said it was asking investors to get in touch if they had lost money after buying Shire American Depository Receipts between June 20 and Oct. 14. AbbVie Chief Executive Richard Gonzalez told investors in July that expected tax benefits were ""not the primary rationale"" for the combination but, in reality, the law firm said tax was a critical factor.  The U.S. firm ditched the planned $55 billion takeover after the U.S. government announced a change in treatment of so-called tax inversions, sending Shire shares into a tailspin.     (Reporting by Ben Hirschler; Editing by Greg Mahlich)",2014-10-29,ABBV,"Wed Oct 29, 2014 | 9:54am EDT",U.S. law firm says investigating AbbVie over collapsed Shire deal,http://www.reuters.com//article/shire-ma-abbvie-idUSL5N0SO3OM20141029?type=companyNews
151,"  * Expedia shares jump after results; GoPro rallies* Abbvie shares rise after results, outlook* Indexes up: Dow 1 percent, S&P 1 percent, Nasdaq 1.3 percent   (Updates to late afternoon)By Caroline ValetkevitchNEW YORK, Oct 31 U.S. stocks rose sharply on Friday, with the Dow hitting an intraday record high as the Bank of Japan significantly ramped up its stimulus program, just days after the Federal Reserve wound down its years-long package of incentives.The Dow was on track to set a new closing record high as well, along with the S&P 500, after the December e-minis contract hit an intraday record. Gains were broad, with the benchmark S&P 500 index posting 125 new 52-week highs and two new lows. The Nasdaq Composite recorded 218 new highs and 31 new lows. Among the biggest positives on the S&P 500, Abbvie shares rose 3.5 percent after the drugmaker reported quarterly earnings and said it could deliver strong long-term growth without rushing into another big merger attempt.The Bank of Japan's board voted to accelerate purchases of Japanese government bonds while tripling its purchases of exchange-traded funds and real-estate investment trusts.That could help the outlook for stocks, especially if the U.S. economy keeps improving and earnings beat expectations as they have been. ""The market technically went from violating moving averages to making new highs, and you get this surprise move out of the Bank of Japan which is kind of giving a little bit of a tailwind to the rally,"" said Eric Kuby, chief investment officer at North Star Investment Management Corp. in Chicago.The majority of S&P 500 companies are beating earnings expectations so far. With results in from 70 percent of companies, 75.8 percent are reporting earnings above analyst expectations, according to Thomson Reuters data, well above the 63 percent average in the past 20 years. At 2:27 p.m. (1827 GMT), the Dow Jones industrial average  rose 162.2 points, or 0.94 percent, to 17,357.62, the S&P 500 gained 18.72 points, or 0.94 percent, to 2,013.37 and the Nasdaq Composite added 57.77 points, or 1.27 percent, to 4,623.91.The U.S. dollar rallied as well, pressuring crude oil   prices and spot gold, which dropped 2.6 percent, the most for any day this year. A strong dollar makes commodities such as oil more expensive for buyers using other currencies.Among the day's biggest percentage gains, shares of Expedia  rose 5.5 percent a day after it reported results. GoPro  shares jumped 13.8 percent after forecasting better-than-expected holiday quarter sales.The largest decliner on the Nasdaq was Starbucks, down 2.1 percent, a day after it reported results.Advancing issues outnumbered declining ones on the NYSE by 2,262 to 767, for a 2.95-to-1 ratio on the upside; on the Nasdaq, 1,866 issues rose and 825 fell for a 2.26-to-1 ratio favoring advancers.   (Editing by Chizu Nomiyama, James Dalgleish, Leslie Adler and Chris Reese)",2014-10-31,ABBV,"Fri Oct 31, 2014 | 2:51pm EDT",US STOCKS-S&P 500 on track to end at record; BoJ move adds fuel to rally,http://www.reuters.com//article/markets-stocks-usa-idUSL1N0SQ26L20141031?type=companyNews
152,"  * Expedia shares jump after results; GoPro rallies* Abbvie shares rise after results, outlook* Indexes up: Dow 1 percent, S&P 1 percent, Nasdaq 1.3 percent   (Updates to early afternoon trading, changes byline)By Caroline ValetkevitchNEW YORK, Oct 31 U.S. stocks rose sharply on Friday, with the Dow hitting an intraday record high as the Bank of Japan significantly ramped up its stimulus program, just days after the Federal Reserve wound down its years-long package of incentives.The S&P 500 came within 0.1 percent of its record high, after the December e-minis contract hit an intraday record earlier. Gains were broad, with the benchmark S&P 500 index posting 124 new 52-week highs and two new lows; and the Nasdaq Composite recording 214 new highs and 31 new lows.  Among the biggest positives on the S&P 500, Abbvie shares rose 4 percent after the drugmaker reported quarterly earnings and said it could deliver strong long-term growth without rushing into another big merger attempt.The BoJ's board voted to accelerate purchases of Japanese government bonds while tripling its purchases of exchange-traded funds and real-estate investment trusts.That could help the outlook for stocks, especially if the U.S. economy keeps improving. ""Economic growth (in the United States) is looking pretty good, earnings are good ... we will end the year certainly closer to 2,100 than 2,000 on the S&P 500,"" said Paul Zemsky, chief investment officer of multi-asset strategies and solutions at Voya Investment Management in New York.The majority of S&P 500 companies are beating earnings expectations so far. With results in from 70 percent of companies, 75.8 percent are reporting earnings above analyst expectations, according to Thomson Reuters data, above the 63 percent average in the past 20 years. At 1:11 p.m. Eastern time, the Dow Jones industrial average  rose 172.81 points, or 1 percent, to 17,368.23, the S&P 500 gained 19.12 points, or 0.96 percent, to 2,013.77 and the Nasdaq Composite added 59.55 points, or 1.3 percent, to 4,625.69.The U.S. dollar rallied as well, pressuring crude oil prices and spot gold, which dropped 2.6 percent, the most for any day this year. A strong dollar makes commodities such as oil more expensive for buyers using other currencies.Among the day's biggest percentage gains, shares of Expedia  rose 4.7 percent, a day after it reported results. GoPro shares jumped 15.5 percent after forecasting better-than-expected holiday quarter sales.The largest decliner on the Nasdaq was Starbucks, down 2.0 percent, a day after it reported results.Advancing issues outnumbered declining ones on the NYSE by 2,185 to 828, for a 2.64-to-1 ratio on the upside; on the Nasdaq, 1,862 issues rose and 803 fell for a 2.32-to-1 ratio favoring advancers.   (Additional reporting by Rodrigo Campos; Editing by Chizu Nomiyama, James Dalgleish, Leslie Adler and Chris Reese)",2014-10-31,ABBV,"Fri Oct 31, 2014 | 1:38pm EDT",US STOCKS-Dow hits record high; BoJ ramps up stimulus,http://www.reuters.com//article/markets-stocks-usa-idUSL1N0SQ1VX20141031?type=companyNews
153,"   By Ransdell Pierson  AbbVie, which this month abandoned its planned $55 billion purchase of Dublin drugmaker Shire (SHP.L), reported impressive quarterly earnings on demand for its Humira arthritis drug and said it could deliver strong long-term growth without rushing into another big merger attempt.""The underlying growth prospects of AbbVie don't require us to do a deal of that size,"" AbbVie Chief Executive Richard Gonzalez said in conference call, but added the company was keen on smaller acquisitions, particularly of treatments involving rare diseases, cancer and hepatology.AbbVie shares rose 3.5 percent to $63.35 in morning trading.The Chicago drugmaker, which significantly boosted its full-year earnings forecast, said it had earned $506 million, or 31 cents per share, in the third quarter. That compared with $964 million, or 60 cents per share, a year earlier. Excluding special items, including charges for the attempted Shire deal, AbbVie earned 89 cents per share. Analysts on average expected 77 cents, according to Thomson Reuters I/B/E/S.Sales rose 7.8 percent to $5.02 billion, $200 million above forecasts. ""We see today's results as reinforcing our view that AbbVie shares remain well-positioned heading into 2015,"" said JPMorgan analyst Chris Schott. He said AbbVie could win U.S. marketing approval within weeks for a combination treatment for hepatitis C that may bolster earnings next year and beyond.AbbVie, spun off early last year from Abbott Laboratories (ABT.N), is also testing treatments for cancer, Parkinson's Disease, endometriosis and other diseases. The company had hoped to buy Shire and locate the combined company in Britain to take advantage of the nation's lower tax rate. But AbbVie walked away after tax law changes announced by the U.S. Treasury made the tax-inversion deal less attractive. Sales of Humira, the world's top-selling drug, jumped almost 18 percent to $3.26 billion. They accounted for 65 percent of total sales, underscoring the company's need for other products to broaden its portfolio.Gonzalez attributed Humira's sales growth to the wide range of approved uses of the drug, including for Crohn's disease and psoriasis, and because it is still being introduced in more countries 12 years after its U.S. launch.Although Humira's U.S. patent lapses in late 2016, AbbVie has said it will take years for other drugmakers to develop and win approval for their own generic versions. A few other AbbVie brands showed strong growth in the quarter, including thyroid hormone replacement drug Synthroid, whose sales rose 24 percent to $200 million. But others declined, including cholesterol treatments and AndroGel testosterone gel, whose sales have been hurt by safety concerns for the drug class. AbbVie raised its 2014 profit forecast to between $3.25 and $3.27 per share from its prior view of $3.06 to $3.16.  (Reporting by Ransdell Pierson; Editing by Chizu Nomiyama, James Dalgleish and Lisa Von Ahn)",2014-10-31,ABBV,"Fri Oct 31, 2014 | 1:36pm EDT",AbbVie says strong results lessen need for big deal,http://www.reuters.com//article/us-abbvie-results-idUSKBN0IK16820141031?type=companyNews
154,"  * GoPro rallies as holiday outlook shines* Abbvie shares rise after results, outlook* Indexes up: Dow 1 percent, S&P 1 percent, Nasdaq 1.2 percent   (Updates to midday)By Rodrigo CamposNEW YORK, Oct 31 The Dow industrials hit a record high on Friday as stocks rallied on Wall Street after the Bank of Japan significantly ramped up its stimulus program, just days after the Federal Reserve wound down its years-long package of incentives.The S&P 500 came within 0.1 percent of its record high, after the December e-minis contract hit an intraday record earlier.Gains were broad, with 123 new 52-week highs on the S&P 500 versus just two new lows. The Nasdaq Composite recorded 209 new highs and 27 new lows. The BoJ's board voted 5-4 to accelerate purchases of Japanese government bonds while tripling its purchases of exchange-traded funds and real-estate investment trusts.At the same time, Japan's $1.2 trillion Government Pension Investment Fund announced new allocations for its portfolio, raising its holdings of domestic and foreign stock holdings to 25 percent each from 12 percent.""It's not just the (BoJ) easing but the asset allocation from the pension plan is of course also helpful,"" said Paul Zemsky, chief investment officer of multi-asset strategies and solutions at Voya Investment Management in New York. ""Economic growth (in the United States) is looking pretty good, earnings are good. ... We will end the year certainly closer to 2,100 than 2,000 on the S&P 500,"" he added.The quarterly earnings season has been strong so far, with 75.8 percent of S&P 500 components reporting earnings above analyst expectations, according to Thomson Reuters data, above the 63 percent average in the past 20 years.At 11:59 a.m. (1559 GMT) the Dow Jones industrial average  rose 166.08 points, or 0.97 percent, to 17,361.5, the S&P 500 gained 19.49 points, or 0.98 percent, to 2,014.14, and the Nasdaq Composite added 55.47 points, or 1.21 percent, to 4,621.61. The U.S. dollar rallied as well, pressuring crude oil prices and spot gold, which dropped 2.6 percent, the most for any day this year. A strong dollar makes commodities such as oil more expensive for buyers using other currencies""If you're holding gold as a hedge against inflation, how long can you stay there? It's been a losing trade for a while now,"" Zemsky said.U.S. consumer spending fell for the first time in eight months in September, but the slowdown is likely to be temporary, as other data showed wages in the third quarter recorded their largest increase in more than six years.Abbvie shares rose 4 percent to $63.62 after the drugmaker reported quarterly earnings and said it could deliver strong long-term growth without rushing into another big merger attempt.GoPro shares jumped 12.6 percent to $76.82 the day after it forecast better-than-expected holiday quarter sales.Advancing issues outnumbered declining ones on the NYSE by 2,117 to 852, for a 2.48-to-1 ratio on the upside; on the Nasdaq, 1,815 issues rose and 803 fell for a 2.26-to-1 ratio favoring advancers.   (Reporting by Rodrigo Campos; Editing by Chizu Nomiyama, James Dalgleish and Leslie Adler)",2014-10-31,ABBV,"Fri Oct 31, 2014 | 12:15pm EDT",US STOCKS-Broad rally lifts Wall St to record as BoJ bumps up stimulus,http://www.reuters.com//article/markets-stocks-usa-idUSL1N0SQ1MH20141031?type=companyNews
155,"  (Adds CEO, analyst comments, product sales, shares)By Ransdell PiersonOct 31 AbbVie, which this month abandoned its planned $55 billion purchase of Dublin drugmaker Shire, reported impressive quarterly earnings on demand for its Humira arthritis drug and said it could deliver strong long-term growth without rushing into another big merger attempt.""The underlying growth prospects of AbbVie don't require us to do a deal of that size,"" AbbVie Chief Executive Richard Gonzalez said in conference call, but added the company was keen on smaller acquisitions, particularly of treatments involving rare diseases, cancer and hepatology.AbbVie shares rose 3.5 percent to $63.35 in morning trading.The Chicago drugmaker, which significantly boosted its full-year earnings forecast, said it had earned $506 million, or 31 cents per share, in the third quarter. That compared with $964 million, or 60 cents per share, a year earlier. Excluding special items, including charges for the attempted Shire deal, AbbVie earned 89 cents per share. Analysts on average expected 77 cents, according to Thomson Reuters I/B/E/S.Sales rose 7.8 percent to $5.02 billion, $200 million above forecasts.""We see today's results as reinforcing our view that AbbVie shares remain well-positioned heading into 2015,"" said JPMorgan analyst Chris Schott. He said AbbVie could win U.S. marketing approval within weeks for a combination treatment for hepatitis C that may bolster earnings next year and beyond. AbbVie, spun off early last year from Abbott Laboratories , is also testing treatments for cancer, Parkinson's Disease, endometriosis and other diseases.The company had hoped to buy Shire and locate the combined company in Britain to take advantage of the nation's lower tax rate. But AbbVie walked away after tax law changes announced by the U.S. Treasury made the tax-inversion deal less attractive.Sales of Humira, the world's top-selling drug, jumped almost 18 percent to $3.26 billion. They accounted for 65 percent of total sales, underscoring the company's need for other products to broaden its portfolio. Gonzalez attributed Humira's sales growth to the wide range of approved uses of the drug, including for Crohn's disease and psoriasis, and because it is still being introduced in more countries 12 years after its U.S. launch.Although Humira's U.S. patent lapses in late 2016, AbbVie has said it will take years for other drugmakers to develop and win approval for their own generic versions.A few other AbbVie brands showed strong growth in the quarter, including thyroid hormone replacement drug Synthroid, whose sales rose 24 percent to $200 million.But others declined, including cholesterol treatments and AndroGel testosterone gel, whose sales have been hurt by safety concerns for the drug class.AbbVie raised its 2014 profit forecast to between $3.25 and $3.27 per share from its prior view of $3.06 to $3.16.    (Reporting by Ransdell Pierson; Editing by Chizu Nomiyama, James Dalgleish and Lisa Von Ahn)",2014-10-31,ABBV,"Fri Oct 31, 2014 | 11:22am EDT",UPDATE 2-AbbVie says strong results lessen need for big deal,http://www.reuters.com//article/abbvie-results-idUSL1N0SQ0OJ20141031?type=companyNews
