,Article,Date,Symbol,Time,Title,Url
224,"  * Initial jobless claims climb more than expected* Factory orders fall for sixth straight month* AbbVie to buy Pharmacyclics for about $21 bln* Indexes: Dow up 0.07 pct, S&P off 0.08 pct, Nasdaq up 0.02 pct   (Updates to afternoon, adds comments)By Sinead CarewNEW YORK, March 5 U.S. stocks were little changed on Thursday, after two days of declines on the S&P 500, as economic data did little to alter expectations on the timing of an interest rate hike by the Federal Reserve.Initial jobless claims rose to 320,000 in the latest week, above the 295,000 estimate and 313,000 in the prior week. The disappointing claims numbers come after a weaker-than-expected private payrolls report on Wednesday and ahead of Friday's monthly employment report. Investors were looking ahead to the jobs report due out on Friday to help them assess the timing of the Fed's first interest rate hike in years, said Brian Battle, director of trading at Performance Trust Capital Partners, in Chicago.""We're kind of tapping our foot for tomorrow's non-farm payroll,"" said Battle. ""The Federal Reserve made it very clear they're going to raise rates but its going to be data dependent. It's one of the benchmark numbers they're looking at.""At 12:50 p.m., the Dow Jones industrial average rose 11.85 points, or 0.07 percent, to 18,108.75, the S&P 500  lost 1.64 points, or 0.08 percent, to 2,096.89 and the Nasdaq Composite added 0.99 points, or 0.02 percent, to 4,968.13. A separate report showed new orders for U.S. factory goods unexpectedly fell in January for a sixth month, a sign of weakness in the manufacturing sector.As investors attempt to speculate on the timing of the Fed's impending rate increase, the equity market's advance has slowed since the March 2 highs for both the Dow and S&P 500, with each index down 0.9 percent.""There is nothing really to drive sentiment one way or the other that is going to change people's perceptions on anything at the moment so therefore you are just getting this churning back and forth,"" said Ken Polcari, director of the NYSE floor division at O'Neil Securities in New York. AbbVie is to buy Pharmacyclics for about $21 billion, giving it access to what is expected to be one of the world's top-selling cancer drugs and expanding its reach in the profitable oncology field. Pharmacyclics shares jumped 10.5 percent to $254.63 while AbbVie lost 4 percent to $57.68.Kroger rose 5.6 percent to $73.56 after the biggest U.S. supermarket operator reported a 23 percent rise in quarterly profit and forecast full-year earnings above expectations.The European Central Bank said it will start its new government bond-buying program of 60 billion euros a month on March 9 and raised its economic growth forecast for 2015. It boosted its 2016 inflation forecast to 1.5 percent.Advancing issues outnumbered declining ones on the NYSE by 1,520 to 1,408, for a 1.08-to-1 ratio; on the Nasdaq, 1,374 issues rose and 1,265 fell for a 1.09-to-1 ratio.The benchmark S&P 500 index was posting 20 new 52-week highs and 2 new lows; the Nasdaq Composite was recording 81 new highs and 30 new lows.     (Additional reporting by Chuck Mikolajczak, Editing by Bernadette Baum)",2015-03-05,ABBV,"Thu Mar 5, 2015 | 1:06pm EST","US STOCKS-Wall St little changed after 2-day drop, data",http://www.reuters.com//article/markets-stocks-usa-idUSL1N0W71XP20150305?type=companyNews
225,"  An updated experimental form of AbbVie Inc's Humira arthritis drug has clear advantages over the original that could help the company confront looming cheaper biosimilar forms of the blockbuster medication, Chief Executive Richard Gonzalez said in an interview.""It's a fundamental change in the formulation of Humira,"" Gonzalez said. ""I wouldn't describe it as a tweak."" Asked if AbbVie intends to switch current Humira patients to the new formulation, if it is approved, he said it was too soon to predict, but that such a strategy would make sense.    (Reporting by Ransdell Pierson; Editing by Christian Plumb)",2015-03-05,ABBV,"Thu Mar 5, 2015 | 12:46pm EST",AbbVie CEO says new form of Humira could thwart generics,http://www.reuters.com//article/us-abbvie-ceo-humira-idUSKBN0M124K20150305?type=companyNews
226,"  March 5 ABBVIE:  * Interview: AbbVie CEO says experimental version of Humira has ""a fundamentalchange in formulation""  * Interview: AbbVie CEO says altered form of Humira is not a ""tweaked"" product,but will be clearly differentiated  * Interview: AbbVie CEO says too early to predict whether Humira patients will eventually be switched to experimental new formulation, but that would make sense  * Interview: AbbVie CEO says investors will be ""pleasantly surprised"" at durability of Humira franchise",2015-03-05,ABBV,"Thu Mar 5, 2015 | 12:08pm EST",BRIEF-Interview: AbbVie CEO says experimental version of Humira is fundamentally different,http://www.reuters.com//article/abbvie-pharmacyclics-brief-idUSWEN00EXL20150305?type=companyNews
227,"   By Michelle Sierra and Karen Schwartz | NEW YORK, March 12  NEW YORK, March 12 The loan market received another boost this week as drugmaker Abbvie and semiconductor company NXP boosted U.S. M&A volume to $152.7 billion so far this year, including completed and deals in the pipeline.On the investment grade side, AbbVie is leading the charge backing its $21 billion acquisition of Pharmacyclics with an $18 billion 364-day senior unsecured bridge loan from Morgan Stanley and Bank of Tokyo-Mitsubishi UFJ. The bridge loan, which is the largest financing so far this year, is in the market and is expected to be syndicated among the company's relationship banks.""It seems that most of the activity has been on investment grade as opposed to non-investment grade,"" a banker said. ""The capacity for investment grade is bigger particularly with the regulatory overhaul that's been going on.""Frontier Communications has lined up the second-biggest financing with an $11.6 billion bridge loan to fund its $10.5 billion acquisition of wireline assets from Verizon. The two deals have helped push investment grade M&A deal volume to $47 billion in 2015.The Abbvie bridge loan will fund the cash component of the acquisition alongside cash on AbbVie's balance sheet. The deal is expected to be replaced with bonds only.""Healthcare continues to be a hot sector. The Abbvie deal speaks to capacity for acquisition financing. It's a robust market for these type of deals,"" a second banker said. AbbVie, rated A by Standard & Poor's and Baa1 by Moody's, will pay $261.25 per share in cash and stock, a 13 percent premium to Pharmacyclics stock's closing price on March 4. Under the acquisition, Pharmacyclics shareholders have the option to be paid 100 percent cash, 100 percent stock or a mix of cash and stock.Leveraged lift NXP is separately backing its up to $40 billion merger with U.S.-based Freescale with $7 billion of loans, which have pushed leveraged M&A loan volume to $70 billion this year.The loans include a $3.25 billion five-year Term Loan B1 initially paying 325bp over Libor, stepping down to 300bp for net leverage of 2.0 times; a $3.25 billion seven-year Term Loan B2 initially paying 350bp over Libor, stepping down to 325bp for leverage of 2.0 times.There is also an up to $500 million five-year super senior revolver paying 200bp over Libor, stepping down to 175bp for leverage of 2.0 times and to 150bp for leverage of 1.5 times. The revolver also pays a 25bp commitment fee on undrawn amounts. Lead arranger and bookrunner Credit Suisse has initially committed 100 percent of the term loans and $112.5 million of the revolver.The term loans will be used to pay the cash consideration of the offer, refinance Freescale's existing credit facility, and backstop a consent process on Freescale's existing bonds.The revolver will be used for working capital and other general corporate purposes.The acquisition price puts Freescale's value at $11.8 billion, with a total enterprise value of $16.7 billion including debt. The companies said that they would finance the merger with $1 billion of cash on hand, $1 billion of new debt and around 115m of NXP ordinary shares.NXP is rated BB+ by Standard & Poor's and Ba2 by Moody's.    (Editing By Chris Mangham and Jon Methven)",2015-03-12,ABBV,"Thu Mar 12, 2015 | 11:16am EDT",TRLPC: Abbvie and NXP boost M&A volumes,http://www.reuters.com//article/usma-volume-idUSL1N0WE1I820150312?type=companyNews
228,"  An independent panel recommended unblinding a late-stage study testing Pharmacyclics Inc and Johnson & Johnson's Imbruvica, after the treatment was successful against two similar forms of cancer in combination with other drugs.Pharmacyclics, which recently agreed to be acquired by AbbVie Inc for about $21 billion, said Imbruvica showed a statistically significant improvement in survival without disease progression, the study's main goal.Pharmacyclics' shares closed up about 0.7 percent on Monday, while AbbVie's stock closed up about 2 percent.Imbruvica, which is co-marketed by Pharmacyclics and J&J, is already approved for four cancer indications in the United States. The study is testing Imbruvica in combination with bendamustine and rituximab (BR), against a placebo in combination with BR, in 578 previously treated patients with chronic lymphocytic leukemia (CLL) or small lymphocytic lymphoma.Imbruvica is already approved for CLL patients who have had at least one prior therapy. Detailed results of the study will be submitted to health authorities for future labeling considerations, Pharmacyclics said. The company has forecast U.S. sales of Imbruvica to hit $1 billion this year. Worldwide sales are forecast to reach $5.8 billion by 2020, according to the average analyst estimate compiled by Thomson Reuters Cortellis. (Reporting by Natalie Grover in Bengaluru; Editing by Simon Jennings)",2015-03-16,ABBV,"Mon Mar 16, 2015 | 5:09pm EDT",Pharmacyclics cancer drug successful as combination therapy: independent panel,http://www.reuters.com//article/us-pharmacyclics-fda-idUSKBN0MC27L20150316?type=companyNews
229,"  March 17 Ablynx NV* Ablynx initiates the first of two phase IIb RA studies with its anti-il-6r nanobody, partnered with Abbvie* Study aims to identify optimum dose and frequency of administration of ALX-0061 for next phases of development * Study is expected to enrol 330 subjects in United States, Europe and South America, who will be randomly assigned to placebo or four different dose groups of ALX-0061 administered subcutaneously * Following completion of 24-week study, eligible subjects will be invited to participate in an open-label extension study. * Ablynx is responsible for phase II clinical development of alx-0061 in both RA and Systemic Lupus Erythematosus (SLE)* If results meet pre-defined success criteria, Abbvie will exercise its right to in-license ALX-0061 and be responsible for subsequent phase III clinical development and commercialisation-CEO  Source text for Eikon:  Further company coverage:",2015-03-17,ABBV,"Tue Mar 17, 2015 | 2:16am EDT",BRIEF-Ablynx starts first of phase IIb rheumatoid arthritis study with Abbvie,http://www.reuters.com//article/idUSFWN0WI06320150317?type=companyNews
230,"  U.S. drugmaker AbbVie Inc reported better-than-expected quarterly profit and revenue, driven by strong sales of its arthritis drug, Humira.Shares of the company, which also raised its full-year adjusted profit forecast, rose about 2 percent to $65.69 in premarket trading on Thursday.Sales of Humira jumped 18 percent to $3.11 billion in the first quarter, accounting for about two-thirds of total revenue.The company agreed last month to buy Pharmacyclics Inc for about $21 billion to reduce its dependence on Humira and expand its cancer drug pipeline.Sales of AbbVie's all-oral hepatitis C treatment Viekira Pak, approved by U.S. regulators in December, came in at $231 million. The company has forecast an annualized run rate of more than $3 billion globally for Viekira Pak by the end of 2015.Revenue rose 10.5 percent to $5.04 billion in the quarter ended March 31, above the $4.99 billion analysts on average had expected. Profit rose to $1.02 billion, or 63 cents per share, from $980 million, or 61 cents per share, a year earlier. On an adjusted basis, the company earned 94 cents per share, beating the average analyst estimate of 85 cents, according to Thomson Reuters I/B/E/S. AbbVie raised its full-year adjusted profit forecast to $4.10-$4.30 per share, from $4.05 to $4.25 earlier.(This sroty corrects to say 'annualized run rate of more than $3 billion globally by the end of 2015' not 'annual sales of more than $3 billion by the end of the year' in the sixth paragraph) (Reporting by Ankur Banerjee in Bengaluru; Editing by Maju Samuel and Sriraj Kalluvila)",2015-04-23,ABBV,"Thu Apr 23, 2015 | 9:32am EDT",Drugmaker AbbVie's profit beats estimates on strong Humira sales,http://www.reuters.com//article/us-abbvie-results-idUSKBN0NE1A620150423?type=companyNews
231,"  (Corrects to say 'annualized run rate of more than $3 billion globally by the end of 2015' not 'annual sales of more than $3 billion by the end of the year' in paragraph 6)April 23 U.S. drugmaker AbbVie Inc  reported better-than-expected quarterly profit and revenue, driven by strong sales of its arthritis drug, Humira.Shares of the company, which also raised its full-year adjusted profit forecast, rose about 2 percent to $65.69 in premarket trading on Thursday.Sales of Humira jumped 18 percent to $3.11 billion in the first quarter, accounting for about two-thirds of total revenue. The company agreed last month to buy Pharmacyclics Inc  for about $21 billion to reduce its dependence on Humira and expand its cancer drug pipeline.Sales of AbbVie's all-oral hepatitis C treatment Viekira Pak, approved by U.S. regulators in December, came in at $231 million. The company has forecast an annualized run rate of more than $3 billion globally for Viekira Pak by the end of 2015.Revenue rose 10.5 percent to $5.04 billion in the quarter ended March 31, above the $4.99 billion analysts on average had expected. Profit rose to $1.02 billion, or 63 cents per share, from $980 million, or 61 cents per share, a year earlier.On an adjusted basis, the company earned 94 cents per share, beating the average analyst estimate of 85 cents, according to Thomson Reuters I/B/E/S.AbbVie raised its full-year adjusted profit forecast to $4.10-$4.30 per share, from $4.05 to $4.25 earlier.   (Reporting by Ankur Banerjee in Bengaluru; Editing by Maju Samuel and Sriraj Kalluvila)",2015-04-23,ABBV,"Thu Apr 23, 2015 | 9:28am EDT",CORRECTED-UPDATE 1-Drugmaker AbbVie's profit beats estimates on strong Humira sales,http://www.reuters.com//article/abbvie-results-idUSL4N0XK4QQ20150423?type=companyNews
232,"  April 23 U.S. drugmaker AbbVie Inc  reported a 4 percent rise in quarterly profit, driven by strong sales of its arthritis drug, Humira.The company's profit rose to $1.02 billion, or 63 cents per share, in the first quarter ended March 31, from $980 million, or 61 cents per share, a year earlier. On an adjusted basis, the company earned 94 cents per share.  Revenue rose 10.5 percent to $5.04 billion.   (Reporting by Ankur Banerjee in Bengaluru; Editing by Maju Samuel)",2015-04-23,ABBV,"Thu Apr 23, 2015 | 7:55am EDT",Drugmaker AbbVie profit rises on sales of Humira,http://www.reuters.com//article/abbvie-results-idUSL4N0XK4PW20150423?type=companyNews
233,"   By Danielle Robinson  NEW YORK, May 11 (IFR) - Apple, Shell and AbbVie blitzed the US bond market last week with a combined US$34bn of jumbo bond deals in just two days, bringing the week's tally to US$52bn, the fourth-largest of all time.AbbVie issued US$16.7bn to finance its acquisition of Pharmacyclics - it was the sixth-biggest bond deal ever - after attracting US$60bn of demand.The next day Apple issued US$8bn on US$21bn of demand and Shell US$10bn on US$23bn of orders.But bankers are warning borrowers planning to raise some US$80bn or more in May not to be dazzled by the US market's seeming resilience.New-issue concessions have bulged in the past week after wild swings in 10 and 30-year Treasuries and huge supply took their toll. Now there are fears that the bond market has reached a tipping point, and corporates may face rising funding costs from here on.""The real risk to the market over the course of a busy May for new issues is extreme volatility in Treasuries,"" said Jonny Fine, head of investment-grade debt syndicate in the Americas at Goldman Sachs.""We have gone from new-issue concessions of zero to 5bp in March to a weaker environment where NICs are 10bp-15bp. In the same period credit spreads have widened a little and Treasuries have increased a lot, so all-in costs of debt issuance have deteriorated.""The new-issue market has been able to recover from temporary gluts at various times this year. And, in the absence of Treasury volatility, it only took a few slow weeks to bring concessions snapping back in.Now, although investors still have cash to put to work, not knowing where rates are heading requires higher concessions, especially at the long end of the curve. It was no coincidence, then, that Apple paid 10bp in NICs and Shell 11bp-16bp on the day the 30-year Treasury yield pierced the 3% mark for the first time since December.FUNDAMENTAL With European government bonds backing up dramatically, commodity prices stabilising and US economic growth expected to improve, some think the Treasury market is undergoing a fundamental shift away from curve flattening, towards a period of steepening at the long end.""Many former entrenched trends are now over and the new long-term trends have begun,"" said William O'Donnell, head of US Treasury strategy at Royal Bank of Scotland.""We are going through the earliest phase of a 'term-risk tantrum'. What we have witnessed since the end of March is markets coming to grips with ongoing improvement in the US economy and maybe a nascent recovery out of Europe at a time when we are staring at record low European and US yields. It's making people have a complete re-think."" Fed Chair Janet Yellen also made comments during the week that bolstered that view.""She sent a signal to the market that stocks have gone too high and bond yields are too low at a time when the Fed could raise rates in September,"" said O'Donnell.Although yields tightened on Thursday, the wild swings saw issuers such as Anglo American pay new-issue premiums of as much as 19bp and most other borrowers that day paid double-digit concessions across maturities.ILLIQUID  Matters will be made worse by the illiquidity in the secondary market.""Larger new-issue premiums impact future bond pricing to a greater extent than we have seen in the past, due to the illiquidity in the secondary market,"" said Michael Shapiro, manager on Societe Generale's US bond syndicate.""The existing secondary curve can widen because of a larger new-issue premium and the result is wider pricing points when an issuer or one of its peers seeks to return to the market.""Borrowers are also likely to find that they can no longer determine what they will pay in the bond market based on what others are achieving.""There have been times when the concessions that various credits in different sectors paid have been uniform, but this is not one of those environments,"" said Fine.""It's more critical than at any other time for syndicate managers to really understand the difference between individual credits and sectors and how they are likely to be accepted by the bond market versus others.""Strong order books, however, have shown that demand is still there. And bankers and issuers hope that any reduction of demand for bonds from retail investors (put off by the damage done by wider Treasury yields to total returns) will be offset by insurance companies and pension funds coming in for higher-yielding paper.(This story originally appeared in International Financing Review, a Thomson Reuters publication)   (Reporting by Danielle Robinson; Editing by Matthew Davies)",2015-05-11,ABBV,"Mon May 11, 2015 | 10:26am EDT",Borrowers warned: Don't be fooled by high grade market resilience,http://www.reuters.com//article/investmentgrade-bonds-volatility-idUSL1N0Y20VA20150511?type=companyNews
234,"  AbbVie Inc said on Wednesday that its hepatitis C cocktail Viekira Pak was effective whether or not it was used in combination with the compound ribavirin against the most common form of the disease, according to data from a late-stage study. Viekira Pak, a combination of the drugs Viekirax and Exviera, was approved in December for use as both a standalone treatment and in tandem with ribavirin, a broad-spectrum antiviral approved in 1998.All the patients in the study showed a sustained response to Viekira Pak as a standalone treatment after 12 weeks of treatment, AbbVie said. The late-stage study on which the U.S. Food and Drug Administration based its decision to approve Viekira Pak in December showed it cured 91-100 percent of all patients with the infection.Viekira Pak is one of three treatments for the liver-scarring disease fighting to corner the lion's share of the multi-billion dollar market and competes with Gilead Sciences Inc's Sovaldi and Harvoni, and Johnson & Johnson's Olysio.   (Reporting by Vidya L Nathan in Bengaluru, Editing by Simon Jennings)",2015-06-24,ABBV,"Wed Jun 24, 2015 | 7:14am EDT",AbbVie hepatitis C cocktail succeeds in late-stage study,http://www.reuters.com//article/us-abbvie-study-idUSKBN0P413320150624?type=companyNews
235,"  (Adds details, background)June 24 AbbVie Inc said on Wednesday that its hepatitis C cocktail Viekira Pak was effective whether or not it was used in combination with the compound ribavirin against the most common form of the disease, according to data from a late-stage study.Viekira Pak, a combination of the drugs Viekirax and Exviera, was approved in December for use as both a standalone treatment and in tandem with ribavirin, a broad-spectrum antiviral approved in 1998. All the patients in the study showed a sustained response to Viekira Pak as a standalone treatment after 12 weeks of treatment, AbbVie said. The late-stage study on which the U.S. Food and Drug Administration based its decision to approve Viekira Pak in December showed it cured 91-100 percent of all patients with the infection. Viekira Pak is one of three treatments for the liver-scarring disease fighting to corner the lion's share of the multi-billion dollar market and competes with Gilead Sciences Inc's Sovaldi and Harvoni, and Johnson & Johnson's Olysio.(Reporting by Vidya L Nathan in Bengaluru, Editing by Simon Jennings)",2015-06-24,ABBV,"Wed Jun 24, 2015 | 7:12am EDT",UPDATE 1-AbbVie hepatitis C cocktail succeeds in late-stage study,http://www.reuters.com//article/abbvie-study-idUSL3N0ZA3HR20150624?type=companyNews
236,"  June 24 AbbVie Inc said on Wednesday that all patients in a late-stage study showed a sustained response to its cocktail of hepatitis C treatments, currently sold in the U.S. as Viekira Pak. The treatment was successful in patients with the most common form of the disease at 12 weeks, the company said.     (Reporting by Vidya L Nathan in Bengaluru, Editing by Simon Jennings)  ",2015-06-24,ABBV,"Wed Jun 24, 2015 | 6:19am EDT",AbbVie hepatitis C cocktail succeeds in late-stage study,http://www.reuters.com//article/abbvie-study-idUSL3N0ZA3FP20150624?type=companyNews
237,"   By Brendan Pierson  A Delaware judge has dismissed a lawsuit by AbbVie Inc shareholders seeking to clear the way to sue the directors of AbbVie's former parent Abbott Laboratories for their possible roll in promoting off-label use of the cholesterol drug TriCor. Vice Chancellor Sam Glasscock of the Delaware Chancery Court ruled Tuesday that the shareholders lacked standing to bring the lawsuit.  To read the full story on WestlawNext Practitioner Insights, click here: bit.ly/1Dw4K1P",2015-07-22,ABBV,"Wed Jul 22, 2015 | 6:18pm EDT",Judge tosses shareholder case over AbbVie spinoff releases,http://www.reuters.com//article/health-abbvie-idUSL1N10233N20150722?type=companyNews
238,"  The U.S. Food and Drug Administration on Friday approved two treatments for less common forms of hepatitis C virus (HCV) infections.The regulator cleared AbbVie Inc's Technivie, which targets HCV genotype 4 infections, and Bristol-Myers Squibb Co's Daklinza, used to treat HCV genotype 3 infections.About 2.7 million Americans are infected with HCV, of which 10 percent are genotype 3. Genotype 4 is considered among the least common, according to the Centers for Disease Control and Prevention.Both treatments do not require the co-administration of older antivirals, the regulator said.The viral disease causes inflammation of the liver that can lead to diminished function or failure of the organ. Technivie comprises three drugs that are included in Viekira Pak, AbbVie's regimen for the most common form of HCV infection - genotype 1. (1.usa.gov/1gSuFvU)Technivie is the first regimen approved to safely and effectively treat genotype 4, while Daklinza is the first for genotype 3, the FDA said. The regulator has approved the use of Daklinza in combination with Gilead Sciences Inc's Sovaldi.  (1.usa.gov/1VFlkaX)Viekira Pak raked in sales of $231 million in the first quarter 2015, while Gilead's Sovaldi brought in $972 million in the same period. (The story corrects paragraph six to say Technivie ""comprises three drugs that are included in Viekira Pak"", not ""includes the same cocktail of drugs that comprise Viekira Pak"") (Reporting by Samantha Kareen Nair in Bengaluru; Editing by Kirti Pandey and Saumyadeb Chakrabarty)",2015-07-24,ABBV,"Fri Jul 24, 2015 | 5:43pm EDT","AbbVie, Bristol-Myers get FDA nod for hep C treatments",http://www.reuters.com//article/us-abbvie-fda-idUSKCN0PY1WA20150724?type=companyNews
