,Article,Date,Symbol,Time,Title,Url
51,"  * CHS can buy up to 1.7 mln tons of fertilizer annually* CHS scraps construction of North Dakota fertilizer plant* Deal for 80 years   (Adds details, background)Aug 12 U.S.-based agribusiness CHS Inc  said it would invest $2.8 billion in a unit of fertilizer producer CF Industries Holdings Inc to secure nitrogen fertilizer supplies.This is the third deal in a week in the highly fragmented global fertilizer industry, which is trying to cope with weak prices caused by excess supply.CHS will have the right to buy as much as 1.7 million tons UAN - a solution of urea and ammonium nitrate in water - and urea, at market prices annually, the companies said on Wednesday.The deal accounts for about 8.9 percent of CF's total production capacity and will be effective for 80 years. CF said last Thursday it would buy Netherlands-based rival OCI NV's North American and European plants for $6 billion, while CVR Partners LP said on Monday it would buy Rentech Nitrogen Partners LP for $533 million.CHS, an agribusiness owned by farmers, ranchers and cooperatives across the United States, will be entitled to semi-annual profit distributions from the unit, CF Industries Nitrogen LLC, the companies said.CF Nitrogen currently owns production plants in Louisiana, Iowa and Mississippi. CF plans to drop down a fourth plant, located in Oklahoma, into CF Nitrogen before the deal closes, expected by Feb. 1. CHS said on Wednesday it would not go ahead with the construction of a fertilizer plant at Spiritwood in North Dakota.The $3 billion project, announced in 2014, was expected to produce more than 2,400 tons of ammonia daily when completed in the first half of 2018.CHS, a big customer for CF, said the deal does not include additional capacity CF will get from the OCI acquisition. Morgan Stanley & Co LLC and Goldman Sachs & Co are CF's financial advisers, while Skadden, Arps, Slate, Meagher & Flom LLP is its legal adviser.Baker & McKenzie LLP is the legal adviser to CHS.While CF shares were down less than 1 percent at $56.85 before the bell, CHS shares were unchanged.Up to Tuesday's close, CHS stock had declined 3.6 percent over the past 12 months, while CF shares had fallen 16 percent.(Reporting By Shubhankar Chakravorty in Bengaluru; Editing by Sriraj Kalluvila)",2015-08-12,CF,"Wed Aug 12, 2015 | 9:17am EDT",UPDATE 2-CHS in $2.8 bln deal with CF for fertilizer supply,http://www.reuters.com//article/cf-industries-investment-chs-idUSL3N10N4EP20150812?type=companyNews
52,"  Aug 12 U.S.-based agribusiness CHS  said it will invest $2.8 billion in a unit of U.S. fertilizer producer CF Industries Holdings Inc. CHS will have the right to buy as much as 1.7 million tons of urea and ammonium nitrate and urea at market prices annually, the companies said on Wednesday.    (Reporting By Shubhankar Chakravorty in Bengaluru; Editing by Sriraj Kalluvila)  ",2015-08-12,CF,"Wed Aug 12, 2015 | 7:42am EDT",CHS to invest $2.8 bln in fertilizer maker CF Industries' unit,http://www.reuters.com//article/cf-industries-investment-chs-idUSL3N10N4DW20150812?type=companyNews
53,"   By Rod Nickel  Sinking crop prices and frenzied output growth by nitrogen fertilizer producers have sparked nearly $10 billion worth of deals in the fragmented sector and signal more consolidation may  be ahead in the largest of three crop nutrient markets.Illinois-based CF Industries Holdings Inc (CF.N), the world's third-largest nitrogen fertilizer producer, was involved in three of four deals in the past month, taking out two potential competitors in its backyard and locking up sales volumes in the United States, the world's No. 1 corn-producing country. ""What CF is doing is classic corporate self-preservation in a world where there are well-financed people trying to get into their core Midwest and U.S. Gulf Coast nitrogen market,"" said Chris Damas, editor of the BCMI Report on markets.Unlike in the potash and phosphate industries dominated by a few players, the top 20 nitrogen companies account for just over one-third of global supply, according to consultancy CRU Group. CF's share is less than 4 percent, it said.On Wednesday farmer co-operative CHS Inc (CHSCP.O) ditched plans to spend $3 billion building a plant in North Dakota and agreed instead to pay $2.8 billion for a stake in CF's nitrogen fertilizer unit, while securing a supply deal.That move followed last Thursday's announcement CF would buy Netherlands-based rival OCI NV's (OCI.AS) North American and European plants for $6 billion, to become the biggest publicly traded nitrogen player. The deals increase CF's market clout by removing two potential U.S. rival plants, just as Agrium Inc (AGU.TO), Yara International (YAR.OL), Koch Industries [KCHIN.UL] and others build North American capacity. CVR Partners LP (UAN.N) said on Monday it would buy Rentech Nitrogen Partners LP RNF.N for $533 million, creating North America's fifth-largest nitrogen maker.Potash Corp's (POT.TO) $8.6 billion takeover bid for German rival K+S AG (SDFGn.DE) has captured headlines this summer, a deal that would expand the reach of the world's biggest fertilizer producer.POORER TIMES ON THE FARM The incentive to cut deals in nitrogen fertilizer starts at the farm gate. Falling grain prices have lightened farmers' wallets, especially after corn Cc1 plunged Wednesday to a nearly 10-month low.With lower crop receipts, farmers cannot afford to pay as much for fertilizer and other farm inputs, although farmers apply nitrogen more regularly than other nutrients.Earlier this year, North American prices of urea, a popular form of nitrogen, slid to a four-year low of less than $300 per tonne.Global demand for nitrogen in 2014/15 is forecast by International Fertilizer Industry Association at 112 million tonnes of nutrient, about three times phosphate demand and about four times the size of the potash market. In the CHS deal, CF also secures sales of up to 1.7 million tons annually, similar to its 2014 ammonia-supply deal with phosphate producer Mosaic Co (MOS.N), providing significant sales in uncertain times.The moves come as global surpluses of urea and ammonia are expected to creep higher to nearly one-fifth of production by 2018, according to a May report by BMO Capital Markets.That fragmented nature of the industry means it takes longer for producers to rein in output when times are tough.""You're in a down cycle, commodity prices are down, I think people might be seeing it as a prolonged period,"" said CHS Chief Executive Officer Carl Casale in an interview.""(Producers) see that as an opportunity to consolidate the industry (and) that would be driving a lot of public company activity."" (Reporting by Rod Nickel in Winnipeg, Manitoba; Editing by Josephine Mason, Lisa Shumaker and Peter Galloway)",2015-08-13,CF,"Thu Aug 13, 2015 | 12:38pm EDT",Bleak outlook sparks frenzied dealmaking in nitrogen fertilizer market,http://www.reuters.com//article/us-nitrogen-m-a-idUSKCN0QI20W20150813?type=companyNews
54,  Nov 3 OCI NV :* CF Industries Holdings Inc and OCI announce expiration of Hart-Scott-Rodino act waiting period  Source text for Eikon:  Further company coverage:    (Gdynia Newsroom) ,2015-11-03,CF,"Tue Nov 3, 2015 | 1:12am EST",BRIEF-Oci and CF Industries announce expiration Hart-Scott-Rodino act waiting period,http://www.reuters.com//article/idUSFWN12X06720151103?type=companyNews
55,"  U.S. fertilizer producer CF Industries Holdings Inc (CF.N) reported a 31 percent drop in third-quarter profit on Wednesday after markets closed, pressured by weakening prices.Nitrogen fertilizer prices have fallen sharply year over year, weighed down by excessive global production and soft demand. CF and other North American producers, however, benefit from low costs of natural gas, a key ingredient in nitrogen fertilizer production.CF's net earnings fell to $91 million or 39 cents per share from $131 million or 52 cents per share a year earlier, missing expectations. Net sales for the quarter totaled $927.4 million, up slightly due to a recent acquisition. Analysts, on average, had expected the world's third-largest maker of nitrogen fertilizer to earn 73 cents a share on sales of $887 million, according to Thomson Reuters I/B/E/S. The average selling price for ammonia fell 15 percent from a year earlier to $446 per ton, while the price of UAN (urea ammonium nitrate) dipped nearly 7 percent year over year to $242 per ton. CF said its expansions at nitrogen plants in Louisiana and Iowa were on schedule for start-up between the fourth quarter of this year and mid-2016.Illinois-based CF was involved in three of four deals in summer in the nitrogen fertilizer sector, including a $6-billion purchase of Netherlands-based rival OCI NV's (OCI.AS) North American and European plants.  (Reporting by Rod Nickel in Winnipeg, Manitoba; Editing by Chris Reese and Andrew Hay)",2015-11-04,CF,"Wed Nov 4, 2015 | 6:29pm EST",Fertilizer maker CF Industries' profit tumbles 31 percent,http://www.reuters.com//article/us-cf-industries-results-idUSKCN0ST35020151104?type=companyNews
56,"  (Adds fertilizer prices, expansion update, Street expectations)Nov 4 U.S. fertilizer producer CF Industries Holdings Inc reported a 31 percent drop in third-quarter profit on Wednesday after markets closed, pressured by weakening prices.Nitrogen fertilizer prices have fallen sharply year over year, weighed down by excessive global production and soft demand. CF and other North American producers, however, benefit from low costs of natural gas, a key ingredient in nitrogen fertilizer production. CF's net earnings fell to $91 million or 39 cents per share from $131 million or 52 cents per share a year earlier, missing expectations. Net sales for the quarter totaled $927.4 million, up slightly due to a recent acquisition.Analysts, on average, had expected the world's third-largest maker of nitrogen fertilizer to earn 73 cents a share on sales of $887 million, according to Thomson Reuters I/B/E/S. The average selling price for ammonia fell 15 percent from a year earlier to $446 per ton, while the price of UAN (urea ammonium nitrate) dipped nearly 7 percent year over year to $242 per ton. CF said its expansions at nitrogen plants in Louisiana and Iowa were on schedule for start-up between the fourth quarter of this year and mid-2016.Illinois-based CF was involved in three of four deals in summer in the nitrogen fertilizer sector, including a $6-billion purchase of Netherlands-based rival OCI NV's North American and European plants.   (Reporting by Rod Nickel in Winnipeg, Manitoba; Editing by Chris Reese and Andrew Hay)",2015-11-04,CF,"Wed Nov 4, 2015 | 6:28pm EST",UPDATE 1-Fertilizer maker CF Industries' profit tumbles 31 pct,http://www.reuters.com//article/cf-industries-results-idUSL1N12Z45M20151104?type=companyNews
57,"  Nov 4 U.S. fertilizer producer CF Industries Holdings Inc reported lower third-quarter profit on Wednesday after markets closed.CF's net earnings fell to $91 million or 39 cents per share from $131 million or 52 cents per share a year earlier. Net sales for the quarter totaled $927.4 million, up slightly.   (Reporting by Rod Nickel in Winnipeg, Manitoba; Editing by Chris Reese)",2015-11-04,CF,"Wed Nov 4, 2015 | 6:07pm EST",Fertilizer maker CF Industries' profit tumbles,http://www.reuters.com//article/cf-industries-results-idUSL1N12Z2IY20151104?type=companyNews
58,"  Nov 9 OCI NV : * Announces the filing with the U.S. Securities and Exchange Commission of a registration statement on Form S-4 containing a preliminary proxy statement/shareholders circular/prospectus in connection with the proposed combination of CF Industries Holdings, Inc. and OCI's European, North American and Global Distribution businesses  Source text: bit.ly/1HC3TyG Further company coverage:    (Gdynia Newsroom)  ",2015-11-09,CF,"Mon Nov 9, 2015 | 2:37am EST",BRIEF-Registration statement filed for combination of its OCI NV unit with CF Industries,http://www.reuters.com//article/idUSFWN13300Y20151109?type=companyNews
59,  Nov 23 Oci NV :* CF Industries and OCI committed to pursuing combination  Source text for Eikon:  Further company coverage:    (Gdynia Newsroom) ,2015-11-23,CF,"Mon Nov 23, 2015 | 1:07am EST",BRIEF-OCI and CF committed to pursuing combination,http://www.reuters.com//article/idUSFWN13F01X20151123?type=companyNews
60,"  BRUSSELS Dec 2 The following are mergers under review by the European Commission and a brief guide to the EU merger process:APPROVALS AND WITHDRAWALS -- Belgian chemical group Solvay to acquire U.S. peer Cytec (approved Dec. 2)NEW LISTINGS -- U.S. private equity firm Thomas H. Lee Partners and investment bank Goldman Sachs to jointly acquire U.S. facility management company GCA Service Group from Blackstone Group (notified Nov. 30/deadline Jan. 13/simplified)-- UK investment firm Intermediate Capital Group and German investment firm Capiton to jointly acquire German resin products maker Prefere Resins Holding (notified Nov. 27/deadline Jan. 12/simplified)-- Swedish private equity firm Ratos AB and Finnish insurer Varma Mutual Pension Insurance Company to jointly acquire Swedish real estate developer Serena Properties AB (notified Nov. 23/deadline Jan. 6/simplified)EXTENSIONS AND OTHER CHANGES NoneFIRST-STAGE REVIEWS BY DEADLINE DEC 7 -- U.S. fertiliser maker CF Industries Holdings to acquire OCI NV's North American and European plants (notified Oct. 30/deadline Dec. 7)-- Enel Green Power and asset management company F2I to set up a joint venture (notified Oct. 30/deadline Dec. 7)DEC 8 -- Swedish state utility Vattenfall and GDF Suez Energie Deutschland AG to to set up a consortium (notified Nov. 3/deadline Dec. 8)DEC 9 -- Austrian home improvement chain OBI to acquire some retail sites from Austrian peer BauMax (notified Nov. 4/deadline Dec. 9)DEC 10 -- German dairy producer DMK Deutsches Milchkontor GmbH to acquire Dutch cheese producer DOC Kaas B.V. (notified Nov. 5/deadline Dec. 10)DEC 11 -- Private equity firm KKR to acquire Swiss-based vending machine operator Selecta (notified Nov. 6/deadline Dec. 11/simplified)-- Private equity firm LetterOne Holdings to acquire German energy company E.ON's oil and gas assets in the Norwegian North Sea (notified Nov. 6/deadline Dec. 11/simplified)-- Trading company Gunvor Group to acquire refinery operator Kuwait Petroleum Europoort (notified Nov. 6/deadline Dec. 11/simplified)-- Swiss Re to acquire Guardian Financial Services (notified Nov. 6/deadline Dec. 11/simplified)-- UK insurer Aviva and the Public Sector Pension Investment Board to set up a property joint venture (notified Nov. 6/deadline Dec. 11/simplified)DEC 12  -- Canadian auto parts maker Linamar to acquire French peer Montupet (notified Nov. 6/deadline Dec. 12)DEC 14 -- French bank Caisse des Depots, Abu Dhabi-based investment and development firm Mubadala Development Co and Vivalto Bel to jointly acquire French private health club operator Group Vivalto Sante (notified Nov. 9/deadline Dec. 14)DEC 16 -- Private equity firm Vista Equity Partners to acquire technology company Solera Holdings Inc (notified Nov. 11/deadline Dec. 16)-- Commodity trader Trafigura to acquire de facto sole control of Belgian zinc producer Nyrstar (notified Nov. 11/Dec. 16)DEC 17 -- Germany's Bertelman plans to buy remaining 25.1 percent stake in printing group Privonis from Axel Springer . (notified Nov. 12/ deadline Dec. 17)-- France's Michelin and Fives plan joint venture in metal 3D printing (notified Nov. 12/ deadline Dec. 17/simplified)-- The Ontario Municipal Employees Retirement System (Omers) to buy out environment and social issues consultant ERM with the Alberta Investment Management Corp as a co-investor (notified Nov. 12/ deadline Dec. 17/simplified)-- Canadian car parts supplier Magna International  to acquire German automotive transmission systems maker Getrag (notified Nov. 12/deadline Dec. 17)DEC 18 -- AXA and Danish public pension fund ATP plan to acquire  control of two hotels jointly with Club Quarters (notified Nov. 13/ deadline Dec. 18/simplified)DEC 21  -- Finnish stainless steel maker Outokumpu to acquire shares in Germany's Hernandez Edelstahl (notified Nov. 16/deadline Dec. 21)-- EQT Services to acquire 75 percent of Top-Toy, a toy retailer in the Nordic Countries and Germany (notified Nov. 16/deadline Dec. 21/simplified)DEC 23 -- Transgourmet, a unit of Switzerland's Coop, to buy Austria's C+C Pfeiffer, a subsidiary of the Pfeiffer trading group, as well as to take a 50 percent stake in centralised purchasing team Top Team (notified Nov. 18/deadline Dec. 23/simplified)-- Novartis to buy remaining rights to Ofatumumab from Britain's GlaxoSmithKline (notified Nov. 18/deadline Dec. 23)JAN 4 -- MS&AD Insurance Group Holdings Inc to buy Amlin PLC, an underwriter in the Lloyd's of London specialist insurance market (notified Nov. 19/deadline Jan 4/simplified)JAN 6 -- Private equity firm Ratos AB and Finland's Varma Mutual Pension Insurance Company to jointly acquire joint venture Serena Properties AB (notified Nov. 23/deadline Jan. 6/simplified)JAN 11 -- Italian state-owned investment fund Fondon Strategico Italiano to acquire a stake in Italian oil contractor Saipem  from state-controlled oil company Eni  (notified Nov. 26/deadline Jan. 11/simplified)-- Japanese trading company Sumitomo Corp and Japan's Sumitomo Mitsui Banking Corp to acquire joint control of Indonesian motorcyle financing company PT Summit Oto Finance and Indonesian car financing company PT Oto Multiartha, which are now solely controlled by Sumitomo Corp (notified Nov. 26/deadline Jan. 11/simplified)-- Danish transport and logistics company DSV to acquire U.S. rival UTi Worldwide (notified Nov. 26/deadline Jan. 11/simplified)JAN 12  -- U.S. conglomerate Berkshire Hathaway to acquire U.S. aerospace parts maker Precision Castparts (notified Nov. 27/deadline Jan. 12)-- French company Caisse des Dépôts et Consignations to acquire 49.9 percent stakes in three wind and solar power companies from French wind and solar farm operator La Compagnie du Vent (notified Nov. 27/deadline Jan. 12/simplified)-- Oilfield services provider Halliburton to buy rival Baker Hughes in a stock and cash transaction (notified Nov. 27/deadline Jan. 12)-- Private investment company KKCG and Taiwanese technology company Hon Hai Precision Industry Co, which is also known as Foxconn, to set up a joint venture in the Czech Republic (notified Nov. 27/deadline Jan. 12/simplified)-- Banking group Goldman Sachs and UK charitable foundation The Wellcome Trust to form a joint venture (notified Nov. 27/deadline Jan. 12/simplified)JAN 13 -- U.S. packages delivery company FedEx to acquire Dutch peer TNT (notified July /deadline extended to Jan. 13 from Dec. 8 after the companies asked for more time)JAN 18 -- South African paper maker Mondi  to acquire some assets from portfolio company Walki (notified July 29/deadline extended to Jan. 18 from Sept. 2 after the European Commission opened an in-depth investigation)JAN 22 -- U.S. drinks can maker Ball Corp to acquire British rival Rexam Plc (notified June 15/deadline extended for the third time to Jan 22 from Dec. 23 after companies submitted commitments)MARCH 3 -- Cable telecoms company Liberty Global's Belgian subsidiary Telenet to buy mobile network operator Base from Dutch group KPN (notified Aug. 17/deadline extended to March 17 from March 3)MARCH 9 -- U.S. office supplier Staples to acquire U.S. rival Office Depot (notified Aug. 21/deadline extended for the third time to March 9 from March 2 after the companies asked for more time)APRIL 18 -- Hutchison Whampoa to acquire Telefonica's  O2 UK subsidiary (notified Sept. 11/deadline extended for the fourth time to April 18 from March 16 after Hutchison asked for more time)SUSPENDED -- SOCAR, Azerbaijan's state energy company, to buy stakes in Greek natural gas grid operator DESFA from Greek natural gas utility DEPA (notified Oct. 1/deadline suspended on Jan. 21)GUIDE TO EU MERGER PROCESS DEADLINES: The European Commission has 25 working days after a deal is  filed for a first-stage review. It may extend that by 10 working days to 35 working days, to consider either a company's proposed remedies or an EU member state's request to handle the case.Most mergers win approval but occasionally the Commission  opens a detailed second-stage investigation for up to 90  additional working days, which it may extend to 105 working  days.SIMPLIFIED: Under the simplified procedure, the Commission announces the clearance of uncontroversial first-stage mergers without giving any reason for its decision. Cases may be reclassified as non-simplified - that is, ordinary first-stage reviews - until they are approved.   (Compiled by Foo Yun Chee and Philip Blenkinsop)",2015-12-02,CF,"Wed Dec 2, 2015 | 12:41pm EST",EU mergers and takeovers (Dec 2),http://www.reuters.com//article/eu-mergers-idUSL8N13R43M20151202?type=companyNews
61,"   By Simon Jessop | LONDON  LONDON The boss of $4 billion U.S. hedge fund Passport Capital said on Thursday he had bought into U.S. agro-chemicals firm CF Industries as he thought it was undervalued and was likely to launch a $3.5 billion share buy back in 2016. Speaking at the Sohn Conference in London, John Burbank said that although concerns around growth in China were clouding the short-term outlook in the broader commodity markets, he expected the company to begin buying shares in the second half of 2016.   (Reporting by Simon Jessop, editing by Kirstin Ridley)",2015-12-03,CF,"Thu Dec 3, 2015 | 8:30am EST",Passport Capital's Burbank likes CF Industries for buybacks,http://www.reuters.com//article/us-sohn-conference-passport-idUSKBN0TM1MA20151203?type=companyNews
62,"   By Simon Jessop | LONDON  LONDON Dec 3 The boss of $4 billion U.S. hedge fund Passport Capital said on Thursday he had bought into U.S. agro-chemicals firm CF Industries as he thought it was undervalued and was likely to launch a $3.5 billion share buy back in 2016.  Speaking at the Sohn Conference in London, John Burbank said that although concerns around growth in China were clouding the short-term outlook in the broader commodity markets, he expected the company to begin buying shares in the second half of 2016.   (Reporting by Simon Jessop, editing by Kirstin Ridley) ",2015-12-03,CF,"Thu Dec 3, 2015 | 8:21am EST",Passport Capital's Burbank likes CF Industries for buybacks,http://www.reuters.com//article/sohn-conference-passport-idUSL8N13S2XW20151203?type=companyNews
