,Article,Date,Symbol,Time,Title,Url
0,"   By Rod Nickel  Jan 14 The new chief executive of CF Industries Holdings Inc is open to finding a better capital structure for the U.S. fertilizer company, including the option of a master limited partnership, Tony Will said on Tuesday in his first interview since taking over this month.  The company will spend nearly $2 billion this year on its expansion of nitrogen production in Louisiana and Iowa, but Will said CF's interest is low in taking on a partner to reduce costs. ",2014-01-14,CF,"Tue Jan 14, 2014 | 3:38pm EST",New CF Industries CEO says open to different capital structure,http://www.reuters.com//article/cfindustries-structure-idUSL2N0KO0WD20140114?type=companyNews
1,"  The U.S. Department of Justice has approved Mosaic Co's (MOS.N) $1.4 billion purchase of CF Industries' (CF.N) Florida phosphate business, Mosaic said on Wednesday.The deal, which still requires other regulatory approvals, gives Mosaic, the world's biggest producer of phosphate fertilizer products, a bigger hold on North American sales, and some analysts speculated that it may raise competition concerns.The price includes $200 million to cover the closure and long-term care of phosphogypsum stacks, a radioactive by-product of phosphate production, under CF's current Florida operations. Minnesota-based Mosaic, which operates other phosphate facilities nearby, would acquire the South Pasture phosphate mine and plant, a phosphate manufacturing plant and ammonia terminal and warehouse facilities. Once the deal closes, Illinois-based CF will focus on nitrogen production. Mosaic and CF shares dipped slightly after normal trading hours.(Reporting by Rod Nickel in Winnipeg, Manitoba; Editing by Nick Zieminski)",2014-01-15,CF,"Wed Jan 15, 2014 | 5:00pm EST",U.S. Justice Department clears Mosaic-CF Industries deal,http://www.reuters.com//article/us-mosaic-cfindustries-doj-idUSBREA0E1NB20140115?type=companyNews
2,"  Jan 15 The U.S. Department of Justice has approved Mosaic Co's $1.4 billion purchase of CF Industries' Florida phosphate business, Mosaic said on Wednesday.The deal, which still requires other regulatory approvals, gives Mosaic, the world's biggest producer of phosphate fertilizer products, a bigger hold on North American sales, and some analysts speculated that it may raise competition concerns.The price includes $200 million to cover the closure and long-term care of phosphogypsum stacks, a radioactive by-product of phosphate production, under CF's current Florida operations. Minnesota-based Mosaic, which operates other phosphate facilities nearby, would acquire the South Pasture phosphate mine and plant, a phosphate manufacturing plant and ammonia terminal and warehouse facilities. Once the deal closes, Illinois-based CF will focus on nitrogen production. Mosaic and CF shares dipped slightly after normal trading hours.",2014-01-15,CF,"Wed Jan 15, 2014 | 4:59pm EST",U.S. Justice Department clears Mosaic-CF Industries deal,http://www.reuters.com//article/mosaic-cfindustries-doj-idUSL2N0KP20K20140115?type=companyNews
3,"  Feb 13 CF Industries Holdings Inc, the world's second-largest nitrogen fertilizer producer, said on Thursday that it has agreed to long-term deals to supply ammonium nitrate to customers.The deals come as Deerfield, Illinois-based CF focuses on nitrogen production after agreeing last year to sell its phosphate business to Mosaic Co for $1.4 billion. CF said it will supply 700,000 to 800,000 tons of industrial-grade ammonium nitrate and ammonium nitrate solution annually to Orica International Pte. Ltd and Nelson Brothers LLC for at least 10 years starting in 2017. Orica provides commercial explosives and blasting systems to the mining and infrastructure markets, while Nelson  manufactures and distributes mining explosives. The deals provide steady demand for most of CF's production capacity from its Yazoo City nitrogen complex in Mississippi, and will lead to a $65-million reconfiguration of the plant in 2014, the company said.",2014-02-13,CF,"Thu Feb 13, 2014 | 4:43pm EST",CF Industries inks long-term deals to supply ammonium nitrate,http://www.reuters.com//article/cfindustries-nitrogen-idUSL2N0LI21R20140213?type=companyNews
4,"  Feb 18 U.S. fertilizer producer CF Industries Holdings Inc reported lower fourth quarter profit on Tuesday. Net earnings fell to $325.8 million, or $5.71 per share, from $470.7 million, or $7.40 per share a year earlier.  ",2014-02-18,CF,"Tue Feb 18, 2014 | 4:51pm EST",CF Industries profit falls,http://www.reuters.com//article/cfindustries-results-idUSL2N0LN0UA20140218?type=companyNews
5,"  Feb 19 Converting existing CF Industries  fertilizer facilities into a master limited partnership structure does not look terribly compelling, Chief Financial Officer Dennis Kelleher said on Wednesday. CF said in December that it hired two undisclosed investment banks to evaluate funding options, and that continuing study will also consider how to structure facilities that CF is currently building, Kelleher said. A master limited partnership is a dividend-paying investment vehicle that enjoys special tax breaks and is often used by natural resources companies.  ",2014-02-19,CF,"Wed Feb 19, 2014 | 11:19am EST",CF Industries sees MLP for existing assets 'not compelling',http://www.reuters.com//article/cfindustries-mlp-idUSL2N0LO14120140219?type=companyNews
6,"  March 17 Mosaic Co said on Monday that it has completed its $1.4-billion purchase of CF Industries'  phosphate business. The deal includes assets in Florida such as a phosphate mine, plant, and a phosphate manufacturing facility.  ",2014-03-17,CF,"Mon Mar 17, 2014 | 12:03pm EDT",Mosaic closes $1.4 bln purchase of CF Industries' phosphate business,http://www.reuters.com//article/mosaic-cf-industries-idUSL2N0ME0US20140317?type=companyNews
7,"  April 21 U.S. fertilizer company CF Industries Holdings Inc said on Monday it has shut down its entire nitrogen complex at Woodward, Oklahoma due to a problem in one of the boilers. The Deerfield, Illinois-based company said it will take about six to eight weeks to resume normal operations. During that time, the plant will carry out maintenance that had been scheduled for June.   (Reporting by Rod Nickel in Winnipeg, Manitoba. Editing by Andre Grenon)  ",2014-04-21,CF,"Mon Apr 21, 2014 | 6:16pm EDT",CF Industries shuts Oklahoma nitrogen complex for repairs,http://www.reuters.com//article/cf-industries-shutdown-idUSL2N0ND1CZ20140421?type=companyNews
8,"   By Rod Nickel  U.S. fertilizer producer CF Industries Holdings Inc (CF.N) reported a big drop in adjusted quarterly profit on Wednesday as nitrogen sales fell during a colder than usual winter.Adjusted net earnings, excluding a one-time gain from the sale of CF's phosphate business, fell to $247.5 million, or $4.51 per share, in the first quarter from $406.5 million, or $6.47 per share, a year earlier. Including the $1.4 billion sale of the phosphate business to Mosaic Co (MOS.N) in March, net earnings were $708.5 million, or $12.90 per share.Net sales for the Deerfield, Illinois, company dipped 15 percent to $1.13 billion. Net sales of CF's nitrogen fertilizers totaled $987.5 million, down 10 percent from the year-before quarter. Analysts had on average expected CF to earn $4.53 a share on sales of $1.189 billion, according to Thomson Reuters I/B/E/S. Shares of CF, the world's No. 2 nitrogen fertilizer maker after Norway's Yara International ASA (YAR.OL), were flat after normal trading hours in New York.(Reporting by Rod Nickel in Winnipeg, Manitoba; Editing by James Dalgleish; and Peter Galloway)",2014-05-07,CF,"Wed May 7, 2014 | 5:04pm EDT",CF Industries adjusted profit falls with weaker nitrogen sales,http://www.reuters.com//article/us-cfindustries-results-idUSBREA4612020140507?type=companyNews
9,"  (Adds analysts' expectations, sales, share activity)By Rod NickelMay 7 U.S. fertilizer producer CF Industries Holdings Inc reported a big drop in adjusted quarterly profit on Wednesday as nitrogen sales fell during a colder than usual winter. Adjusted net earnings, excluding a one-time gain from the sale of CF's phosphate business, fell to $247.5 million, or $4.51 per share, in the first quarter from $406.5 million, or $6.47 per share, a year earlier.Including the $1.4 billion sale of the phosphate business to Mosaic Co in March, net earnings were $708.5 million, or $12.90 per share. Net sales for the Deerfield, Illinois, company dipped 15 percent to $1.13 billion. Net sales of CF's nitrogen fertilizers totaled $987.5 million, down 10 percent from the year-before quarter. Analysts had on average expected CF to earn $4.53 a share on sales of $1.189 billion, according to Thomson Reuters I/B/E/S.Shares of CF, the world's No. 2 nitrogen fertilizer maker after Norway's Yara International ASA, were flat after normal trading hours in New York.   (Reporting by Rod Nickel in Winnipeg, Manitoba; Editing by James Dalgleish; and Peter Galloway)",2014-05-07,CF,"Wed May 7, 2014 | 5:02pm EDT",UPDATE 1-CF Industries adjusted profit falls with weaker nitrogen sales,http://www.reuters.com//article/cfindustries-results-idUSL2N0NT26X20140507?type=companyNews
10,"  U.S. fertilizer producer CF Industries (CF.N) reported on Wednesday a big drop in adjusted profit for the first quarter after markets closed.Adjusted net earnings, excluding a one-time gain from the sale of CF's phosphate business, fell to $247.5 million or $4.51 per share from $406.5 million or $6.47 per share a year earlier.  (Reporting by Rod Nickel in Winnipeg, Manitoba; Editing by James Dalgleish) ",2014-05-07,CF,"Wed May 7, 2014 | 4:27pm EDT",CF Industries adjusted profit falls,http://www.reuters.com//article/us-cfindustries-results-idUSBREA460ZK20140507?type=companyNews
11,"  May 7 U.S. fertilizer producer CF Industries  reported on Wednesday a big drop in adjusted profit for the first quarter after markets closed. Adjusted net earnings, excluding a one-time gain from the sale of CF's phosphate business, fell to $247.5 million or $4.51 per share from $406.5 million or $6.47 per share a year earlier.   (Reporting by Rod Nickel in Winnipeg, Manitoba; Editing by James Dalgleish)  ",2014-05-07,CF,"Wed May 7, 2014 | 4:26pm EDT",CF Industries adjusted profit falls,http://www.reuters.com//article/cfindustries-results-idUSL2N0NS1K420140507?type=companyNews
12,"  Aug 6 U.S. fertilizer producer CF Industries  on Wednesday reported a lower second-quarter profit and said it would boost its dividend and buy back $1 billion worth of shares. Net earnings fell to $312.6 million, or $6.10 per share, from $498.2 million, or $8.38 per share, a year earlier.   (Reporting by Rod Nickel in Winnipeg, Manitoba; Editing by Steve Orlofsky)  ",2014-08-06,CF,"Wed Aug 6, 2014 | 4:20pm EDT","CF Industries to raise dividend, buy back shares; profit falls",http://www.reuters.com//article/cfindustries-results-idUSL2N0QB1UT20140806?type=companyNews
13,"   By Balazs Koranyi and Joachim Dagenborg | OSLO  OSLO Norway's Yara and Chicago-based CF Industries are in talks about a merger of equals that would create a $27.5 billion global fertilizer producer to rival world No.1 Potash Corp in an oversupplied and fragmented market.The deal would give Yara, the world's biggest nitrate fertilizer maker, major production units in the United States, where costs are lower due to cheap gas. CF Industries would gain a global footprint through Yara's presence in 150 countries with production assets and a well established distribution network.The two firms' combined market capitalization of $27.5 billion would put it almost on par with Canada's Potash Corp of Saskatchewan, the world' largest fertilizer firm worth $28.9 billion. The firms said in separate filings that the talks were at an early stage, and there were no assurances that these would result in any transaction. Yara said it had been forced to go public because information about the talks were at a risk of a leak. It wanted to conclude the process quickly but said nothing was expected in the coming days.Yara shares surged nearly 9 percent in early trade and were 6 percent higher at 1330 GMT (9.30 a.m. EDT), valuing the company at $14.4 billion. CF rose 3.5 percent in early trade, giving the firm. Market capitalization of $13.2 billion.""At first glance, we view any future deal as positive for Yara,"" JPMorgan said in a note. ""A deal would diversify the company's cost base away from Europe – which remains one of the most expensive production regions globally."" ""Yara could integrate its US export/marketing business for example and expand its nitrate business into North America,"" the note said.The two firms fought a bitter battle in 2010 over control of U.S. rival Terra Industries, won by CF with a $4.7 billion offer. That deal also put Yara and CF into a 50/50 joint venture operating the GrowHow production units in Britain. Analyst said regulatory concerns would be minimal as CF focuses on the United States while Yara has few U.S. operations. CF has major production assets while Yara is stronger  downstream and it runs a coveted distribution network.With the deal CF would gain access to global distribution while Yara would benefit from cheap U.S. gas, the main ingredient in ammonia, which forms the base of nitrate fertilizers used in agricultural crops.Global fertilizer margins have been under pressure, mainly  due to Chinese overproduction, and the International Fertilizer Industry Association expects global production growth to well outpace demand at least through 2018. The association sees nitrogen fertilizer output rising nearly twice as fast as demand between 2014 and 2018, increasing the surplus in the market which could reach 9 percent of global production by 2018.""In terms of revenues, Yara has the highest revenues but the lower margin, while CF has higher margin and lower revenues,""     Per Haagensen, an analyst at RS Platou Markets said. ""It seems to me that it is a pretty fair merger of equals."" ""I don't think there will be a third company coming in and trying to join in because these are the two biggest nitrogen producers essentially.""  Yara is being advised by Citi and Norwegian brokerage ABG Sundal Collier.GOVERNMENT HURDLE  Potentially the biggest hurdle to any deal would be the Norwegian government, which owns a 36.2 percent stake in Yara.The government said in June it would not cut its stake below 34 percent and any change in that stance would likely require approval in parliament, an uphill battle as the government rules in a minority and relies on opposition parties to push through its agenda.The trade ministry said it had not taken a position while the majority of parties contacted by Reuters said they could support the deal as long as the combined firm's headquarters stayed in Norway and the state maintained a 34 percent stake.Another snag could be that Yara Chief Executive Joergen Ole Haslestad will be stepping down and will be replaced by Norsk Hydro CEO Richard Brandtzaeg in February.With U.S. gas prices trading near historic lows, Yara has been working to build capacity in North America and plans to build an ammonia plant with Germany's BASF in Texas.It has also been expanding rapidly in South America in recent years, buying Bunge's Brazilian fertilizer business and acquiring the majority of Brazilian phosphate miner Galvani Indústria.CF Industries in March sold its phosphate business to rival Mosaic Co for $1.4 billion to focus on its core nitrogen fertilizer products. It has also been working on a $3.8 billion expansion of nitrogen fertilizer production in Louisiana and Iowa. (Additional reporting by Ole Petter Skonnord and Gwladys Fouche; Editing by Terje Solsvik, Keith Weir and Susan Thomas)",2014-09-23,CF,"Tue Sep 23, 2014 | 5:27pm EDT","Norway's Yara, CF in talks to create $27.5 billion global fertilizer producer",http://www.reuters.com//article/us-yara-intl-cf-industries-m-a-idUSKCN0HI0TQ20140923?type=companyNews
14,"  * Yara shares surge nearly 9 pct, CF shares up 3.5 pct* Potential merged company would rival Potash Corp in market cap* Fertiliser margins under pressure, market oversupplied   (Adds Breakingviews link)By Balazs Koranyi and Joachim DagenborgOSLO, Sept 23 Norway's Yara and Chicago-based CF Industries are in talks about a merger of equals that would create a $27.5 billion global fertilizer producer to rival world No.1 Potash Corp in an oversupplied and fragmented market.The deal would give Yara, the world's biggest nitrate fertiliser maker, major production units in the United States, where costs are lower due to cheap gas. CF Industries would gain a global footprint through Yara's presence in 150 countries with production assets and a well established distribution network.The two firms' combined market capitalisation of $27.5 billion would put it almost on par with Canada's Potash Corp of Saskatchewan, the world' largest fertilizer firm worth $28.9 billion.The firms said in separate filings that the talks were at an early stage, and there were no assurances that these would result in any transaction.Yara said it had been forced to go public because information about the talks were at a risk of a leak. It wanted to conclude the process quickly but said nothing was expected in the coming days.Yara shares surged nearly 9 percent in early trade and were 6 percent higher at 1330 GMT, valuing the company at $14.4 billion. CF rose 3.5 percent in early trade, giving the firm. Market capitalisation of $13.2 billion.""At first glance, we view any future deal as positive for Yara,"" JPMorgan said in a note. ""A deal would diversify the company's cost base away from Europe - which remains one of the most expensive production regions globally."" ""Yara could integrate its US export/marketing business for example and expand its nitrate business into North America,"" the note said.The two firms fought a bitter battle in 2010 over control of U.S. rival Terra Industries, won by CF with a $4.7 billion offer. That deal also put Yara and CF into a 50/50 joint venture operating the GrowHow production units in Britain.Analyst said regulatory concerns would be minimal as CF focuses on the United States while Yara has few U.S. operations. CF has major production assets while Yara is stronger  downstream and it runs a coveted distribution network.With the deal CF would gain access to global distribution while Yara would benefit from cheap U.S. gas, the main ingredient in ammonia, which forms the base of nitrate fertilizers used in agricultural crops.Global fertiliser margins have been under pressure, mainly  due to Chinese overproduction, and the International Fertilizer Industry Association expects global production growth to well outpace demand at least through 2018. The association sees nitrogen fertiliser output rising nearly twice as fast as demand between 2014 and 2018, increasing the surplus in the market which could reach 9 percent of global production by 2018.""In terms of revenues, Yara has the highest revenues but the lower margin, while CF has higher margin and lower revenues,""     Per Haagensen, an analyst at RS Platou Markets said. ""It seems to me that it is a pretty fair merger of equals.""""I don't think there will be a third company coming in and trying to join in because these are the two biggest nitrogen producers essentially.""Yara is being advised by Citi and Norwegian brokerage ABG Sundal Collier. GOVERNMENT HURDLE Potentially the biggest hurdle to any deal would be the Norwegian government, which owns a 36.2 percent stake in Yara.The government said in June it would not cut its stake below 34 percent and any change in that stance would likely require approval in parliament, an uphill battle as the government rules in a minority and relies on opposition parties to push through its agenda.The trade ministry said it had not taken a position while the majority of parties contacted by Reuters said they could support the deal as long as the combined firm's headquarters stayed in Norway and the state maintained a 34 percent stake.Another snag could be that Yara Chief Executive Joergen Ole Haslestad will be stepping down and will be replaced by Norsk Hydro CEO Richard Brandtzaeg in February.With U.S. gas prices trading near historic lows, Yara has been working to build capacity in North America and plans to build an ammonia plant with Germany's BASF in Texas.It has also been expanding rapidly in South America in recent years, buying Bunge's Brazilian fertiliser business and acquiring the majority of Brazilian phosphate miner Galvani Indústria.CF Industries in March sold its phosphate business to rival Mosaic Co for $1.4 billion to focus on its core nitrogen fertilizer products. It has also been working on a $3.8 billion expansion of nitrogen fertilizer production in Louisiana and Iowa.(Additional reporting by Ole Petter Skonnord and Gwladys Fouche; Editing by Terje Solsvik, Keith Weir and Susan Thomas)",2014-09-23,CF,"Tue Sep 23, 2014 | 12:39pm EDT","UPDATE 4-Norway's Yara, CF in talks to create $27.5 bln global fertiliser producer",http://www.reuters.com//article/yara-intl-cf-industries-ma-idUSL6N0RO0V520140923?type=companyNews
15,"  OSLO, Sept 23 Fertiliser producer Yara International is in talks with CF Industries  about a possible merger of equals, the Norwegian firm said on Tuesday. ""The discussions are at an early stage, and there can be no assurances that these discussions will result in any transaction,"" Yara said in a filing to the Oslo bourse.   (Reporting by Balazs Koranyi, editing by Terje Solsvik)  ",2014-09-23,CF,"Tue Sep 23, 2014 | 2:49am EDT",Yara in talks with CF Industries on merger of equals,http://www.reuters.com//article/yara-intl-cf-industries-ma-idUSFWN0RN01L20140923?type=companyNews
