,Article,Date,Symbol,Time,Title,Url
53,"  U.S. health insurer Cigna Corp (CI.N) has had its first meetings with competitor Anthem Inc (ANTM.N) after it rebuffed Anthem's $47 billion merger proposal last month, a person familiar with the matter said on Thursday.It was not immediately clear if the new talks, which were held in the last few days, would lead to the companies reaching a deal. The talks come as both Cigna and rival Aetna Inc (AET.N) consider the possible acquisition of smaller player Humana Inc (HUM.N), people familiar with the matter have said previously.The source on the Cigna-Anthem talks asked not to be identified because the discussions are confidential. Cigna and Anthem declined to comment. CNBC first reported on the latest talks between the two companies.A combined Cigna and Anthem would have 53 million customers in commercial, government, consumer and other kinds of health insurance plans.  Big U.S. health insurers are seeking acquisitions to boost membership in government-paid healthcare plans and employer-based insurance. The bigger the insurer, the more power it has negotiating prices and improving its doctor networks.Earlier on Thursday, U.S. health insurer Centene Corp (CNC.N) said it would buy smaller rival Health Net Inc HNT.N for $6.3 billion, underscoring the healthcare industry's rush to bulk up to negotiate more advantageous prices with suppliers and hospitals, and attract new customers. In rejecting Anthem's offer, Cigna previously cited Anthem's ""lack of growth strategies,"" complications related to its membership of Blue Cross Blue Shield Association and a ""massive"" data breach it suffered in February.Cigna's board is also concerned by Anthem's ""insistence"" that one person - Joseph Swedish, Anthem's president and chief executive officer - assume four roles of the combined company: chairman, CEO, president and head of integration. Anthem has said it believes investors support its refusal to guarantee that the CEO role of the combined company would go to Cigna CEO David Cordani.  (Reporting by Greg Roumeliotis in New York; Editing by Peter Galloway)",2015-07-02,CI,"Thu Jul 2, 2015 | 11:55am EDT","Anthem, Cigna in new round of talks: source",http://www.reuters.com//article/us-cigna-m-a-anthem-idUSKCN0PC1XJ20150702?type=companyNews
54,"  July 2 U.S. health insurer Cigna Corp has had its first meetings with competitor Anthem Inc after it rebuffed Anthem's $47 billion merger proposal last month, a person familiar with the matter said on Thursday.It was not immediately clear if the new talks, which were held in the last few days, would lead to the companies reaching a deal. The talks come as both Cigna and rival Aetna Inc  consider the possible acquisition of smaller player Humana Inc , people familiar with the matter have said previously.The source on the Cigna-Anthem talks asked not to be identified because the discussions are confidential. Cigna and Anthem declined to comment. CNBC first reported on the latest talks between the two companies.A combined Cigna and Anthem would have 53 million customers in commercial, government, consumer and other kinds of health insurance plans. Big U.S. health insurers are seeking acquisitions to boost membership in government-paid healthcare plans and employer-based insurance. The bigger the insurer, the more power it has negotiating prices and improving its doctor networks. Earlier on Thursday, U.S. health insurer Centene Corp  said it would buy smaller rival Health Net Inc  for $6.3 billion, underscoring the healthcare industry's rush to bulk up to negotiate more advantageous prices with suppliers and hospitals, and attract new customers.In rejecting Anthem's offer, Cigna previously cited Anthem's ""lack of growth strategies,"" complications related to its membership of Blue Cross Blue Shield Association and a ""massive"" data breach it suffered in February. Cigna's board is also concerned by Anthem's ""insistence"" that one person - Joseph Swedish, Anthem's president and chief executive officer - assume four roles of the combined company: chairman, CEO, president and head of integration.Anthem has said it believes investors support its refusal to guarantee that the CEO role of the combined company would go to Cigna CEO David Cordani.    (Reporting by Greg Roumeliotis in New York; Editing by Peter Galloway)",2015-07-02,CI,"Thu Jul 2, 2015 | 11:52am EDT","Anthem, Cigna in new round of talks -source",http://www.reuters.com//article/cigna-ma-anthem-idUSL1N0ZI1CQ20150702?type=companyNews
55,"  (Adds no comment from Cigna, regulators involved in deal, paragraphs 2, 8)By Luciana LopezNEW YORK, July 3 Aetna Inc's $37 billion deal to buy smaller health insurer Humana Inc will face rigorous scrutiny from U.S. regulators, which antitrust experts said could also make other large-scale mergers in the sector more difficult.The Aetna-Humana tie-up would be the largest such deal among health insurers. Friday's announcement starts the clock on an examination by regulators of whether consumers will be hurt by diminished competition. Competition regulators include the Department of Justice and various state-level agencies.The deal follows weeks of intense discussions about potential combinations among the five biggest U.S. health insurers: Aetna, Humana, Cigna Corp, Anthem Inc  and UnitedHealth Group.Insurers want more leverage in a healthcare system that has seen major consolidation among hospitals and doctor practices, as well as mergers between medical device makers and other suppliers. The cost of new drugs has soared, and President Barack Obama's healthcare law has made it harder for insurers to pass on higher costs to customers.Last month, Anthem offered to buy Cigna for $47 billion. The combined company would have surpassed UnitedHealth to become the single largest U.S. health insurer.Cigna, which had also considered purchasing Humana, has so far rejected the buyout approach. Some industry watchers expect a potential buyout of Cigna to be revived after Aetna's deal.Industry sources said Cigna and Anthem may have just a few months to sign a deal if they want it to be considered by antitrust authorities along with the Aetna-Humana deal. Cigna declined to comment about the Aetna-Humana deal. Anthem said it had nothing to say about other potential mergers.Regulators ""should be exceedingly skeptical of this deal"" between Aetna and Humana, said Diana Moss, president of the American Antritrust Institute. ""Depending on who merges and the change to the market structure, that affects the concerns about the competition.""Aetna said it is ready to address regulatory concerns.""Obviously this is something that we expect will get a thorough and careful review,"" Shawn Guertin, Aetna's chief financial officer, said in an interview. ""We've spent a lot of time looking at this at a fairly detailed level, and we certainly think that's a manageable situation."" Guertin conceded that a combined company could have some overlap, but declined to name possible divestitures that regulators might seek.""We're in the same business at the highest level, and so there certainly is an overlap in that regard,"" he said.""It's really about local markets,"" Guertin said. RECENT DEALS SCUTTLED Antitrust experts said a regulatory review of Aetna and Humana could also factor in whether there is another major deal in the industry.Regulators are expected to scrutinize how competition in local markets will be affected for each line of insurance: Medicare for the elderly, Medicaid for the poor, individual insurance, commercial insurance for small and large business and the large employer business.Regulators have recently scuttled deals in other industries that would have created mega players. In April, Comcast Corp abandoned its $45 billion offer for Time Warner Cable Inc because of antitrust worries.This month, the U.S. Justice Department sued to stop Sweden's Electrolux AB from buying General Electric Co's appliance business.""Agencies are becoming increasingly skeptical about whether you can remedy anti-competitive mergers by having some kind of divestiture,"" said David Balto, formerly the policy director of the Bureau of Competition of the Federal Trade Commission.Mergers might give insurers more punch to negotiate lower prices with pharmaceutical companies, Balto said. But he called that a ""Faustian bargain.""""Maybe they have more buying power, but then they're going to have more selling power.""   (Additional reporting by Caroline Humer and Gregory Roumeliotis; Editing by David Gregorio)",2015-07-03,CI,"Fri Jul 3, 2015 | 4:46pm EDT",UPDATE 1-Aetna's Humana deal to bring scrutiny on other insurer tie-ups -experts,http://www.reuters.com//article/healthcare-ma-regulator-idUSL1N0ZJ10J20150703?type=companyNews
56,"  Health insurers Anthem Inc (ANTM.N) and Cigna Corp (CI.N) were moving ahead to sign a merger deal as Cigna backed down on its differences over governance issues, CNBC tweeted, citing sources.The tweets also quoted sources as saying that UnitedHealth Group Inc (UNH.N) was looking to bid for Cigna.Cigna shares were up 3 percent at $155.08 in early trading on the Nasdaq. Anthem shares were up marginally at $160.27. UnitedHealth shares were little changed at $119.88.Cigna declined to comment on the report. Anthem and UnitedHealth were not immediately available for comment. Anthem had made several offers for Cigna, but a deal had been hung up in part due to differences over leadership. Anthem made its bid public on June 20, offering Cigna $47 billion in cash and stock.The biggest U.S. health insurers are seeking acquisitions to boost membership in government-paid healthcare plans and the employer-based insurance that is Cigna's specialty. Being bigger can help them negotiate better prices and improve their network of doctors. The U.S. Supreme Court's decision to uphold subsidies for individuals under President Barack Obama's signature healthcare law removed a large overhang for the insurers who would benefit from increasing enrollments into the Medicare and Medicaid programs.The report comes less than a week after Aetna Inc (AET.N) said it would buy smaller rival Humana Inc (HUM.N) for about $37 billion in cash and stock. Experts expect a potential acquisition of Cigna by Anthem to come under antitrust scrutiny. (Reporting by Vidya L Nathan and Anjali Rao Koppala in Bengaluru; Editing by Don Sebastian)",2015-07-09,CI,"Thu Jul 9, 2015 | 12:02pm EDT","Anthem, Cigna progressing toward deal: CNBC",http://www.reuters.com//article/us-cigna-m-a-anthem-idUSKCN0PJ1UW20150709?type=companyNews
57,"  (Adds details, background, updates shares)July 9 Health insurers Anthem Inc and Cigna Corp were moving ahead to sign a merger deal as Cigna backed down on its differences over governance issues, CNBC tweeted, citing sources.The tweets also quoted sources as saying that UnitedHealth Group Inc was looking to bid for Cigna.Cigna shares were up 3 percent at $155.08 in early trading on the Nasdaq. Anthem shares were up marginally at $160.27. UnitedHealth shares were little changed at $119.88. Cigna declined to comment on the report. Anthem and UnitedHealth were not immediately available for comment.Anthem had made several offers for Cigna, but a deal had been hung up in part due to differences over leadership. Anthem made its bid public on June 20, offering Cigna $47 billion in cash and stock. The biggest U.S. health insurers are seeking acquisitions to boost membership in government-paid healthcare plans and the employer-based insurance that is Cigna's specialty. Being bigger can help them negotiate better prices and improve their network of doctors. The U.S. Supreme Court's decision to uphold subsidies for individuals under President Barack Obama's signature healthcare law removed a large overhang for the insurers who would benefit from increasing enrollments into the Medicare and Medicaid programs.The report comes less than a week after Aetna Inc  said it would buy smaller rival Humana Inc for about $37 billion in cash and stock.Experts expect a potential acquisition of Cigna by Anthem to come under antitrust scrutiny.    (Reporting by Vidya L Nathan and Anjali Rao Koppala in Bengaluru; Editing by Don Sebastian)",2015-07-09,CI,"Thu Jul 9, 2015 | 11:04am EDT","UPDATE 1-Anthem, Cigna progressing towards deal - CNBC",http://www.reuters.com//article/cigna-ma-anthem-idUSL3N0ZP59820150709?type=companyNews
58,"  July 9 Health insurers Anthem Inc and Cigna Corp were moving ahead to sign a merger deal as Cigna backed down over governance issues, CNBC tweeted, citing sources.The tweets also quoted sources as saying that UnitedHealth Group Inc was looking to bid for Cigna.  Cigna shares were up 3 percent at $155.08 in early trading on the Nasdaq. Anthem shares were up marginally at $160.27. UnitedHealth shares were little changed at $119.88.   (Reporting by Vidya L Nathan in Bengaluru,) ",2015-07-09,CI,"Thu Jul 9, 2015 | 10:19am EDT","Anthem, Cigna progressing towards deal - CNBC",http://www.reuters.com//article/cigna-ma-anthem-idUSL3N0ZP57T20150709?type=companyNews
59,"  (Recasts to include merger talk)By Caroline HumerJuly 16 UnitedHealth Group Inc, the largest U.S. health insurer, on Thursday forecast higher profit and said medical costs were under control, pushing off any discussion about its role in a frenzy of insurer consolidation.UnitedHealth is the first of the national health insurers to report second quarter earnings amid dealmaking in the industry. Aetna Inc and Humana Inc have recently struck a deal, and Anthem Inc is in pursuit of Cigna Corp . UnitedHealth has also been reported to have looked at Aetna and Cigna.Companies are having to adjust to the national healthcare reform law, the Affordable Care Act, and have sought to cut costs and grow larger to use size to negotiate better contracts with doctors.""We are well positioned across virtually all of the key markets and...have plenty of scale across all our business segments,"" Chief Executive Stephen Helmsley told investors on a conference call. ""We are just going to continue to run our business."" UnitedHealth said medical cost trends remained controlled and were consistent with management expectations. The company's medical loss ratio - or percentage of premiums paid out for medical services - was 81.4 percent, a decline of 20 basis points but 60 basis points higher than Wall Street estimates.Shares fell about 1.8 percent after missing Wall Street cost estimates. They recovered some ground as the company attributed the shortfall to a miscalculation by the Street on the mix of its business.Executives said customer medical costs were higher for  Medicaid, Medicare and exchanges, where enrollment grew, than in the commercial sector. Disappointment that it did not announce a deal with its earnings report may have influenced the shares as well.""Certainly there has been speculation about what United is doing, or saying to Cigna,"" Leerink Partners analyst Ana Gupte said.The company said it expected medical spending to increase in the lower half of a range of 5.5 percent to 6.5 percent. That stable trend should enable it to accurately price insurance plans and produce the earnings growth it has forecast, Mizuho Securities healthcare analyst Sheryl Skolnick said. The company reported a 12.6 percent increase in second-quarter profit, and beat Wall Street expectations, largely due to cuts in sales, general and administrative costs and a better tax rate.It raised its profit forecast for the full year to $6.25-$6.35 per share from $6.15-$6.30 on revenue of about $154 billion. Analysts on average expect a full-year profit of $6.26 per share on revenue for $143.61 billion, according to Thomson Reuters I/B/E/S.UnitedHealth's revenue grew 11 percent to $36.26 billion, helped by its Optum business, which includes its technology and pharmacy benefit management businesses.Net income rose to $1.59 billion, or $1.64 per share, from $1.41 billion, or $1.42 per share, a year earlier.Analysts on average had expected a profit of $1.58 per share on revenue of $35.85 billion, according to Thomson Reuters I/B/   (Reporting by Caroline Humer in New York and Vidya L Nathan in Bengaluru; Editing by Don Sebastian, Bernadette Baum and Andrew Hay)",2015-07-16,CI,"Thu Jul 16, 2015 | 12:55pm EDT","UPDATE 3-UnitedHealth serves up second quarter growth, but no deal",http://www.reuters.com//article/unitedhealth-results-idUSL4N0ZW3BQ20150716?type=companyNews
60,"  July 16 UnitedHealth Group Inc, the largest U.S. health insurer, reported a quarterly profit that jumped 12.6 percent as revenue increased in its Optum business and enrollments increased.The insurer's net income rose to $1.59 billion, or $1.64 per share, for the quarter ended June 30 from $1.41 billion, or $1.42 per share, a year earlier. ]  UnitedHealth is the first of the national health insurers to report earnings. Its report comes at a time when the industry is in the midst of consolidation, with Aetna Inc and Humana Inc having recently struck a deal and Anthem Inc  in pursuit of Cigna Corp.   (Reporting by Vidya L Nathan in Bengaluru,; Editing by Don Sebastian) ",2015-07-16,CI,"Thu Jul 16, 2015 | 6:16am EDT","UnitedHealth's profit rises on higher enrollments, Optum business",http://www.reuters.com//article/unitedhealth-results-idUSL4N0ZW3A820150716?type=companyNews
61,"   By Greg Roumeliotis  Health insurer Anthem Inc is close to finalizing negotiations to acquire peer Cigna Inc and could announce a roughly $48 billion deal as early as this week, according to a person familiar with the matter.Most issues that were preventing a deal, such as price and the role of Cigna Chief Executive David Cordani, have been resolved, the person said, without offering details. Anthem has slightly improved on its previous cash and stock offer of $184 per share, the person added. The Wall Street Journal earlier reported that Anthem was nearing an agreement to pay about $187 per share for Cigna.Anthem and Cigna did not immediately respond to requests for comment. Cigna shares jumped 6.5 percent in after-hours trading to $161 while Anthem's shares were marginally lower after closing at $155.10 on Wednesday. A merger between the two health insurers would follow Aetna Inc's deal to buy Humana Inc for $37 billion, part of an industry consolidation following the Supreme Court's decision to uphold the Obamacare reforms.Anthem said in June that it had made several offers for Cigna but a deal had been delayed due in part to differences over who would lead the company and corporate governance. Cigna also said it was concerned that other members of the Blue Cross Blue Shield Association would be an obstacle.   (Reporting by Greg Roumeliotis in New York; Editing by Ken Wills)",2015-07-22,CI,"Wed Jul 22, 2015 | 7:56pm EDT",Anthem set to announce deal for Cigna this week -source,http://www.reuters.com//article/cigna-ma-anthem-idUSL1N10239Z20150722?type=companyNews
62,"  (Repeats with new story number)By Greg RoumeliotisJuly 22 Health insurer Anthem Inc is close to finalizing negotiations to acquire peer Cigna Inc  and could announce a roughly $48 billion deal as early as this week, according to a person familiar with the matter.Most issues that were preventing a deal, such as price and the role of Cigna Chief Executive David Cordani, have been resolved, the person said, without offering details. Anthem has slightly improved on its previous cash and stock offer of $184 per share, the person added. The Wall Street Journal earlier reported that Anthem was nearing an agreement to pay about $187 per share for Cigna. Anthem and Cigna did not immediately respond to requests for comment.Cigna shares jumped 6.5 percent in after-hours trading to $161 while Anthem's shares were marginally lower after closing at $155.10 on Wednesday. A merger between the two health insurers would follow Aetna Inc's deal to buy Humana Inc for $37 billion, part of an industry consolidation following the Supreme Court's decision to uphold the Obamacare reforms.Anthem said in June that it had made several offers for Cigna but a deal had been delayed due in part to differences over who would lead the company and corporate governance. Cigna also said it was concerned that other members of the Blue Cross Blue Shield Association would be an obstacle.   (Reporting by Greg Roumeliotis in New York; Editing by Ken Wills)",2015-07-22,CI,"Wed Jul 22, 2015 | 7:50pm EDT",RPT-UPDATE 2-Anthem set to announce deal for Cigna this week -source,http://www.reuters.com//article/cigna-ma-anthem-idUSL1N10239B20150722?type=companyNews
63,"   By Greg Roumeliotis  Health insurer Anthem Inc is close to finalizing negotiations to acquire peer Cigna Inc and could announce a roughly $48 billion deal as early as this week, according to a person familiar with the matter.Most issues that were preventing a deal, such as price and the role of Cigna Chief Executive David Cordani, have been resolved, the person said, without offering details. Anthem has slightly improved on its previous cash and stock offer of $184 per share, the person added.The Wall Street Journal earlier reported that Anthem was nearing an agreement to pay about $187 per share for Cigna. Anthem and Cigna did not immediately respond to requests for comment. Cigna shares jumped 6.5 percent in after-hours trading to $161 while Anthem's shares were marginally lower after closing at $155.10 on Wednesday. A merger between the two health insurers would follow Aetna Inc's deal to buy Humana Inc for $37 billion, part of an industry consolidation following the Supreme Court's decision to uphold the Obamacare reforms. Anthem said in June that it had made several offers for Cigna but a deal had been delayed due in part to differences over who would lead the company and corporate governance. Cigna also said it was concerned that other members of the Blue Cross Blue Shield Association would be an obstacle. (Reporting by Greg Roumeliotis in New York; Editing by Ken Wills)",2015-07-22,CI,"Wed Jul 22, 2015 | 7:31pm EDT",Anthem set to announce deal for Cigna this week: source,http://www.reuters.com//article/us-cigna-m-a-anthem-idUSKCN0PW2JG20150722?type=companyNews
64,"  (Adds more details from source)By Greg RoumeliotisJuly 22 Health insurer Anthem Inc is close to finalizing negotiations to acquire peer Cigna Inc  and could announce a roughly $48 billion deal as early as this week, according to a person familiar with the matter.Most issues that were preventing a deal, such as price and the role of Cigna Chief Executive David Cordani, have been resolved, the person said, without offering details. Anthem has slightly improved on its previous cash and stock offer of $184 per share, the person added. The Wall Street Journal earlier reported that Anthem was nearing an agreement to pay about $187 per share for Cigna. Anthem and Cigna did not immediately respond to requests for comment.Cigna shares jumped 6.5 percent in after-hours trading to $161 while Anthem's shares were marginally lower after closing at $155.10 on Wednesday. A merger between the two health insurers would follow Aetna Inc's deal to buy Humana Inc for $37 billion, part of an industry consolidation following the Supreme Court's decision to uphold the Obamacare reforms.Anthem said in June that it had made several offers for Cigna but a deal had been delayed due in part to differences over who would lead the company and corporate governance. Cigna also said it was concerned that other members of the Blue Cross Blue Shield Association would be an obstacle.   (Reporting by Greg Roumeliotis in New York; Editing by Ken Wills)",2015-07-22,CI,"Wed Jul 22, 2015 | 7:29pm EDT",UPDATE 2-Anthem set to announce deal for Cigna this week -source,http://www.reuters.com//article/cigna-ma-anthem-idUSL3N1025QG20150722?type=companyNews
