,Article,Date,Symbol,Time,Title,Url
134,"   By Bill Berkrot and Caroline Humer | NEW YORK  NEW YORK Cigna Corp signed deals that will pay the makers of two potent but pricey cholesterol-lowering treatments based on how well their customers respond to the medications, the health insurer said on Wednesday.The treatments, Repatha from Amgen Inc and Praluent sold by Regeneron Pharmaceuticals Inc and Sanofi, hit the market last summer with a list price of more than $14,000 per year. They were approved for patients unable to tolerate or who are not able to adequately control ""bad"" LDL cholesterol with statins, such as Lipitor, the most commonly prescribed drugs for cholesterol. Statins typically cost only hundreds of dollars a year.The deals are the highest profile examples to date of insurers basing payments on how well medicines perform for patients. Cigna and Aetna Inc signed deals this year for Entresto, a heart failure drug from Novartis that had slow sales because of its high price.With no price controls on prescription medicines in the United States, as they have in Europe and elsewhere, insurers and pharmacy benefit managers (PBMs) have become far more aggressive in demanding price discounts and limiting access to expensive new medicines.Under the new agreements, if customers do not reduce LDL to levels seen in clinical trials, the drugmakers will further discount the cost. If the treatments meet or exceed anticipated cholesterol reduction, the negotiated price remains in place, Cigna said.Cigna declined to disclose the prices negotiated, or level of LDL reduction it will use to determine if further discounts are in order. In extensive clinical trials, the drugs reduced LDL by 60 percent or more.Regeneron's head of commercial operations, Robert Terifay, said he expects insurers to increasingly use value analyses to determine payment for chronic conditions, including asthma and heart disease. He said Regeneron had signed deals with other payers to assess the value of Praluent, but declined to identify them. The drugmakers have reported meager sales of Repatha and Praluent, injectable biotech drugs called PCSK9 inhibitors, as insurers have been slow to approve customers seeking the treatments.Amgen last month said some three-quarters of Repatha prescriptions have been denied, and doctors have expressed frustration over the barriers to getting the new medicines to patients. ""We continue to work with payers to help them see the unintended consequences of an onerous system, resulting in patients with high LDL levels not getting access to Repatha,"" Amgen said in a statement. Cigna has a process in place ""that ensures timely access to these very important breakthrough medications for the population that really needs these medications, while ensuring that there isn't a lot of inappropriate or unnecessary utilization,"" Chris Bradbury, senior vice president of Cigna Pharmacy, said in an interview.    Some reimbursement barriers are expected to be removed if large ongoing trials demonstrate that the drugs prevent heart attacks and deaths in addition to dramatically lowering LDL. The first of those results are expected later this year.Aetna said it chose not to engage in a similar performance-based reimbursement arrangement at this time. ""As more cardiovascular outcomes data becomes available, well revisit our options,"" Aetna spokesman T.J. Crawford said. Cigna said it will analyze integrated medical and pharmacy claims data to determine if its customers treated with PCSK9s experience cardiovascular improvements to get a sense of the drugs' benefits outside of the clinical trial setting.It will look for reductions in heart attacks and strokes, for example, Bradbury said.Cigna is seeking to understand the level of medical cost avoidance in order to determine ""a fair market value for the price of the drugs,"" Bradbury said.Amgen shares closed down nearly 2 percent on Wednesday, while Regeneron shares fell 3.6 percent, both on Nasdaq.      (Additional reporting by Ransdell Pierson; editing by Alan Crosby and Diane Craft)",2016-05-11,CI,"Wed May 11, 2016 | 6:45pm EDT","Cigna makes deals with Amgen, Sanofi for pricey cholesterol drugs",http://www.reuters.com//article/us-cigna-cholesterol-idUSKCN0Y21J1?type=companyNews
135,"   By Bill Berkrot and Caroline Humer | NEW YORK  NEW YORK Cigna Corp signed deals that will pay the makers of two potent but pricey cholesterol-lowering treatments based on how well their customers respond to the medications, the health insurer said on Wednesday.The treatments, Repatha from Amgen Inc and Praluent sold by Regeneron Pharmaceuticals Inc and Sanofi, hit the market last summer with a list price of more than $14,000 per year. They were approved for patients unable to tolerate or who are not able to adequately control ""bad"" LDL cholesterol with statins, such as Lipitor, the most commonly prescribed drugs for cholesterol. Statins typically cost only hundreds of dollars a year.The deals are the highest profile examples to date of insurers basing payments on how well medicines perform for patients. Cigna and Aetna Inc signed deals this year for Entresto, a heart failure drug from Novartis that had slow sales because of its high price.With no price controls on prescription medicines in the United States, as they have in Europe and elsewhere, insurers and pharmacy benefit managers (PBMs) have become far more aggressive in demanding price discounts and limiting access to expensive new medicines.Under the new agreements, if customers do not reduce LDL to levels seen in clinical trials, the drugmakers will further discount the cost. If the treatments meet or exceed anticipated cholesterol reduction, the negotiated price remains in place, Cigna said.Cigna declined to disclose the prices negotiated, or level of LDL reduction it will use to determine if further discounts are in order. In extensive clinical trials, the drugs reduced LDL by 60 percent or more.Regeneron's head of commercial operations, Robert Terifay, said he expects insurers to increasingly use value analyses to determine payment for chronic conditions, including asthma and heart disease. He said Regeneron had signed deals with other payers to assess the value of Praluent, but declined to identify them. The drugmakers have reported meager sales of Repatha and Praluent, injectable biotech drugs called PCSK9 inhibitors, as insurers have been slow to approve customers seeking the treatments.Amgen last month said some three-quarters of Repatha prescriptions have been denied, and doctors have expressed frustration over the barriers to getting the new medicines to patients. ""We continue to work with payers to help them see the unintended consequences of an onerous system, resulting in patients with high LDL levels not getting access to Repatha,"" Amgen said in a statement. Cigna has a process in place ""that ensures timely access to these very important breakthrough medications for the population that really needs these medications, while ensuring that there isn't a lot of inappropriate or unnecessary utilization,"" Chris Bradbury, senior vice president of Cigna Pharmacy, said in an interview.    Some reimbursement barriers are expected to be removed if large ongoing trials demonstrate that the drugs prevent heart attacks and deaths in addition to dramatically lowering LDL. The first of those results are expected later this year.Aetna said it chose not to engage in a similar performance-based reimbursement arrangement at this time. ""As more cardiovascular outcomes data becomes available, well revisit our options,"" Aetna spokesman T.J. Crawford said. Cigna said it will analyze integrated medical and pharmacy claims data to determine if its customers treated with PCSK9s experience cardiovascular improvements to get a sense of the drugs' benefits outside of the clinical trial setting.It will look for reductions in heart attacks and strokes, for example, Bradbury said.Cigna is seeking to understand the level of medical cost avoidance in order to determine ""a fair market value for the price of the drugs,"" Bradbury said.Amgen shares closed down nearly 2 percent on Wednesday, while Regeneron shares fell 3.6 percent, both on Nasdaq.      (Additional reporting by Ransdell Pierson; editing by Alan Crosby and Diane Craft)",2016-05-11,CI,"Wed May 11, 2016 | 6:45pm EDT","UPDATE 3-Cigna makes deals with Amgen, Sanofi for pricey cholesterol drugs",http://www.reuters.com//article/cigna-cholesterol-idUSL2N1880KS?type=companyNews
136,"  May 11 Regeneron Pharmaceuticals Inc* Regeneron head of commercial operations Robert Terifay, in interview, says drugmaker has signed deals with other payers, in addition to Cigna, to assess value of its Praluent cholesterol drug * Says could take years for Cigna's medical, pharmaceuticals databases to suggest whether Praluent cuts heart attack risk * Says easiest measure of value for payers is extent to which drug lowers LDL cholesterol * Says expects insurers to increasingly use value analyses for many chronic diseases, including asthma and heart disease  Source text for Eikon:  Further company coverage:    (Reporting by Ransdell Pierson)",2016-05-11,CI,"Wed May 11, 2016 | 12:59pm EDT",BRIEF-Regeneron says in deals with other payers to assess Praluent value,http://www.reuters.com//article/idUSL2N18818B?type=companyNews
137,"  NEW YORK May 11 Cigna Corp signed deals that will pay the makers of Repatha and Praluent, two powerful but pricey cholesterol lowering treatments, based on how well their customers respond to the medicines, the health insurer said on Wednesday.The treatments hit the market last year with a list price of more than $14,000 per year. They were approved for patients who are not able to adequately control ""bad cholesterol"" with statins, the most commonly prescribed drugs for cholesterol. Statins typically cost only hundreds of dollars a year.  Sanofi SA and Regeneron Pharmaceuticals  make Praluent and Amgen Inc makes Repatha.    (Reporting by Caroline Humer; Editing by Nick Zieminski) ",2016-05-11,CI,"Wed May 11, 2016 | 9:05am EDT","Cigna makes deals with Amgen, Sanofi for pricey cholesterol drugs",http://www.reuters.com//article/cigna-cholesterol-idUSL2N1880JN?type=companyNews
138,  May 11 Cigna Corp : * Says has entered into new value-based contracts with both amgen and sanofi/regeneron for PCSK9 inhibitors for commercial business  Source text for Eikon:  Further company coverage:    (Bengaluru Newsroom: +1-646-223-8780)  ,2016-05-11,CI,"Wed May 11, 2016 | 8:37am EDT",BRIEF-Cigna enters into new contracts with Amgen and Sanofi/Regeneron,http://www.reuters.com//article/idUSFWN1880W1?type=companyNews
139,"  NEW YORK Health insurer Cigna Corp plans to cut its customers' prescriptions for opioid treatments by 25 percent over the next three years, putting its weight behind a U.S. government battle against addictive pain killers.Cigna, whose plan to be acquired by Anthem Inc would make it part of the nation's largest health insurer, said  on Thursday it is backing efforts by state governments to require doctors to check state databases for high-risk customers before prescribing opioid drugs for longer than 21 days.U.S. President Barack Obama earlier this year asked Congress for $1.1 billion in new funding over two years to expand treatment for a spreading heroin and prescription pain killer epidemic.Some medical researchers believe an increase in opioid prescriptions over the past few years has caused many patients to become hooked and to seek heroin when their prescriptions expire. In 2014, a record number of Americans died from drug overdoses. As part of its plan, Cigna is to send doctors information from its own claims databases about its customers' prescription opioid use, enabling doctors to find out if prescriptions have been written elsewhere or if patients have been prescribed drugs to treat opioid addiction.It will also work with physicians to educate them on prescribing guidelines and access to medication-assisted therapy to treat substance use disorders, Cigna's Chief Medical Officer for Behavioral Health Dr. Douglas Nemecek said in an interview.  Nemecek said Cigna is considering the same types of measures that it has used to moderate use of many medications, including prior authorization, step therapy and the size of the co-pay. Over 250 million prescriptions are written each year for opioids, Nemecek said. He declined to provide the number attributed to Cigna customers. (Reporting by Caroline Humer; Editing by Bill Rigby)",2016-05-19,CI,"Thu May 19, 2016 | 8:06am EDT",Cigna plans to cut opioid use among U.S. customers by 25 pct,http://www.reuters.com//article/us-cigna-opioids-idUSKCN0YA1J8?type=companyNews
140,"  NEW YORK Health insurer Cigna Corp plans to cut its customers' prescriptions for opioid treatments by 25 percent over the next three years, putting its weight behind a U.S. government battle against addictive pain killers.Cigna, whose plan to be acquired by Anthem Inc would make it part of the nation's largest health insurer, said  on Thursday it is backing efforts by state governments to require doctors to check state databases for high-risk customers before prescribing opioid drugs for longer than 21 days.U.S. President Barack Obama earlier this year asked Congress for $1.1 billion in new funding over two years to expand treatment for a spreading heroin and prescription pain killer epidemic.Some medical researchers believe an increase in opioid prescriptions over the past few years has caused many patients to become hooked and to seek heroin when their prescriptions expire. In 2014, a record number of Americans died from drug overdoses. As part of its plan, Cigna is to send doctors information from its own claims databases about its customers' prescription opioid use, enabling doctors to find out if prescriptions have been written elsewhere or if patients have been prescribed drugs to treat opioid addiction.It will also work with physicians to educate them on prescribing guidelines and access to medication-assisted therapy to treat substance use disorders, Cigna's Chief Medical Officer for Behavioral Health Dr. Douglas Nemecek said in an interview.  Nemecek said Cigna is considering the same types of measures that it has used to moderate use of many medications, including prior authorization, step therapy and the size of the co-pay. Over 250 million prescriptions are written each year for opioids, Nemecek said. He declined to provide the number attributed to Cigna customers. (Reporting by Caroline Humer; Editing by Bill Rigby)",2016-05-19,CI,"Thu May 19, 2016 | 8:06am EDT",Cigna plans to cut opioid use among U.S. customers by 25 pct,http://www.reuters.com//article/cigna-opioids-idUSL2N18F15U?type=companyNews
141,"  WASHINGTON Quarrels have broken out behind the scenes of Anthem Inc's (ANTM.N) proposed acquisition of Cigna Corp (CI.N), as the health insurers seek regulatory approval for their landmark deal, the Wall Street Journal reported on Sunday.The newspaper said the squabbles could delay or derail antitrust approvals, though the deal does not appear to be in danger of imminent collapse.Sources familiar with the matter confirmed the citations in the Journal story. An Anthem spokeswoman declined to comment on the Journal report. Cigna officials were not immediately available to comment.  In a series of letters between top officials including their chief executives, the Journal said Anthem and Cigna accuse each other of violating the July merger agreement and fumbling submissions to regulators. A key point of contention is Anthem's lawsuit against Express Scripts Holding Co (ESRX.O), a middleman for prescription drugs, according to the newspaper. The suit accuses Express Scripts of overcharging Anthem for drugs.Cigna Chairman Isaiah Harris Jr., in an April 9 letter to Anthem's board, said the suit could hurt the prospects for regulatory approval and the combined company's value, the Journal said. Anthem responded to Cigna's board that it had alerted Cigna to the possibility of a lawsuit early in their merger talks, and that getting better prices from Express Scripts could only be beneficial, the newspaper reported. Disclosure statements from the two companies earlier this month hinted that they had different views about when the deal would close. In a filing with the Securities and Exchange Commission Cigna said that the deal may close in 2017, rather than in 2016 due to the complexity of the regulatory process. Anthem, meanwhile, said it had not changed its expectations on timing. (Reporting by David Morgan and Olivia Oran Editing by Jane Merriman and Andrea Ricci)",2016-05-22,CI,"Sun May 22, 2016 | 1:54pm EDT","Anthem, Cigna merger squabbles could delay antitrust approval: WSJ",http://www.reuters.com//article/us-cigna-m-a-anthem-idUSKCN0YD0RF?type=companyNews
142,"  WASHINGTON Quarrels have broken out behind the scenes of Anthem Inc's (ANTM.N) proposed acquisition of Cigna Corp (CI.N), as the health insurers seek regulatory approval for their landmark deal, the Wall Street Journal reported on Sunday.The newspaper said the squabbles could delay or derail antitrust approvals, though the deal does not appear to be in danger of imminent collapse.Sources familiar with the matter confirmed the citations in the Journal story. An Anthem spokeswoman declined to comment on the Journal report. Cigna officials were not immediately available to comment.  In a series of letters between top officials including their chief executives, the Journal said Anthem and Cigna accuse each other of violating the July merger agreement and fumbling submissions to regulators. A key point of contention is Anthem's lawsuit against Express Scripts Holding Co (ESRX.O), a middleman for prescription drugs, according to the newspaper. The suit accuses Express Scripts of overcharging Anthem for drugs.Cigna Chairman Isaiah Harris Jr., in an April 9 letter to Anthem's board, said the suit could hurt the prospects for regulatory approval and the combined company's value, the Journal said. Anthem responded to Cigna's board that it had alerted Cigna to the possibility of a lawsuit early in their merger talks, and that getting better prices from Express Scripts could only be beneficial, the newspaper reported. Disclosure statements from the two companies earlier this month hinted that they had different views about when the deal would close. In a filing with the Securities and Exchange Commission Cigna said that the deal may close in 2017, rather than in 2016 due to the complexity of the regulatory process. Anthem, meanwhile, said it had not changed its expectations on timing. (Reporting by David Morgan and Olivia Oran Editing by Jane Merriman and Andrea Ricci)",2016-05-22,CI,"Sun May 22, 2016 | 1:54pm EDT","UPDATE 1-Anthem, Cigna merger squabbles could delay antitrust approval -WSJ",http://www.reuters.com//article/cigna-ma-anthem-idUSL2N18J09P?type=companyNews
143,"  WASHINGTON May 22 Quarrels have broken out behind the scenes of Anthem Inc's proposed acquisition of Cigna Corp, as the health insurers seek regulatory approval for their landmark deal, the Wall Street Journal reported on Sunday.The newspaper said the squabbles could delay or derail antitrust approvals, though the deal does not appear to be in danger of imminent collapse.An Anthem spokeswoman declined to comment on the Journal report. Cigna officials were not immediately available to comment. In a series of letters between top officials including their chief executives, the Journal said Anthem and Cigna accuse each other of violating the July merger agreement and fumbling submissions to regulators. A key point of contention is Anthem's lawsuit against Express Scripts Holding Co, a middleman for prescription drugs, according to the newspaper. The suit accuses Express Scripts of overcharging Anthem for drugs. Cigna Chairman Isaiah Harris Jr., in an April 9 letter to Anthem's board, said the suit could hurt the prospects for regulatory approval and the combined company's value, the Journal said. Anthem responded to Cigna's board that it had alerted Cigna to the possibility of a lawsuit early in their merger talks, and that getting better prices from Express Scripts could only be beneficial, the newspaper reported.(Reporting by David Morgan. Editing by Jane Merriman)",2016-05-22,CI,"Sun May 22, 2016 | 10:21am EDT","Anthem, Cigna merger squabbles could delay antitrust approval - WSJ",http://www.reuters.com//article/cigna-ma-anthem-idUSL2N18J062?type=companyNews
144,"   By Caroline Humer  Anthem Inc Chief Executive Officer Joseph Swedish said on Tuesday the health insurer was pushing for approval from antitrust regulators reviewing its $51 billion acquisition of Cigna Corp and expects to hear a decision in July.Anthem's bid for Cigna followed closely after Aetna Inc's  proposed $34 billion purchase of Humana Inc   last July. The two transactions would reduce the U.S. health insurance market to three major players from five, raising questions about whether regulators scrutinizing the deals would approve both.Swedish said antitrust regulators have asked many questions about how it and Cigna manage healthcare benefits for large employers, but that the overall review was moving forward as expected.Speaking at the UBS Global Healthcare Conference, Swedish said Anthem has argued to regulators that the deal will save consumers money as the combined company would be able to negotiate better prices for medical services. Swedish expects the U.S. Department of Justice to make a determination on the deal in July. He spoke openly about the process after the Wall Street Journal reported there was heated correspondence between Anthem and Cigna lawyers working on the review. The company had previously declined to comment.Anthem General Counsel Thomas Zielinski provided further detail, saying the company is due to meet with the Justice Department in July, when they expect to learn if the deal will be rejected, approved, or approved with remediations such as asset sales. The company announced plans to buy Cigna nearly a year ago in a cash and stock deal worth about $54 billion at the time.Anthem shares fell 1.9 percent, or $2.43, to $130.75 and Cigna shares were off 54 cents, or 0.4 percent, at $125.61 in Tuesday trading. Based on those share prices, the deal is worth $51 billion and values Cigna shares at $170.67. In particular, investors have focused on doubts that large national customers support the deal, an issue that has turned federal antitrust regulators against other acquisitions it has reviewed this year and last year.Zielinski said that both Anthem and Cigna had provided antitrust regulators with 30 to 50 national customers to contact. National hospitals and doctors groups have spoken out against the deal, saying it would hurt Americans.Zielinski also told investors on Tuesday that he was considering several different ways that he could meet any conditions regulators might set. He did not provide details on those alternatives, but said that there were interested buyers for assets if sales were required.",2016-05-24,CI,"Tue May 24, 2016 | 12:40pm EDT",Anthem CEO expects U.S. regulatory decision in July,http://www.reuters.com//article/cigna-ma-anthem-idUSL2N18L0SQ?type=companyNews
