,Article,Date,Symbol,Time,Title,Url
94,"   By Brendan Pierson  Health insurer Cigna Corp on Friday agreed to drop its requirement that patients with HIV/AIDS get some of their medications exclusively through its mail-order pharmacy, settling a consumer lawsuit.California-based advocacy group Consumer Watchdog, which announced the settlement on Friday, had sued Cigna in April in Florida federal court on behalf of a Fort Lauderdale man. They claimed the mail-order requirement discriminated against HIV/AIDS patients in order to boost profits.When the settlement takes effect on Dec. 1, Cigna patients will be able to get their drugs at any in-network pharmacy.The group sought to represent a nationwide class of HIV/AIDS patients, but Cigna agreed to the settlement before the court certified the case as a class action. Consumer Watchdog claimed that Cigna's policy of requiring patients to buy certain high-cost specialty HIV/AIDS drugs through its mail-order program violated the Affordable Care Act, President Barack Obama's signature healthcare law, which prohibits discriminating on the basis of patients' medical condition.It said the program prevented patients from consulting with knowledgeable local pharmacists about the safety of their drug regimens, ran the risk of compromising their privacy when they received drugs in the mail and, in some cases, made the drugs more expensive.Patients who paid more than they would have through a local pharmacy will be able to seek reimbursement under the settlement, Consumer Watchdog said. ""This settlement will bring to a close a nerve-racking episode for patients with HIV and AIDS who face serious threats to their health and privacy,"" Jerry Flanagan, lead staff attorney for Consumer Watchdog, said in a press release.Cigna spokeswoman Karen Eldred said the company had no comment on the settlement, which was finalized in court on Thursday. Consumer Watchdog reached with United Healthcare and Anthem Blue Cross in July 2014 and June 2013, respectively.The case is John Doe, on behalf of himself and all others similarly situated plaintiffs, v. Cigna Health and Life Insurance Co et al, U.S. District Court, Southern District of Florida, No. 15-60894. (Reporting By Brendan Pierson in New York; Editing by David Gregorio)",2015-10-09,CI,"Fri Oct 9, 2015 | 4:47pm EDT",Cigna drops mail-order requirement for HIV drugs in settlement,http://www.reuters.com//article/us-cigna-hiv-settlement-idUSKCN0S32J820151009?type=companyNews
95,"   By Brendan Pierson  Oct 9 Health insurer Cigna Corp on Friday agreed to drop its requirement that patients with HIV/AIDS get some of their medications exclusively through its mail-order pharmacy, settling a consumer lawsuit.California-based advocacy group Consumer Watchdog, which announced the settlement on Friday, had sued Cigna in April in Florida federal court on behalf of a Fort Lauderdale man. They claimed the mail-order requirement discriminated against HIV/AIDS patients in order to boost profits.When the settlement takes effect on Dec. 1, Cigna patients will be able to get their drugs at any in-network pharmacy.The group sought to represent a nationwide class of HIV/AIDS patients, but Cigna agreed to the settlement before the court certified the case as a class action. Consumer Watchdog claimed that Cigna's policy of requiring patients to buy certain high-cost specialty HIV/AIDS drugs through its mail-order program violated the Affordable Care Act, President Barack Obama's signature healthcare law, which prohibits discriminating on the basis of patients' medical condition.It said the program prevented patients from consulting with knowledgeable local pharmacists about the safety of their drug regimens, ran the risk of compromising their privacy when they received drugs in the mail and, in some cases, made the drugs more expensive. Patients who paid more than they would have through a local pharmacy will be able to seek reimbursement under the settlement, Consumer Watchdog said.""This settlement will bring to a close a nerve-racking episode for patients with HIV and AIDS who face serious threats to their health and privacy,"" Jerry Flanagan, lead staff attorney for Consumer Watchdog, said in a press release. Cigna spokeswoman Karen Eldred said the company had no comment on the settlement, which was finalized in court on Thursday.Consumer Watchdog reached with United Healthcare and Anthem Blue Cross in July 2014 and June 2013, respectively.The case is John Doe, on behalf of himself and all others similarly situated plaintiffs, v. Cigna Health and Life Insurance Co et al, U.S. District Court, Southern District of Florida, No. 15-60894.   (Reporting By Brendan Pierson in New York; Editing by David Gregorio)",2015-10-09,CI,"Fri Oct 9, 2015 | 4:45pm EDT",Cigna drops mail-order requirement for HIV drugs in settlement,http://www.reuters.com//article/cigna-hiv-settlement-idUSL1N12926H20151009?type=companyNews
96,"  NEW YORK Anthem Inc (ANTM.N) Chief Executive Officer Joseph Swedish said on Wednesday that he expects its planned acquisition of Cigna to close in the second half of 2016 as anticipated.Swedish said the company is currently responding to antitrust requests on the combination, which will create the largest health insurer in the United States. It is also working with state-based regulators who are reviewing the transaction.    (Reporting by Caroline Humer, Editing by Franklin Paul)",2015-10-28,CI,"Wed Oct 28, 2015 | 9:02am EDT",Anthem CEO expects Cigna acquisition to close second half of 2016,http://www.reuters.com//article/us-anthem-results-ceo-idUSKCN0SM1LY20151028?type=companyNews
97,"  (Recasts to focus on individual exchange business, adds CFO and analyst comments, share prices)By Caroline HumerOct 28 Health insurer Anthem Inc said on Wednesday that its Obamacare insurance business is being hampered by lower-than-anticipated enrollment due to fewer applicants than expected and cheaper premium rates at competitors.Anthem has been one of the biggest and most profitable insurers in the new individual market, which was overhauled in 2014 with new government subsidized plans sold on exchanges created under Obamacare. Now Anthem says that business will drag on profit growth in 2016 and could even affect its long-term 2018 financial target.The comments from the second-largest U.S. health insurer came in its third-quarter financial report, which showed that other government-based businesses had outperformed expectations.Shares of Anthem were down 5.1 percent at $137.35 in morning trading. Cigna Corp, which Anthem has announced plans to buy, was down 3.2 percent while shares of Aetna Inc, which reports on Thursday, were down 2.8 percent.""We're trending the wrong direction on enrollment,"" Anthem Chief Financial Officer Wayne DeVeydt told investors on a conference call. The company lost 69,000 exchange customers during the quarter, ending with 824,000 customers. It has 1.75 million total individual customers. Anthem, which operates Blue Cross Blue Shield plans in more than a dozen states, said it expects continued enrollment declines in the fourth quarter and that 2016 will be weak as competitors undercut prices. After that, it is counting on improvements in 2017 and 2018 when it expects to be able to compete better on prices.Many of its individual customers buy their insurance on the exchanges created under President Barack Obama's national healthcare reform law and receive subsidies from the government aimed at making it more affordable. The government expects about 9.1 million people to have this insurance at the end of 2015, a lower target than the 15 million it once aimed for, and for next year expects 10 million people to enroll.Earlier this week, the U.S. government said that in the 37 states where it runs exchanges, the monthly premium rate of the benchmark health insurance plan will increase 7.5 percent on average. DeVeydt said the company was not seeing what hospitals attested to this week: patients dropping coverage because of premium prices.Two weeks ago, UnitedHealth Group Inc disappointed investors when it told them the individual business was cutting into profit this year. Unlike Anthem, it said it expected 2016 to improve.Leerink Partners analyst Ana Gupte described Anthem's commentary on the call as being ""very cautious"" and noted the pressure from market share losses to other plans that had priced below them in 2016. Anthem said its other businesses did well as more people enrolled for its government plans in Medicare for the elderly and disabled and Medicaid for lower-income families. Medicaid enrollment rose by 786,000 members in the third quarter.Anthem said earnings rose to $654.8 million, or $2.43 per share, from $630.9 million, or $2.22 per share, a year earlier.The company said spending on medical claims as a percentage of premiums rose to 83.6 percent from 82.5 percent a year ago, due to expenses in its individual business. The metric is keenly watched for signs of rising costs.On an adjusted basis, Anthem earned $2.73 per share, well above analysts' average estimate of $2.33 according to Thomson Reuters I/B/E/S.Revenue rose to $19.77 billion from $18.37 billion. Analysts were expecting revenue of $19.64 billion.The company also forecast full-year profit of $10.10-$10.20 per share, below analysts' expectations of $10.22.   (Reporting by Caroline Humer in New York and Amrutha Penumudi in Bengaluru; Editing by Savio D'Souza and Matthew Lewis)",2015-10-28,CI,"Wed Oct 28, 2015 | 11:04am EDT",UPDATE 2-Anthem shares falls as Obamacare business hampers profit,http://www.reuters.com//article/anthem-results-idUSL3N12S3HI20151028?type=companyNews
98,"  NEW YORK Oct 28 Anthem Inc Chief Executive Officer Joseph Swedish said on Wednesday that he expects its planned acquisition of Cigna to close in the second half of 2016 as anticipated. Swedish said the company is currently responding to antitrust requests on the combination, which will create the largest health insurer in the United States. It is also working with state-based regulators who are reviewing the transaction.   (Reporting by Caroline Humer, Editing by Franklin Paul)  ",2015-10-28,CI,"Wed Oct 28, 2015 | 9:00am EDT",Anthem CEO expects Cigna acquisition to close 2nd half of 2016,http://www.reuters.com//article/anthem-results-ceo-idUSL1N12S0XF20151028?type=companyNews
