,Article,Date,Symbol,Time,Title,Url
15,"  (The following statement was released by the rating agency) CHICAGO, August 26 (Fitch) Fitch Ratings has affirmed Cummins, Inc.'s (CMI)  Issuer Default Rating (IDR) and long-term debt ratings at 'A'. The Rating  Outlook is Stable. A full list of rating actions follows at the end of this  release. KEY RATING DRIVERS The ratings incorporate CMI's strong operating profile including competitive  positions in its engine and power generation markets, technological  capabilities, and global distribution network. The company's new product  development continues to be effective in meeting new requirements for fuel  efficiency, emissions standards, and systems integration. In addition, CMI's  financial flexibility and low leverage mitigate concerns about the company's  exposure to cyclical heavy- and medium-duty truck, off-road equipment, and power  generation markets.  CMI's debt totaled nearly $1.7 billion at June 29, 2014, and debt/EBITDA  remained low at 0.74x. CMI's leverage would be lower when considering the impact  of earnings from manufacturing and distributor joint ventures which are excluded  from Fitch's calculation of EBITDA.  Joint venture income from unconsolidated ventures, primarily related to the  engine and distribution segments, is an important source of earnings for CMI and  generates approximately 17% of segment profit. In late 2013, CMI initiated a  plan to acquire most of its partly-owned distributors in the U.S. and Canada to  be largely completed by the end of 2016. It estimates the acquisitions will  total approximately $600 million, of which roughly half had been completed by  mid-2014. The majority of the transactions are occurring at predetermined prices  as distribution agreements expire.  CMI expects that full ownership of the distributors will enable it to streamline  operations and improve customer support. Slightly more than half of distribution  revenue is generated from parts, filtration and service which tend to be more  stable than CMI's original equipment business. Acquiring CMI's North American  distributors involves less risk than acquiring unrelated third-party businesses  and provides an opportunity to capture future aftermarket revenue associated  with original equipment sales.  Rating concerns include normal cyclicality in CMI's end markets and the risk of  vertical integration by CMI's truck engine customers. CMI has a substantial  market share of engine sales in the North America heavy duty and medium duty  markets, but its customers also produce their own engines which could  potentially displace CMI engines. This concern is mitigated by CMI's effective  product development which supports demand by end-users for its engines. Also,  any loss of market share could be partly offset by expansion in emerging regions  which offer long-term growth prospects and by diversification across CMI's other  engine, components and distribution businesses.  Other rating concerns include spending for share repurchases and acquisitions  which are up materially. The company intends to return 50% of operating cash  flow to shareholders, but this level should still allow it to maintain low  leverage and solid liquidity. Fitch expects CMI would adjust discretionary  spending if necessary to maintain strong credit metrics.  Revenue has been up modestly year-to-date and could increase by at least high  single digits for the full year. The positive sales trend reflects CMI's  distributor acquisitions, improving demand in the North America heavy- and  medium-duty truck market, and higher volume in the Components segment related to  new emissions standards in Europe and China. Demand in the North America truck  market may begin to moderate by 2015 but should remain positive due to growing  freight volumes and sustainable industry production levels for heavy duty  trucks.  Strength in the truck market is partly offset by continued weakness in the Power  Generation segment due to low demand in international markets and by a decline  in CMI's military revenue in North America. The Power Generation business is not  expected to improve in the near term, but CMI has introduced new products in the  smaller end of the generator market and taken steps to reduce costs. Growth in  emerging markets is mixed and will depend partly on enforcement of emissions  standards that support sales of Cummins' emissions equipment. China and Europe  are improving but the truck market in Brazil has experienced a significant  decline due to a weak economy.  Margins, excluding equity income from joint ventures, could increase for all of  2014 due to higher volumes in the Engine and Components segments. The impact of  higher volumes is partly offset by warranty costs which, although still at low  levels, are temporarily being negatively affected by engine complexity  associated with emissions technology and on-board diagnostics. Lower margins in  the Power Generation business could stabilize or recover as CMI adjusts its cost  structure in line with revenue.  Fitch estimates free cash flow (FCF) after dividends in 2014 could decline to  around $600 million compared to FCF of $929 million in 2013. The estimated  decline reflects the absence of positive tax items that occurred in 2013 and the  negative impact of higher capital expenditures and dividends in 2014. Fitch  expects FCF could remain lower in 2015 depending on working capital requirements  and capital expenditures needed to support sales growth and new product  development. However, Fitch estimates CMI will generate solid FCF over the long  term, including FCF/Total Adjusted Debt of 15%-20% or higher. The company has a  history of generating positive FCF even during weak parts of the economic cycle.  CMI expects to contribute $205 million to pension plans in 2014, including $94  million of required contributions, compared to $169 million in 2013. CMI  contributed $156 million in the first half of 2014. In 2013, the U.S. plan  reached an overfunded position as a result of asset returns and contributions.  At the end of 2013, U.S. plans were overfunded by $184 million and U.K. plans  were overfunded by $87 million.  Liquidity at June 29, 2014 included cash and equivalents of approximately $2.2  billion, not including $158 million of marketable securities. Slightly more than  half of CMI's cash was held outside the U.S. Liquidity also included  availability under a $1.75 billion five-year revolver which matures in 2017,  most of which was available. Liquidity was offset by $33 million of current  maturities of long term debt and $30 million of loans payable. Debt maturities  are spread out, with no significant maturities scheduled before 2023. RATING SENSITIVITIES Future developments that may, individually or collectively, lead to a positive  rating action include: --Consistently higher margins through business cycles, including EBITDA margins  near 15% or higher, compared to 12.4% in 2013 and roughly 12%-14% since 2010;  --FCF/Total Adjusted Debt consistently above 20%; --A reduction in the risk of potential outsourcing of engines at large truck  customers, relative to total sales and earnings derived from truck customers; --Continued low leverage, defined as debt/EBITDA near 0.5x or lower and FFO  adjusted leverage consistently near 1.0x-1.5x. Future developments that may, individually or collectively, lead to a negative  rating action include: --Cash deployment for share repurchases or other discretionary spending  contributes to consistently higher leverage defined as debt/EBITDA above 1.25x; --Market share deteriorates as a result of customer in-sourcing or competitive  pressure; --Weak FCF, including FCF/Total Adjusted Debt consistently in the mid-teens or  below; --Unexpected challenges related to CMI's technological capabilities and new  product development lead to lower profitability and FCF.  Fitch has affirmed CMI's ratings as follows: --IDR at 'A'; --Senior unsecured credit facility at 'A';  --Senior unsecured debt at 'A'. The Rating Outlook is Stable. Contact: Primary Analyst Eric Ause Senior Director +1-312-606-2302 Fitch Ratings, Inc. 70 W. Madison Street Chicago, IL 60602 Secondary Analyst Craig Fraser Managing Director +1-212-908-0310 Committee Chairperson Wes Moultrie Managing Director +1-312-368-3186 Media Relations: Brian Bertsch, New York, Tel: +1 212-908-0549, Email:  brian.bertsch@fitchratings.com. Additional information is available at 'www.fitchratings.com'. Applicable Criteria and Related Research: --'Corporate Rating Methodology' (May 28, 2014). Applicable Criteria and Related Research:  Corporate Rating Methodology - Including Short-Term Ratings and Parent and  Subsidiary Linkage here Additional Disclosure  Solicitation Status  here ALL FITCH CREDIT RATINGS ARE SUBJECT TO CERTAIN LIMITATIONS AND DISCLAIMERS.  PLEASE READ THESE LIMITATIONS AND DISCLAIMERS BY FOLLOWING THIS LINK:  here. IN ADDITION, RATING  DEFINITIONS AND THE TERMS OF USE OF SUCH RATINGS ARE AVAILABLE ON THE AGENCY'S  PUBLIC WEBSITE 'WWW.FITCHRATINGS.COM'. PUBLISHED RATINGS, CRITERIA AND  METHODOLOGIES ARE AVAILABLE FROM THIS SITE AT ALL TIMES. FITCH'S CODE OF  CONDUCT, CONFIDENTIALITY, CONFLICTS OF INTEREST, AFFILIATE FIREWALL, COMPLIANCE  AND OTHER RELEVANT POLICIES AND PROCEDURES ARE ALSO AVAILABLE FROM THE 'CODE OF  CONDUCT' SECTION OF THIS SITE. FITCH MAY HAVE PROVIDED ANOTHER PERMISSIBLE  SERVICE TO THE RATED ENTITY OR ITS RELATED THIRD PARTIES. DETAILS OF THIS  SERVICE FOR RATINGS FOR WHICH THE LEAD ANALYST IS BASED IN AN EU-REGISTERED  ENTITY CAN BE FOUND ON THE ENTITY SUMMARY PAGE FOR THIS ISSUER ON THE FITCH  WEBSITE.   ",2014-08-26,CMI,"Tue Aug 26, 2014 | 11:05am EDT",Fitch Affirms Cummins at 'A'; Outlook Stable,http://www.reuters.com//article/fitch-affirms-cummins-at-a-outlook-stabl-idUSFit73267920140826?type=companyNews
16,"  Oct 28 Cummins Inc posted higher-than-expected quarterly profit on Tuesday, lifted by strong sales of its vehicle components in North America, Europe and China.But the company, which also makes natural gas engines used to generate electricity, said global demand for that equipment ""remains weak"" and was considering a restructuring that could cuts costs in the long term but may reduce earnings by as much as $40 million. The Columbus, Indiana-based maker of diesel engines and fuel and emission controls reported third-quarter net profit of $423 million, or $2.32 a share, up from $355 million, or $1.90 a share, during the comparable quarter last year. Analysts, on average, expected Cummins to post a profit of $2.28 a share, according to Thomson Reuters I/B/E/S. Sales rose 15 percent to $4.9 billion. Revenue growth was especially strong in North America, where trucking companies, encouraged by the economic rebound, falling fuel prices and rising freight volumes, are updating their fleets and buying more trucks from key Cummins' customers, including Paccar Inc  and Navistar International Corp.       (Reporting by James B. Kelleher in Chicago; Editing by Jeffrey Benkoe)",2014-10-28,CMI,"Tue Oct 28, 2014 | 7:55am EDT",Cummins posts higher profit; eyes cost cuts at natgas engine unit,http://www.reuters.com//article/cummins-results-idUSL1N0SM27M20141028?type=companyNews
17,"  NEW YORK Shares of Cummins could rise by as much as 15 percent over the next year as its North American market could prove stronger than some expect, according to a report in Barron's financial newspaper.In addition to strength in North America, its business abroad could improve, especially in China, the newspaper said in its edition to be published on Monday.In the United States, a recovering economy, along with tight rail capacity and aging truck fleets, is driving truckers to buy new vehicles, the report said, noting that some analysts think that the order upturn could last at least through 2016. Shares of Cummins, which closed Friday at $145.06, are up 2.9 percent for the year so far, compared with the S&P 500's gain of 10.4 percent for that period.   (Reporting by Caroline Valetkevitch; Editing by Eric Walsh)",2014-11-17,CMI,"Sun Nov 16, 2014 | 7:53pm EST",Cummins shares could rise as much as 15 percent over next year: Barron's,http://www.reuters.com//article/us-cummins-idUSKCN0J101I20141117?type=companyNews
18,"  NEW YORK Nov 16 Shares of Cummins could rise by as much as 15 percent over the next year as its North American market could prove stronger than some expect, according to a report in Barron's financial newspaper.In addition to strength in North America, its business abroad could improve, especially in China, the newspaper said in its edition to be published on Monday. In the United States, a recovering economy, along with tight rail capacity and aging truck fleets, is driving truckers to buy new vehicles, the report said, noting that some analysts think that the order upturn could last at least through 2016.  Shares of Cummins, which closed Friday at $145.06, are up 2.9 percent for the year so far, compared with the S&P 500's gain of 10.4 percent for that period.   (Reporting by Caroline Valetkevitch; Editing by Eric Walsh)",2014-11-17,CMI,"Sun Nov 16, 2014 | 7:15pm EST",Cummins shares could rise as much as 15 pct over next yr-Barron's,http://www.reuters.com//article/cummins-idUSL2N0T700E20141117?type=companyNews
19,"  WASHINGTON Cummins Inc (CMI.N) Chief Executive Officer Tom Linebarger said on Friday the company is still growing its market share in China but is prepared for lower infrastructure spending in the country.""We are prepared, based on what we have heard from the Chinese government, that infrastructure spending will remain a little lower for a while, and that's not necessarily great for us,"" Linebarger said at the Business Roundtable.""But our business in China is still terrific, we still have a lot of growth areas, we are growing market share.""    (Reporting by Krista Hughes; Editing by Eric Beech)",2015-01-23,CMI,"Fri Jan 23, 2015 | 2:34pm EST",Cummins CEO says still growing market share in China,http://www.reuters.com//article/us-cummins-ceo-china-idUSKBN0KW2BM20150123?type=companyNews
20,"  WASHINGTON Jan 23 Cummins Inc Chief Executive Officer Tom Linebarger said on Friday the company is still growing its market share in China but is prepared for lower infrastructure spending in the country.""We are prepared, based on what we have heard from the Chinese government, that infrastructure spending will remain a little lower for a while, and that's not necessarily great for us,"" Linebarger said at the Business Roundtable. ""But our business in China is still terrific, we still have a lot of growth areas, we are growing market share.""  (Reporting by Krista Hughes; Editing by Eric Beech)",2015-01-23,CMI,"Fri Jan 23, 2015 | 2:25pm EST",Cummins CEO says still growing market share in China,http://www.reuters.com//article/cummins-ceo-china-idUSL1N0V21RQ20150123?type=companyNews
21,"  Diesel engine maker Cummins Inc (CMI.N) cut its full-year revenue forecast, citing weak demand in international markets and a strong dollar, sending its shares down about 3.6 percent in premarket trade on Thursday.The company, which gets more than half its revenue from outside the United States, said it now expected full-year revenue of $19.61 billion to $20 billion, down from its previous forecast of $20 billion to $23 billion.Analysts on average were expecting revenue of $20.96 billion in 2015, according to Thomson Reuters I/B/E/S.The weak forecast overshadowed an 11 percent rise in quarterly revenue compared with a year earlier, driven by strong demand for the company's truck engines in North America.Cummins, which also makes natural gas engines used to generate electricity, said it faced weak demand in Brazil and Europe in the fourth quarter. The company also said the strong dollar and weakness in international markets would continue to offset improving demand in North America.The euro has fallen about 12 percent against the dollar in 2014 and dropped another 6 percent since the start of 2015. The company's net sales rose to $5.09 billion in the fourth quarter ended Dec.31, from $4.59 billion a year earlier.Net income attributable to Cummins rose to $444 million, or $2.44 per share, from $432 million, or $2.32 per share. Excluding items, the company earned $2.56 per share, beating the average analyst estimate of $2.51.Cummins' shares closed at $144.16 on the New York Stock Exchange on Wednesday. The stock had risen about 14 percent in the past 12 months, compared with a 0.54 percent fall in the Dow Jones U.S. Commercial Vehicles & Trucks Index .DJUSHR. (Reporting by Radhika Rukmangadhan in Bengaluru; Editing by Maju Samuel and Simon Jennings)",2015-02-05,CMI,"Thu Feb 5, 2015 | 8:56am EST","Cummins cuts forecast due to weak overseas demand, strong dollar",http://www.reuters.com//article/us-cummins-results-idUSKBN0L91KN20150205?type=companyNews
22,"  (Adds details, shares, background)Feb 5 Diesel engine maker Cummins Inc  cut its full-year revenue forecast, citing weak demand in international markets and a strong dollar, sending its shares down about 3.6 percent in premarket trade on Thursday.The company, which gets more than half its revenue from outside the United States, said it now expected full-year revenue of $19.61 billion to $20 billion, down from its previous forecast of $20 billion to $23 billion.Analysts on average were expecting revenue of $20.96 billion in 2015, according to Thomson Reuters I/B/E/S.The weak forecast overshadowed an 11 percent rise in quarterly revenue compared with a year earlier, driven by strong demand for the company's truck engines in North America. Cummins, which also makes natural gas engines used to generate electricity, said it faced weak demand in Brazil and Europe in the fourth quarter.The company also said the strong dollar and weakness in international markets would continue to offset improving demand in North America. The euro has fallen about 12 percent against the dollar in 2014 and dropped another 6 percent since the start of 2015.The company's net sales rose to $5.09 billion in the fourth quarter ended Dec.31, from $4.59 billion a year earlier. Net income attributable to Cummins rose to $444 million, or $2.44 per share, from $432 million, or $2.32 per share.Excluding items, the company earned $2.56 per share, beating the average analyst estimate of $2.51.Cummins' shares closed at $144.16 on the New York Stock Exchange on Wednesday. The stock had risen about 14 percent in the past 12 months, compared with a 0.54 percent fall in the Dow Jones U.S. Commercial Vehicles & Trucks Index.   (Reporting by Radhika Rukmangadhan in Bengaluru; Editing by Maju Samuel and Simon Jennings)",2015-02-05,CMI,"Thu Feb 5, 2015 | 8:53am EST","UPDATE 1-Cummins cuts forecast due to weak overseas demand, strong dollar",http://www.reuters.com//article/cummins-results-idUSL4N0VF5PU20150205?type=companyNews
23,"  Feb 5 Cummins Inc, a maker of diesel engines, reported an 11 percent rise in quarterly revenue, helped by strong demand from  North America.Sales rose to $5.09 billion in the fourth quarter ended Dec. 31, from $4.59 billion a year earlier. Net income attributable to Cummins rose to $444 million, or $2.44 per share, from $432 million, or $2.32 per share.  Excluding items, the company earned $2.56 per share.   (Reporting by Radhika Rukmangadhan in Bengaluru; Editing by Maju Samuel)",2015-02-05,CMI,"Thu Feb 5, 2015 | 7:51am EST",Diesel engine maker Cummins reports 11 pct rise in revenue,http://www.reuters.com//article/cummins-results-idUSL4N0VF5K420150205?type=companyNews
24,"  Shares of Cummins Inc (CMI.N) rose almost 4 percent after the diesel engine maker reported a rise in quarterly revenue, boosted by distributor acquisitions in North America and stronger demand in truck and bus markets.Total revenue increased to $5.02 billion in the second quarter from $4.84 billion in the same period last year.Cummins' revenue from North America jumped 12 percent in the quarter, while international sales fell by 6 percent, dragged lower by a weak economy in Brazil. Net income attributable to Cummins rose to $471 million, or $2.62 per share, from $446 million, or $2.43 per share, a year earlier.Cummins expects full-year 2015 revenues to grow between 2 percent and 4 percent. On a conference call following the earnings release, Cummins executives said the company hoped to get market share in China to 17 percent by 2018, with a ""stretch goal"" of 25 percent.  Second-quarter revenues in China, including joint ventures, increased 6 percent year-over-year to $960 million, the company said. ""The growth was driven primarily by stronger sales of new engines and components in our highway markets, which more than offset very weak market conditions,"" Chief Executive Tom Linebarger said.Cummins has had a presence in China for over 30 years, with several products featuring on and off-highway vehicles and strong relationships with original equipment manufacturers (OEMs). Cummins' executives said they recognized that the Chinese economy had slowed, but still see sales in China growing to $3.5 billion this year, up from $3.3 billion in 2014. Second-quarter sales rose in all four of Cummins' major segments. In engines, strong demand for on-highway, or trucks and buses, drove sales growth, which was offset by weaker demand in global industrial markets and lower truck demand in Brazil. Growth in the distribution segment included a $14 million gain from North American acquisitions, while a stronger dollar hurt the segment's sales by 6 percent. Higher sales in components and power generation were driven by demand in international markets. Cummins shares rose $4.72, or 3.8 percent, to $128.50 on the New York Stock Exchange. (Reporting by Meredith Davis; Editing by Paul Simao)",2015-07-28,CMI,"Tue Jul 28, 2015 | 12:29pm EDT","Diesel engine maker Cummins' quarterly profit, revenue rise",http://www.reuters.com//article/us-cummins-results-idUSKCN0Q219I20150728?type=companyNews
25,"  (Adds comments from conference call)July 28 Shares of Cummins Inc rose almost 4 percent after the diesel engine maker reported a rise in quarterly revenue, boosted by distributor acquisitions in North America and stronger demand in truck and bus markets.Total revenue increased to $5.02 billion in the second quarter from $4.84 billion in the same period last year.Cummins' revenue from North America jumped 12 percent in the quarter, while international sales fell by 6 percent, dragged lower by a weak economy in Brazil.Net income attributable to Cummins rose to $471 million, or $2.62 per share, from $446 million, or $2.43 per share, a year earlier.Cummins expects full-year 2015 revenues to grow between 2 percent and 4 percent. On a conference call following the earnings release, Cummins executives said the company hoped to get market share in China to 17 percent by 2018, with a ""stretch goal"" of 25 percent.Second-quarter revenues in China, including joint ventures, increased 6 percent year-over-year to $960 million, the company said. ""The growth was driven primarily by stronger sales of new engines and components in our highway markets, which more than offset very weak market conditions,"" Chief Executive Tom Linebarger said.Cummins has had a presence in China for over 30 years, with several products featuring on and off-highway vehicles and strong relationships with original equipment manufacturers (OEMs).Cummins' executives said they recognized that the Chinese economy had slowed, but still see sales in China growing to $3.5 billion this year, up from $3.3 billion in 2014. Second-quarter sales rose in all four of Cummins' major segments. In engines, strong demand for on-highway, or trucks and buses, drove sales growth, which was offset by weaker demand in global industrial markets and lower truck demand in Brazil.Growth in the distribution segment included a $14 million gain from North American acquisitions, while a stronger dollar hurt the segment's sales by 6 percent.Higher sales in components and power generation were driven by demand in international markets.Cummins shares rose $4.72, or 3.8 percent, to $128.50 on the New York Stock Exchange.   (Reporting by Meredith Davis; Editing by Paul Simao)",2015-07-28,CMI,"Tue Jul 28, 2015 | 12:28pm EDT","UPDATE 1-Diesel engine maker Cummins' quarterly profit, revenue rise",http://www.reuters.com//article/cummins-results-idUSL1N1080Z120150728?type=companyNews
