,Article,Date,Symbol,Time,Title,Url
31,"  (Adds CVS declining to comment)SAO PAULO May 22 A formal bid by CVS Caremark Corp to purchase Brazilian drugstore firm DPSP has been rejected by the company, a Brazilian news website reported on Thursday.News magazine Exame said CVS had made a formal bid to purchase DPSP for about 4.5 billion reais ($2 billion). U.S.-based CVS is being advised by local investment firm Patria Investimentos, while DPSP hired Morgan Stanley to help advise in the negotiations, according to Exame.Last year, CVS purchased Drogaria Onofre, Brazil's eighth-largest drugstore chain by sales, in its first international venture. Brazil's pharmacy industry has in recent years seen a surge of mergers and acquisitions as the country's middle class grew. DPSP, which includes the Drogaria Sao Paulo and Pacheco chains, is Brazil's third-largest drugstore operator by number of stores according to the Abramafa pharmacy association, with 840 stores in 80 cities. It trails Raia Drogasil and Brasil Pharma. Representatives for DPSP said the company would not confirm the report, while representatives for Patria Investimentos declined to comment. CVS's public relations director also declined to comment and Morgan Stanley in Brazil did not immediately respond to request for comment.($1 = 2.217 Brazilian reais)   (Reporting by Asher Levine and Alberto Alerigi Jr; Editing by G Crosse and Andrea Ricci)",2014-05-22,CVS,"Thu May 22, 2014 | 4:48pm EDT",UPDATE 2-Brazil drugstore firm rejects $2 bln offer from CVS -report,http://www.reuters.com//article/brazil-cvs-care-idUSL1N0O81U620140522?type=companyNews
32,"  SAO PAULO May 22 CVS Caremark Corp made a formal bid to purchase Brazilian drugstore firm DPSP for about 4.5 billion reais ($2  billion), though the offer was rejected, a Brazilian news website reported on Thursday.DPSP, which includes the Drogaria Sao Paulo and Pacheco chains, is Brazil's third-largest drugstore operator by number of stores, the website of Brazilian news magazine Exame said.CVS is being advised by local investment firm Patria Investimentos, while DPSP hired Morgan Stanley to help advise in the negotiations, the report added. Press representatives for DPSP said the company would not confirm the report, while representatives for Patria Investimentos declined to comment. Press representatives for CVS in the United States and Morgan Stanley in Brazil did not immediately respond to requests for comment. ($1 = 2.217 Brazilian reais)   (Reporting by Asher Levine and Alberto Alerigi Jr.)",2014-05-22,CVS,"Thu May 22, 2014 | 3:16pm EDT",CVS makes $2 bln offer for Brazilian drugstore firm -report,http://www.reuters.com//article/brazil-cvs-care-idUSL1N0O81RB20140522?type=companyNews
33,"   By Verna, Gates and David Adams | BIRMINGHAM Ala.  BIRMINGHAM Ala. The Alabama Supreme Court on Friday allowed a class action lawsuit seeking more than $3 billion to go forward against CVS Health Corp and several insurance companies, affirming the ruling by a lower court which said the plaintiffs could be certified as a class.The case dates back to a 1999 class action settlement for $56 million over alleged accounting fraud at MedPartners, a physician and pharmacy benefits management corporation. CVS Health could not be reached for comment.MedPartners became Caremark and merged in 2007 with CVS, now known as CVS Health. In 2003, Alabama attorneys filed a lawsuit on behalf of a stockholder John Lauriello, alleging fraudulent insurance information was given in court by MedPartners and its insurers. The plaintiffs allege that MedPartners and its insurers hid the fact that unlimited insurance coverage was available at the time of the initial class action in 1998, enabling them to settle for $56 million, instead of $3 billion in stockholder losses, according to court documents.The 48-page opinion from the Alabama Supreme Court affirmed a Jefferson County Circuit Judge's 2013 order certifying the case as a class action.",2014-09-13,CVS,"Fri Sep 12, 2014 | 9:16pm EDT",Alabama court lets class action lawsuit against CVS Health proceed,http://www.reuters.com//article/us-cvs-health-classaction-idUSKBN0H801M20140913?type=companyNews
34,"  BIRMINGHAM, Ala., Sept 12 The Alabama Supreme Court on Friday allowed a class action lawsuit seeking more than $3 billion to go forward against CVS Health Corp and several insurance companies, affirming the ruling by a lower court which said the plaintiffs could be certified as a class.The case dates back to a 1999 class action settlement for $56 million over alleged accounting fraud at MedPartners, a physician and pharmacy benefits management corporation.CVS Health could not be reached for comment. MedPartners became Caremark and merged in 2007 with CVS, now known as CVS Health. In 2003, Alabama attorneys filed a lawsuit on behalf of a stockholder John Lauriello, alleging fraudulent insurance information was given in court by MedPartners and its insurers. The plaintiffs allege that MedPartners and its insurers hid the fact that unlimited insurance coverage was available at the time of the initial class action in 1998, enabling them to settle for $56 million, instead of $3 billion in stockholder losses, according to court documents.The 48-page opinion from the Alabama Supreme Court affirmed a Jefferson County Circuit Judge's 2013 order certifying the case as a class action.   (Reporting by Verna Gates; Writing by David Adams; Editing by Lisa Shumaker)",2014-09-13,CVS,"Fri Sep 12, 2014 | 9:02pm EDT",Alabama court lets class action lawsuit against CVS Health proceed,http://www.reuters.com//article/cvs-health-classaction-idUSL1N0RE00720140913?type=companyNews
35,"  Over the last several months there has been a 'plateau and downward trend' in the use of Gilead Sciences Inc's controversial $1,000-a-pill hepatitis C treatment, Sovaldi, a CVS Health Corp analysis showed.The study, encompassing data from May through August 2014, suggests that another surge of patients will begin therapy when newer treatments of similar effectiveness and shorter duration are introduced later in the year. U.S. health regulators are due to decide by Oct. 10 whether to approve a new treatment, a pill that combines Sovaldi with the experimental therapy ledipasvir and eliminates the need for other treatments. The research revealed Sovaldi therapy discontinuation rates of 8.1 percent, approximately four times higher than those in trials, CVS said on Wednesday. Patients who were completely new to Hepatitis C treatment were also more likely to discontinue therapy, the study found. The CVS Health Research Institute analyzed discontinuation rates for nearly 2,000 patients who filled prescriptions for Sovaldi since December. The patients were managed by CVS Caremark, the CVS Health pharmacy benefit management business.Hepatitis C kills more than 15,000 Americans each year, mostly from illnesses such as cirrhosis and liver cancer, according to the U.S. Centers for Disease Control and Prevention.  (Reporting by Natalie Grover in Bangalore; Editing by Simon Jennings)",2014-09-17,CVS,"Wed Sep 17, 2014 | 8:41am EDT",Study shows downward trend in Sovaldi utilization,http://www.reuters.com//article/us-gilead-sciences-study-idUSKBN0HC19620140917?type=companyNews
36,"  Sept 17 Over the last several months there has been a 'plateau and downward trend' in the use of Gilead Sciences Inc's controversial $1,000-a-pill hepatitis C treatment, Sovaldi, a CVS Health Corp analysis showed.The study, encompassing data from May through August 2014, suggests that another surge of patients will begin therapy when newer treatments of similar effectiveness and shorter duration are introduced later in the year.U.S. health regulators are due to decide by Oct. 10 whether to approve a new treatment, a pill that combines Sovaldi with the experimental therapy ledipasvir and eliminates the need for other treatments. The research revealed Sovaldi therapy discontinuation rates of 8.1 percent, approximately four times higher than those in trials, CVS said on Wednesday. Patients who were completely new to Hepatitis C treatment were also more likely to discontinue therapy, the study found. The CVS Health Research Institute analyzed discontinuation rates for nearly 2,000 patients who filled prescriptions for Sovaldi since December. The patients were managed by CVS Caremark, the CVS Health pharmacy benefit management business.Hepatitis C kills more than 15,000 Americans each year, mostly from illnesses such as cirrhosis and liver cancer, according to the U.S. Centers for Disease Control and Prevention.   (Reporting by Natalie Grover in Bangalore; Editing by Simon Jennings)",2014-09-17,CVS,"Wed Sep 17, 2014 | 8:38am EDT",Study shows downward trend in Sovaldi utilization,http://www.reuters.com//article/gilead-sciences-study-idUSL3N0RI40S20140917?type=companyNews
37,"   By Jonathan Stempel  Caremark LLC, a unit of CVS Health Corp, will pay $6 million to settle U.S. allegations that it knowingly failed to reimburse Medicaid for prescription drug costs paid on behalf of patients who were also covered by private health plans it administered.The settlement announced on Friday by the U.S. Department of Justice resolves claims that Caremark, a pharmacy benefits management company, violated the federal False Claims Act by improperly processing claims of such ""dual eligible"" patients.Donald Well, a former Caremark employee who brought the case to the government's attention, will receive $1.02 million plus interest under the law's whistleblower provisions. CVS spokeswoman Christine Cramer said the Woonsocket, Rhode Island-based company settled to avoid protracted litigation, and denied wrongdoing. She also said the accord does not involve its pharmacy or Medicare Part D businesses. Caremark is a pharmacy benefits manager for private health plans that insured some patients who also had Medicaid coverage. Medicaid can seek reimbursement from private insurers or their pharmacy benefits managers if it pays prescription drug claims of such patients in error.The government said a Caremark computer platform improperly deducted co-payments or other sums when calculating payments on some claims. It said this caused Medicaid to cover prescription drug costs for dual eligible patients that should have been borne by Caremark-administered private health plans.      (eporting by Jonathan Stempel in New York; Editing by Chizu Nomiyama. Editing by Andre Grenon)",2014-09-26,CVS,"Fri Sep 26, 2014 | 1:38pm EDT",CVS' Caremark unit settles U.S. false claims allegations,http://www.reuters.com//article/us-cvshealth-caremark-settlement-idUSKCN0HL1Z720140926?type=companyNews
38,"  (Adds allegations, whistleblower details, CVS comment, byline)By Jonathan StempelSept 26 Caremark LLC, a unit of CVS Health Corp , will pay $6 million to settle U.S. allegations that it knowingly failed to reimburse Medicaid for prescription drug costs paid on behalf of patients who were also covered by private health plans it administered. The settlement announced on Friday by the U.S. Department of Justice resolves claims that Caremark, a pharmacy benefits management company, violated the federal False Claims Act by improperly processing claims of such ""dual eligible"" patients.Donald Well, a former Caremark employee who brought the case to the government's attention, will receive $1.02 million plus interest under the law's whistleblower provisions. CVS spokeswoman Christine Cramer said the Woonsocket, Rhode Island-based company settled to avoid protracted litigation, and denied wrongdoing. She also said the accord does not involve its pharmacy or Medicare Part D businesses. Caremark is a pharmacy benefits manager for private health plans that insured some patients who also had Medicaid coverage. Medicaid can seek reimbursement from private insurers or their pharmacy benefits managers if it pays prescription drug claims of such patients in error.The government said a Caremark computer platform improperly deducted co-payments or other sums when calculating payments on some claims. It said this caused Medicaid to cover prescription drug costs for dual eligible patients that should have been borne by Caremark-administered private health plans.       (Reporting by Jonathan Stempel in New York; Editing by Chizu Nomiyama. Editing by Andre Grenon)",2014-09-26,CVS,"Fri Sep 26, 2014 | 12:55pm EDT",UPDATE 1-CVS' Caremark unit settles U.S. false claims allegations,http://www.reuters.com//article/cvshealth-caremark-settlement-idUSL2N0RR1DH20140926?type=companyNews
39,"  Sept 26 Caremark LLC, a unit of CVS Health Corp , will pay $6 million to settle U.S. allegations that it knowingly failed to reimburse Medicaid for prescription drug costs paid on behalf of Medicaid beneficiaries who were also eligible for drug benefits under private health plans it administered. The settlement was announced on Friday by the U.S. Department of Justice, and resolved allegations brought under the federal False Claims Act.   (Reporting by Jonathan Stempel in New York; Editing by Chizu Nomiyama)  ",2014-09-26,CVS,"Fri Sep 26, 2014 | 11:57am EDT",CVS' Caremark unit settles U.S. False Claims Act case,http://www.reuters.com//article/cvshealth-caremark-settlement-idUSL2N0RR1C820140926?type=companyNews
40,"  Sept 26 CVS Health Corp :  * U.S. Department of Justice says caremark to pay $6 million to resolve falseclaims act allegations  * Justice Department says caremark, now part of CVS Health Corp  settles charges stemming from alleged failure to reimburse medicaid for some prescription drug costs  * Justice Department says a whistleblower will receive $1.02 million plus interest in connection with the caremark settlement",2014-09-26,CVS,"Fri Sep 26, 2014 | 11:46am EDT",BRIEF-Caremark to pay $6 million to resolve False Claims Act case,http://www.reuters.com//article/cvshealth-brief-idUSWEN00E0320140926?type=companyNews
41,"  Drug retailer CVS Health Corp will pay $225,000 to settle allegations in California that it misled consumers about package sizes using false bottoms and sides on some of its store-branded products, a Fresno-based unit of ABC News, reported on Friday.CVS will pay the settlement to Fresno, Yolo, Sacramento, and Shasta counties after investigators found the company mislabeled 11 products under its own brand, the television station KFSN-TV reported, citing court documents. Reuters was not immediately able to confirm the report. CVS said it had reached agreements with California district attorneys to resolve the allegations and would redesign the packaging of its brands, the news channel reported on its website.The retailer has two years to comply with California state labeling laws and can continue to make the products until January, the news channel said. CVS was not immediately available for comment.  (Reporting by Ramkumar Iyer in Bangalore; Editing by Lisa Shumaker)",2014-10-04,CVS,"Fri Oct 3, 2014 | 9:22pm EDT","CVS to pay $225,000 for misleading package sizes in California: local TV",http://www.reuters.com//article/us-cvs-health-settlement-idUSKCN0HT01920141004?type=companyNews
42,"  Oct 3 Drug retailer CVS Health Corp will pay $225,000 to settle allegations in California that it misled consumers about package sizes using false bottoms and sides on some of its store-branded products, a Fresno-based unit of ABC News, reported on Friday.CVS will pay the settlement to Fresno, Yolo, Sacramento, and Shasta counties after investigators found the company mislabeled 11 products under its own brand, the television station KFSN-TV reported, citing court documents. (abc30.tv/1xMBt3X)Reuters was not immediately able to confirm the report. CVS said it had reached agreements with California district attorneys to resolve the allegations and would redesign the packaging of its brands, the news channel reported on its website. The retailer has two years to comply with California state labeling laws and can continue to make the products until January, the news channel said. CVS was not immediately available for comment.   (Reporting by Ramkumar Iyer in Bangalore; Editing by Lisa Shumaker)",2014-10-04,CVS,"Fri Oct 3, 2014 | 9:19pm EDT","CVS to pay $225,000 for misleading package sizes in California -local TV",http://www.reuters.com//article/cvs-health-settlement-idUSL3N0RZ00220141004?type=companyNews
43,"   By Nandita Bose and Nathan Layne | CHICAGO  CHICAGO Some large U.S. retailers are refusing to use Apple Inc's APPL.O new electronic payments service as they commit to developing a rival payments system that would bolster their profits by eliminating credit card transaction fees.Wal-Mart Stores Inc (WMT.N) is among the roughly 50 big retailers that have chosen not to accept Apple Pay, along with Rite Aid Corp (RAD.N) and CVS HealthCorp (CVS.N).They say they are working instead on developing their own payment system, called Current C, through the Merchants Customer Exchange (MCX) consortium.The driving force behind developing a retailer-owned mobile payment solution is to avoid paying credit card transaction fees to card companies like Visa (V.N) and Mastercard (MA.N), analysts said. Fees range between 2 percent and 3 percent of costs per transaction.""""The economics and benefits of having your own payment system is definitely one of the main reasons,"" said Hitesh Sheth, chief executive of retail technology cybersecurity firm Vectra Networks.Apple did not immediately respond to queries seeking comment. Mastercard criticized the move by CVS and Rite Aid, saying it would limit the options of consumers. ""We are disappointed that both Rite Aid and CVS have decided to block their customers from using the payment method of their choice,"" Mastercard spokesman Jim Issokson said. Apple Pay, unveiled just last month, is a mobile payment app that allows consumers to buy things by simply holding their iPhone6 and 6 Plus devices up to readers installed by store merchants.The retailers shunning Apple Pay have also refused to use mobile payment systems like Google Wallet and Softcard. Rite Aid stopped accepting Apple Pay last week at its 4,572 stores. Spokeswoman Ashley Flower said on Monday the company is continually evaluating various forms of mobile payment technologies.CVS did not respond to queries seeking comment but a visit to two CVS stores showed the NFC (Near Field Communications) reader on which Apple Pay was used has been deactivated.Wal-Mart spokesman Randy Hargrove said Wal-Mart is not participating in Apple Pay at this point. It is focused instead on MCX, as one of the heavyweights in the consortium. Target said that it supports MCX but is also allowing users to make online purchases through its mobile app using Apple Pay.Antitrust experts said CVS and Rite Aid have the right to drop a vendor if they believe they can save money by going around the credit card companies and Apple, both of which will take a piece of the action.But they could run into antitrust trouble if they coordinated on dropping Apple Pay and Google Wallet or if someone else, perhaps a person working with CurrentC, organized their decision to drop Apple and Googles payment services.""If I was a regulator, I would want to take a look at that, said Peter Carstensen, who teaches antitrust at the University of Wisconsin Law School. (Additional reporting by Diane Bartz in Washington)",2014-10-27,CVS,"Mon Oct 27, 2014 | 5:12pm EDT","Some U.S. retailers shun Apple Pay, eye rival payments system",http://www.reuters.com//article/us-rite-aid-apple-pay-idUSKBN0IG1ZD20141027?type=companyNews
44,"  Drug retailers CVS Health Corp (CVS.N) and Rite Aid Corp (RAD.N) have disabled Apple Inc's (AAPL.O) new electronic payments service Apple Pay from their stores over the weekend, the New York Times reported.Apple Pay, which was unveiled in September, is a mobile payment app that allows consumers to buy things by simply holding their iPhone6 and 6 Plus devices up to readers installed by store merchants. A Rite Aid spokeswoman told the New York Times that the company does not currently accept Apple Pay. The company is ""still in the process of evaluating our mobile payment options.""Rite Aid and CVS are not part of the group of retailers that had teamed up with Apple on its payment system. However, Apple Pay technology was working in Rite Aid and CVS stores over the week, the newspaper said. The reason for the disabling was not immediately clear, the newspaper said.According to analysts, disabling the acceptance of Apple Pay is a way to support a rival system that is being developed by Merchants Customer Exchange (MCX), a consortium of merchants that includes Rite Aid and CVS, the NYT reported. MCX is developing CurrentC, an app that scans the bar code of the product and initiates the payment transfer by connecting to the customer's debit card, according to MCX's website. CurrentC will not be available until 2015. Apple, Rite Aid and CVS could not be immediately reached for comments outside regular U.S. business hours. (Reporting by Rishika Sadam in Bangalore; Editing by Gopakumar Warrier)",2014-10-27,CVS,"Mon Oct 27, 2014 | 11:13am EDT","CVS Health, Rite Aid block Apple Pay in their stores: NYT",http://www.reuters.com//article/us-apple-cvs-health-idUSKBN0IG0J320141027?type=companyNews
45,"  Oct 27 Drug retailers CVS Health Corp  and Rite Aid Corp have disabled Apple Inc's new electronic payments service Apple Pay from their stores over the weekend, the New York Times reported.Apple Pay, which was unveiled in September, is a mobile payment app that allows consumers to buy things by simply holding their iPhone6 and 6 Plus devices up to readers installed by store merchants.A Rite Aid spokeswoman told the New York Times that the company does not currently accept Apple Pay. The company is ""still in the process of evaluating our mobile payment options."" Rite Aid and CVS are not part of the group of retailers that had teamed up with Apple on its payment system. However, Apple Pay technology was working in Rite Aid and CVS stores over the week, the newspaper said.The reason for the disabling was not immediately clear, the newspaper said. (nyti.ms/1rJ2RsA) According to analysts, disabling the acceptance of Apple Pay is a way to support a rival system that is being developed by Merchants Customer Exchange (MCX), a consortium of merchants that includes Rite Aid and CVS, the NYT reported. MCX is developing CurrentC, an app that scans the bar code of the product and initiates the payment transfer by connecting to the customer's debit card, according to MCX's website. CurrentC will not be available until 2015.Apple, Rite Aid and CVS could not be immediately reached for comments outside regular U.S. business hours.   (Reporting by Rishika Sadam in Bangalore; Editing by Gopakumar Warrier)",2014-10-27,CVS,"Mon Oct 27, 2014 | 3:34am EDT","CVS Health, Rite Aid block Apple Pay in their stores - NYT",http://www.reuters.com//article/apple-cvs-health-idUSL4N0SM25420141027?type=companyNews
46,"   By Deepa Seetharaman | LAGUNA BEACH Calif.  LAGUNA BEACH Calif. Apple Inc (AAPL.O) CEO Tim Cook fired back at CVS (CVS.N) and Rite Aid (RAD.N) on Monday after the drugstore chains blocked the iPhone maker's mobile payments service, saying there were plenty of other retailers around the world to sign up.Apple Pay launched about a week ago and saw more than a million credit cards registered over the first 72 hours. It already totes up more transactions than all other ""contact less"" payment methods combined, Cook said, citing Visa and Mastercard data. Such services, through which a user pays by holding a smartphone close to a specially designed terminal, have failed to catch on in the United States despite the backing of Google Inc (GOOG.O) and other influential players.News emerged over the weekend that the two retailers had opted out of Apple Pay in favor of a rival system that roughly 50 chains, including Wal-Mart and Best Buy, are developing for in-house use. ""We've got a lot more merchants to sign up, we've got a lot of banks to sign up and we've got the rest of the world,"" Cook told the Wall Street Journal Digital Live conference, in the company's most extensive comments on the blockade so far.In launching Apple Pay, the iPhone maker hopes to lock in more customers for its mobile devices by enhancing their overall utility. Industry experts say it stands a chance of becoming the first widely used payments feature on smartphones. CVS and Rite Aid have not explained their surprise move.     But the driving force behind developing a retailer-owned mobile payment solution is to avoid paying credit card transaction fees to card companies like Visa (V.N) and Mastercard (MA.N), analysts said. Fees range between 2 percent and 3 percent of costs per transaction.Rite Aid stopped accepting Apple Pay last week at its 4,572 stores. Spokeswoman Ashley Flower said the company was evaluating various forms of mobile payment technologies.  CVS did not respond to queries seeking comment but a visit to two of its stores showed that the NFC (Near Field Communications) reader on which Apple Pay was used had been deactivated.It remains to be seen, despite early signs of success, whether mobile payments will become widely adopted.  Cook argued on Monday that Apple Pay offered better security and privacy than competing services, and that retailers risked alienating customers by limiting choices at checkout.""It's a skirmish,"" Cook said in response to a question about the retailers' moves.""Merchants have different objectives sometimes. But in the long arc of time, you only are relevant as a retailer or merchant if your customers love you.""      (Writing by Edwin Chan; Editing by Stephen Coates)",2014-10-28,CVS,"Tue Oct 28, 2014 | 11:29am EDT",Apple CEO fires back as retailers block Pay,http://www.reuters.com//article/us-apple-payments-idUSKBN0IH0AZ20141028?type=companyNews
