,Article,Date,Symbol,Time,Title,Url
79,"  * Jobless claims, factory data weaker-than expected* April home resales unexpectedly decline* Lumber Liquidators plunges after CEO resigns* CVS up on $10.1 bln Omnicare deal* Indexes up: Dow 0.02 pct, S&P 0.1 pct, Nasdaq 0.2 pct   (Updates to open)By Tanya AgrawalMay 21 U.S. stocks moved higher in morning trading on Thursday as investors shrugged of fresh batch of weaker-than-expected data, which came a day after the Federal Reserve all but ruled out an interest rate hike in June.The central bank's officials believed it would be premature to raise rates next month even though most felt the economy was set to rebound from a dismal start to the year, according to minutes from their April policy meeting.However, data on Thursday showed that the number of Americans filing new claims for unemployment benefits rose slightly more than expected last week, while growth in the manufacturing sector slowed for a second straight month during May. That was followed by data that showed home resales unexpectedly fell in April as tight inventories pushed prices higher.Still, the underlying trend in last week's jobless claims suggested the jobs market was strengthening despite a sluggish economy.""There is a malaise in the market as investors re-adjust their expectations of a Fed hike,"" said Andrew Barber, chief market strategist at Eagleview Capital in Delaware.""The consensus is probably for a tightening in September, though an increasing number of people think there will be no hike in 2015 as economic data remains weak."" At 10:13 a.m. ET (1413 GMT) the Dow Jones industrial average  was up 4.51 points, or 0.02 percent, at 18,289.91, the S&P 500 was up 2.76 points, or 0.13 percent, at 2,128.61 and the Nasdaq Composite was up 7.37 points, or 0.15 percent, at 5,079.12.Eight of the 10 major S&P 500 sectors were higher, with the energy index rising 0.7 percent as oil prices rose for a second day.The Fed has kept interest rates at near zero for almost a decade, which has made funds cheaper and helped the stock market reach record highs.The S&P 500 hit a record intraday high on Wednesday. The Dow, which had closed at record highs in the previous two sessions, was also briefly on track for another all-time high close. Salesforce.com shares rose 5.4 percent to $73.98 trading after the cloud software company, the subject of takeover speculation for the past few weeks, reported a profit for the first time in seven quarters. [ID:nL3N0YB57DLumber Liquidators shares plunged 14.8 percent to $21.55 after the hardwood flooring retailer's chief executive resigned unexpectedly.NetApp fell 11.8 percent to $31.15 after the data storage equipment maker reported lower-than-expected quarterly results and cut about 500 jobs.Best Buy jumped 5.2 percent to $35.54 after the consumer electronics chain reported better-than-expected quarterly profit and sales.CVS Health was up 2.8 percent at $104.14 after it said it would buy pharmacy service provider Omnicare for $10.1 billion. Omnicare shares rose 1.3 percent to $95.92.Advancing issues outnumbered decliners on the NYSE by 1,685 to 1,112, for a 1.52-to-1 ratio on the upside. On the Nasdaq, 1,213 issues rose and 1,189 fell for a 1.02-to-1 ratio favoring advancers.The S&P 500 showed nine new 52-week highs and two new lows, while the Nasdaq recorded 38 new highs and 18 new lows.   (Editing by Savio D'Souza)",2015-05-21,CVS,"Thu May 21, 2015 | 10:22am EDT",US STOCKS-Wall St shrugs off weak data to inch higher,http://www.reuters.com//article/markets-stocks-usa-idUSL3N0YC4MT20150521?type=companyNews
80,"  (Corrects to ""people aged between 55 and 64"" from ""people aged between 50-75"" in paragraph 2)* Deal values Omnicare at $12.7 bln, including $2.3 bln debt* Offer of $98/share at 4 pct premium to Wednesday close* Deal to add $0.20/share to CVS's adjusted earnings in 2016* Omnicare shares rise to $95.75 premarket; CVS up 1.6 pctMay 21 CVS Health Corp, the second-largest U.S. drugstore operator, said on Thursday it will buy pharmacy services provider Omnicare Inc for $10.1 billion to expand in the growing market serving the senior patient population.The number of people aged between 55 and 64, commonly called baby boomers, having two or more chronic conditions that require medication grew 39.2 percent in the last decade, according to the Centers for Disease Control and Prevention's latest report.Baby Boomers surpassed all other age groups as the highest-cost medication users in 2014, according to a report from Express Scripts, the largest U.S. pharmacy benefit manager. CVS offered $98 per Omnicare share, representing a premium of 4 percent to Omnicare's closing price on Wednesday.The offer is at a nearly 21 percent premium to Omnicare's April 21 close, the day before Bloomberg reported that the company was exploring a sale.Shares of Omnicare, the top U.S. provider of pharmacy services to the elderly, rose 1.2 percent to $95.75 in premarket trading. CVS's stock was up 1.6 percent at $102.90 in light trading on Thursday.The deal comes at a time when pharmacy benefit managers and pharmacy chain operators are consolidating to negotiate better prices with drugmakers. Rite Aid Corp bought pharmacy benefit manager EnvisionRx for about $2 billion in February, while health insurer UnitedHealth Group Inc agreed to buy Catamaran Corp  for about $12.8 billion in March.""Both (CVS and Omnicare) are big Part D players and there could be some scale benefits in negotiating with other payors,"" Cowen & Co analyst Charles Rhyee wrote in a note on Wednesday.Bloomberg first reported on Wednesday that CVS was nearing a deal to buy Omnicare.CVS said the deal will also help expand its presence in the rapidly growing specialty pharmacy business, which sells high-cost drugs to treat complex or rare conditions. CVS said it expects the deal to add about 20 cents to adjusted earnings per share in 2016.The deal values Omnicare at about $12.7 billion, including debt of about $2.3 billion, the companies said.CVS said it had secured $13 billion in financing from Barclays for the deal, which is expected to close near the end of 2015.Barclays and Evercore are CVS's financial advisers, while Bank of America Merrill Lynch and Centerview Partners advised Omnicare.CVS's legal adviser is Sullivan & Cromwell LLP, while White & Case LLP served as Omnicare's legal counsel.(Reporting by Sruthi Ramakrishnan and Vidya L Nathan in Bengaluru; Editing by Sriraj Kalluvila)",2015-05-21,CVS,"Thu May 21, 2015 | 9:19am EDT",CORRECTED-UPDATE 2-CVS to buy pharmacy services provider Omnicare for $10.1 bln,http://www.reuters.com//article/omnicare-ma-cvs-health-idUSL3N0YC3WR20150521?type=companyNews
81,"  * 4-week jobless claims at lowest since April 2000* Lumber Liquidators plunges after CEO resigns unexpectedly* Best Buy rises; NetApp falls after results* CVS up on $10.1 bln Omnicare deal* Futures down: Dow 23 pts, S&P 2.75 pts, Nasdaq 10.50 pts   (Adds details, comment, updates prices)By Tanya AgrawalMay 21 U.S. stocks were set to open slightly lower on Thursday after weekly U.S. jobless claims rose more than expected, and a day after minutes from the Federal Reserve meeting bolstered the view that rates would stay near zero until later this year.While the number of Americans filing new claims for unemployment benefits rose slightly more than expected last week, the four-week moving average was the lowest since April 2000, continuing to suggest the labor market was tightening. That gives weight to the opinion of most central bank officials who agreed that economic growth would climb to a healthier pace and the labor market would strengthen, according to minutes from the Fed's April 28-29 meeting.Fed officials believed it would be premature to raise rates in June, even though most felt the U.S. economy was set to rebound from a dismal start to the year.Data measuring the growth in the U.S. manufacturing sector in May is due at 9:45 a.m. ET (1345 GMT) and 15 minutes later the National Association of Realtors data is expected to show that sales of used homes increased last month.""There is a malaise in the market as investors re-adjust their expectations of a Fed hike,"" said Andrew Barber, chief market strategist at Eagleview Capital in Delaware. S&P 500 e-mini futures were down 2.75 points and their fair value - a formula that evaluates pricing by taking into account interest rates, dividends and time to expiration on the contract - indicated a lower open.Dow Jones industrial average e-mini futures fell 23 points and Nasdaq 100 e-mini futures lost 10.50 points.""The consensus is probably for a tightening in September, though an increasing number of people think there will be no hike in 2015 as economic data remains weak,"" said Barber.The Fed has kept interest rates at near zero for almost a decade, which has made funds cheaper and helped the stock market reach record highs. The S&P 500 hit a record intraday high on Wednesday. The Dow, which had closed at record highs in the previous two sessions, was also briefly on track for another all-time high close.Salesforce.com shares rose 3.7 percent to $72.77 in premarket trading after the cloud software company, the subject of takeover speculation for the past few weeks, reported a profit for the first time in seven quarters. [ID:nL3N0YB57DLumber Liquidators shares plunged 16.1 percent to $21.21 after the hardwood flooring retailer's chief executive resigned unexpectedly.NetApp fell 12.26 percent to $31 after the data storage equipment maker reported lower-than-expected quarterly results and cut about 500 jobs.Best Buy jumped 5.5 percent to $35.64 after the consumer electronics chain reported better-than-expected quarterly profit and sales.CVS Health was up 1.6 percent at $102.90 after it said it would buy pharmacy service provider Omnicare for $10.1 billion. Omnicare shares rose 1.1 percent to $95.71.Hewlett-Packard, Intuit and Gap are scheduled to report results after the close.   (Editing by Savio D'Souza)",2015-05-21,CVS,"Thu May 21, 2015 | 9:10am EDT",US STOCKS-Wall St set to open lower as weekly jobless claims rise,http://www.reuters.com//article/markets-stocks-usa-idUSL3N0YC4EB20150521?type=companyNews
82,  May 21 Drugstore operator CVS Health Corp  said it will acquire pharmacy service provider Omnicare Inc for an enterprise value of about $12.7 billion.The $98 per share offer represents a premium of 4 percent over Omnicare's closing price on Wednesday. The deal includes debt of about $2.3 billion.  (Reporting by Sruthi Ramakrishnan in Bengaluru; Editing by Sriraj Kalluvila),2015-05-21,CVS,"Thu May 21, 2015 | 7:10am EDT",CVS Health to buy Omnicare in $12.7 billion deal,http://www.reuters.com//article/omnicare-ma-cvs-health-idUSL3N0YC3W320150521?type=companyNews
83,"  May 21 The following bids, mergers, acquisitions and disposals were reported by 1030 GMT on Thursday:** CVS Health Corp, the second-largest U.S. drugstore operator, is nearing a deal to buy pharmacy service provider Omnicare Inc for more than $12 billion, according to two people familiar with the matter.** Oil producer Pacific Rubiales Energy Corp said it has agreed to the C$6.50 per share cash offer from Mexico's Alfa Sab de CV and investment firm Harbour Energy Ltd.** Permira Advisers LLC, the buyout firm that owns most of Ancestry.com LLC, the world's largest family history website helping users trace their heritage, is exploring a sale that could value the genealogy website at $2.5-$3.0 billion, including debt, according to people familiar with the matter.** U.S. private equity firm Cerberus Capital Management LP on Thursday launched a selldown of up to $878 million in railway firm Seibu Holdings, IFR reported, citing a term sheet of the transaction.** U.S. private equity firm Bain Capital will cut its 70 percent stake in Japanese restaurant chain Skylark Co Ltd  to less than 50 percent.** Cadila Healthcare Ltd, among India's top ten drugmakers, is in late-stage talks to buy smaller rival Claris Lifesciences Ltd for about 34 billion rupees ($534 million), the Economic Times newspaper reported, citing sources aware of the talks. ** Indian drugmaker Strides Arcolab Ltd has agreed to buy businesses in Australia and Mauritius from South Africa's Aspen Pharmacare Holdings Ltd, paying $300 million to expand its footprint in markets set for brisk growth.** GE, which announced plans last month to sell $200 billion in GE Capital finance assets, now expects to be largely done with the process by 2016 instead of finishing in 2017.** Bermuda-based reinsurer PartnerRe said on Wednesday it was ready to talk to Italian holding company Exor  to see if there was room to improve its $6.8 billion takeover bid.AXIS Capital Holdings Ltd Chief Executive Officer Albert Benchimol told employees on Wednesday that a merger with PartnerRe Ltd was still in the best interests of both reinsurance companies, according to a memo seen by Reuters. ** Oman's United Finance said National Bank of Oman had confirmed interest in participating in a bidding process for a possible acquisition of the company.** Brazilian investment bank BTG Pactual SA and its partners P2Brasil and GMR Energia jointly sold 100 percent of renewable energy company Latin America Power (LAP) to SunEdison, BTG and P2 said.** German lender HSH Nordbank could split off a ""bad bank"" for non-performing shipping loans as part of a plan to create a sustainable business model, according to a person familiar with the matter. ** Israeli defence electronics firm Elbit Systems  has agreed to buy Nice Systems' cyber and intelligence division for $157.9 million as it seeks to boost its presence in this fast-growing market.** South Korean media company Jcontentree Corp  said it would buy the 50 percent stake that it does not already own in the country's third-largest movie theatre chain Megabox Inc for 152 billion won ($139 million).** Dubai's Amanat Holdings said it has bought a 4.14 percent stake in London-listed UAE healthcare firm Al Noor Hospitals from Deutsche Bank for 250 million dirhams ($68.1 million).** Booker Group Plc, Britain's biggest cash-and-carry wholesaler, has agreed to buy the Londis and Budgens chains 40 million pounds ($62.2 million) to expand its network of grocery and convenience stores and tap into changing consumer habits.** Indian vehicle maker Mahindra and Mahindra Ltd  said it would buy a 33 percent voting stake in the agricultural machinery-making unit of Mitsubishi Heavy Industries Ltd  for $25 million.($1 = 63.7100 Indian rupees)  ($1 = C$1.2081)  ($1 = 1,092.5100 won)  ($1 = 3.6730 UAE dirham)  ($1 = 0.6436 pounds)   (Compiled by Ankit Ajmera in Bengaluru)",2015-05-21,CVS,"Thu May 21, 2015 | 6:36am EDT",Deals of the day- Mergers and acquisitions,http://www.reuters.com//article/deals-day-idUSL3N0YC3BT20150521?type=companyNews
84,"   By Nandita Bose and Nathan Layne | CHICAGO  CHICAGO Target Corp's (TGT.N) sale of its in-store pharmacies to CVS Health Corp (CVS.N) may encourage large supermarket chains with struggling pharmacies to look for professional drug store partners of their own.More than 1,660 Target pharmacies will become CVS units in the $1.9 billion deal, the first time a drugstore chain has expanded its pharmacy business within a third party retail store, pharmacy consultants and analysts said.Drug stores in recent years have focused on opening new stores, an effort which has slowed recently.Target pharmacies helped drive overall sales at the chain but lost money, as the government health care program known as Obamacare expanded ranks of insured and increased pressure on costs.""Grocery store chains must be taking the news today and thinking hard about it. Pharmacy is not really a core competence,"" said Todd Huseby, partner, AT Kearney said, citing Safeway and Albertsons as two companies that might consider it. Neither responded to a request for comment. Some supermarkets may have the scale and buying power to make their own pharmacies work, said Neil Stern, senior partner at retail consulting firm McMillan Doolittle. They may see the store-in-store format as an opening for a competitor, he said.However, margins are eroding, said Adam Fein, president of advisory and research firm Pembroke Consulting.  ""The future of pharmacy is really about being a low cost buyer of generic drugs and capability to dispense specialty drugs and that is an area of challenge for several supermarket operators,"" he said.Supermarkets with pharmacies such as Kroger (KR.N), Safeway and Stop & Shop saw a 0.6 percent increase in the number of prescriptions filled, but a 0.17 percent decline in prescription market share in 2014 from a year earlier, data from Fein's blog Drug Channels showed.Last year, prescriptions filled at chain drugstores like CVS, Walgreens WBA.N, Rite Aid (RAD.N) rose 5.1 percent, with 1.41 percent growth in prescription market share, while mass merchant chains like Wal-Mart Stores Inc (WMT.N) increased market share by 0.32 percent. Wal-Mart's health and wellness business has been performing very well, and it sees no need to have pharmacies handled by another company, spokeswoman Sarah McKinney said.Drug store chains could look to stores-in-stores as a way to get ""immediate access to new markets at a much lower cost,"" than building their own stores, said Tom Charland, chief executive at consulting firm Merchant Medicine. (Reporting by Nandita Bose in Chicago; Editing by Richard Chang)",2015-06-15,CVS,"Mon Jun 15, 2015 | 7:46pm EDT",CVS-Target deal could spur supermarkets to find pharmacy partners,http://www.reuters.com//article/us-targetpharmacy-m-a-cvs-health-competi-idUSKBN0OV2XI20150615?type=companyNews
85,"   By Sruthi Ramakrishnan and Nathan Layne  Drugstore operator CVS Health Corp (CVS.N) will buy Target Corp's (TGT.N) pharmacies and clinics in a $1.9 billion deal that should help it bargain with drug makers for lower prices, while freeing Target from a costly business where it struggled to make a profit. CVS, the second-largest U.S. drugstore operator with 7,800 stores, said on Monday it will acquire Target's more than 1,660 pharmacies in 47 states with about $4 billion in annual sales. It will also acquire Target's nearly 80 clinics.The pharmacies will continue to be located within Target stores but carry the CVS brand. The move was the CVS' second large acquisition in as many months, coming on the heels of its $10.1 billion deal for healthcare services firm Omnicare Inc OCR.N in May.  The transaction will significantly expand the drugstore chain's retail presence and should bolster its bargaining power with pharmaceutical companies. ""The healthcare industry is evolving rapidly,"" CVS Chief Executive Larry Merlo said on a conference call. ""In this environment, success is all about effectively managing costs, quality and access.""  For Target, the deal divests a business that was ""modestly negative"" in terms of profits. While Target will lose revenue, its sales, general and administrative costs will drop by $1 billion. Target Chief Executive Brian Cornell said the move fits with the company's focus on a handful of categories where it believes it can be most competitive including apparel, items for children and health and wellness-related goods. Target will continue to handle the sale of over-the-counter drugs.Cornell, who has been remaking the retailer's strategy since taking the helm in August, said the deal will allow it to focus resources on reviving its food business, for instance. He also said it should bring more customers into Target stores. The companies hope CVS' price advantages, including in generic drugs, will attract more customers to the pharmacies who then buy other items from Target. ""They bring scale, cost efficiency; they bring expertise that we just could not bring to a space that we were operating as a subscale player,"" Cornell said of CVS. CVS shares were up 0.7 percent at $102.88, while Target shares rose 1.3 percent to $80.51 in morning trading.The two companies said the 80 Target clinics will be rebranded as MinuteClinics, as will the 20 additional clinics they plan to open within three years of the deal closing, expected near the end of 2015..Target and CVS also said they plan to co-develop five to 10 small-format stores, potentially accelerating Target's strategy of finding growth through smaller outlets in urban areas.The deal will also affect both companies' plans for share buybacks. Target said it would likely use some of the expected $1.2 billion in after-tax proceeds for shares repurchases. It doubled its share buyback program to $10 billion last week.In contrast, CVS cut its 2015 share repurchase program by $1 billion to $5 billion as a result of the transaction, which it will finance with debt. The move adds to the strain on its finances, already under pressure from the Omnicare deal.CVS' reduced buyback target led it to lower its 2015 and 2016 adjusted earnings forecast. Barclays is CVS' financial adviser, while Target's is Goldman Sachs.CVS' legal adviser is Fried Frank and regulatory adviser is Dechert LLP. Target's legal advisers are Faegre Baker Daniels LLP, Wachtell, Lipton, Rosen & Katz, and Dorsey & Whitney. (Reporting by Sruthi Ramakrishnan in Bengaluru and Nathan Layne in Chicago; Editing by Savio D'Souza and Cynthia Osterman)",2015-06-15,CVS,"Mon Jun 15, 2015 | 6:29pm EDT",CVS Health to buy Target's pharmacy business for $1.9 billion,http://www.reuters.com//article/us-targetpharmacy-m-a-cvs-health-idUSKBN0OV1C620150615?type=companyNews
86,"  * Deal to boost CVS' bargaining power, narrow Target's focus* All new Target stores with pharmacies to include CVS pharmacy* CVS cuts 2015 share repurchase program to $5 bln from $6 bln* Target to use $1.2 bln proceeds for share repurchase* CVS shares up 0.7 pct, Target up 1.3 pct   (Adds CEO comments, details)By Sruthi Ramakrishnan and Nathan LayneJune 15 Drugstore operator CVS Health Corp  will buy Target Corp's pharmacies and clinics in a $1.9 billion deal that should help it bargain with drug makers for lower prices, while freeing Target from a costly business where it struggled to make a profit.CVS, the second-largest U.S. drugstore operator with 7,800 stores, said on Monday it will acquire Target's more than 1,660 pharmacies in 47 states with about $4 billion in annual sales. It will also acquire Target's nearly 80 clinics.The pharmacies will continue to be located within Target stores but carry the CVS brand. The move was the CVS' second large acquisition in as many months, coming on the heels of its $10.1 billion deal for healthcare services firm Omnicare Inc in May.The transaction will significantly expand the drugstore chain's retail presence and should bolster its bargaining power with pharmaceutical companies.""The healthcare industry is evolving rapidly,"" CVS Chief Executive Larry Merlo said on a conference call. ""In this environment, success is all about effectively managing costs, quality and access.""For Target, the deal divests a business that was ""modestly negative"" in terms of profits. While Target will lose revenue, its sales, general and administrative costs will drop by $1 billion.Target Chief Executive Brian Cornell said the move fits with the company's focus on a handful of categories where it believes it can be most competitive including apparel, items for children and health and wellness-related goods. Target will continue to handle the sale of over-the-counter drugs. Cornell, who has been remaking the retailer's strategy since taking the helm in August, said the deal will allow it to focus resources on reviving its food business, for instance.He also said it should bring more customers into Target stores. The companies hope CVS' price advantages, including in generic drugs, will attract more customers to the pharmacies who then buy other items from Target.""They bring scale, cost efficiency; they bring expertise that we just could not bring to a space that we were operating as a subscale player,"" Cornell said of CVS.CVS shares were up 0.7 percent at $102.88, while Target shares rose 1.3 percent to $80.51 in morning trading. The two companies said the 80 Target clinics will be rebranded as MinuteClinics, as will the 20 additional clinics they plan to open within three years of the deal closing, expected near the end of 2015..Target and CVS also said they plan to co-develop five to 10 small-format stores, potentially accelerating Target's strategy of finding growth through smaller outlets in urban areas.The deal will also affect both companies' plans for share buybacks.Target said it would likely use some of the expected $1.2 billion in after-tax proceeds for shares repurchases. It doubled its share buyback program to $10 billion last week.In contrast, CVS cut its 2015 share repurchase program by $1 billion to $5 billion as a result of the transaction, which it will finance with debt. The move adds to the strain on its finances, already under pressure from the Omnicare deal.CVS' reduced buyback target led it to lower its 2015 and 2016 adjusted earnings forecast.Barclays is CVS' financial adviser, while Target's is Goldman Sachs.CVS' legal adviser is Fried Frank and regulatory adviser is Dechert LLP. Target's legal advisers are Faegre Baker Daniels LLP, Wachtell, Lipton, Rosen & Katz, and Dorsey & Whitney.   (Reporting by Sruthi Ramakrishnan in Bengaluru and Nathan Layne in Chicago; Editing by Savio D'Souza and Cynthia Osterman)",2015-06-15,CVS,"Mon Jun 15, 2015 | 2:12pm EDT",UPDATE 4-CVS Health to buy Target's pharmacy business for $1.9 bln,http://www.reuters.com//article/targetpharmacy-ma-cvs-health-idUSL3N0Z13VO20150615?type=companyNews
