,Article,Date,Symbol,Time,Title,Url
108,"  (Adds CVS comment)By Jonathan StempelSept 16 CVS Health Corp reached a $48 million settlement of a lawsuit accusing the U.S. drugstore operator of fraudulently concealing a big loss of revenue in its pharmacy benefits manager business, culminating in a plunge in its stock price.The all-cash settlement with investors led by three Massachusetts public pension funds was disclosed in a Monday filing with the federal court in Providence, Rhode Island.CVS' share price tumbled 20.1 percent on Nov. 5, 2009, after the company, then known as CVS Caremark, revealed the loss of contracts representing about $4.5 billion of annual revenue.Shareholders said this disclosure blindsided them, after CVS officials had repeatedly assured them that the company was doing an excellent job integrating the former Caremark Rx Inc and retaining clients. CVS bought Caremark in March 2007 and changed its name to CVS Health last September.The settlement requires court approval and awaits class-action certification for shareholders from Oct. 30, 2008, to Nov. 4, 2009. CVS denied wrongdoing. CVS spokeswoman Carolyn Castel said the payment will be covered by insurance and that the Woonsocket, Rhode Island-based company settled to avoid the ""burden, uncertainty and expense of continuing litigation.""In April 2014, CVS agreed to pay $20 million to settle U.S. Securities and Exchange Commission civil charges related to the PBM business, and its accounting for an unrelated acquisition.The $48 million is just 1 percent of CVS' annual profit, but the plaintiffs' lawyers in court papers called the accord ""a very good recovery,"" given the risks of continued litigation. They estimated the sum at 5.33 percent of the potential $900 million of ""recoverable damages"" in the litigation.The lead plaintiffs are the City of Brockton Retirement System, Norfolk County Retirement System and Plymouth County Retirement System.Their lawyers, led by Robbins Geller Rudman & Dowd and Labaton Sucharow, plan to seek legal fees of up to 30 percent of the settlement amount, court papers show.The case, which has a different named plaintiff and defendant, is Medoff v. CVS Caremark Corp et al, U.S. District Court, District of Rhode Island, No. 09-00554.   (Reporting by Jonathan Stempel in New York; Editing by Lisa Von Ahn and Alan Crosby)",2015-09-16,CVS,"Wed Sep 16, 2015 | 11:55am EDT",UPDATE 1-CVS Health in $48 million settlement of lawsuit over hiding loss,http://www.reuters.com//article/cvs-health-settlement-idUSL1N11M1DK20150916?type=companyNews
109,"  Sept 16 CVS Health Corp reached a $48 million settlement of a lawsuit accusing the U.S. drugstore operator of fraudulently concealing a big loss of revenue in its pharmacy benefits manager business, culminating in a plunge in its stock price.The all-cash settlement with investors led by three Massachusetts public pension funds was disclosed in a Monday filing with the federal court in Providence, Rhode Island.CVS' share price tumbled 20.1 percent on Nov. 5, 2009, after the company, then known as CVS Caremark, revealed the loss of contracts representing about $4.5 billion of annual revenue.Shareholders said this disclosure blindsided them, after CVS officials had repeatedly assured them that the company was doing an excellent job integrating the former Caremark Rx Inc and retaining clients.CVS bought Caremark in March 2007. The Woonsocket, Rhode Island-based company changed its name to CVS Health last September. The settlement requires court approval and awaits class-action certification for shareholders from Oct. 30, 2008, to Nov. 4, 2009. CVS denied wrongdoing.CVS spokeswoman Carolyn Castel was not immediately available on Wednesday to comment. In April 2014, CVS agreed to pay $20 million to settle U.S. Securities and Exchange Commission civil charges related to the PBM business, and its accounting for an unrelated acquisition.The $48 million is just 1 percent of CVS' annual profit, but the plaintiffs' lawyers in court papers called the accord ""a very good recovery,"" given the risks of continued litigation. They estimated the sum at 5.33 percent of the potential $900 million of ""recoverable damages"" in the litigation.The lead plaintiffs are the City of Brockton Retirement System, Norfolk County Retirement System and Plymouth County Retirement System.Their lawyers, led by Robbins Geller Rudman & Dowd and Labaton Sucharow, plan to seek legal fees of up to 30 percent of the settlement amount, court papers show.The case, which has a different named plaintiff and defendant, is Medoff v. CVS Caremark Corp et al, U.S. District Court, District of Rhode Island, No. 09-00554.     (Reporting by Jonathan Stempel in New York; Editing by Lisa Von Ahn)",2015-09-16,CVS,"Wed Sep 16, 2015 | 10:09am EDT",CVS Health in $48 million settlement of lawsuit over stock plunge,http://www.reuters.com//article/cvs-health-settlement-idUSL1N11M0WH20150916?type=companyNews
110,"   By Brendan Pierson  CVS Health Corp's pharmacy benefit management unit has dodged a whistleblower lawsuit accusing it of multiple violations of the federal Medicare law, including approving claims for drugs without proper physician identification or necessary authorization. U.S. District Judge Ronald Buckwalter of the Eastern District of Pennsylvania ruled Tuesday that while CVS Caremark, a division of Rhode Island-based CVS, may have made errors in processing Medicare claims, it did not deliberately defraud the government.  To read the full story on WestlawNext Practitioner Insights, click here: bit.ly/1JqJqfF",2015-09-23,CVS,"Wed Sep 23, 2015 | 7:54pm EDT",CVS dodges Medicare fraud whistleblower lawsuit,http://www.reuters.com//article/health-cvs-idUSL1N11T2OJ20150923?type=companyNews
111,"   By Michael Flaherty and Caroline Humer  Valeant Pharmaceuticals Inc. sustained hits on several fronts on Thursday after CVS Health Corp and Express Scripts dropped Philidor from their networks in a sign the fallout from the drugmaker's connection with the specialty pharmacy is spreading.The moves by the nation's two largest pharmacy benefit managers whacked Valeant shares before the market close, and pushed them 10 percent lower to $99 after hours.After coming under pressure this summer, Valeant's stock plunged last week after short-seller Citron Research said that the company was using its drug distributor, Philidor Rx, to inflate revenue numbers.About a dozen Valeant officials held a conference call on Monday to address the accusations, which helped ease pressure on the company's stock. Valeant said it properly accounts for sales through its pharmacy partners and only books revenue once one of its medicines reaches a patient.Valeant's stock recovered throughout the week than sank on the CVS and Express Scripts news. CVS, late on Thursday, said its Caremark program was dropping Philidor. CVS took the step following an audit of Philidor, citing ""noncompliance"" with its provider agreement, the company said.Shortly after the market close, Express Scripts said it too was ending its ties to Philidor.  CVS did not explain the ""noncompliance"" further when contacted by Reuters. Bloomberg on Thursday said Philidor has altered doctors orders to wring more payment out of insurers, according to former employees and an internal document, which details how to proceed with a prescription for certain Valeant drugs after they have been rejected.""Valeants drugs are provided to patients through many channels, including traditional retail pharmacies, specialty pharmacies, and directly from health care providers,"" said Valeant Spokeswoman Laurie Little in an emailed statement. Philidor declined to comment on Thursday.  CVS and Express Scripts Holdings manage most of the prescriptions filled under health plans run by the nation's largest insurers. Express Scripts manages prescription benefits for 85 million people.  The move by CVS and Express Scripts will have a direct impact on Valeant, though Philidor accounts for a small portion of the Canadian company's revenues.In Valeant's detailed presentation on Monday that spelled out its dealings with Philidor, the company said that the pharmacy accounted for about 5.9 percent of its total sales so far this year.The stock was trading as high as $260 per share in August. The next month, U.S. Democratic politicians singled out Valeant for hiking drug prices on consumers, and a federal subpoena followed. With the stock under pressure, the Citron report last Wednesday sent it into a tailspin.TOP SHAREHOLDER SPEAKS  The CVS announcement came after mutual fund manager Ruane, Cunniff & Goldfarb Inc., sent a letter to its own investors about the Valeant saga. The Sequoia Fund, which the mutual fund manages, owns 9.93 percent of Valeant and is the company's largest shareholder.While the letter is largely a defense of Valeant's practices, it says that the company needs to move faster with paying down its debt. It also points out that Valeant's aggressive business practices have ""pushed boundaries,"" and that the company needs to better manage its image.""We would stress the importance of taking a more systemic approach to managing business practices with an eye on the company's long-term corporate reputation,"" said the letter dated Oct. 28 and signed by Ruane, Cunniff & Goldfarb President Robert Goldfarb and Executive Vice President David Poppe.Separately, two of the five independent directors of the Sequoia Fund resigned over the weekend, the Wall Street Journal reported on Thursday, citing the boards chairman. A person who answered the phone at Ruane, Cunniff & Goldfarb said the chairman, Roger Lowenstein, could not be reached. ACTIVISTS HIT Valeant's abrupt slide from a hedge fund darling to a drug company under fire has weighed heavily on two of the best known U.S. activist funds: ValueAct Partners and Pershing Square.ValueAct has been an investor in Valeant since 2006, and played a significant role in instituting the company's strategy and its current CEO, Michael Pearson. Pearson took over in 2008 and built Valeant into a more than $40 billion company with over 100 transactions. ValueAct, with $19 billion under management, now has two directors on the company's board, and was the fourth largest shareholder as of June 30.William Ackman's Pershing Square, Valeant's third-largest shareholder, has scheduled a call on Friday at 9 am EDT to address the drug company's issues. Pershing owned 5.7 percent of Valeant as of June 30, and faced a paper loss of more than $800 million at one point last week. (Additional reporting by Vidya L Nathan; Editing by Cynthia Osterman, Nick Zieminski and Andrew Hay)",2015-10-29,CVS,"Thu Oct 29, 2015 | 7:27pm EDT","CVS, Express Scripts drop Valeant's Philidor; stock dives",http://www.reuters.com//article/us-valeant-pharmacies-shareholders-idUSKCN0SN28U20151029?type=companyNews
112,"  (Adds CVS, Express Scripts dropping Philidor, share drop)By Michael Flaherty and Caroline HumerOct 29 Shares of Valeant Pharmaceuticals Inc. fell further on Thursday after CVS Health Corp and Express Scripts dropped Philidor Rx from their networks in a sign the fall-out from the drugmaker's connection with the specialty pharmacy is spreading.Philidor Rx, the speciality pharmacy used by Valeant, is at the center of accusations lodged by a short-seller last week that Valeant inflated revenues - allegations that sent Valeant shares into a tailspin.The stock recovered some of its losses, and was trading higher through most of Thursday until CVS, late in the trading session, said its Caremark program was dropping Philidor. CVS took the step following an audit of Philidor, citing ""noncompliance"" with its provider agreement, the company said.Valeant's New York traded shares fell 4.7 percent to $111.50 at the close. The stock was trading as high as $260 per share in August. Express Scripts, later on Thursday, said it too was ending its ties to Philidor.The CVS announcement came after mutual fund manager Ruane, Cunniff & Goldfarb Inc., sent a letter to its own investors about the Valeant saga. The Sequioa Fund, which the mutual fund manages, owns 9.93 percent of Valeant and is the company's largest shareholder. While the letter is largely a defense of Valeant's practices, it says that the company needs to move faster with paying down its debt. It also points out that Valeant's aggressive business practices have ""pushed boundaries,"" and that the company needs to better manage its reputation.""We would stress the importance of taking a more systemic approach to managing business practices with an eye on the company's long-term corporate reputation,"" said the letter dated Oct. 28 and signed by Ruane, Cunniff & Goldfarb President Robert Goldfarb and Executive Vice President David Poppe.Separately, two of the five independent directors of the Sequioa Fund resigned over the weekend, the Wall Street Journal reported on Thursday, citing the board's chairman. Reuters could not immediately reach the chairman, Roger Lowenstein. After coming under pressure this summer, Valeant's stock plunged after short-seller Citron Research said last week that the company was using its drug distributor, Philidor, to inflate revenue numbers.(Additional reporting by Vidya Nathan; Editing by Cynthia Osterman, Nick Zieminski and Andrew Hay)",2015-10-29,CVS,"Thu Oct 29, 2015 | 5:22pm EDT","UPDATE 4-CVS, Express Scripts drop Valeant's Philidor; stock dives",http://www.reuters.com//article/valeant-pharmacies-shareholders-idUSL3N12T5VA20151029?type=companyNews
113,"  Drugstore chain CVS Health Corp (CVS.N) said it had dropped Philidor Rx, a specialty pharmacy associated with Valeant Pharmaceuticals Inc (VRX.TO) (VRX.N), from its Caremark program.Valeant's shares tumbled last week after influential short-seller Citron Research said the company was using specialty pharmacies to inflate revenue.  CVS took the step following an audit of Philidor, citing  ""noncompliance"" with its provider agreement.     (Reporting by Natalie Grover in Bengaluru; Editing by Anil D'Silva)",2015-10-29,CVS,"Thu Oct 29, 2015 | 4:12pm EDT","CVS Health drops Philidor, adds to Valeant's woes",http://www.reuters.com//article/us-valeant-pharmacies-cvs-health-idUSKCN0SN2QY20151029?type=companyNews
114,"  Oct 29 Drugstore chain CVS Health Corp  said it had dropped Philidor Rx, a specialty pharmacy associated with Valeant Pharmaceuticals Inc , from its Caremark program.Valeant's shares tumbled last week after influential short-seller Citron Research said the company was using specialty pharmacies to inflate revenue.  CVS took the step following an audit of Philidor, citing  ""noncompliance"" with its provider agreement.     (Reporting by Natalie Grover in Bengaluru; Editing by Anil D'Silva) ",2015-10-29,CVS,"Thu Oct 29, 2015 | 4:08pm EDT","CVS Health drops Philidor, adds to Valeant's woes",http://www.reuters.com//article/valeant-pharmacies-cvs-health-idUSL3N12T68520151029?type=companyNews
115,"   By Ramkumar Iyer and Natalie Grover  Vertex Pharmaceuticals Inc said it received a subpoena from the U.S. Department of Justice in the third quarter, seeking documents related primarily to its ""good laboratory practices"" in a bioanalytical lab.Good laboratory practices are rules that govern non-clinical safety studies, ensuring quality, integrity and reliability of data. Shares of the cystic fibrosis drugmaker, which said it was in the process of responding to the subpoena, fell about 2 percent after-hours.Separately, drugmaker Mylan NV and drugstore chain CVS Health Corp said in their quarterly filings that they had also received subpoenas from federal agencies. CVS said the Drug Enforcement Administration in September sought documents related to controlled substance policies, procedures, and practices at eight pharmacy locations since May 2012. Mylan said the U.S. Securities and Exchange Commission was seeking documents with regard to certain ""related party matters"".CVS and Mylan's shares were little changed after the bell.",2015-10-30,CVS,"Fri Oct 30, 2015 | 6:04pm EDT","Vertex, Mylan, CVS subpoenaed by federal agencies",http://www.reuters.com//article/healthcare-subpeona-idUSL1N12U31520151030?type=companyNews
116,"  Vertex Pharmaceuticals Inc said it received a subpoena from the U.S. Department of Justice in the third quarter, seeking documents related primarily to its ""good laboratory practices"" in a bioanalytical lab.Good laboratory practices are rules that govern non-clinical safety studies, ensuring quality, integrity and reliability of data. Shares of the cystic fibrosis drugmaker, which said it was in the process of responding to the subpoena, fell about 2 percent after-hours. Separately, drugmaker Mylan NV and drugstore chain CVS Health Corp said in their quarterly filings that they had also received subpoenas from federal agencies. CVS said the Drug Enforcement Administration in September sought documents related to controlled substance policies, procedures, and practices at eight pharmacy locations since May 2012. Mylan said the U.S. Securities and Exchange Commission was seeking documents with regard to certain ""related party matters"".CVS and Mylan's shares were little changed after the bell.  (Reporting by Natalie Grover and Ramkumar Iyer in Bengaluru; Editing by Anil D'Silva)",2015-10-30,CVS,"Fri Oct 30, 2015 | 6:01pm EDT","Vertex, Mylan, CVS subpoenaed by federal agencies",http://www.reuters.com//article/us-healthcare-subpeona-idUSKCN0SO2SS20151030?type=companyNews
117,"  Oct 30 Vertex Pharmaceuticals Inc said it received a subpoena from the U.S. Department of Justice in the third quarter, seeking documents related primarily to its ""good laboratory practices"" in a bioanalytical lab.Good laboratory practices are rules that govern non-clinical safety studies, ensuring quality, integrity and reliability of data.Shares of the cystic fibrosis drugmaker, which said it was in the process of responding to the subpoena, fell about 2 percent after-hours. Separately, drugmaker Mylan NV and drugstore chain CVS Health Corp said in their quarterly filings that they had also received subpoenas from federal agencies. CVS said the Drug Enforcement Administration in September sought documents related to controlled substance policies, procedures, and practices at eight pharmacy locations since May 2012. Mylan said the U.S. Securities and Exchange Commission was seeking documents with regard to certain ""related party matters"".CVS and Mylan's shares were little changed after the bell.   (Reporting by Natalie Grover and Ramkumar Iyer in Bengaluru; Editing by Anil D'Silva)",2015-10-30,CVS,"Fri Oct 30, 2015 | 6:00pm EDT","Vertex, Mylan, CVS subpoenaed by federal agencies",http://www.reuters.com//article/healthcare-subpeona-idUSL3N12U6IX20151030?type=companyNews
118,"   By Sruthi Ramakrishnan  CVS Health Corp (CVS.N) gave a disappointing profit forecast for 2016, hurt by costs related to the acquisition of Target Corp's pharmacies and as its own pharmacy benefits management (PBM) business expands in low-margin Medicare and Medicaid plans.The drugstore operator's profit missed analysts' estimates for the first time in six quarters, as its $10-billion Omnicare acquisition failed to offset pressure from lower reimbursement rates and new low-margin generic drugs.CVS shares were down 4.6 percent at $98.98 in heavy trading on Friday, among the top decliners on the S&P 500 .SPX. They fell as much as 7 percent earlier.The weak forecast from CVS, the No.2 U.S. drugstore chain by store count, comes in the same week that larger rival Walgreens Boots Alliance Inc (WBA.O) said it would buy No.3 Rite Aid Corp (RAD.N) for $9.4 billion.CVS forecast 2016 adjusted earnings of $5.68-$5.88 per share, including a $4 billion stock buyback plan and a 6 cents per share impact related to the acquisition of Target's (TGT.N) pharmacies in June. Analysts on average were expecting a profit of $6.02 per share, according to Thomson Reuters I/B/E/S.""While no one can complain about a $100 billion behemoth growing EPS 10-14 percent in a challenging environment, expects were clearly somewhat higher given the M&A activity in 2015,"" Evercore ISI analyst Ross Muken wrote in a note.CVS said sales at its drugstores were hurt in the third quarter by the introduction of low-margin generic drugs, lower reimbursement rates and its move to stop selling tobacco products last year. ""Reimbursement pressure has not changed but ... Medicare and Medicaid are big areas of growth in this (PBM) business. And they carry a lower margin rate,"" Chief Executive Larry Merlo said on a conference call.Rising generic drug prices are hurting drugstore operators as insurers and PBMs have been slow in raising reimbursement rates for those drugs.Margins in CVS's PBM business, which accounted for 66 percent of net revenue in the quarter ended Sept. 30, fell 45 basis points. Net income attributable to CVS rose 31.4 percent to $1.25 billion, or $1.11 per share. Excluding items, it earned $1.28 per share. Net revenue rose 10.3 percent to $38.64 billion.Analysts had expected earnings of $1.29 per share on revenue of $37.89 billion.About 9.2 million CVS shares were traded by 11 a.m ET, with the stock' turnover topping $900 million, the third highest among S&P 500 companies. (Reporting by Sruthi Ramakrishnan in Bengaluru; Editing by Savio D'Souza)",2015-10-30,CVS,"Fri Oct 30, 2015 | 11:05am EDT","CVS 2016 profit forecast hurt by healthcare plans, Target deal",http://www.reuters.com//article/us-cvs-health-results-idUSKCN0SO1BR20151030?type=companyNews
119,"  * Q3 adjusted profit of $1.28/share vs est $1.29* To buy back $4 bln of shares in 2016* Revenue of $38.64 bln beats est. of $37.89 bln* Sees 2016 adjusted EPS $5.68-$5.88 vs est $6.02* Shares fall as much as 7 pct in heavy trading   (Adds details from conference call, analyst comment; updates shares)By Sruthi RamakrishnanOct 30 CVS Health Corp gave a disappointing profit forecast for 2016, hurt by costs related to the acquisition of Target Corp's pharmacies and as its own pharmacy benefits management (PBM) business expands in low-margin Medicare and Medicaid plans. The drugstore operator's profit missed analysts' estimates for the first time in six quarters, as its $10-billion Omnicare acquisition failed to offset pressure from lower reimbursement rates and new low-margin generic drugs.CVS shares were down 4.6 percent at $98.98 in heavy trading on Friday, among the top decliners on the S&P 500. They fell as much as 7 percent earlier.The weak forecast from CVS, the No.2 U.S. drugstore chain by store count, comes in the same week that larger rival Walgreens Boots Alliance Inc said it would buy No.3 Rite Aid Corp  for $9.4 billion.CVS forecast 2016 adjusted earnings of $5.68-$5.88 per share, including a $4 billion stock buyback plan and a 6 cents per share impact related to the acquisition of Target's  pharmacies in June. Analysts on average were expecting a profit of $6.02 per share, according to Thomson Reuters I/B/E/S.""While no one can complain about a $100 billion behemoth growing EPS 10-14 percent in a challenging environment, expects were clearly somewhat higher given the M&A activity in 2015,"" Evercore ISI analyst Ross Muken wrote in a note.CVS said sales at its drugstores were hurt in the third quarter by the introduction of low-margin generic drugs, lower reimbursement rates and its move to stop selling tobacco products last year. ""Reimbursement pressure has not changed but ... Medicare and Medicaid are big areas of growth in this (PBM) business. And they carry a lower margin rate,"" Chief Executive Larry Merlo said on a conference call.Rising generic drug prices are hurting drugstore operators as insurers and PBMs have been slow in raising reimbursement rates for those drugs.Margins in CVS's PBM business, which accounted for 66 percent of net revenue in the quarter ended Sept. 30, fell 45 basis points.Net income attributable to CVS rose 31.4 percent to $1.25 billion, or $1.11 per share. Excluding items, it earned $1.28 per share. Net revenue rose 10.3 percent to $38.64 billion.Analysts had expected earnings of $1.29 per share on revenue of $37.89 billion.About 9.2 million CVS shares were traded by 11 a.m ET, with the stock' turnover topping $900 million, the third highest among S&P 500 companies.   (Reporting by Sruthi Ramakrishnan in Bengaluru; Editing by Savio D'Souza)",2015-10-30,CVS,"Fri Oct 30, 2015 | 11:05am EDT","UPDATE 3-CVS 2016 profit forecast hurt by healthcare plans, Target deal",http://www.reuters.com//article/cvs-health-results-idUSL3N12U4OC20151030?type=companyNews
120,"  Oct 30 CVS Health Corp, the second-largest U.S. drugstore chain, reported a 10.3 percent rise in quarterly net revenue, helped by strong demand for its pharmacy benefit management services.Net income attributable to the company rose to $1.25 billion, or $1.11 per share, in the third quarter ended Sept. 30, from $948 million, or 81 cents per share, a year earlier.  Net revenue rose to $38.64 billion from $35.02 billion.   (Reporting by Sruthi Ramakrishnan in Bengaluru; Editing by Savio D'Souza) ",2015-10-30,CVS,"Fri Oct 30, 2015 | 6:56am EDT",CVS Health quarterly revenue increases 10 pct,http://www.reuters.com//article/cvs-health-results-idUSL3N12T4AF20151030?type=companyNews
