,Article,Date,Symbol,Time,Title,Url
0,"  Jan 14 (The following statement was released by the rating agency)Fitch Ratings has affirmed and withdrawn the  following ratings for CVS Caremark Corp. (NYSE: CVS):--Long-term Issuer Default Rating (IDR) at 'BBB+';--Senior unsecured bank facilities at 'BBB+';--Senior unsecured notes at 'BBB+';--Short-term IDR at 'F2'; --Commercial paper at 'F2'.The Rating Outlook is Stable.Fitch is discontinuing the ratings, which are uncompensated. KEY RATING DRIVERS The affirmations reflect the company's relatively steady credit metrics and  strong liquidity position. Fitch expects CVS to manage its credit profile and  capital allocation within the context of maintaining its publicly stated  adjusted debt/EBITDA (including NPV of lease obligations) ratio of 2.7 times  (x). The ratings also consider CVS's strong positioning in all prescription  distribution channels, with a #2 market position in the retail segment and  pharmacy benefit management (PBM) and a #1 position in the fast-growing  specialty pharmacy business, making it the largest provider of prescriptions in  the U.S. with a 21% share of 2012 prescription volume.The company is well positioned to drive continued market share gains and  capitalize on favorable industry trends for prescription growth such as the  aging population and expansion of coverage to the uninsured, the continued  growth in higher-margin generics and mid-teens growth in specialty pharmacy over  the next five years. Of concern are the ongoing cyclical pressures on the  industry resulting in soft front end sales, the industry-wide pressure on  pharmacy pricing and reimbursement rates in both the retail and PBM businesses,  and any potential hit to profitability from regulatory issues. Ongoing  healthcare reform initiatives could pressure reimbursement rates but be positive  for prescription volume over the intermediate term as the Affordable Care Act is  implemented.CVS and Cardinal Health recently announced an agreement to jointly source their  generics and also announced a three-year extension through June 2019 of Cardinal  Health's existing pharmaceutical distribution agreements with CVS Caremark. The  U.S.-based joint venture is expected to be operational as soon as July 1, 2014,  and will have an initial term of 10 years. In order to reflect an equitable  50/50 joint venture, the agreement includes a quarterly payment of $25 million  over the life of the agreement from Cardinal Health to CVS Caremark. The  payments have an estimated after-tax present value of $435 million. Fitch  expects large pharmacy chain, distributors and service providers to continue to  find ways to partner together to leverage their buying scale and distribution  networks. This was also evidenced by the announcement of a strategic  relationship in March 2013 between Walgreens and Alliance Boots with  AmeriSourceBergen to collaborate on global supply chain opportunities. Retail EBIT Margins Expected to be up Modestly in 2014-2015  The retail segment which accounts for approximately 70% of operating profit  continues to perform well in spite of near-term cyclical pressures and the  company continues to lead the drug retail sector in sales productivity and other  operating metrics. It has had a successful track record in integrating  large-scale retail acquisitions over the past 10 years, while maintaining a  healthy level of growth and improving profitability on an organic basis.  As large-scale retail acquisition opportunities are limited going forward, share  gains will depend on: generating above-average organic growth; store closings or  share losses by weaker independents and regional chains; and small market  fill-in acquisitions and prescription file buys. Fitch expects retail top-line  growth to be in the 3% - 4% range going forward with comparable store sales  growth in the 2% - 2.5% range and square footage contribution in the 1% - 1.25%  range. Operating profit growth is expected to be 9% in 2013 and in the  mid-single digits in 2014 - 2015, which assumes flat to a modest increase in  gross margin, due to the ongoing benefit of branded to generic conversions  offset by reimbursement pressure on the prescription side. As a result, retail  EBIT margins are expected to increase modestly over the next 2 - 3 years on an  expected base of 9.4% to 9.5% in 2013.PBM EBIT Margin Expand In 2013; Expected to be Flat in 2014/2015 CVS has seen positive momentum in its PBM segment since 2011 from a top line  perspective with strong business wins that were accretive in 2012, including the  ramp up of Aetna and the UAM acquisition which contributed $5.5 billion in  incremental revenue in 2012. The company has won approximately $25 billion in  net new business over the past three years. Revenues have grown in the mid-20%  range in 2011 - 2012 and are expected to grow in the 4% to 6% in 2013 to 2015.  CVS recently announced the acquisition of Coram LLC (Coram), the specialty  infusion services and enteral nutrition business unit of Apria Healthcare Group  Inc. for approximately $2.1 billion. Coram is expected to generate approximately  $1.4 billion in revenues during the first 12 months following the close of the  deal (expected end of 1Q'14) and will further strengthen CVS's leadership  position in the specialty pharmacy market where it controls about 20% of the  market with 2013 estimated revenue of $20 billion.Pharmacy services EBIT margin are expected to expand to 4% from 3.6% in 2013  after four years of decline, as the company integrates large scale contracts  such as Aetna Inc. and is realizing benefits from the streamlining initiatives  that it put in place in late 2009 to deliver over $1 billion in cost savings  from 2011 - 2015.Overall EBIT Growth of Mid-Single Digits; Strong FCFFitch expects total EBIT growth including retail to be in the mid-single digit  over the next 24 months, after growing 11%-12% in 2013. CVS continues to  generate strong free cash flow (FCF) providing the company with significant  financial flexibility. Fitch expects $3.3 billion to $3.5 billion in annual FCF  (after dividends which are expected to grow in the 20% to 25% range annually, as  the company targets a payout ratio of 25% to 30% by 2015, and before any sales  leaseback transactions) over the next few years. Fitch expects FCF will  primarily be used toward share buybacks ($4 billion to $5 billion annually), and  any bolt-on acquisitions within the context of maintaining adjusted debt/EBITDAR  at 2.7x. The company's liquidity is also supported by various credit facilities  that support its $3.5 billion commercial paper program.CVS had $10 billion in debt outstanding at Sept. 30, 2013. CVS recently issued  $4 billion of debt (staggered maturities of 3, 5, 10, and 30 years) to fund the  $2.1 billion acquisition of Coram and to pay down commercial paper borrowings  (which stood at $814 million on Sept. 30, 2013). The company has debt maturities  of $550 million each in 2014 and 2015 and $1.2 billion in 2016, which Fitch  expects will be refinanced.",2014-01-14,CVS,"Tue Jan 14, 2014 | 9:30am EST",RPT-Fitch affirms CVS Caremark at 'BBB+'; withdraws ratings,http://www.reuters.com//article/fitch-affirms-cvs-caremark-at-bbb-withdr-idUSFit68359520140114?type=companyNews
1,"   By Phil Wahba and Julie Steenhuysen  CVS Caremark Corp will stop selling tobacco products at its 7,600 stores by October 1, the company said on Wednesday, making it the first national drugstore chain in the United States to take cigarettes off the shelves.Public health experts hailed the precedent-setting decision by the No. 2 U.S. drugstore as a step that could pressure other retailers to follow suit. With pharmacies taking on a larger role in the U.S. healthcare system with walk-in clinics and services such as managing health plans, many experts say they should no longer offer unhealthy products like tobacco.President Barack Obama, a former smoker, praised CVS, saying in a statement the move will help wider efforts to ""reduce tobacco-related deaths, cancer, and heart disease, as well as bring down healthcare costs.""CVS expects the decision to hurt profits initially, along with a $2 billion hit to annual sales. But the company, whose Caremark unit is a pharmacy benefits manager for corporations and the U.S. government's Medicare program, believes the move will boost its appeal as a healthcare provider.CVS hopes to replace some sales through signing up customers to smoking cessation programs, which will be a selling point with potential corporate contracts.Analysts said CVS could eventually recoup lost sales through increased use of its healthcare services. But investors focused on the short-term pain. CVS shares fell 1 percent. Larger rival Walgreen Co, which will keep selling cigarettes, rose 3.9 percent, while No. 3 Rite Aid Corp which also will still offer cigarettes rose 2 percent.Shares of cigarette makers Lorillard Inc, Altria Group and Reynolds American all slipped.Pharmacists have long been a source of community health information, and drugstore chains have embraced that tradition by adding walk-in clinics. CVS is the largest U.S. pharmacy healthcare provider, with more than 800 MinuteClinic locations.""I think CVS recognized that it was just paradoxical to be both a seller of deadly products and a healthcare provider,"" U.S. Centers for Disease Control and Prevention Director Thomas Frieden told Reuters. CVS Caremark Chief Medical Officer Dr. Troyen Brennan said in a piece in the Journal of the American Medical Association that increased health coverage under the U.S. Affordable Care Act ""comes with a price"" of promoting public health.Experts noted that healthcare organizations and advocacy groups such as Americans for Nonsmokers' Rights have been urging pharmacies for years to get out of the tobacco business.Cornell University communication professor Jeff Niederdeppe cited ""an evolving social climate that has become less and less supportive of the marketing, sale, and use of tobacco products in the U.S.""Some U.S. cities, including Boston and San Francisco, already ban the sale of tobacco products in pharmacies, and nonsmoking advocates hope other chains will follow CVS. ""This is a trend we're going to see many, many retailers and food companies jump on,"" said Alexandra von Plato, president and global chief creative officer of Publicis Healthcare Communications Group.Only 18 percent of U.S. adults smoke, down sharply from 43 percent in 1965. But the habit still kills 480,000 Americans each year, remaining the leading cause of preventable death in the United States.SHORT-TERM HIT CVS said the decision to drop tobacco sales will cost the company 6 cents to 9 cents in profit per share this year. Analysts expect 2014 revenue of $132.9 billion and earnings of $4.47 per share, according to Thomson Reuters I/B/E/S.Overall U.S. cigarette sales fell 31.3 percent from 2003 to 2013, according to Euromonitor International. And CVS faced more competition in selling to that shrinking market, as discount retailers Family Dollar Stores Inc and Dollar General Corp chains charge much less and have far more locations. ""We believe the move will be viewed as a positive long-term decision by CVS, despite the near-term profit drag, as it paves the way for increased credibility with both healthcare consumers and payers,"" ISI Group analyst Ross Muken wrote in a note to investors.CVS has been bolstering its position in the healthcare market in recent months and in December, it said it expected pharmacy benefit manager revenue to rise between 7.25 percent and 8.5 percent in 2014, more than double the rate of retail business growth.Tobacco companies shrugged off the announcement even as shares dipped on concerns about potential disruption to sales.""It's up to retailers to decide if they're going to sell tobacco products,"" said Brian May, spokesman for Altria Group, maker of Marlboro and other popular brands.RBC Capital Markets analyst Nik Modi said he expected little impact on tobacco companies. He noted that they rely on convenience stores for more than 75 percent of sales.But Dr. Richard Wender of the American Cancer Society said CVS's move would have an effect.""Every time we make it more difficult to purchase a pack of cigarettes, someone quits.""(Reporting by Phil Wahba in New York and Julie Steenhuysen in Chicago; Editing by Jilian Mincer, Lisa Shumaker and David Gregorio)",2014-02-05,CVS,"Wed Feb 5, 2014 | 4:49pm EST",CVS becomes first big U.S. drugstore chain to drop tobacco,http://www.reuters.com//article/us-cvscaremark-cigarettes-idUSBREA140RP20140205?type=companyNews
2,"  By Phil Wahba and Julie SteenhuysenFeb 5 CVS Caremark Corp will stop selling tobacco products at its 7,600 stores by Oct. 1, the company said on Wednesday, making it the first national drugstore chain in the United States to take cigarettes off the shelves.Public health experts hailed the precedent-setting decision by the No. 2 U.S. drugstore as a step that could pressure other retailers to follow suit. With pharmacies taking on a larger role in the U.S. healthcare system with walk-in clinics and services such as managing health plans, many experts say they should no longer offer unhealthy products like tobacco.President Barack Obama, a former smoker, praised CVS, saying in a statement the move will help wider efforts to ""reduce tobacco-related deaths, cancer, and heart disease, as well as bring down healthcare costs.""CVS expects the decision to hurt profits initially, along with a $2 billion hit to annual sales. But the company, whose Caremark unit is a pharmacy benefits manager for corporations and the U.S. government's Medicare program, believes the move will boost its appeal as a healthcare provider.CVS hopes to replace some sales through signing up customers to smoking cessation programs, which will be a selling point with potential corporate contracts.Analysts said CVS could eventually recoup lost sales through increased use of its healthcare services. But investors focused on the short-term pain. CVS shares fell 1 percent. Larger rival Walgreen Co, which will keep selling cigarettes, rose 3.9 percent, while No. 3 Rite Aid Corp which also will still offer cigarettes rose 2 percent.Shares of cigarette makers Lorillard Inc, Altria Group and Reynolds American all slipped.Pharmacists have long been a source of community health information, and drugstore chains have embraced that tradition by adding walk-in clinics. CVS is the largest U.S. pharmacy healthcare provider, with more than 800 MinuteClinic locations.""I think CVS recognized that it was just paradoxical to be both a seller of deadly products and a healthcare provider,"" U.S. Centers for Disease Control and Prevention Director Thomas Frieden told Reuters. CVS Caremark Chief Medical Officer Dr. Troyen Brennan said in a piece in the Journal of the American Medical Association that increased health coverage under the U.S. Affordable Care Act ""comes with a price"" of promoting public health.Experts noted that healthcare organizations and advocacy groups such as Americans for Nonsmokers' Rights have been urging pharmacies for years to get out of the tobacco business.Cornell University communication professor Jeff Niederdeppe cited ""an evolving social climate that has become less and less supportive of the marketing, sale, and use of tobacco products in the U.S.""Some U.S. cities, including Boston and San Francisco, already ban the sale of tobacco products in pharmacies, and nonsmoking advocates hope other chains will follow CVS.""This is a trend we're going to see many, many retailers and food companies jump on,"" said Alexandra von Plato, president and global chief creative officer of Publicis Healthcare Communications Group. Only 18 percent of U.S. adults smoke, down sharply from 43 percent in 1965. But the habit still kills 480,000 Americans each year, remaining the leading cause of preventable death in the United States. SHORT-TERM HIT CVS said the decision to drop tobacco sales will cost the company 6 cents to 9 cents in profit per share this year. Analysts expect 2014 revenue of $132.9 billion and earnings of $4.47 per share, according to Thomson Reuters I/B/E/S.Overall U.S. cigarette sales fell 31.3 percent from 2003 to 2013, according to Euromonitor International. And CVS faced more competition in selling to that shrinking market, as discount retailers Family Dollar Stores Inc and Dollar General Corp chains charge much less and have far more locations.""We believe the move will be viewed as a positive long-term decision by CVS, despite the near-term profit drag, as it paves the way for increased credibility with both healthcare consumers and payers,"" ISI Group analyst Ross Muken wrote in a note to investors.CVS has been bolstering its position in the healthcare market in recent months and in December, it said it expected pharmacy benefit manager revenue to rise between 7.25 percent and 8.5 percent in 2014, more than double the rate of retail business growth.Tobacco companies shrugged off the announcement even as shares dipped on concerns about potential disruption to sales.""It's up to retailers to decide if they're going to sell tobacco products,"" said Brian May, spokesman for Altria Group , maker of Marlboro and other popular brands.RBC Capital Markets analyst Nik Modi said he expected little impact on tobacco companies. He noted that they rely on convenience stores for more than 75 percent of sales.But Dr. Richard Wender of the American Cancer Society said CVS's move would have an effect.""Every time we make it more difficult to purchase a pack of cigarettes, someone quits.""",2014-02-05,CVS,"Wed Feb 5, 2014 | 4:45pm EST",UPDATE 3-CVS becomes first big U.S. drugstore chain to drop tobacco,http://www.reuters.com//article/cvscaremark-cigarettes-idUSL2N0LA11S20140205?type=companyNews
3,"  By Phil Wahba and Julie SteenhuysenFeb 5 CVS Caremark Corp said on Wednesday that it would stop selling tobacco products at its 7,600 stores by October, becoming the first national drugstore chain in the United States to take cigarettes off the shelf.Public health experts called the decision by the No. 2 U.S. drugstore chain a precedent-setting step that could pressure other retailers to follow suit.President Barack Obama, a former smoker, praised the move, saying CVS had set a powerful example.""Today's decision will help advance my Administration's efforts to reduce tobacco-related deaths, cancer, and heart disease, as well as bring down healthcare costs,"" Obama said in a statement.CVS, whose Caremark unit is a major pharmacy benefits manager for corporations and the U.S. government's Medicare program, said the decision would strengthen its position as a healthcare provider.""I think it will put pressure on other retailers who want to be in healthcare,"" said CVS Caremark Chief Medical Officer Dr. Troyen Brennan.Although some U.S. cities, including Boston and San Francisco, already ban the sale of tobacco products in pharmacies, advocates hope the voluntary move by CVS will have a ripple effect across other drugstore chains.Walgreen Co, the largest pharmacy chain, said it would still sell cigarettes for now but will continue to evaluate the product category. Third-ranked Rite Aid Corp  did not immediately respond to a request for comment. Some retailers stopped selling cigarettes years ago:  Target Corp decided to drop them in 1996, while East Coast supermarket chain Wegmans Food Markets did so in 2008.Dr. Risa Lavizzo-Mourey, chief executive officer of the Robert Wood Johnson Foundation, which focuses on public health, said CVS had made ""a bold, precedent-setting move because it acknowledges that pharmacies have become healthcare settings.""SMALL FINANCIAL IMPACT However, CVS said the decision would not make a big dent in its financial results. The company said the cost would be about $2 billion in annual sales and 6 cents to 9 cents in profit per share this year. Analysts expect CVS to report 2014 revenue of $132.9 billion and earnings of $4.47 per share, according to Thomson Reuters.Declining smoking rates, along with new competition in the last two years from the low-cost Family Dollar Stores Inc  and Dollar General Corp chains, suggest prospects for tobacco product sales were shrinking at CVS. Dollar stores have far more locations and offer goods at lower prices.""We believe the move will be viewed as a positive long-term decision by CVS, despite the near-term profit drag, as it paves the way for increased credibility with both healthcare consumers and payors,"" ISI Group analyst Ross Muken wrote in a note.Matthew Myers, president of the Campaign for Tobacco-Free Kids, said CVS's announcement could help lead more people to quit smoking.U.S. cigarette sales fell 31.3 percent between 2003 and 2013, according to Euromonitor International. Although adult smoking rates have fallen from 43 percent of Americans in 1965 to 18 percent currently, the habit remains the leading cause of preventable death in the United States, killing more than 480,000 people each year.Last month, the American Lung Association and other advocacy organizations called on political leaders to commit to cutting smoking rates to less than 10 percent of the population in a decade and to protect all Americans from secondhand smoke within five years.FOCUS ON HEALTHCARE The decision by CVS comes on the heels of several recent deals bolstering the company's position in the healthcare market.CVS in December said it expected its pharmacy benefit manager revenue to rise between 7.25 percent and 8.5 percent in 2014, easily outpacing growth of 2 percent to 3.25 percent in its retail business.In December, CVS and pharmaceutical distributor Cardinal Health Inc announced a 10-year agreement to form the largest generic drug sourcing operation in the United States. A month earlier, CVS said it was buying Coram LLC, Apria Healthcare Group Inc's specialty infusion services business.CVS executives said the company would replace some of lost cigarette sales through smoking cessation programs at its pharmacies and through Caremark.The company said the programs would be also be a key selling point as it tries to land more corporate contracts this year.",2014-02-05,CVS,"Wed Feb 5, 2014 | 9:05am EST",RPT-UPDATE 1-CVS to become first major U.S. drugstore chain to drop cigarettes,http://www.reuters.com//article/cvscaremark-cigarettes-idUSL2N0LA0QB20140205?type=companyNews
