,Article,Date,Symbol,Time,Title,Url
0,"  (Updates EMC; Adds Akorn, Comcast, Grupos Salinas, Lucchini, Dentsu Aegis, Slovenske Elektrarne, Enel, BauMax, Verizon, Wind, BSkyB, Allergan, Hapag-Lloyd, Douglas, Eastman Chemical and Vodafone)Sept 11 The following bids, mergers, acquisitions and disposals were reported by 2030 GMT on Thursday:** U.S. specialty drugmaker Akorn Inc is exploring a bid for Belgian drugmaker UCB SA's U.S. subsidiary, a deal that would allow the company to move its tax domicile overseas, according to people familiar with the matter. UCB is looking to sell its U.S. specialty generics subsidiary, Kremers Urban Pharmaceuticals Inc, in a deal that could fetch as much as $2 billion.** State attorneys general working to determine whether Comcast Corp's deal to buy Time Warner Cable Inc  is legal have expanded their investigation to include AT&T Inc's plans to buy DirecTV, according to sources close to the merger probe.** Mexico's Grupo Salinas said on Wednesday that its chairman would buy out its partner Grupo Televisa SAB's  50 percent stake in the country's No. 3 wireless operator Iusacell for $717 million and seek a strategic partner to build up the carrier.** European Union antitrust regulators approved on Thursday British broadcaster BSkyB's planned $9 billion takeover of Rupert Murdoch's pay-TV companies in Germany and Italy, which will make it the biggest pay-TV provider in Europe.** Billionaire William Ackman is close to signing up Allergan investors who combined own at least 35 percent of the Botox maker to call a special shareholder meeting, according to people familiar with the matter, giving the hedge fund manager a victory in his fight to acquire Allergan.** Italian steelmaker Lucchini said on Thursday that it has received a binding offer from India's JSW Steel for its core assets in Piombino and is considering the offer.** Hapag-Lloyd and Compania SudAmericana de Vapores secured conditional European Union approval on Thursday for their tie-up to create the world's fourth-largest container shipping company.** German books-to-cosmetics retailer Douglas has asked for second-round bids for its Christ jewellery arm in a potential deal worth more than 400 million euros ($517 million), two sources familiar with the deal said.** Eastman Chemical Co said it will buy Taminco Corp  for $1.8 billion to get a key chemical used in products for the food, agricultural and water treatment markets. ** Vodafone's chief executive Vittorio Colao said Europe's biggest cable group Liberty Global could be a good fit for the mobile operator ""for the right price"", according to a Bloomberg report.** Italian mobile phone operator Wind, a unit of Russian telecoms group Vimpelcom, has set an end-October deadline to receive non-binding offers for its phone masts, two sources close to the matter said. The long-expected deal could be worth at least 500 million euros ($647 million), Reuters reported last week.** Verizon Communications Inc Chief Executive Lowell McAdam said on Thursday that the telecoms company would open to selling some of its towers if the price was right.** Struggling Austrian home improvements group BauMax has sold its Bulgarian unit with eight stores to local investor Haedus JSC, it said, taking another step in its campaign to shrink back to health.** Italian utility Enel said it had made a binding offer to buy a 60.62 percent stake in Chile's Enersis  from its own Spanish unit Endesa for 8.25 billion euros ($10.66 billion) in a move to simplify operations. ** Slovakia is looking at various ways to strengthen its position in domestic electricity producer Slovenske Elektrarne, which has been put up for sale by majority owner Enel, Prime Minister Robert Fico said.** A Dentsu Aegis executive said the advertising company was not interested in acquiring rival Interpublic Group of Cos, putting merger speculation to rest for the moment.** Portuguese healthcare company Jose de Mello Saude has started a takeover battle for the indebted Espirito Santo family's hospitals business, offering 4.4 euros per share in an attempt to trump last month's bid by Mexico's Grupo Angeles. Jose de Mello Saude said on Thursday that its bid for main rival Espirito Santo Saude (ES Saude) is 2.3 percent higher than the Mexican offer of 4.3 euros per share, which valued ES Saude at about 411 million euros ($531 million).** Atlantic City's Revel casino-hotel, which closed earlier this month after filing for bankruptcy, reached a deal to sell itself to a Florida developer for $90 million in cash, a fraction of the billions of dollars it cost to build.** Dubai private equity firm Ithmar Capital has sold a 7.3 percent stake in Al Noor Hospitals Group Plc for 10.30 pounds per share, two sources familiar with the matter said on Thursday, in a deal worth 87.55 million pounds ($142 million). ** Southern Copper Corp said on Wednesday that it still hoped to buy a share in Anglo American Plc's $3.3 billion Quellaveco project in Peru, and that talks must now take place at the highest level.** BlackBerry Ltd said on Thursday it had acquired Movirtu, a provider of virtual identity solutions, as part of its move to continue building out its portfolio of value-added services that cater to the needs of its core base of corporate and government clients.** P&O Maritime, a subsidiary of Dubai's DP World Ltd , one of the world's largest port operators, has bought a majority stake in Spain's Remolcadores de Puerto y Altura, the acquirer said in a statement on Thursday.** A group of U.S. senators wants Burger King Worldwide Inc  to scrap its plans to invert, or move its tax domicile to Canada, as part of a deal to buy coffee and donut chain Tim Hortons Inc.** Brazilian telecom Grupo Oi SA reiterated on Wednesday it had commissioned investment bank BTG Pactual  to seek possible partners in a joint bid for rival wireless carrier TIM Participacoes SA.** Russia's No.2 oil producer NK Lukoil OAO has launched a bid to buy a diesel pipeline which runs through Ukraine to Hungary, Vedomosti reported on Thursday, citing a letter from the company's head to President Vladimir Putin.** Poland wants energy firms PGE, Tauron, and Enea to buy some of the mines from the ailing state-run coal producer Kompania Weglowa, Deputy Economy Minister Tomasz Tomczykiewicz said on Thursday.** EMC Corp plans to keep its majority stake in software maker VMware Inc despite pressure from activist hedge fund Elliott Management, a person familiar with EMC's thinking told Reuters on Thursday.** Spanish telecoms group Jazztel PLC said on Thursday that it was in talks over the possible acquisition of smaller competitor Yoigo, the Spanish arm of TeliaSonera AB .** The chief executive of Argos-owner Home Retail Group Plc  said the group had not taken a decision to sell its Homebase D.I.Y chain amid media speculation that the group could sell the division to private equity investors.($1 = 0.77 euro)    ($1 = 0.62 British pounds)   (Compiled by Anya George Tharakan and Manya Venkatesh in Bangalore)",2014-09-11,EMN,"Thu Sep 11, 2014 | 4:49pm EDT",Deals of the day- Mergers and acquisitions,http://www.reuters.com//article/deals-day-idUSL3N0RC3GF20140911?type=companyNews
1,"   By Kanika Sikka  Eastman Chemical Co (EMN.N) said it will buy Taminco Corp TAM.N for $1.8 billion to get a key chemical used in products for the food, agricultural and water treatment markets.Taminco's shares rose 11 percent to $26.55, topping the offer price of $26 per share, after Eastman also gave the company 30 days to solicit alternative proposals. Eastman's shares also rose.""There is a lot of optimism due to the terms of the transaction that another bidder might emerge,"" Suntrust Robinson Humphrey analyst James Sheehan said.Eastman's offer has the blessings of the board of both companies and that of Apollo Global Management (APO.N), Taminco's largest shareholder with a 53.7 percent stake. The deal will add alkylamines to Eastman's portfolio. Alkylamines are a key ingredient to make agricultural chemicals, animal feed additives, personal care and water treatment products, among other things. Eastman, which has been making acquisitions to expand its portfolio of specialty chemicals, said it would also assume $1 billion in debt. This year, Eastman has already announced plans to buy window films maker Commonwealth Laminating & Coating, and BP's (BP.L) aviation turbine business to expand its specialty fluids business.Eastman expects Taminco to add more than 35 cents per share to profit in 2015 and more than 60 cents in 2016. It expects synergies to be about 5 percent of Taminco's 2013 sales. Taminco, spun off from Belgium-based biopharmaceutical and specialty chemical company UCB SA (UCB.BR) in 2003, reported net sales of $1.2 billion in 2013.Eastman posted net sales of $9.4 billion in 2013 and earned $7.44 per share from continuing operations. Eastman said it will fund the deal with available cash and debt financing and expects the transaction to close in the fourth quarter this year.Morgan Stanley & Co. LLC is Taminco's financial adviser, while Citigroup is Eastman's adviser.Shares of Taminco, which went public in 2013, rose to an all-time high of $26.80. Eastman's shares rose nearly 2 percent, before shedding half its gains to trade at $83.99 in afternoon trading. (Additional reporting by Tanvi Mehta in Bangalore; Editing by Savio D'Souza)",2014-09-11,EMN,"Thu Sep 11, 2014 | 2:20pm EDT",Eastman Chemical to buy Taminco for $1.8 billion,http://www.reuters.com//article/us-taminco-corp-offer-idUSKBN0H61QX20140911?type=companyNews
2,"   By Caroline Valetkevitch | NEW YORK, Sept 11  NEW YORK, Sept 11 Taminco Corp shares were up 11 percent on Thursday after Eastman Chemical Co  said it will acquire the specialty chemical company.Shares of Eastman Chemical were up 1.5 percent.Eastman Chemical's offer of $26 per share represents an 8.9 percent premium to Taminco's Wednesday close.Among other big movers in the materials sector, Dow Chemical's stock was down 1.3 percent after a federal appeals court decided Dow Chemical was not entitled to more than $1 billion of tax deductions based on a decade of transactions with ""sham"" partnerships that Goldman and the law firm King & Spalding promoted. Index snapshot at 1131 EDT (1531 GMT):* S&P 500 down 2.92 points, or 0.15 percent. * Nasdaq Comp down 10.35 points, or 0.23 percent.* Dow industrials down 39.59 points, or 0.23 percent. * Russell 2000 down 0.75 points, or 0.06 percent.* S&P MidCap up 2.22 points, or 0.16 percent.* S&P SmallCap up 1.03 points, or 0.15 percent.   (Editing by Bernadette Baum)",2014-09-11,EMN,"Thu Sep 11, 2014 | 11:38am EDT",US STOCKS-Taminco jumps after news of Eastman Chemical deal,http://www.reuters.com//article/markets-usa-stocks-idUSL1N0RC1EW20140911?type=companyNews
3,"  BRUSSELS Nov 3 The following are mergers under review by the European Commission and a brief guide to the EU merger process:APPROVALS AND WITHDRAWALS -- French mutual BPCE, which is part of French bank Natixis , to acquire 49.9 percent of five subsidiaries of La Compagnie du Soleil and La Compagnie du Vent, which is jointly owned by French utility GDF Suez and Soper (approved Nov. 3)-- Private equity firm Apollo Management to buy Portuguese insurer Companhia de Seguros Tranquilidade (approved Nov. 3)NEW LISTINGS -- Malaysian palm oil producer Sime Darby Bhd to acquire New Britain Palm Oil Ltd (notified Oct. 31/deadline Dec. 5/simplified-- U.S. chemicals company Eastman Chemical Co to buy U.S. peer Taminco Corp (notified Oct. 31/deadline Dec. 5/simplified)-- Private equity firm Vista Equity Partners to buy U.S. business software maker Tibco Software Inc (notified Oct. 31/deadline Dec. 5/simplified)-- French insurer CNP Assurances S.A. to acquire 51 percent of Santander Insurance Life Ltd, Santander Insurance Europe Ltd and Santander Insurance Services Ireland Ltd from Spanish bank Santander's (notified Oct. 30/deadline Dec. 4/simplified)EXTENSIONS AND OTHER CHANGES NoneFIRST-STAGE REVIEWS BY DEADLINE NOV 5 -- SOCAR, Azerbaijan's state energy company, to buy stakes in Greek natural gas grid operator DESFA from Greek natural gas utility DEPA (notified Oct. 1/deadline Nov. 5)NOV 12 -- Aerospace group Airbus and French engine maker Safran to set up a joint venture (notified Oct. 8/deadline Nov. 12)NOV 13 -- Investment firm Strategic Value Partners to acquire Linpac Senior Holdings Ltd, the parent company of plastic packager Linpac Packaging Ltd (notified Oct. 9/deadline Nov. 13/simplified)-- Chemicals company Albemarle to buy specialty chemicals producer Rockwood Holdings Inc (notified Oct. 9/deadline Nov. 13)NOV 14  -- Mexican chemicals producer Mexichem to buy German plastic maker Vestolit (notified Oct. 10/deadline Nov. 14)-- Dutch mutual fund APG and Hammerson to acquire joint control of property developer Via from property developers SDMG and the Meyer Bergman Group (notified Oct. 10/deadline Nov. 14/simplified)-- Japanese trucks maker Hino Motors Ltd, which is a unit of Toyota Motors Corp, Indonesian car distributor Indomobil and Japanese trading house Sumitomoto Corp to set up a joint venture in Indonesia (notified Oct. 10/deadline Nov. 14/simplified)-- U.S. medical device maker Medtronic Inc to acquire Irish peer Covidien (notified Oct. 10/deadline Nov. 14)NOV 17 -- Abu Dhabi-based Etihad Airways to acquire 49 percent stake in Italian airline Alitalia (notified Sept. 29/deadline extended to Nov. 17 from Nov. 3 after commitments submitted Oct. 27)-- Private equity firm KKR and German insurer Allianz to acquire indirect joint control of vending machine operator Selecta (notified Oct. 13/deadline Nov. 17)NOV 18 -- Property developer RREEF, a unit of Deutsche Bank , and German property consultancy ECE to jointly acquire properties (notified Oct. 14/deadline Nov. 18)NOV 20 -- Private equity firm TDR Capital to acquire British housing developer Lakeside Ltd (notified Oct. 16/deadline Nov. 20/simplified) -- French telecoms operator Orange to acquire Spanish provider Jazztel (notified Oct. 16/deadline Nov. 20)NOV 21 -- Macquarie Infrastructure and Real Assets (Europe) Ltd and Spanish transport services provider Ferrovial Aeropuertos S.A.U. which is part of Spanish builder Ferrovial, to acquire joint control of British airport operator Airport Holdings NDH1 from Heathrow Airports Holdings Ltd (notified Oct. 17/deadline Nov. 21)-- British insurer Aviva and Polish bank BZ WBK  to set up a joint venture (notified Oct. 17/deadline Nov. 21/simplified)NOV 24 -- South Korea's Lotte Chemical Corp to acquire Versalis Elastomers Co. Ltd, which is a joint venture between Italian energy group ENI subsidiary Versalis and Lotte (notified Oct. 20/deadline Nov. 24/simplified)NOV 26 -- Chinese conglomerate Fosun to purchase French holiday group Club Mediterranee (notified Oct. 22/deadline Nov. 26/simplified)-- Private equity firm Blackstone to acquire Alliance Automotive from Weinberg Capital Partners (notified Oct. 22/deadline Nov. 26)NOV 28  -- Canadian pension fund Ontario Teachers' Pension Plan to acquire minority stake in laundry solutions company CSC ServiceWorks from private equity firm Pamplona Capital Management (notified Oct. 24/deadline Nov.28/simplified)-- Spanish insurance company Mapfre to buy the Italian and German businesses of Direct Line, Britain's largest motor insurer (notified Oct. 24/deadline Nov. 28/simplified)DEC 1 -- Dutch insurer Aegon to acquire a 51 percent stake in Spanish insurers Aegon Santander Vida and Aegon Santander Nao Vida, which are now solely owned by Spanish bank Santander (notified Oct. 27/deadline Dec. 1/simplified)-- Mondelez International Inc and competitor D.E Master Blenders to merge their coffee businesses in new company called Jacobs Douwe Egberts (notified Oct. 27/deadline Dec. 1)-- Oil major BP to acquire jet fuel business Statoil Fuel and Retail Aviation (notified Oct. 27/deadline Dec. 1)DEC 2 -- U.S. car seat and electrical power systems maker Lear Corp to acquire car leather producer Eagle Ottawa LLC from priva<te investment firm Everett Smith Group Ltd (notified Oct. 28/deadline Dec. 2/simplified)DEC 15 -- France's Lafarge and Swiss peer Holcim  to merge (notified with commitments on Oct. 27/deadline Dec. 15)FEB 5 -- Belgian telecoms group Telenet to acquire 50 percent stake in Belgian broadcasting company De Vijver Media (notified Aug. 18/deadline extended for the second time to March 5 from Feb. 5)MARCH 11 -- U.S. orthopaedic products maker Zimmer Holdings  to acquire rival Biomet Inc (notified Aug. 29/deadline extended for the second time to March 11 from Feb. 16)GUIDE TO EU MERGER PROCESS DEADLINES: The European Commission has 25 working days after a deal is  filed for a first-stage review. It may extend that by 10 working days to 35 working days, to consider either a company's proposed remedies or an EU member state's request to handle the case.Most mergers win approval but occasionally the Commission  opens a detailed second-stage investigation for up to 90  additional working days, which it may extend to 105 working  days.SIMPLIFIED: Under the simplified procedure, the Commission announces the clearance of uncontroversial first-stage mergers without giving any reason for its decision. Cases may be reclassified as non-simplified -- that is, ordinary first-stage reviews -- until they are approved.   (Editing by Foo Yun Chee)",2014-11-03,EMN,"Mon Nov 3, 2014 | 10:53am EST",EU mergers and takeovers (Nov 3),http://www.reuters.com//article/eu-mergers-takeovers-idUSL6N0ST42Q20141103?type=companyNews
4,"  BRUSSELS Nov 24 The following are mergers under review by the European Commission and a brief guide to the EU merger process:APPROVALS AND WITHDRAWALS -- South Korea's Lotte Chemical Corp to acquire Versalis Elastomers Co. Ltd, which is a joint venture between Italian energy group ENI subsidiary Versalis and Lotte (approved Nov. 13)-- Chemicals company Albemarle to buy specialty chemicals producer Rockwood Holdings Inc (approved Nov. 13)-- Mexican chemicals producer Mexichem to buy German plastic maker Vestolit (notified Oct. 10/deadline Nov. 14)NEW LISTINGS -- French holding company Eurazeo and Groupe Credit Agricole to jointly acquire two building complexes SCI Lafayette and SCI Stratege (notified Nov. 20/deadline Jan. 6/simplified)-- Czech state-owned holding company Cesky Aeroholding and privately-owned low-cost Czech carrier Travel Service to jointly acquire Czech Airlines (notified Nov. 14/deadline Dec. 19)-- Aerospace group Airbus and Singapore Airlines  to jointly acquire Airbus Asia Training Centre (notified Nov. 10/deadline Dec. 15/simplified)EXTENSIONS AND OTHER CHANGES NoneFIRST-STAGE REVIEWS BY DEADLINE NOV 26 -- Aerospace group Airbus and French engine maker Safran to set up a joint venture (notified Oct. 8/deadline extended to Nov. 26 from Nov. 12 after the companies offered concessions)-- Private equity firm Blackstone to acquire Alliance Automotive from Weinberg Capital Partners (notified Oct. 22/deadline Nov. 26)NOV 28 -- U.S. medical device maker Medtronic Inc to acquire Irish peer Covidien (notified Oct. 10/deadline extended to Nov. 28 from Nov. 14 after Medtronic offered concessions)DEC 1 -- Mondelez International Inc and competitor D.E Master Blenders to merge their coffee businesses in new company called Jacobs Douwe Egberts (notified Oct. 27/deadline Dec. 1)-- Oil major BP to acquire jet fuel business Statoil Fuel and Retail Aviation (notified Oct. 27/deadline Dec. 1)DEC 2 -- U.S. car seat and electrical power systems maker Lear Corp to acquire car leather producer Eagle Ottawa LLC from private< investment firm Everett Smith Group Ltd (notified Oct. 28/deadline Dec. 2/simplified)DEC 4  -- French telecoms operator Orange to acquire Spanish provider Jazztel (notified Oct. 16/deadline extended to Dec. 4 from Nov. 20 after the Spanish competition authority asked to review the case/commitments submitted on Nov. 13)-- French insurer CNP Assurances S.A. to acquire 51 percent of Santander Insurance Life Ltd, Santander Insurance Europe Ltd and Santander Insurance Services Ireland Ltd from Spanish bank Santander's (notified Oct. 30/deadline Dec. 4/simplified)DEC 5 -- Malaysian palm oil producer Sime Darby Bhd to acquire New Britain Palm Oil Ltd (notified Oct. 31/deadline Dec. 5/simplified-- U.S. chemicals company Eastman Chemical Co to buy U.S. peer Taminco Corp (notified Oct. 31/deadline Dec. 5/simplified)-- Private equity firm Vista Equity Partners to buy U.S. business software maker Tibco Software Inc (notified Oct. 31/deadline Dec. 5/simplified)DEC 9 -- U.S. healthcare information company IMS Health to acquire certain businesses from French healthcare software provider Cegedim (notified Nov. 4/deadline Dec. 9)DEC 10 -- Santander Consumer Finance, part of Spanish bank Santander, and French car maker Peugeot S.A. (PSA) to set up a series of joint finance companies (notified Nov. 5/deadline Dec. 10)DEC 11 -- Mining groups Anglo American and BHP Billiton   to acquire joint control of manganese miner Samancor which is now solely controlled by BHP Billiton (notified Nov. 6/deadline Dec. 11/simplified)-- Oil giant Saudi Aramco to buy a minority stake in South Korean refiner S-Oil Corp from Hanjin Group  (notified Nov. 6/deadline Dec. 11/simplified) DEC 12 -- U.S. investment management firm Varder Partners to acquire 51 percent of Spanish bank Popular's credit card business (notified Nov. 14/deadline Dec. 12/simplified)-- Privately-held Czech airline Travel Service to take a 34 percent stake in national carrier Czech Airlines (notified Nov. 14/deadline Dec. 12DEC 15 -- France's Lafarge and Swiss peer Holcim  to merge (notified with commitments on Oct. 27/deadline Dec. 15)DEC 16 -- Private equity firms Blackstone and TPG to jointly acquire British mortgage lender Kensington Group plc (notified Nov. 11/deadline Dec. 16/simplified)DEC 17 -- Private equity firm 3i to acquire Diamond Holding GmbH from German jewellery retailer Group Christ Juweliere und Unrmacher Seit (notified Nov. 12/deadline Dec. 17/simplified)DEC 18 -- ReAssure to acquire HSBC's pensions manufacturing business (notified Nov. 13/deadline Dec. 18/simplified) DEC 19 -- Private equity firm EQT to acquire German engineering groups Siemens's hearing-aids business (notified Nov. 14/deadline Dec. 19/simplified)-- CCMP Capital to acquire 47 percent stake in PQ Corp from Carlyle Group (notified Nov. 14/deadline Dec. 19/simplified)-- Yanfeng Automotive Trim Systems, a subsidiary of China's biggest automaker SAIC Motor Corp., to acquire Johnson Control's  auto interiors business (notified Nov. 14/deadline Dec. 19/simplified)DEC 23 -- U.S. company IBM to take over German airline Lufthansa's information technology infrastructure services division and staff for 1 billion euros (notified Nov. 18/deadline Dec. 23)JAN 5 -- Norwegian telecoms firm Telenor to form joint venture with media company Schibsted, South Africa's Naspers and Singapore Press Holdings  (notified Nov. 19/deadline Jan. 5/simplified)JAN 6 -- Hong Kong conglomerate Cheung Kong to form joint venture with Mitsubishi Corp's leasing arm MC Aviation Partners (notified Nov. 20/deadline Jan. 6/simplified)FEB 5 -- Belgian telecoms group Telenet to acquire 50 percent stake in Belgian broadcasting company De Vijver Media (notified Aug. 18/deadline extended for the second time to March 5 from Feb. 5)MARCH 18 -- U.S. orthopaedic products maker Zimmer Holdings  to acquire rival Biomet Inc (notified Aug. 29/deadline extended for the third time to March 18 from March 11)MARCH 23 -- SOCAR, Azerbaijan's state energy company, to buy stakes in Greek natural gas grid operator DESFA from Greek natural gas utility DEPA (notified Oct. 1/deadline extended to March 23 from Nov. 5 after the Commission opened an in-depth probe)GUIDE TO EU MERGER PROCESS DEADLINES: The European Commission has 25 working days after a deal is  filed for a first-stage review. It may extend that by 10 working days to 35 working days, to consider either a company's proposed remedies or an EU member state's request to handle the case.Most mergers win approval but occasionally the Commission  opens a detailed second-stage investigation for up to 90  additional working days, which it may extend to 105 working  days.SIMPLIFIED: Under the simplified procedure, the Commission announces the clearance of uncontroversial first-stage mergers without giving any reason for its decision. Cases may be reclassified as non-simplified -- that is, ordinary first-stage reviews -- until they are approved.   (Editing by Foo Yun Chee)",2014-11-24,EMN,"Mon Nov 24, 2014 | 12:15pm EST",EU mergers and takeovers (Nov 24),http://www.reuters.com//article/eu-mergers-takeovers-idUSL6N0TE3HL20141124?type=companyNews
