,Article,Date,Symbol,Time,Title,Url
67,"   By Sonali Paul | MELBOURNE  MELBOURNE Newmont Mining Corp said on Thursday it is applying for an injunction to get workers back to its Batu Hijau mine as it fights a controversial tax on copper exports that led the company to halt shipments from Indonesia this year.The top U.S. gold miner stopped exporting copper concentrate from the mine on the Indonesian island of Sumbawa in January after the government introduced an escalating tax on metal concentrates in a push to force miners to build smelters in the Southeast Asian country.Newmont has taken a hard line against the tax by filing for international arbitration against the state, arguing that the export tax violates the company's investment agreement with the country.Newmont CEO Gary Goldberg told an industry function in Melbourne that the company would seek interim injunctive relief from the arbitration panel to reopen the mine and resume exports, ahead of the outcome of the arbitration.""We estimate it could take several months to obtain a ruling on interim relief and at least several weeks to ramp back up to full production if that relief is granted,"" Goldberg said in a speech.Newmont halted copper mining at Batu Hijau on June 5, saying its concentrate storage facilities were full. Despite the dispute, Newmont still considered Indonesia a ""great place"" to be working in the long term, Goldberg said. He stressed Newmont would continue to try to resolve the dispute through talks with the government while also pursuing the arbitration, but said he had no plans to visit Indonesia while he was in the Asia-Pacific region over the next week.""Arbitration isn't necessarily the way I'd like to resolve this. I'd rather resolve it through negotiation with either the current government or the incoming government, if it goes that long,"" Goldberg told reporters after his speech.Fellow miner Freeport-McMoRan Copper & Gold Inc, last month sealed a deal by agreeing to a much reduced export duty of 7.5 percent, and is set to resume copper concentrate exports.  While Newmont has said it was continuing talks with the government, an Indonesian official has previously denied any talks have taken place. ""I get their public position is important and I appreciate that, but we continue to look for ways that we can achieve a successful outcome for both of us there,"" Goldberg said.He said he had no plans yet to talk to Indonesia's president-elect Joko Widodo as he was just putting together his government.""But if they think that would be helpful, I'm always available,"" Goldberg said. Newmont was open to reviving talks on a possible merger with Barrick Gold Corp, the world's largest gold miner, Goldberg said, but said there have been no discussions since talks fell apart in April. ""Clearly we overlap and we work together. KCGM (in Australia) is an example. We've got a joint venture in Nevada. And I wouldn't close the door on it at all,"" Goldberg told reporters.Newmont had no plans to sell its remaining operations in Australia, after selling its Jundee mine earlier this year for $91 million, as its other mines, including Tanami in the Northern Territory, are performing well, he said. (Reporting by Sonali Paul; Editing by Richard Pullin)",2014-08-07,FCX,"Thu Aug 7, 2014 | 8:58am EDT",Newmont seeks injunction to reopen Indonesia copper mine: CEO,http://www.reuters.com//article/us-newmont-mining-indonesia-idUSKBN0G71GJ20140807?type=companyNews
68,"  (Adds more Freeport comments, background)JAKARTA Aug 7 Freeport-McMoRan Inc's  Indonesia unit will complete on Thursday loading for its first copper concentrate export shipment since new mining rules were introduced in the Southeast Asian nation, the unit's CEO said.Production at its Grasberg mining complex is already back to normal levels, Freeport Indonesia CEO Rozik Soetjipto said.Freeport clinched a deal with the Indonesian government late last month to end a six-month dispute over a controversial escalating tax on metal concentrates that halted all export at one of the world's biggest copper mines.Earlier this week, the Arizona-based firm said it would resume copper concentrate exports on Wednesday, with an initial shipment of 10,000 tonnes to China.""Concentrates that have been stockpiled for months (had) hardened, which slowed the loading process,"" Rozik said on Thursday. ""At 1500 today, the loading will be finished ... we still don't know if we can ship today or tomorrow morning, but it is supposed to be today.""Rozik did not give an estimate for concentrate exports for the year, and a company spokeswoman was unavailable for comment on Thursday. Mining ministry and central bank officials forecast that Freeport will now export between 750,000-756,000 tonnes of copper concentrate in the second half of 2014, worth $1.5 billion.The export tax was part of moves to force all miners to develop local mineral processing facilities, which would bring bigger returns for the government from Indonesia's mineral resources.But mining industry executives in Indonesia have balked at the idea of developing downstream industries and building smelters, citing a lack of power and infrastructure in remote areas where mines are often located. The escalating tax on metal concentrates kicked in at 25 percent and rises to 60 percent in the second half of 2016, before a total concentrate export ban in 2017.Under a revision of the tax, Freeport will now pay a 7.5 percent duty on its copper concentrate exports, but that rate falls as it spends on its smelter, hitting zero once investment in the project exceeds 30 percent of total cost.Freeport currently smelts some 30 to 40 percent of its output from its Grasberg mine at a copper smelter in Gresik, East Java. The firm is now looking at potential smelter construction sites in Gresik and Papua, with land acquisition costs likely to be around $100 million, said Rozik, adding that he hoped that ground-breaking would take place this year.Freeport previously worked on a feasibility study for a copper smelter with Indonesia's Aneka Tambang (Antam), and Rozik said the state-owned miner may help with permit applications and construction.Talks with possible partners for financing the smelter project are ongoing, he added, with both Antam and Newmont Mining Corp involved in the discussions.Newmont, which runs the Batu Hijau copper and gold mine, has adopted a tougher approach to resolving the export tax dispute by filing for international arbitration.Indonesian Mining Association Executive Director Syahrir Abubakar urged Newmont on Thursday to withdraw its arbitration case.   (Additional reporting by Yayat Supriatna and Adriama Nina Kusuma; Reporting by Wilda Asmarini; Writing by Michael Taylor; Editing by Muralikumar Anantharaman)",2014-08-07,FCX,"Thu Aug 7, 2014 | 4:27am EDT",UPDATE 1-Freeport Indonesia to resume exports as production back to normal,http://www.reuters.com//article/indonesia-freeport-exports-idUSL4N0QD2QB20140807?type=companyNews
69,"  * Injunction to reopen mine could take months to obtain* Newmont prefers to resolve Indonesia dispute through talks* CEO says open to reviving merger talks with Barrick   (Adds CEO comments on Indonesia, Barrick, Australia operations)By Sonali PaulMELBOURNE, Aug 7 Newmont Mining Corp  said on Thursday it is applying for an injunction to get workers back to its Batu Hijau mine as it fights a controversial tax on copper exports that led the company to halt shipments from Indonesia this year.The top U.S. gold miner stopped exporting copper concentrate from the mine on the Indonesian island of Sumbawa in January after the government introduced an escalating tax on metal concentrates in a push to force miners to build smelters in the Southeast Asian country.Newmont has taken a hard line against the tax by filing for international arbitration against the state, arguing that the export tax violates the company's investment agreement with the country.Newmont CEO Gary Goldberg told an industry function in Melbourne that the company would seek interim injunctive relief from the arbitration panel to reopen the mine and resume exports, ahead of the outcome of the arbitration. ""We estimate it could take several months to obtain a ruling on interim relief and at least several weeks to ramp back up to full production if that relief is granted,"" Goldberg said in a speech.Newmont halted copper mining at Batu Hijau on June 5, saying its concentrate storage facilities were full.Despite the dispute, Newmont still considered Indonesia a ""great place"" to be working in the long term, Goldberg said.He stressed Newmont would continue to try to resolve the dispute through talks with the government while also pursuing the arbitration, but said he had no plans to visit Indonesia while he was in the Asia-Pacific region over the next week. ""Arbitration isn't necessarily the way I'd like to resolve this. I'd rather resolve it through negotiation with either the current government or the incoming government, if it goes that long,"" Goldberg told reporters after his speech.Fellow miner Freeport-McMoRan Copper & Gold Inc, last month sealed a deal by agreeing to a much reduced export duty of 7.5 percent, and is set to resume copper concentrate exports.While Newmont has said it was continuing talks with the government, an Indonesian official has previously denied any talks have taken place. ""I get their public position is important and I appreciate that, but we continue to look for ways that we can achieve a successful outcome for both of us there,"" Goldberg said.He said he had no plans yet to talk to Indonesia's president-elect Joko Widodo as he was just putting together his government.""But if they think that would be helpful, I'm always available,"" Goldberg said.Newmont was open to reviving talks on a possible merger with Barrick Gold Corp, the world's largest gold miner, Goldberg said, but said there have been no discussions since talks fell apart in April.""Clearly we overlap and we work together. KCGM (in Australia) is an example. We've got a joint venture in Nevada. And I wouldn't close the door on it at all,"" Goldberg told reporters.Newmont had no plans to sell its remaining operations in Australia, after selling its Jundee mine earlier this year for $91 million, as its other mines, including Tanami in the Northern Territory, are performing well, he said.(Reporting by Sonali Paul; Editing by Richard Pullin)",2014-08-07,FCX,"Thu Aug 7, 2014 | 1:59am EDT",UPDATE 2-Newmont seeks injunction to reopen Indonesia copper mine - CEO,http://www.reuters.com//article/newmont-mining-indonesia-idUSL4N0QD0ZL20140807?type=companyNews
70,"  MELBOURNE Newmont Mining Corp (NEM.N) said on Thursday it is applying for an injunction to get workers back to its Batu Hijau mine as it fights a controversial tax on copper exports that led the company to halt shipments from Indonesia this year.The top U.S. gold miner stopped exporting copper concentrate from the mine on the Indonesian island of Sumbawa in January after the government introduced an escalating tax on metal concentrates in a push to force miners to build smelters in the Southeast Asian country.Newmont has taken a hard line against the tax by filing for international arbitration against the state, arguing that the export tax violates the company's investment agreement with the country.Newmont CEO Gary Goldberg told an industry function in Melbourne that the company would ""seek interim injunctive relief to get our people back to work"", although he said it could take several months to gain such relief. It would then take ""at least several weeks to ramp back up to full production if that relief is granted,"" Goldberg said in a speech.Despite the dispute, Indonesia remained a ""great place"" to be working in the long term, Goldberg said. In addition to pursuing arbitration, Newmont says it has also been negotiating with the government to try to resolve the impasse. An Indonesian official has previously denied any talks have taken place. Fellow miner Freeport-McMoRan Copper & Gold Inc (FCX.N), last month sealed a deal by agreeing to a much reduced export duty of 7.5 percent, and is set to resume copper concentrate exports. Newmont halted copper mining at Batu Hijau on June 5, saying its concentrate storage facilities were full.  (Reporting by Sonali Paul; Editing by Muralikumar Anantharaman and Richard Pullin)",2014-08-07,FCX,"Thu Aug 7, 2014 | 12:19am EDT",Newmont seeks injunction for return of Indonesian copper mine workers: CEO,http://www.reuters.com//article/us-newmont-mining-indonesia-idUSKBN0G709Y20140807?type=companyNews
71,"  (Refiles to remove typo in headline and first paragraph)JAKARTA Aug 8 Freeport-McMoRan Inc's  Indonesia unit has completed its first copper concentrate export shipment since new mining rules were introduced in Indonesia, a spokeswoman said on Friday, signalling the end of a seven-month tax spat with the government. Freeport clinched a deal with the Indonesian government late last month to end a dispute over a controversial escalating tax on metal concentrates that halted all export at one of the world's biggest copper mines. Company spokeswoman Daisy Primayanti said by text that the export copper concentrate shipment had been completed late Thursday. Earlier this week, the Arizona-based firm said it would resume copper concentrate exports with an initial shipment of 10,000 tonnes to China.     (Reporting by Michael Taylor; Editing by Richard Pullin)",2014-08-08,FCX,"Fri Aug 8, 2014 | 12:56am EDT",REFILE-Freeport Indonesia says copper exports resumed as tax dispute ends,http://www.reuters.com//article/indonesia-freeport-exports-idUSL4N0QC2H020140808?type=companyNews
72,"   By Kristen Hays | FREEPORT  FREEPORT Texas Aug 13 Independent refiner Phillips 66 said on Wednesday it is evaluating the export of super-light crude oil known as condensate, after two industry peers received U.S. government approval to ship it overseas after minimal processing.The company declined to say if it has sought formal permission to export condensate from the U.S. Department of Commerce, which is tasked with interpreting exceptions to a decades-old ban on crude exports.""We're evaluating the process and seeking a better understanding,"" Chris Chandler, Phillips 66's head of natural gas liquids (NGLs) said. ""That process is still a little unclear to us.""He spoke before the groundbreaking for the construction of a 100,000 barrel per day (bpd) fractionation plant that strips NGLs from gas and a liquified petroleum gas (LPG) export facility that will require $3 billion in investments.The facility in Freeport, Texas will sit near the Gulf Coast and is close to the company's 247,000 bpd refinery in Sweeny, which has a link to Kinder Morgan's Crude and Condensate pipeline, a 300,000 bpd line that moves crude from the Eagle Ford fields to Houston. The terminal after start up in 2016 will provide 4.4 million barrels per month of export capacity for LPGs, which include butane and propane.Asked if the export facility could potentially export condensate that has been minimally processed, Chandler said: ""This Freeport facility has a lot of expansion possibilities. It's close to the Gulf of Mexico, three miles from open water. We have the capability of doing a lot more here than we do currently.""Chief Executive Greg Garland, while cautioning further plans are still being weighed, said the company could end up spending more on energy infrastructure on the Gulf Coast. ""We're thinking of $10 billion in projects right here on the Gulf Coast,"" he said.Demand is growing for new facilities to handle surging output of oil and gas from the U.S. shale boom. That output has prompted a rise in exports of refined products and led to calls for a loosening of the ban on crude exports, especially because local refiners have limited capacity to run lighter crudes coming out of shale fields.""In the not too distant future we need to export crude. We are long light sweet crude in Texas,"" Texas Railroad Commissioner Barry Smitherman, the state's top energy regulator, said.In June, Commerce told Pioneer Natural Resources and Enterprise Product Partners they could export stabilized condensate as a refined product without a special license, which is needed to export unprocessed domestic crude.U.S. law has long defined processed oil as having passed through distillation towers, key pieces of refinery equipment that turn crude oil into finished products.But the Commerce Department said equipment known as stabilizers, traditionally used to treat crude so it meets pipeline specifications, could also be used to comply with the refining regulation.       (Reporting By Kristen Hays; Editing by Terry Wade and Andrew Hay)",2014-08-13,FCX,"Wed Aug 13, 2014 | 12:40pm EDT","Phillips 66 says evaluating condensate export process, seeking clarity",http://www.reuters.com//article/phillips66-exports-terminal-idUSL2N0QI2GH20140813?type=companyNews
73,"  (Repeats earlier story with no change in text)By Randy Fabi, Fergus Jensen and Michael TaylorJAKARTA Aug 24 As negotiations to resolve an increasingly bitter dispute over Indonesian mining rules teetered on the brink of collapse, the chairman of Freeport-McMoRan Inc James ""Jim Bob"" Moffett flew to Jakarta for last-ditch talks.Indonesia's chief economics minister, Chairul Tanjung, said he had got to a point where he felt only talking directly to the 76-year-old U.S. mining legend might break a deadlock in the six-month row, which had already cost Southeast Asia's top economy more than $1 billion and put thousands of jobs at risk.In less than two hours the two men had reached an agreement, setting the stage to resume exports and restore badly needed government revenue to the world's fourth most populous nation.""I just convinced him that this was the maximum the government can give,"" Tanjung said in an interview. ""He believed me, I believed him and we shook hands. Very simple.""Tanjung, one of Indonesia's richest businessmen, was appointed minister in May and made reaching a deal to get mining exports going again a priority to revive an economy suffering its sharpest slowdown since the global financial crisis.But a looming presidential election had made it even harder to reach a politically unpopular compromise with foreign miners.Aside from any chemistry between the two successful businessmen, the breakthrough came because Moffett had taken a more flexible approach, said Tanjung.The dispute with Freeport had centred on its refusal to pay an escalating mineral concentrate export tax and its bid to extend its mining contract. The meeting was only attended by a small number of Indonesian officials and Freeport, and according to Tanjung the solution was to focus on what the two could agree on to get exports restarted and set other issues aside for now.Freeport agreed to a $115 million downpayment for a smelter, to pay higher royalties and divest more of its Indonesian unit.Indonesia in return substantially cut the concentrate export tax for Freeport and other miners building smelters.Moffett is a likeable and larger-than-life Louisiana businessman, known for his Elvis impersonations during lighter moments, but also a shrewd deal maker.Starting his career as a wildcat prospector in Louisiana, Moffett founded McMoRan Oil & Gas Co with two of his partners in 1969 and put together the merger with Freeport 12 years later.With a 47-year history in Indonesia, Freeport's fortunes were transformed by the discovery of the Grasberg mine in Papua, one of the world's biggest deposits of gold and copper.Helped by Moffett's ties to late autocratic President Suharto, Freeport won the right in 1988 to mine Grasberg, which has been a lightning rod for grievances over its impact on the environment, security arrangements and revenue sharing.The recent talks did not touch on Freeport's controversial links to the Suharto family or environmental issues, said Sukhyar, director general for coal and minerals at the ministry, who played a role in the negotiations. HIGH STAKES In January, Indonesia introduced a mineral ore export ban and the escalating tax on metal concentrate shipments in a bid to force miners to process raw materials to lift their value.But the tough measures in some cases backfired as miners such as Freeport and Newmont Mining Corp said the rules breached their contracts and exports stopped.The stakes were high on both sides.The Grasberg complex in Papua provided around a fifth of Freeport's global revenue last year.In Indonesia, the company employs 24,000 including contractors, and is one of the country's largest tax payers.Freeport believed the new mining rules, particularly the  export tax, violated its contract. The company refused to pay the tax and invest in a copper smelter unless the government provided assurances it would be allowed to continue operating after its contract expires in 2021.Freeport wanted certainty to spend more than $15 billion to build what would be the world's biggest underground mine, while the government said it could not renegotiate until 2019, two years before the contract expired. Freeport Indonesia CEO Rozik Soetjipto said the breakthrough came when the new minister arrived with a business background.""He understood that it is impossible for a company to continue such huge investments if there are no legal guarantees for the long term continuation and fiscal certainty.""A trained dentist, Tanjung, 52, was ranked as Indonesia's fifth-richest man by Forbes with a net wealth of $4 billion. His company CT Corp now operates two of the country's top five TV stations and has retail and banking interests.DENGUE FEVER Freeport had sent its chief executive, Richard Adkerson, to Jakarta in June to focus on negotiating a deal.Despite weeks of talks, which included meeting at a Jakarta hospital after a senior negotiator fell ill with dengue fever, the two sides remained deadlocked.""Adkerson was here for a month. He was running from pillar to post and nothing was happening,"" said a senior industry official with knowledge of the negotiations, who declined to be named due to the sensitivity of the issue.According to the minister, Adkerson, an accountant by training, wanted to stick very closely to the terms of Freeport's contract.""He wanted to continue their Contract of Work. He wanted to keep paying the same royalties - the old rate,"" Tanjung said. Freeport's Soetjipto said Adkerson's contribution in reaching a deal was ""very important"".Requests for comment from Moffett and Adkerson sought via a spokesman at Freeport's head office in Phoenix were declined.An emailed statement said: ""the Company and its executives have sought to engage in constructive discussions and to maintain good relations with Indonesian officials including the President, Ministers, Parliamentary representatives, and local officials of each respective administration.""""BIGGER PICTURE"" By the end of June, talks were at a breaking point and some were questioning whether Freeport had a future in Indonesia.""I told them, 'If they want to continue business here I don't want to discuss it with Adkerson any more,'"" Tanjung said. ""I want to talk with the chairman.""At the same time, negotiations with Indonesia's second-biggest copper producer Newmont also reached an impasse and the U.S. miner decided to file for international arbitration.The move soured relations and the government threatened to terminate Newmont's contract if the company did not withdraw its legal challenge.Freeport chose a different path and decided instead to keep negotiating, with Moffett flying to Jakarta.At the private meeting in Jakarta in early July, Tanjung and Moffett agreed to leave the most contentious issues over contract renegotiations to the next government and instead focus on getting exports restarted.Tanjung told Reuters he felt he needed to bring Moffett in because ""as a chairman you can see a bigger picture.""A memorandum of understanding that was initially 90-pages long was whittled down to just 10 pages, the bare bones of what the two sides could agree on, said an industry official with knowledge of the matter, who declined to be named.The government also agreed to a framework valid for at least six months that could be used to renegotiate the contract under the next administration.The final step left was for the cabinet and President Susilo Bambang Yudhoyono to approve the MOU, though the unfolding presidential election delayed ratification and there were concerns the deal could still fall through.But finally drawing a line under the near seven-month dispute, a shipment of 10,000 tonnes of copper concentrate left Indonesia for China on Aug. 8.   (Additional reporting by Wilda Asmarini, Gayatri Suroyo and Adriana Nina Kusuma and Dennys Kapa in JAKARTA and Allison Martell in TORONTO; Editing by Ed Davies)",2014-08-24,FCX,"Sun Aug 24, 2014 | 5:00pm EDT","RPT-INSIGHT -Behind Indonesia mining deal, newly minted minister and U.S. mining legend",http://www.reuters.com//article/indonesia-mining-idUSL4N0QS2NV20140824?type=companyNews
