,Article,Date,Symbol,Time,Title,Url
261,"  (Adds comment from Freeport in 7th paragraph)By Wilda Asmarini and Bernadette Christina MuntheJAKARTA Jan 28 Indonesia's government and Freeport McMoRan Inc on Thursday failed to reach a deal on extending the U.S. mining giant's six-month export permit, potentially halting shipments from the country's massive Grasberg copper and gold mine.An export stoppage would deal a blow to Freeport's profits and deny the Indonesian government desperately needed revenue from one of its biggest taxpayers. It could also buoy global copper prices, which have slipped 3 percent so far this year on worries about oversupply.Freeport's six-month export permit for its Indonesian unit expired on Thursday and it was unclear how soon a new one would be issued as the two sides have yet to resolve a government demand that the U.S. firm first pay a $530 million deposit.""It's done for today. For the next meeting with Freeport, there is no schedule so far,"" Bambang Gatot Ariyono, the mines ministry's director general of coal and minerals, told reporters. ""It's no problem if Freeport doesn't export tomorrow.""Energy Minister Sudirman Said earlier this week had said he was certain the government would approve the export permit and was open to negotiations with Freeport on the $530 million deposit. Freeport said in a statement it was still engaged in discussions with the Indonesian government and was confident Jakarta would issue the license.Indonesia wants the deposit as a guarantee that the Phoenix, Arizona-based company will complete construction of another local smelter. The amount would add to an estimated $80 million that Freeport set aside in July 2015 to obtain its current export permit.Said said Freeport must offer an alternative if does not want to provide the deposit to demonstrate its commitment to expanding Indonesia's smelter capacity. Freeport CEO Richard Adkerson said late on Tuesday the government's demand for a smelter deposit was ""inconsistent"" with an agreement reached between the two sides in mid-2014.According to that agreement, Freeport must sell the government a greater share of the Grasberg copper and gold mine, located in the province of Papua, and invest in domestic processing to win an extension of its mining contract beyond 2021.Usually, Freeport Indonesia produces about 220,000 tonnes of copper ore per day. About one-third usually goes to its domestic smelter at Gresik.A prolonged interruption to the mine would affect about 24,000 workers at Grasberg, potentially leading to unrest in a region where Indonesia's government is trying to increase economic activity.       (Reporting by Wilda Asmarini; With additional reporting by Susan Taylor in Toronto; Editing by Himani Sarkar, David Evans and Paul Simao)",2016-01-28,FCX,"Thu Jan 28, 2016 | 1:22pm EST","UPDATE 2-Indonesia, Freeport fail to reach deal over copper export permit",http://www.reuters.com//article/indonesia-freeport-idUSL3N15C5P6?type=companyNews
262,"   By Euan Rocha | TORONTO  TORONTO The Canadian arm of mining giant BHP Billiton (BHP.AX) has signed a letter of intent to help fund exploration at Aston Bay Holdings Ltd's (BAY.V) Storm copper project, Aston Bay said on Thursday. Under terms of the preliminary deal, BHP could earn a 75 percent interest in Storm, located in Canada's far north territory of Nunavut, if it spends a minimum of C$40 million on exploration over the next few years. Vancouver-based Aston Bay, a small exploration company, will have no required exploration expenses for four years from the date a definitive agreement is signed. The two sides expect to finalize a deal in the second quarter, said Aston Bay. A definitive deal would be a huge boost for Aston Bay, which like many of its small peers has seen its share price pummeled amid the rout in commodity prices. The price of copper CMCU3 continues to languish around levels not seen since the tail end of the financial crisis in 2009. Such earn-in agreements allow mining majors to secure stakes in promising early-stage projects for relatively limited up-front risk. They were fairly common when metal prices soared through much of the last decade, but have become rare in the last few years for both base metal and precious metal assets.The latest move by BHP comes close on the heels of similar moves by rival Rio Tinto (RIO.L)(RIO.AX), which recently inked similar deals involving the copper assets of two Canadian juniors. The developments indicate the majors are beginning to be concerned about their long-term copper project pipeline as supply-demand fundamentals in the commodity remain fairly tight despite the slide in the price of copper.    In November, Avala Resources Ltd AVZ.V announced an earn-in agreement with Rio on its Lenovac project, located in Serbia, coming days after Rio signed a similar deal with Reservoir Minerals Inc RMC.V on its Timok Magmatic Complex in Serbia.    Both assets are located near the promising Cukaru Peki deposit in Serbia, part of a joint venture Reservoir has with Freeport-McMoRan Inc (FCX.N). That deposit has shown promising results, leading to heightened interest in the region. (Editing by Jeffrey Benkoe)",2016-01-28,FCX,"Thu Jan 28, 2016 | 2:41pm EST",BHP Billiton set to fund Aston Bay's Storm copper project,http://www.reuters.com//article/bhp-billiton-ltd-aston-bay-jointventure-idUSL2N15C16Y?type=companyNews
263,"  JAKARTA Jan 28 Indonesia's government and Freeport McMoRan Inc are meeting on Thursday in last-ditch talks to prevent a halt in exports of copper concentrate from the U.S. mining giant's massive Grasberg mine in the province of Papua.A halt in exports would deal a blow to Freeport's profits and deny the Indonesian government desperately needed revenue from one of its biggest taxpayers. A stoppage would also buoy global copper prices that have slipped 3 percent so far this year on worries about oversupply.Freeport's six-month export permit for its Indonesian unit expires on Thursday but it is still unclear how soon a new one will be issued as the two sides have yet to resolve a government demand that the U.S. firm first pay a $530-million deposit.""There has been no information whatsoever from Freeport that states whether they are able to pay or not,"" Mohammad Hidayat, the mine's ministry director of minerals, told reporters on Thursday.""If an export permit extension is not issued today, that means that starting from the 29th they cannot export any more."" Energy Minister Sudirman Said said he was certain the government would approve the export permit and was open to negotiations with Freeport on the $530 million deposit.""They are trying hard to fulfil requirements but asked us to consider the global commodities condition and their financial condition. Let's seek a solution together,"" Said said. Freeport officials were not immediately available to comment on Thursday. The company has previously said it was confident it would obtain a new export license.Jakarta wants the half-a-billion dollar deposit as a guarantee that the Phoenix, Arizona-based company will complete construction of another local smelter. The amount would add to an estimated $80 million that Freeport set aside in July 2015 to obtain its current export permit. Said said if Freeport does not want to provide the deposit, the company must offer an alternative to demonstrate their commitment to expanding Indonesia's smelter capacity.Freeport CEO Richard Adkerson said late Tuesday the government's demand for a smelter deposit was ""inconsistent"" with an agreement reached between the two sides in mid-2014.According to those agreements, Freeport must sell the government a greater share of the Grasberg copper and gold mine and invest in domestic processing to win an extension of its mining contract beyond 2021.    (Reporting by Wilda Asmarini; Editing by Himani Sarkar)",2016-01-28,FCX,"Thu Jan 28, 2016 | 12:05am EST","Indonesia, Freeport in last-ditch talks to prevent halt in copper exports",http://www.reuters.com//article/indonesia-freeport-idUSL3N15C23T?type=companyNews
264,"   By Bernadette Christina Munthe and Fergus Jensen | JAKARTA  JAKARTA Freeport McMoRan Inc on Friday lost its right to export copper concentrate, valued at more than $1 billion, from one of the world's biggest mines as talks with Indonesia's government remained deadlocked over payment for a new metal smelter.Freeport's six-month licence to export concentrate expired on Thursday and it was unclear how soon a new one would be issued as the two sides have yet to resolve a government demand that the U.S. firm first pay a $530 million deposit.    ""Without an export permit, there can be no exports. The exporter knows that,"" Didi Sumedi, Indonesia's director of mining and industrial products told Reuters via text message.    However, it was not clear if exports had actually stopped at Freeport's Grasberg mine in the province of Papua, one of the world's largest copper and gold mines. Asked if overseas shipments had ceased, a Freeport spokesman said ""everything is normal"", without elaborating.Last year, Freeport sold 744 million pounds of copper concentrate from Grasberg, valued at around $1.73 billion, according to the company's fourth-quarter financial results. A prolonged stoppage in exports would hit Freeport's profits and deny the Indonesian government desperately needed revenue from one of its biggest taxpayers. It could also buoy global copper prices, which have slipped more than 3 percent so far this year on worries about oversupply.        But in the short-term, traders do not expect any major market reaction.""If it lasts a couple of months, sure we may see an impact. But with the new mines and mine expansions this year, the market is fairly well covered at the minute,"" said a concentrates trader in Asia. Indonesia has said it was open to negotiations with Freeport on the $530-million deposit and that if the company did not want to pay, it must provide an alternative to demonstrate its commitment to expanding the country's smelter capacity.Indonesia wants the deposit as a guarantee that the Phoenix, Arizona-based company will complete construction of another local smelter. The amount would add to an estimated $80 million that Freeport set aside in July 2015 to obtain its current export permit.Freeport CEO Richard Adkerson said late on Tuesday the government's demand for a smelter deposit was ""inconsistent"" with an agreement reached between the two sides in mid-2014. According to that agreement, Freeport must sell the government a greater share of the Grasberg mine, and invest in domestic processing to win an extension of its mining contract beyond 2021.The U.S. mining giant wants to invest $18 billion to expand its operations at Grasberg, but is seeking government assurances first that it will get a contract extension.Freeport's long-held desire to continue mining in Indonesia beyond 2021 has been beset by controversy, including cabinet infighting, resignations and a major political scandal that led to the resignation of the parliamentary speaker. (Additional reporting by Melanie Burton in Melbourne, writing by Randy Fabi; Editing by Himani Sarkar and Joseph Radford)",2016-01-29,FCX,"Fri Jan 29, 2016 | 1:27am EST","Freeport loses right to export from Indonesia copper mine, talks ongoing",http://www.reuters.com//article/us-indonesia-freeport-idUSKCN0V60BB?type=companyNews
265,"   By Bernadette Christina Munthe and Fergus Jensen | JAKARTA  JAKARTA Freeport McMoRan Inc on Friday lost its right to export copper concentrate, valued at more than $1 billion, from one of the world's biggest mines as talks with Indonesia's government remained deadlocked over payment for a new metal smelter.Freeport's six-month licence to export concentrate expired on Thursday and it was unclear how soon a new one would be issued as the two sides have yet to resolve a government demand that the U.S. firm first pay a $530 million deposit.    ""Without an export permit, there can be no exports. The exporter knows that,"" Didi Sumedi, Indonesia's director of mining and industrial products told Reuters via text message.    However, it was not clear if exports had actually stopped at Freeport's Grasberg mine in the province of Papua, one of the world's largest copper and gold mines. Asked if overseas shipments had ceased, a Freeport spokesman said ""everything is normal"", without elaborating.Last year, Freeport sold 744 million pounds of copper concentrate from Grasberg, valued at around $1.73 billion, according to the company's fourth-quarter financial results. A prolonged stoppage in exports would hit Freeport's profits and deny the Indonesian government desperately needed revenue from one of its biggest taxpayers. It could also buoy global copper prices, which have slipped more than 3 percent so far this year on worries about oversupply.        But in the short-term, traders do not expect any major market reaction.""If it lasts a couple of months, sure we may see an impact. But with the new mines and mine expansions this year, the market is fairly well covered at the minute,"" said a concentrates trader in Asia. Indonesia has said it was open to negotiations with Freeport on the $530-million deposit and that if the company did not want to pay, it must provide an alternative to demonstrate its commitment to expanding the country's smelter capacity.Indonesia wants the deposit as a guarantee that the Phoenix, Arizona-based company will complete construction of another local smelter. The amount would add to an estimated $80 million that Freeport set aside in July 2015 to obtain its current export permit.Freeport CEO Richard Adkerson said late on Tuesday the government's demand for a smelter deposit was ""inconsistent"" with an agreement reached between the two sides in mid-2014. According to that agreement, Freeport must sell the government a greater share of the Grasberg mine, and invest in domestic processing to win an extension of its mining contract beyond 2021.The U.S. mining giant wants to invest $18 billion to expand its operations at Grasberg, but is seeking government assurances first that it will get a contract extension.Freeport's long-held desire to continue mining in Indonesia beyond 2021 has been beset by controversy, including cabinet infighting, resignations and a major political scandal that led to the resignation of the parliamentary speaker. (Additional reporting by Melanie Burton in Melbourne, writing by Randy Fabi; Editing by Himani Sarkar and Joseph Radford)",2016-01-29,FCX,"Fri Jan 29, 2016 | 1:27am EST","UPDATE 3-Freeport loses right to export from Indonesia copper mine, talks ongoing",http://www.reuters.com//article/indonesia-freeport-exports-idUSL3N15D1BB?type=companyNews
266,"  TOKYO Feb 1 Pan Pacific Copper (PPC), Japan's biggest copper smelter, and Freeport have set 2016 treatment and refining charges 9 percent lower than last year's fees, as global mines cut output due to slumping prices.PPC and Freemont have agreed treatment and refining charges (TC/RCs) for this year at $97.35 a tonne and 9.735 cents a pound, a PPC spokesman said on Monday.The outcome is in line with an agreement by China's top integrated copper producer, Jiangxi Copper  , and Chilean miner Antofagasta Minerals over 2016 TC/RCs. TC/RCs are paid by miners to smelters to refine concentrate into metal and are a key part of the global copper industry's earnings.  (Reporting by Yuka Obayashi; Editing by Dale Hudson)",2016-02-01,FCX,"Mon Feb 1, 2016 | 10:05am EST","Japan's Pan Pacific, Freeport agree 2016 TC/RCs at $97.35/T, 9.735 cents/lb",http://www.reuters.com//article/nisshin-nipponsteel-idUSL3N15G4QE?type=companyNews
267,"  JAKARTA Freeport McMoRan Inc has asked Indonesia to reduce a $530 million smelter bond the local unit of the U.S. copper mining giant must set aside before receiving an extension of its export permit, Indonesia's mining minister said on Tuesday.Freeport's 6-month copper concentrate export permit expired last week amid a deadlock over the bond, which Indonesia has requested as a guarantee that the miner will complete construction of another local smelter.""They have appealed to ask whether we can postpone it or give them a discount, but we asked them to show their commitment in another equivalent way,"" Energy and Mines Minister Sudirman Said told reporters, referring to an exchange of letters with the Phoenix, Arizona-based company.Freeport, which runs one of the world's biggest copper mines in Indonesia's easternmost province of Papua, usually produces about 220,000 tonnes of copper ore a day. A prolonged stoppage in shipments would hit the company's profits and deny Jakarta desperately needed revenue from one of its biggest taxpayers. Indonesia wants the deposit as a guarantee that the mining giant will complete construction of another local smelter. The amount would add to an estimated $80 million Freeport set aside in July 2015 to obtain its just-expired export permit.Freeport Indonesia could not be reached for comment on Tuesday. The U.S. miner wants to invest $18 billion to expand its operations at Grasberg, but is seeking government assurances that its right to mine at Grasberg will be extended.      Its current contract - which gives it the right to work and develop the Grasberg complex - expires in 2021. By Indonesian law, this contract cannot be extended until 2019 at the soonest.A memorandum of understanding agreed in July 2014 between the government and Freeport, which ended a seven-month export stoppage and outlined a timetable for a contract extension and smelter construction, had now expired, Said said. An agreement that would maintain operations and investment preparations ahead of contract renewal talks in 2019, was a way to resolve the current problems, he said.      (Reporting by Wilda Asmarini; Writing by Michael Taylor and Fergus Jensen; Editing by Tom Hogue)",2016-02-02,FCX,"Tue Feb 2, 2016 | 2:30am EST",Freeport asks Indonesia to cut or postpone $530 mln smelter bond: mining minister,http://www.reuters.com//article/us-indonesia-freeport-idUSKCN0VB0AM?type=companyNews
268,"  JAKARTA Freeport McMoRan Inc has asked Indonesia to reduce a $530 million smelter bond the local unit of the U.S. copper mining giant must set aside before receiving an extension of its export permit, Indonesia's mining minister said on Tuesday.Freeport's 6-month copper concentrate export permit expired last week amid a deadlock over the bond, which Indonesia has requested as a guarantee that the miner will complete construction of another local smelter.""They have appealed to ask whether we can postpone it or give them a discount, but we asked them to show their commitment in another equivalent way,"" Energy and Mines Minister Sudirman Said told reporters, referring to an exchange of letters with the Phoenix, Arizona-based company.Freeport, which runs one of the world's biggest copper mines in Indonesia's easternmost province of Papua, usually produces about 220,000 tonnes of copper ore a day. A prolonged stoppage in shipments would hit the company's profits and deny Jakarta desperately needed revenue from one of its biggest taxpayers. Indonesia wants the deposit as a guarantee that the mining giant will complete construction of another local smelter. The amount would add to an estimated $80 million Freeport set aside in July 2015 to obtain its just-expired export permit.Freeport Indonesia could not be reached for comment on Tuesday. The U.S. miner wants to invest $18 billion to expand its operations at Grasberg, but is seeking government assurances that its right to mine at Grasberg will be extended.      Its current contract - which gives it the right to work and develop the Grasberg complex - expires in 2021. By Indonesian law, this contract cannot be extended until 2019 at the soonest.A memorandum of understanding agreed in July 2014 between the government and Freeport, which ended a seven-month export stoppage and outlined a timetable for a contract extension and smelter construction, had now expired, Said said. An agreement that would maintain operations and investment preparations ahead of contract renewal talks in 2019, was a way to resolve the current problems, he said.      (Reporting by Wilda Asmarini; Writing by Michael Taylor and Fergus Jensen; Editing by Tom Hogue)",2016-02-02,FCX,"Tue Feb 2, 2016 | 2:30am EST",UPDATE 1-Freeport asks Indonesia to cut or postpone $530 mln smelter bond -mining minister,http://www.reuters.com//article/indonesia-freeport-idUSL3N15H29H?type=companyNews
269,"  * ShFE copper stocks surge 13.8 pct, zinc stocks up 6.6 pct* U.S. unemployment rate hits lowest in 8 years* Mixed jobs data keeps Fed rate hike talk alive* Tin bucks weaker trend and rises 1 pct   (Updates with closing prices)By Eric OnstadLONDON, Feb 5 Copper dropped on Friday after U.S. jobs data kept alive speculation about a U.S. rate hike later this year, boosting the dollar ahead of the Lunar New Year holiday in China.The dollar index bounced back from a week of heavy losses after a mixed U.S. jobs report, which included a fall in the unemployment rate to 4.9 percent, the lowest since February 2008,A stronger dollar makes commodities priced in the U.S. currency more expensive for buyers outside the United States.""That dollar weakness earlier this week really buoyed the metals complex and now some of that is coming off. There's a bit of profit taking, closing out these long positions ahead of the weekend and the Chinese new year,"" said analyst Kash Kamal at broker Sucden Financial.Three-month copper on the London Metal Exchange  closed down 1.2 percent at $4,630 a tonne, erasing similar gains in the previous session when prices hit the highest since Jan. 4 at $4,720 a tonne.Copper has rebounded 7 percent since hitting 6-1/2-year lows in mid-January.Also weighing on prices ahead of the holiday was a surge in weekly inventories of copper, zinc and lead in Shanghai Futures Exchange (ShFE) warehouses. Copper stocks jumped 29,317 tonnes, or 13.8 percent, zinc stocks rose 6.6 percent, while lead stocks more than doubled, reversing the fall from the prior week.Copper and other base metals, however, are likely to bounce back when the Chinese return from holidays, said Eugen Weinberg, head of commodity research at Commerzbank.Friday was the last trading session on ShFE before the holidays. It will resume on Monday Feb. 15.""I wouldn't be surprised to see this recovery to continue going forward. The fundamental data will support the recovery because we're likely to have problems on the production side and on the other hand, demand seems to be a much better shape than many feared.""Given price-related cutbacks and shutdowns announced in the past six months, consultancy CRU anticipates a loss of 610,000 tonnes of contained copper from mine production this year. LME zinc, the best performer on the exchange so far this year, shed 2.2 percent to finish at $1,677 a tonne, but still gained over 3 percent during the week.Aluminium fell 2.3 percent to end at $1,500, lead  gave up 1.8 percent to close at $1,770, nickel  tumbled 4.4 percent to $8,160 while tin bucked the weaker trend and added 1 percent to reach $15,150.PRICES Three month LME copperMost active ShFE copper Three month LME aluminiumMost active ShFE aluminiumThree month LME zincMost active ShFE zincThree month LME leadMost active ShFE leadThree month LME nickelMost active ShFE nickelThree month LME tinMost active ShFE tin               (Additional reporting by Melanie Burton in Melbourne; Editing by David Clarke and Mark Potter)",2016-02-05,FCX,"Fri Feb 5, 2016 | 12:15pm EST",METALS--Copper slides after U.S. jobs data pushes up dollar,http://www.reuters.com//article/global-metals-idUSL8N15K3AO?type=companyNews
