,Article,Date,Symbol,Time,Title,Url
143,"  * Cash copper seen averaging $6,371.70/T in 2015 -poll* LME copper stocks rise by 6,450 tonnes* Coming up: FOMC statement at 1900 GMT   (Updates with official prices)By Harpreet BhalLONDON, Jan 28 Copper rose on Wednesday, rebounding further from 5-1/2-year lows as the dollar eased off highs and traders took the opportunity to buy at still low prices before the Federal Reserve's meeting ends.Three-month copper on the London Metal Exchange (LME) traded at $5,455 a tonne, up 0.6 percent, to recover from a 3 percent drop in the previous session.Copper is still down 13 percent so far this month, extending a 20 percent loss registered over 2013 and 2014. It hit a 5-1/2-year low of $5,339.50 a tonne on Monday.The U.S. central bank is expected to signal it remains on track to begin raising interest rates later this year.Fed policymakers will likely restate their ""patient"" approach to raising rates, while also voicing faith that the economy will continue to pick up.The dollar was steady, easing off earlier highs, before the Fed statement. A weak dollar makes commodities priced in the currency cheaper for holders of other currencies.""If the Fed does emphasise the word ""patience"" then it could take some more wind out of the dollar rally which is a positive sign for copper,"" said Naeem Aslam, chief market analyst at Ava Trade. ""(However)... we do believe that today's event may have no firecrackers and perhaps copper will continue its trend towards the downside as supply dominates over demand.""Highlighting high levels of supplies, copper stocks in LME warehouses rose by 6,450 tonnes to 244,675 tonnes, their highest level in more than nine months. MCU-STOCKSThe global copper market oversupply is expected to shrink this year and next, helping cushion prices that have suffered due to slowing growth in top consumer China, a Reuters poll showed.Global mining company Anglo American said a sharp drop in commodity prices will likely result in impairment charges for its 2014 financial year, as it posted annual production ahead of its guidance for its key commodities.Polish copper producer KGHM, faced with a strike at its Chilean mine, Sierra Gorda, said it had contingency plans to maintain low-level production if the dispute was not resolved. In other metals, zinc traded up 0.8 percent at $2,121 a tonne, partially clawing back losses from the session before, helped by a positive price differential for Chinese buyers.Lead traded almost flat at $1,870, tin was up 0.8 percent at $19,450, nickel traded 1.5 percent higher at $15,020 and aluminium traded 0.1 percent higher at $1,857.50.PRICES  Three month LME copperMost active ShFE copperThree month LME aluminiumMost active ShFE aluminiumThree month LME zincMost active ShFE zincThree month LME leadMost active ShFE leadThree month LME nickelThree month LME tin                 (Additional reporting by Melanie Burton in Melbourne; editing by John Stonestreet/Ruth Pitchford)",2015-01-28,FCX,"Wed Jan 28, 2015 | 8:25am EST",METALS-Copper edges higher ahead of Fed meeting,http://www.reuters.com//article/markets-metals-idUSL6N0V723X20150128?type=companyNews
144,"  JAKARTA Feb 16 Indonesia has dropped its demand that Freeport-McMoran Inc build a $1.5 billion copper smelter in Papua province, saying a regionally owned enterprise would take on the project instead, website Detik.com reported, quoting the mining minister.The ministry in December said Arizona-based Freeport, which runs the world's fifth-largest copper mine in Indonesia, should agree to build the Papua smelter in five years if it wanted a mining contract extension beyond 2021.The latest decision could ease pressure on Freeport, which has already agreed to a $2.3-billion expansion by 2017 of its copper smelting facility in East Java, currently the only one in the country.The government has been pushing the company to comply with rules that force miners to process and refine minerals domestically.""If Freeport is burdened in two locations it would be uneconomical,"" Energy and Mineral Resources Minister Sudirman Said said on Sunday, according to the Detik website.A regionally owned enterprise would build the Papua smelter and could team up with other investors on the project, the ministry said in a document obtained by Reuters. An investor from China has already approached the Papua administration, Detik's report cited Said as saying, without providing details.""A smelter on its own is not economical so we are building an (industrial) zone to make it more attractive,"" Said said. A ministry spokesman was not immediately available to confirm the comments.The 650-hectare industrial zone in Papua's Mimika area is not far from Freeport's concentrate pipeline and already has a port and eletrical infrastructure, according to the document.The zone will also include a cement packaging plant, a liquefied petroleum gas filling plant, a fertilizer plant and a petrochemicals plant. ""This is a win-win solution,"" Said said, adding that Freeport would be contractually required to supply copper concentrate to the Papua smelter.""Whoever is tasked to build the smelter in Papua, Freeport Indonesia will form a business-to-business contract with them to supply concentrate,"" Freeport Indonesia CEO Maroef Sjamsuddin said in the document.Freeport is expected to produce 2 million tonnes of copper concentrate from its Indonesian operations in 2015, up from 1.4 million tonnes in 2014.Indonesia aims to develop 4.5 million tonnes of copper concentrate processing capacity nationally, Said said, up from 1.2 million tonnes at present.    (Reporting by Fergus Jensen; Editing by Joseph Radford)",2015-02-16,FCX,"Mon Feb 16, 2015 | 3:18am EST",Indonesia lifts demand on Freeport to build Papua smelter -media,http://www.reuters.com//article/indonesia-freeport-smelter-idUSL4N0VQ29A20150216?type=companyNews
145,"  Freeport-McMoRan Inc (FCX.N) is unlikely to sell oil, gas and copper assets in the current market as buyers are unwilling to pay good prices for quality assets due to weak commodities prices, the company's chief executive said on Monday.""The idea of property sales is not a likely outcome,"" Freeport CEO Richard Adkerson said, speaking at a BMO conference in Florida.Freeport has been trying to reduce its debt, which ballooned in 2013 after it acquired two oil and gas companies.  Its debt levels stood at $19 billion as of the end of December and it previously set a debt target of $12 billion by the end of 2016. Asset sales were widely seen as one means to help reduce debt.  In late January however, the U.S.-based miner abandoned its debt reduction target, bringing in partners to help fund two oil projects and slashing its capital spending.  (Reporting by Nicole Mordant in Vancouver and Euan Rocha in Toronto; Editing by Chizu Nomiyama and Meredith Mazzilli)",2015-02-23,FCX,"Mon Feb 23, 2015 | 11:38am EST",Freeport CEO says unlikely to sell assets,http://www.reuters.com//article/us-freeportmcmoran-sales-idUSKBN0LR1KH20150223?type=companyNews
146,"  (Adds background, details on debt reduction)Feb 23 Freeport-McMoRan Inc is unlikely to sell oil, gas and copper assets in the current market as buyers are unwilling to pay good prices for quality assets due to weak commodities prices, the company's chief executive said on Monday.""The idea of property sales is not a likely outcome,"" Freeport CEO Richard Adkerson said, speaking at a BMO conference in Florida. Freeport has been trying to reduce its debt, which ballooned in 2013 after it acquired two oil and gas companies. Its debt levels stood at $19 billion as of the end of December and it previously set a debt target of $12 billion by the end of 2016. Asset sales were widely seen as one means to help reduce debt. In late January however, the U.S.-based miner abandoned its debt reduction target, bringing in partners to help fund two oil projects and slashing its capital spending.    (Reporting by Nicole Mordant in Vancouver and Euan Rocha in Toronto; Editing by Chizu Nomiyama and Meredith Mazzilli)",2015-02-23,FCX,"Mon Feb 23, 2015 | 11:34am EST",UPDATE 1-Freeport CEO says unlikely to sell assets,http://www.reuters.com//article/freeportmcmoran-sales-idUSL1N0VX18620150223?type=companyNews
147,"  Feb 23 Freeport-McMoRan Inc is unlikely to sell oil, gas and copper assets in the current market as buyers are unwilling to pay good prices for quality assets due to weak commodities prices, the company's chief executive said on Monday. ""The idea of property sales is not a likely outcome,"" Freeport CEO Richard Adkerson said, speaking at a BMO conference in Florida.   (Reporting by Nicole Mordant in Vancouver; Editing by Chizu Nomiyama)  ",2015-02-23,FCX,"Mon Feb 23, 2015 | 9:42am EST",Freeport CEO says unlikely to sell assets,http://www.reuters.com//article/freeportmcmoran-sales-idUSL1N0VX0YZ20150223?type=companyNews
148,"  (Adds comments from Newmont spokesman, Freeport spokesman in paragraphs 6-7, 13-14)By Wilda AsmariniJAKARTA, March 2 Newmont Mining Corp's  Indonesian copper export permit will not be renewed beyond March 19 unless it strikes a deal with Freeport-McMoRan Inc to invest in the latter's planned smelter, a mines ministry official said on Monday.""For an export permit extension for Newmont, we are still awaiting an agreement between Freeport and Newmont,"" Coal and Minerals Director General Sukhyar told a news conference.""It will depend how serious Newmont's commitment to co-operate with Freeport is and how much they will share the investment,"" Sukhyar said.Indonesia has been in talks with miners about their plans to develop domestic smelting and processing facilities. Early last year, Jakarta put in place export restrictions aimed at forcing mining firms to develop smelting and processing facilities so that Indonesia could refine all of its raw ores and concentrates.""We share the government's stated goal of increasing value-added mineral processing in Indonesia,"" said Newmont spokesman Omar Jabara.""As part of our MoU (memorandum of understanding) with Freeport, we continue working with them in support of their plans to develop a smelter. (Newmont) also has concentrate supply agreements with two Indonesian companies planning to build domestic smelters."" Although fellow U.S.-based miner Freeport is pushing ahead with expansion plans at Indonesia's sole copper smelter at Gresik, Newmont has said multiple studies show its Batu Hijau mine cannot sustain a smelter on its own.The Indonesian government has long urged the companies to cooperate on a smelter. After a fractious nine-month export tax dispute, Newmont signed a deal with the government last year that allowed for the resumption of copper concentrate exports. But this agreement is set to end unless Newmont can show it is serious about domestic processing.""If they really commit, they will be given an export permit extension,"" Sukhyar said. ""The time limit for us to give an export permit extension is March 19.""Newmont and Freeport account for 97 percent of Indonesia's copper output.""We continue to advance our discussions with the government of Indonesia on an agreement for our long-term operating rights,"" said Freeport spokesman Eric Kinneberg, adding the talks include such issues as royalties and taxes, domestic processing and refining, divestment, and local content.""In parallel, we are advancing plans to construct new smelter capacity in Indonesia. A site has been identified and we are actively engaged in discussions on technical, commercial and partnership arrangements.""   (Additional reporting by Michael Taylor, and Susan Taylor in Toronto, writing by Michael Taylor; editing by Louise Heavens, G Crosse and David Clarke)",2015-03-02,FCX,"Mon Mar 2, 2015 | 4:22pm EST",UPDATE 2-Indonesia sets Newmont deadline for Freeport smelter deal,http://www.reuters.com//article/indonesia-newmont-export-idUSL5N0W450K20150302?type=companyNews
149,"   By Wilda Asmarini | JAKARTA  JAKARTA Newmont Mining Corp's Indonesian copper export permit will not be renewed beyond March 19 unless it strikes a deal with Freeport-McMoRan Inc to invest in the latter's planned smelter, a mines ministry official said on Monday.Southeast Asia's largest economy is in talks with miners about their plans to develop domestic smelting and processing facilities.""For an export permit extension for Newmont, we are still awaiting an agreement between Freeport and Newmont,"" Coal and Minerals Director General Sukhyar told a news conference. ""It will depend how serious Newmont's commitment to co-operate with Freeport is and how much they will share the investment,"" Sukhyar said. Early last year, Indonesia put in place export restrictions aimed at forcing mining firms to develop smelting and processing facilities so that Indonesia could refine all of its raw ores and concentrates.Although fellow U.S.-based miner Freeport is pushing ahead with expansion plans at Indonesia's sole copper smelter at Gresik, Newmont has said multiple studies show its Batu Hijau mine cannot sustain a smelter on its own.The Indonesian government has long urged the companies to cooperate on a smelter. After an increasingly fractious nine-month export tax dispute, Newmont signed a deal with the Indonesian government late last year that allowed for the resumption of copper concentrate exports. This agreement is set to end unless it can show it is serious about domestic processing.""If they really commit, they will be given an export permit extension,"" Sukhyar said. ""The time limit for us to give an export permit extension is March 19."" Newmont and Freeport, which account for 97 percent of Indonesia's copper output, could not be reached for comment on Monday. Freeport's local CEO told Reuters last year that a new smelter would be designed only to take concentrate from its assets.Newmont is expected to produce 500,000 tonnes of copper and gold concentrate in 2015 ""at most"", up from 400,000 tonnes in 2014, Sukhyar forecast last month. (Additional reporting by Michael Taylor; writing by Michael Taylor; editing by Louise Heavens and David Clarke)",2015-03-02,FCX,"Mon Mar 2, 2015 | 1:06pm EST",Indonesia sets Newmont deadline for Freeport smelter deal,http://www.reuters.com//article/us-indonesia-newmont-export-idUSKBN0LY22P20150302?type=companyNews
150,"   By Wilda Asmarini | JAKARTA  JAKARTA Newmont Mining Corp's Indonesian copper export permit will not be renewed beyond March 19 unless it strikes a deal with Freeport-McMoRan Inc to invest in the latter's planned smelter, a mines ministry official said on Monday.Southeast Asia's largest economy is in talks with miners about their plans to develop domestic smelting and processing facilities.""For an export permit extension for Newmont, we are still awaiting an agreement between Freeport and Newmont,"" Coal and Minerals Director General Sukhyar told a news conference. ""It will depend how serious Newmont's commitment to co-operate with Freeport is and how much they will share the investment,"" Sukhyar said. Early last year, Indonesia put in place export restrictions aimed at forcing mining firms to develop smelting and processing facilities so that Indonesia could refine all of its raw ores and concentrates.Although fellow U.S.-based miner Freeport is pushing ahead with expansion plans at Indonesia's sole copper smelter at Gresik, Newmont has said multiple studies show its Batu Hijau mine cannot sustain a smelter on its own.The Indonesian government has long urged the companies to cooperate on a smelter. After an increasingly fractious nine-month export tax dispute, Newmont signed a deal with the Indonesian government late last year that allowed for the resumption of copper concentrate exports. This agreement is set to end unless it can show it is serious about domestic processing.""If they really commit, they will be given an export permit extension,"" Sukhyar said. ""The time limit for us to give an export permit extension is March 19."" Newmont and Freeport, which account for 97 percent of Indonesia's copper output, could not be reached for comment on Monday. Freeport's local CEO told Reuters last year that a new smelter would be designed only to take concentrate from its assets.Newmont is expected to produce 500,000 tonnes of copper and gold concentrate in 2015 ""at most"", up from 400,000 tonnes in 2014, Sukhyar forecast last month. (Additional reporting by Michael Taylor; writing by Michael Taylor; editing by Louise Heavens and David Clarke)",2015-03-02,FCX,"Mon Mar 2, 2015 | 7:23am EST",Indonesia sets Newmont deadline for Freeport smelter deal,http://www.reuters.com//article/us-indonesia-newmont-export-idUSKBN0LY16820150302?type=companyNews
151,"  (Fixes name in headline)By Wilda AsmariniJAKARTA, March 2 Newmont Mining Corp's  Indonesian copper export permit will not be renewed beyond March 19 unless it strikes a deal with Freeport-McMoRan Inc to invest in the latter's planned smelter, a mines ministry official said on Monday.Southeast Asia's largest economy is in talks with miners about their plans to develop domestic smelting and processing facilities.""For an export permit extension for Newmont, we are still awaiting an agreement between Freeport and Newmont,"" Coal and Minerals Director General Sukhyar told a news conference. ""It will depend how serious Newmont's commitment to co-operate with Freeport is and how much they will share the investment,"" Sukhyar said.Early last year, Indonesia put in place export restrictions aimed at forcing mining firms to develop smelting and processing facilities so that Indonesia could refine all of its raw ores and concentrates. Although fellow U.S.-based miner Freeport is pushing ahead with expansion plans at Indonesia's sole copper smelter at Gresik, Newmont has said multiple studies show its Batu Hijau mine cannot sustain a smelter on its own.The Indonesian government has long urged the companies to cooperate on a smelter. After an increasingly fractious nine-month export tax dispute, Newmont signed a deal with the Indonesian government late last year that allowed for the resumption of copper concentrate exports. This agreement is set to end unless it can show it is serious about domestic processing.""If they really commit, they will be given an export permit extension,"" Sukhyar said. ""The time limit for us to give an export permit extension is March 19.""Newmont and Freeport, which account for 97 percent of Indonesia's copper output, could not be reached for comment on Monday. Freeport's local CEO told Reuters last year that a new smelter would be designed only to take concentrate from its assets.Newmont is expected to produce 500,000 tonnes of copper and gold concentrate in 2015 ""at most"", up from 400,000 tonnes in 2014, Sukhyar forecast last month.    (Additional reporting by Michael Taylor; writing by Michael Taylor; editing by Louise Heavens and David Clarke)",2015-03-02,FCX,"Mon Mar 2, 2015 | 7:07am EST",REFILE-UPDATE 1-Indonesia sets Newmont deadline for Freeport smelter deal,http://www.reuters.com//article/indonesia-newmont-export-idUSL4N0W43Z120150302?type=companyNews
152,"  JAKARTA, March 2 Newmont Mining Corp's  Indonesian copper export permit will not be renewed beyond March 19 unless it strikes a deal with Freeport-McMoRan Inc to invest in the latter's planned smelter, a mines ministry official said on Monday.Southeast Asia's largest economy is in talks with miners over their plans to develop domestic smelting and processing facilities.  ""For an export permit extension for Newmont, we are still awaiting an agreement between Freeport and Newmont,"" said Coal and Minerals Director General Sukhyar. ""It will depend how serious Newmont's commitment to co-operate with Freeport is and how much they will share the investment.""    (Reporting by Wilda Asmarini; writing by Michael Taylor; Editing by Louise Heavens) ",2015-03-02,FCX,"Mon Mar 2, 2015 | 6:02am EST",Indonesia give Newmont three weeks to strike smelter deal,http://www.reuters.com//article/indonesia-newmont-export-idUSL4N0W43WC20150302?type=companyNews
153,"   By Jonathan Stempel  Credit Suisse Group Inc will pay $10 million in cash and provide $6.25 million worth of advisory work to Freeport-McMoRan Inc to settle allegations it contributed to the natural resources company having overpaid significantly for two oil and gas companies.The settlement was disclosed on Monday in a filing with the Delaware Chancery Court.It came two months after Freeport-McMoRan agreed to pay $137.5 million to resolve shareholder litigation over its 2013 purchases of Plains Exploration & Production Co and McMoRan Exploration Co for roughly $9 billion. That accord did not release shareholder claims against Credit Suisse, which had been Freeport's financial adviser. Credit Suisse denied wrongdoing in agreeing to settle, according to the filing. A spokeswoman for the Swiss bank declined to comment.Shareholders had claimed that the acquisitions were tainted by conflicts of interest, and that Freeport officers and directors breached their duties by allowing the Phoenix-based company to pay too much. The individual defendants also denied wrongdoing. In a regulatory filing in January, Freeport said insurers would cover $115 million of the $137.5 million payout.The case is In re: Freeport-McMoRan Copper & Gold Inc Derivative Litigation, Delaware Chancery Court, No. 8145.",2015-03-16,FCX,"Mon Mar 16, 2015 | 6:23pm EDT",Credit Suisse settles Freeport-McMoRan litigation for $16.25 mln,http://www.reuters.com//article/freeportmcmoran-settlement-idUSL2N0WI2F020150316?type=companyNews
154,"  March 16 Credit Suisse Group Inc will pay $10 million in cash and provide $6.25 million worth of advisory work to Freeport-McMoRan Inc to settle allegations it contributed to the natural resources company having overpaid significantly for two oil and gas companies.The settlement was disclosed on Monday in a filing with the Delaware Chancery Court.It came two months after Freeport-McMoRan agreed to pay $137.5 million to resolve shareholder litigation over its 2013 purchases of Plains Exploration & Production Co and McMoRan Exploration Co for roughly $9 billion. That accord did not release shareholder claims against Credit Suisse, which had been Freeport's financial adviser.Credit Suisse denied wrongdoing in agreeing to settle, according to the filing. A spokeswoman for the Swiss bank declined to comment. Shareholders had claimed that the acquisitions were tainted by conflicts of interest, and that Freeport officers and directors breached their duties by allowing the Phoenix-based company to pay too much. The individual defendants also denied wrongdoing. In a regulatory filing in January, Freeport said insurers would cover $115 million of the $137.5 million payout.The case is In re: Freeport-McMoRan Copper & Gold Inc Derivative Litigation, Delaware Chancery Court, No. 8145.   (Reporting by Jonathan Stempel in New York; Editing by Alan Crosby)",2015-03-16,FCX,"Mon Mar 16, 2015 | 6:15pm EDT",Credit Suisse settles Freeport-McMoRan litigation for $16.25 mln,http://www.reuters.com//article/freeportmcmoran-settlement-idUSL2N0WI2DH20150316?type=companyNews
155,"   By Mike Stone and Greg Roumeliotis  Natural resources conglomerate Freeport-McMoRan Inc has hired Goldman Sachs Group Inc and Barclays Plc to help find private equity firms that will finance some of its projects, according to people familiar with the matter.The move comes two years after Freeport acquired Plains Exploration & Production Co and McMoRan Exploration Co for $19 billion, including debt, in a bid to diversify into the U.S. energy industry as the copper sector's prospects waned.With crude oil prices down from $100 per barrel to a six-year low of $44 per barrel, that strategy has backfired. Not only is less cash generated from the oil and gas assets to fund Freeport's mining projects, but the company now has to find ways to finance the development of assets it acquired.Faced with a 20 percent drop in copper prices in addition to the 50 percent decline in oil prices, Freeport said in January it was looking for partners to help provide funding for its capital expenditure in the Gulf of Mexico.  Freeport is now speaking to the world's largest private equity firms, including Blackstone Group LP, Apollo Global Management LLC and Warburg Pincus LLC, about such partnerships, the people said this week. The exact amount of capital Freeport is seeking could not be learned, but the sources said it would be several billion dollars.The discussions are in a very early stage, said the people, who asked not to be named because discussions are private. Freeport did not return calls seeking comment. Goldman Sachs and Barclays declined to comment. Representatives for Warburg Pincus and Blackstone declined comment. An Apollo representative  had no immediate comment.As part of the 2013 deals, Phoenix, Arizona-based Freeport took on mountains of debt. It now has $18.4 billion in long-term debt and a market capitalization of around $19 billion. To cut its debt pile, Freeport has also considered asset sales. It explored shedding some $5 billion worth of assets in California last year, but the sale stalled as oil prices dropped, people familiar with that deal have said. Private equity firms view the capital expenditures of energy companies as an attractive investment opportunity. In January, for example, GSO Capital Partners LP, Blackstone's credit investment arm, committed up to $500 million for five years to fund the drilling program of oil and natural gas exploration company LINN Energy LLC. (Reporting by Mike Stone and Greg Roumeliotis in New York; editing by Matthew Lewis)",2015-03-17,FCX,"Tue Mar 17, 2015 | 4:50pm EDT","Freeport taps Goldman, Barclays to help find partners: sources",http://www.reuters.com//article/us-freeportmcmoran-m-a-idUSKBN0MD2JE20150317?type=companyNews
