,Article,Date,Symbol,Time,Title,Url
8,"   By Tim McLaughlin | BOSTON  BOSTON May 6 If you're looking for top performing U.S. junk bond funds, pick one that's maxed out in stocks.Bond-fund managers at Loomis Sayles, Fidelity and Eaton Vance are trouncing their benchmarks and almost all their peers by taking advantage of asset allocation rules that permit as much as 35 percent of their holdings in stocks.""Prices are sky high in all sectors of the fixed income market,"" said Matthew Eagan, a portfolio manager at the $18 billion Loomis Sayles Strategic Income Fund. That's why Eagan and some of his competitors are boosting returns by buying stocks and building on existing positions that deliver a one-two punch of dividend yield and capital appreciation.Eagan's bond fund has a 1-year return of 7.92 percent, easily beating the 0.21 advance of its benchmark index and better than 98 percent of its peers in the multisector bond category, according to Morningstar Inc. Its No. 2 overall holding, shares of Corning Inc, have surged 18 percent this year and 41 percent in the past 12 months.Doing even better is the Eaton Vance Bond Fund, whose 1-year return is 9.81 percentage points higher than its benchmark. It is the best performing multisector bond fund with a 1-year return of 10.02 percent, according to Lipper Inc, a Thomson Reuters company.  The $664 million fund's portfolio is about 16 percent to 18 percent invested in stocks, portfolio manager Kathleen Gaffney said.During last month's sell-off of momentum stocks such as biotechnology companies, the Eaton Vance fund took advantage of the stock market dip by adding to existing stock positions, Gaffney said. The fund's largest stock holdings include Ingersoll-Rand PLC, Regions Financial Corp <RF. N>, SLM Corp and Kinder Morgan Inc.Fidelity Investments junk bond fund manager Mark Notkin said the earnings yield of stocks in the S&P 500 Index is now about 6.25 percent. That's better than the 5.2 percent yield of junk bonds, which typically have the highest yields in the bond market.Earnings yield is the inverse of a stock's price-to-earnings ratio and shows the percentage of each dollar invested in the stock that was earned by the company. It's calculated by dividing the earnings per share for the most recent 12-month period with the current market price per share. The earnings yield on S&P 500 stocks has been beating junk bond yields ever since the beginning of the economic recovery, with some of the most pronounced gains coming this month, according to Reuters data. ""Historically, if you look back 25 years, high-yield would be several hundred basis points more than the earnings yield of the S&P 500,"" Notkin said. ""Now, the S&P is a 100 basis points more than the high-yield market. That isn't a little off-kilter, but substantially off-kilter.""Notkin said that's a reason to buy stocks, which he said could outperform junk bond yields for the next two to three years.The Lipper Core Bond Funds index is up 0.11 percent for the 1-year period, as of May 2. And that same index is up 3.2 percent year to date, as of May 2.To be sure, bond fund managers still have to be able to pick the right stocks. The Pioneer High Yield Fund, whose portfolio managers declined to comment, hit some turbulence in the first quarter with its stock selection. The portfolio's allocation to equities was the largest detractor from relative returns. The fund's Class A shares returned 2.6 percent in the quarter, compared to the 3 percent return on the Bank of America Merrill Lynch High Yield Master II Index.One of the fund's stock picks, General Cable Corp, is down 19 percent this year after the company said its income from Venezuela would fall because of changes in the currency exchange rate, pricing controls and social unrest in that country.MANDATE FLEXIBILITY Some multisector and junk bond funds have the flexibility in their mandates to buy stocks and preferred stocks in addition to their holdings of bonds of all stripes. Eagan's fund at Loomis Sayles, for example, can hold as much as 35 percent of its assets in preferred stocks and dividend-paying common stocks.The $10.3 billion Fidelity Capital & Income Fund  run by Notkin, has been maxed out for several quarters with almost 20 percent of its portfolio in stocks, according to its latest fund disclosure. Notkin's bet on Station Casinos was a top contributor to the Fidelity fund's first-quarter performance after the casino operator got a lift from better-than-expected results from its Las Vegas operations.United Rentals Inc, a top stock holding in Notkin's fund, has climbed 18 percent in the past three months as a recovery in the commercial construction industry boosts demand and rental rates for the company's equipment.Notkin's fund has been on a winning streak for a long time, posting a 5-year average annual return of 16.93 percent, compared to the benchmark average annual return of 4.89 percent, according to Morningstar.That puts Notkin's fund in the top 97 percent in high-yield bond category. The fund's 1-year return of 7.59 percent has been helped by avoiding pricey high-yield debt that's trading above par.Bond fund managers who venture into the stock market tend to be value investors, hunting for large-cap, dividend-rich stocks that come with solid balance sheets and strong cash flow.""I stay away from the high flyers,"" Eaton Vance's Gaffney said. She added that stocks shelter part of her portfolio from the interest-rate risk that can hurt a bond fund's performance.If a stock has a dividend yield of around 4 percent, it's fine with some bond fund managers if its share price does little in the way of appreciation.""Four percent is shaping up to be a good number for all bond managers in 2014,"" said Eagan at Loomis Sayles.(Reporting By Tim McLaughlin)",2014-05-06,GLW,"Tue May 6, 2014 | 11:53am EDT",Junk bond fund yields trounce peers as managers buy stocks to boost returns,http://www.reuters.com//article/funds-bonds-stocks-idUSL2N0NR18W20140506?type=companyNews
9,"   By Abhirup Roy and Subrat Patnaik  Corning Inc (GLW.N) reported second-quarter core earnings below analysts' average estimate, hurt by lower demand for its Gorilla Glass, which is used in iPhones and the Galaxy devices.Corning shares fell as much as 10 percent on Tuesday.Gorilla glass sales fell due to lower demand for smartphones and tablets and a delay in the launch of certain new products, Corning's senior vice president, Tony Tripeny, told Reuters.The company cut its full-year growth forecast for cover glass shipments to 20 percent, Chief Financial Officer James Flaws said on a conference call.Flaws estimated that growth in themedia tablet markethad slowed significantly, compared with the company's expectations at the beginning the year.    The company's overall share of tablet sales is likely to fall from a year earlier,especially sincemost of the growth is in the unbranded tablet segment,which Corning is less exposed to, Flaws said.Corning did not give its prior forecast for overall cover glass shipments, but had said in January that it expected shipments of Gorilla glass alone to rise at least 30 percent in 2014. Samsung Electronics Co Ltd (005930.KS), one of Corning's biggest customers, reported weak handset sales in the second quarter, as it faced slowing market growth and intensifying price competition. Apple Inc (AAPL.O) is also reportedly planning to switch from using Gorilla glass to GT Advanced Technologies' GTAT.O Sapphire glass for its next iPhone.Shares of GT Advanced Technologies have more than tripled in the past year, while Corning's shares have gained 43 percent. Corning has also been hurt by falling LCD glass prices over the past few quarters, but said it expected prices to fall at a slower pace in the current quarter.The company reported a rise in quarterly core net sales, helped by higher demand for TVs in the run-up to the FIFA World Cup.Core sales from Corning's display technologies business, which makes LCD panels for Sony Corp (6758.T), LG and Lenovo Group (0992.HK), and accounts for more than 25 percent of the company's revenue, grew 62 percent. The company posted core earnings of 37 cents per share on core net sales of $2.58 billion, missing the analysts' average estimate of a profit of 38 cents per share on revenue of $2.53 billion, according to Thomson Reuters I/B/E/S.The company's net income slumped 74 percent to $169 million, or 11 cents per share, in the second quarter. Corning's shares were down 9.5 percent at 19.96 in afternoon trading on the New York Stock Exchange. (Editing by Simon Jennings)",2014-07-29,GLW,"Tue Jul 29, 2014 | 1:47pm EDT",Corning profit falls short on lower Gorilla glass demand,http://www.reuters.com//article/us-corning-results-idUSKBN0FY13520140729?type=companyNews
10,"  * 2nd-quarter profit $0.37/shr vs est $0.38/shr* Revenue of $2.58 bln vs est $2.53 bln* Cuts full-year cover glass shipment growth forecast* Shares fall as much as 10 pct   (Adds CFO comments; updates shares)By Abhirup Roy and Subrat PatnaikJuly 29 Corning Inc reported second-quarter core earnings below analysts' average estimate, hurt by lower demand for its Gorilla Glass, which is used in iPhones and the Galaxy devices.Corning shares fell as much as 10 percent on Tuesday.Gorilla glass sales fell due to lower demand for smartphones and tablets and a delay in the launch of certain new products, Corning's senior vice president, Tony Tripeny, told Reuters. The company cut its full-year growth forecast for cover glass shipments to 20 percent, Chief Financial Officer James Flaws said on a conference call.Flaws estimated that growth in the media tablet market had slowed significantly, compared with the company's expectations at the beginning the year.The company's overall share of tablet sales is likely to fall from a year earlier, especially since most of the growth is in the unbranded tablet segment, which Corning is less exposed to, Flaws said.Corning did not give its prior forecast for overall cover glass shipments, but had said in January that it expected shipments of Gorilla glass alone to rise at least 30 percent in 2014. Samsung Electronics Co Ltd, one of Corning's biggest customers, reported weak handset sales in the second quarter, as it faced slowing market growth and intensifying price competition.Apple Inc is also reportedly planning to switch from using Gorilla glass to GT Advanced Technologies'  Sapphire glass for its next iPhone.Shares of GT Advanced Technologies have more than tripled in the past year, while Corning's shares have gained 43 percent. Corning has also been hurt by falling LCD glass prices over the past few quarters, but said it expected prices to fall at a slower pace in the current quarter.The company reported a rise in quarterly core net sales, helped by higher demand for TVs in the run-up to the FIFA World Cup.Core sales from Corning's display technologies business, which makes LCD panels for Sony Corp, LG and Lenovo Group, and accounts for more than 25 percent of the company's revenue, grew 62 percent.The company posted core earnings of 37 cents per share on core net sales of $2.58 billion, missing the analysts' average estimate of a profit of 38 cents per share on revenue of $2.53 billion, according to Thomson Reuters I/B/E/S.The company's net income slumped 74 percent to $169 million, or 11 cents per share, in the second quarter.Corning's shares were down 9.5 percent at 19.96 in afternoon trading on the New York Stock Exchange.(Editing by Simon Jennings)",2014-07-29,GLW,"Tue Jul 29, 2014 | 1:43pm EDT",UPDATE 3-Corning profit falls short on lower Gorilla glass demand,http://www.reuters.com//article/corning-results-idUSL4N0Q43U020140729?type=companyNews
11,"  * Windstream rallies; set to spin off assets into REIT* Merck rises as results beat expectations, but Pfizer slips* Herbalife shares tumble after it cuts sales outlook* Indexes: Dow flat, S&P off 0.1 pct, Nasdaq up 0.2 pct   (Updates prices, changes comment, adds Corning)By Rodrigo CamposNEW YORK, July 29 U.S. stocks were little changed on Tuesday after a rally in the telecommunications sector lost steam and a lower earnings forecast from UPS weighed on sentiment.Windstream Holdings jumped 12.8 percent to $11.88 in its busiest trading day on record after the company filed to spin off assets into a tax-efficient publicly-traded real estate investment trust. The strategy triggered bets on long-term advantages for peers but the initial gains reversed in late morning trade. The S&P telecoms sector index rose 2.8 percent after earlier gaining as much as 5.5 percent.""Winstream was unbelievably good at keeping this close to the vest and everybody was surprised,"" said Kim Forrest, senior equity research analyst at Fort Pitt Capital Group in Pittsburgh. However, she said, ""the rethinking of the larger telecoms becoming REITs took the wind off of the market.""Telecom stocks were still higher on bets they could also be looking for ways to reduce taxes. AT&T was up 3.3 percent to $36.83, Verizon gained 1.6 percent to $52.40, CenturyLink was up 4.3 percent to $39.33 and Frontier Communications added 11.1 percent to $6.60.Weighing on the S&P 500, shares of UPS fell 3.4 percent to $99.14 after the world's biggest courier company slashed its earnings forecast for the year due to spending to boost capacity. The S&P industrial sector fell 0.6 percent. Corning shares dropped 9.8 percent to $19.90 after second-quarter core earnings came in below analysts' estimates.Dow components Merck and Pfizer reported better-than-expected results. Merck's new drugs offset declining sales of ones facing generic competition and Pfizer was helped by growing sales of its cancer medicines.Merck shares were up 1.7 percent at $58.95 while Pfizer shed 0.4 percent to $29.97. The Dow Jones industrial average fell less than a point to 16,981.89, the S&P 500 lost 1.84 points or 0.09 percent, to 1,977.07 and the Nasdaq Composite added 7.86 points or 0.18 percent, to 4,452.77.U.S. consumer confidence jumped in July to a high not seen since October 2007 but single-family home prices fell 0.3 percent in May on a seasonally-adjusted basis, falling short of expectations.The Federal Reserve began a two-day meeting on monetary policy. The Fed could make subtle yet telling changes to its policy statement due Wednesday, as it plans how and when to eventually raise interest rates.Shares of health insurer Aetna fell 3.6 percent to $81.74, even as it reported a higher second-quarter profit helped by last year's acquisition of Medicare and Medicaid provider Coventry Health Care.Herbalife cut its sales outlook for the year after raising it three months earlier, following billionaire investor Bill Ackman's latest round of accusations against the company last week. Shares of the weight-loss and nutrition products company slid 11 percent to $60.07.    (Editing by Bernadette Baum and Nick Zieminski)",2014-07-29,GLW,"Tue Jul 29, 2014 | 12:25pm EDT",US STOCKS-Wall St flat as telecom gains offset by earnings,http://www.reuters.com//article/markets-usa-stocks-idUSL2N0Q41G020140729?type=companyNews
12,"  July 29 Speciality glass maker Corning Inc  reported a 25 percent jump in quarterly net sales, helped by higher demand for TVs in Europe and South America in the run-up to the football World Cup.Corning, whose customers include Apple Inc and Samsung Electronics Co Ltd, said net sales rose to $2.48 billion in the second quarter from $1.98 billion a year earlier. The company posted core earnings of 37 cents per share.  Corning's net income fell to $169 million, or 11 cents per share, in the second quarter, from $638 million, or 43 cents per share, a year earlier.    (Reporting by Abhirup Roy in Bangalore; Editing by Simon Jennings)",2014-07-29,GLW,"Tue Jul 29, 2014 | 7:43am EDT",Glass maker Corning's revenue jumps on higher demand for TVs,http://www.reuters.com//article/corning-results-idUSL4N0Q04OQ20140729?type=companyNews
13,"  * Shares slump more than 90 percent to record low of $0.75* Share fall wipes out $1.4 billion in market value* Co says seeking debtor-in-possession financing* Expects court to authorize it to continue business as usual   (Adds trader quotes and details, update share movement)By Swetha GopinathOct 6 GT Advanced Technologies Inc, Apple Inc's partner in a sapphire glass plant in Arizona, filed for bankruptcy on Monday in a stunning turn of events for a company whose fortunes looked bright only a few months ago.The stock fell more than 90 percent to 75 cents, wiping out nearly all of its $1.5 billion market worth. GT was worth more than $2.8 billion in early July on hopes of its scratch-resistant sapphire glass being a part of the new iPhones.""It's unbelievable ... I don't think anyone expected this,"" said Dennis Dick, a proprietary trader at Bright Trading LLC in Las Vegas.""I can't remember the last time ... well Bear Stearns was probably the last time, but we were in a financial crisis then. This was completely out of the blue.""The stock had more than doubled in the nine months between November's announcement of the new Arizona plant and the launch of Apple's new large-screen iPhones on Sept. 9 as investors hoped GT would replicate Corning Inc's success with Gorilla Glass. Since then the stock had slumped 36 percent after GT's sapphire glass was left out of the new iPhones. GT had said a month earlier that the Arizona plant would not be fully operational until early 2015.""It would appear that something very fundamentally broke down in the relationship between Apple and GT Advanced,"" Raymond James analyst Pavel Molchanov said in an email.GT said on Aug. 5 it was expecting Apple to pay it $139 million in connection with the plant. Apple had paid it $439 million totally as of that date.The company had warned then that costs related to the plant had a ""significant impact"" on its liquidity and results. Still, it forecast revenue of $600-$700 million for the full year, more than double the $299 million it reported in 2013. According to data from Markit, which tracks short interest, 43 percent of GT's shares outstanding were being loaned out for short bets, a very high level that indicates there were plenty of investors who thought this stock was headed lower.EXCLUSIVE DEAL Apple will use a sapphire screen for two of the three versions of its Apple Watch, which will be available early next year. It also uses the material on the camera cover and touch sensor button on its iPhones.The deal with Apple placed restrictions on GT selling the sapphire screens for use in certain applications, according to the company's regulatory filings. GT gave Apple an exclusive license for certain applications of its sapphire glass technology, but the iPad maker had no obligation to buy the glass, according to the filings.GT, whose subsidiaries also filed for bankruptcy, said it had $85 million of cash as of Sept. 29. The company had cash and cash equivalents of $333.1 million as of June 28.The company has reported a loss for the last four quarters, but raised the lower end of its full-year adjusted profit forecast in August, citing higher margins.GT, which also makes equipment for consumer electronics, power electronics, solar and LED products, said in its Chapter 11 petition that it had assets of $1.5 billion and liabilities  of $1.3 billion as of June 28.The company filed for bankruptcy in a U.S. bankruptcy court in the District of New Hampshire and said it was seeking debtor-in-possession financing to get access to additional funds.GT said it expected the court to authorize it to continue to conduct business as usual while it reorganized.By 1:30 p.m. ET, more than 115 million shares had changed hands, making it the most actively traded stock on the Nasdaq, despite being halted five times due to excessive volatility.The case is in re: GT Advanced Technologies Inc, U.S. Bankruptcy Court, District of New Hampshire, No: 14-11916.   (Additional reporting by David Gaffen and  Chuck Mikolajczak in New York and Anannya Pramanick in Bangalore; Editing by Sriraj Kalluvila and Savio D'Souza)",2014-10-06,GLW,"Mon Oct 6, 2014 | 2:29pm EDT",UPDATE 3-Apple supplier GT Advanced shocks with bankruptcy filing,http://www.reuters.com//article/gtadvanced-bankruptcy-idUSL3N0S130Y20141006?type=companyNews
14,"   By Abhirup Roy  Corning Inc, the supplier of Gorilla glass to Apple Inc and Samsung Electronics, reported higher-than-expected quarterly revenue and earnings, helped by launches of new smartphone models. Shares of the company, which also supplies LCD panels to consumer electronics companies such as Sony Corp, LG and Lenovo Group, rose 1.6 percent in early trading. Smartphones such as Apple's iPhone 6 and 6 Plus and Samsung's Galaxy Alpha were launched in the quarter ended Sept. 30. Corning said it would launch a new version of Gorilla glass on Nov. 20.The company, however, said fourth-quarter core sales in its specialty materials business, which makes Gorilla glass, were expected to decline by low- to mid-teen digits percent from the third quarter due to the absence of any major new launches.""What happens after a new launch is at some point, they take enough glass to continue to build out their products and that's why we think that in the fourth quarter, we'll see sales down,"" Senior Vice President Tony Tripeny told Reuters. Its LCD panel volumes in the current quarter are expected to be flat or fall slightly from the previous quarter as most of the holiday season orders had been shipped in the third quarter, Tripeny said. Corning had been hurt by falling LCD glass prices in the past few quarters, but the company said the pace of the price decline was moderating.  The company's core net sales rose to $2.65 billion in the third quarter ended Sept. 30 from $2.1 billion, a year earlier. Net income rose to $1.01 billion, or 72 cents per share, from $408 million, or 28 cents per share. The company reported core earnings of 40 cents per share. Analysts on average had expected an adjusted profit of 37 cents per share and revenue of $2.63 billion, according to Thomson Reuters I/B/E/S.  Corning shares were up 1 percent at $19.04 on the New York Stock Exchange. (Editing by Kirti Pandey)",2014-10-28,GLW,"Tue Oct 28, 2014 | 10:16am EDT",Smartphone launches boost Gorilla glass maker Corning,http://www.reuters.com//article/us-corning-results-idUSKBN0IH12320141028?type=companyNews
15,"  (Adds executive comments, details, estimates, shares)By Abhirup RoyOct 28 Corning Inc, the supplier of Gorilla glass to Apple Inc and Samsung Electronics , reported higher-than-expected quarterly revenue and earnings, helped by launches of new smartphone models.Shares of the company, which also supplies LCD panels to consumer electronics companies such as Sony Corp, LG and Lenovo Group, rose 1.6 percent in early trading.Smartphones such as Apple's iPhone 6 and 6 Plus and Samsung's Galaxy Alpha were launched in the quarter ended Sept. 30. Corning said it would launch a new version of Gorilla glass on Nov. 20. The company, however, said fourth-quarter core sales in its speciality materials business, which makes Gorilla glass, were expected to decline by low- to mid-teen digits percent from the third quarter due to the absence of any major new launches.""What happens after a new launch is at some point, they take enough glass to continue to build out their products and that's why we think that in the fourth quarter, we'll see sales down,"" Senior Vice President Tony Tripeny told Reuters.Its LCD panel volumes in the current quarter are expected to be flat or fall slightly from the previous quarter as most of the holiday season orders had been shipped in the third quarter, Tripeny said. Corning had been hurt by falling LCD glass prices in the past few quarters, but the company said the pace of the price decline was moderating.The company's core net sales rose to $2.65 billion in the third quarter ended Sept. 30 from $2.1 billion, a year earlier. Net income rose to $1.01 billion, or 72 cents per share, from $408 million, or 28 cents per share.The company reported core earnings of 40 cents per share.Analysts on average had expected an adjusted profit of 37 cents per share and revenue of $2.63 billion, according to Thomson Reuters I/B/E/S.Corning shares were up 1 percent at $19.04 on the New York Stock Exchange.   (Editing by Kirti Pandey)",2014-10-28,GLW,"Tue Oct 28, 2014 | 10:12am EDT",UPDATE 1-Smartphone launches boost Gorilla glass maker Corning,http://www.reuters.com//article/corning-results-idUSL4N0SN5D020141028?type=companyNews
16,"  Oct 28 Speciality glass maker Corning Inc  reported a 23 percent rise in quarterly net sales, helped by higher demand for its glass used in TVs and smartphones.The company supplies glass for Apple Inc's iPhones and Samsung Electronics' Galaxy devices, and makes LCD panels for Sony Corp, LG and Lenovo Group , among others. Corning said net sales rose to $2.54 billion in the third quarter from $2.07 billion, a year earlier.  Net income rose to $1.01 billion, or 72 cents per share, from $408 million, or 28 cents per share.    (Reporting by Abhirup Roy in Bangalore; Editing by Kirti Pandey)",2014-10-28,GLW,"Tue Oct 28, 2014 | 7:36am EDT",Speciality glass maker Corning's quarterly net sales rise 23 pct,http://www.reuters.com//article/corning-results-idUSL4N0SM38X20141028?type=companyNews
