,Article,Date,Symbol,Time,Title,Url
4,"   By Tom Hals | WILMINGTON, Del  WILMINGTON, Del Oct 22 First Data Corp's Chief Executive Officer Frank Bisignano hailed a $3.5 billion fund-raising in July 2014 for drawing a ""who's who in equity investing"" and paving the way for the payment processor's huge IPO last week.The 2014 deal included one unusual investor: Lehman Brothers, the bank that collapsed in 2008 at the height of the financial crisis.Lehman may be long gone from Wall Street, but its bankruptcy estate still manages a portfolio of more than $10 billion in assets, exceeding the market capitalization of fashion house Ralph Lauren Corp or property investment firm Kimco Realty Corp.From an office in Manhattan, Lehman's staff manage piles of cash and securities, interests in real estate and private equity investments, including a stake in Formula One motor racing.While bankruptcy estates focus on liquidating assets for the benefit of creditors, Lehman dusted off its investing expertise last year and spent $151 million on private placement of stock in First Data.According to a court filing, the money was spent on a ""pro-rata"" share of the private placement, indicating Lehman had a previous relationship with First Data. Lehman provided financing in 2007 for the buyout of First Data, which was led by KKR & Co.""When you get a $3.5 billion vote of confidence by some fabulous investors,"" Bisignano told an analysts call in July 2014, ""the who's who in equity investing in it gives your customers great confidence in your ability."" The private placement of stock was credited by Bisignano for providing cash to pay down First Data's debt and returning the company to profit after years of losses.Lehman's management can make investments if they determine it will likely benefit creditors.Lehman and First Data declined to comment on the Lehman stake.Lehman did not disclose how the First Data investment performed. KKR, which was the lead investor in the 2014 private placement, has estimated in securities filings the value of its investment in First Data rose about 13 percent from the private placement through June 30. However, those gains may have been offset after First Data cut the IPO price by 20 percent from the top of its target range.Shares in First Data were little changed at $15.36 on Thursday, below the $16 IPO price.COMPLEX CASES  Lehman emerged from bankruptcy in 2012 with a new board selected by creditors, overseen by Chairman David Pauker, formerly the executive managing director of Goldin Associates, a financial consultancy. Christopher O'Meara, a former chief financial officer of Lehman, is the chief executive.""I do think it's remarkable both how significant Lehman's assets have turned out to be and how much they still have,"" said David Skeel, a professor at University of Pennsylvania Law School.The First Data deal is not even the largest investment by the bankrupt firm. In 2012, it ponied up about $3 billion to buy two minority positions held by other banks in Archstone, an owner of apartment complexes, giving it full ownership. It later sold Archstone for $6.5 billion.Lehman had teamed up with Tishman Speyer to acquire Archstone for $22.2 billion, including debt, in 2007.In total, Lehman's bankruptcy estate has distributed $105.4 billion to creditors. Of that, $77.2 billion was paid to third-party claims, with the rest paid to other Lehman affiliates. While more than $1 trillion of claims were filed, the estate will recognize about $330 billion, according to court documents.Jonathan Lipson, a professor at Temple University School of Law, said the case could still require years of work as the estate pursues lingering litigation and awaits overseas affiliates to complete their liquidations.""Enron's estate lasted forever and ever,"" Lipson said, referring to the power company that filed in 2001 and closed its bankruptcy case only last year. ""That's what happens with really complex cases.""   (Reporting by Tom Hals in Wilmington, Delaware; Editing by Carmel Crimmins and Frances Kerry)",2015-10-22,KIM,"Thu Oct 22, 2015 | 11:37am EDT",Lehman Brothers returns in deal that led to First Data IPO,http://www.reuters.com//article/firstdata-ipo-lehman-idUSL1N12J1AL20151022?type=companyNews
5,"  April 27 Kimco Realty Corp* Kimco realty announces first quarter 2016 operating results* Q1 FFO per share $0.38* Reaffirms its full year 2016 financial * Adjusted  ffo available to common shareholders was $0.37 per diluted share, for q1 of 2016* Q1 FFO per share view $0.37 -- Thomson Reuters I/B/E/S * Fy2016 FFO per share view $1.58 -- Thomson Reuters I/B/E/S* Declared a quarterly cash dividend of $0.255 per common share * Sees FFO per diluted earnings per share in the range of $ 0.81 to $ 0.92 in the fy 2016* Sees FY FFO per diluted  share in the range of $ 1.54 to $ 1.62* Sees FY FFO as adjusted per diluted common share in the range of $ 1.48 - $ 1.52  Source text for Eikon:  Further company coverage:    (Bengaluru Newsroom: +1-646-223-8780)",2016-04-27,KIM,"Wed Apr 27, 2016 | 4:30pm EDT",BRIEF-Kimco Realty Corp reports Q1 FFO per share $0.38,http://www.reuters.com//article/idUSASC08LUL?type=companyNews
6,     ,2016-05-05,KIM,"Wed May 4, 2016 | 9:21pm EDT",BRIEF-Kimco Realty announces pricing of $150 million 4.25 pct notes due 2045,http://www.reuters.com//article/idUSASC08N2B?type=companyNews
7,"  June 9 Kimco Realty Corp * Sells interests in 17-property Canadian portfolio for $324.0 million, transaction advances the company's strategic exit from Canada by year end  Source text for Eikon:  Further company coverage:    (Bengaluru Newsroom: +1 646 223 8780)  ",2016-06-09,KIM,"Thu Jun 9, 2016 | 6:01pm EDT",BRIEF-Kimco Realty sells interests in Canadian portfolio for $324 mln,http://www.reuters.com//article/idUSASC08TI0?type=companyNews
8,"  July 7 Kimco Realty Corp* Says its transaction activity for Q2 of 2016 exceeded $1 billion* Q2 revenue $696 million * Kimco has six remaining Canadian shopping centers, all of which are in joint ventures and expected to be sold by year end * Sees 2016 guidance range for shopping center acquisitions is $450 million - $550 million * Company's 2016 guidance range for shopping center dispositions is $825 million - $975 million  Source text for Eikon:  Further company coverage:    (Bengaluru Newsroom: +1-646-223-8780)",2016-07-07,KIM,"Thu Jul 7, 2016 | 5:12pm EDT",BRIEF-Kimco Realty says Q2 transaction activity exceeded $1 billion,http://www.reuters.com//article/idUSASC08WCZ?type=companyNews
9,"  July 26 Kimco Realty Corp* Kimco Realty Corp.and Krcx North Holdings, Llc announce Redemption Of Canadian Connection with redemption, Kimco expects to incur a one-time prepayment charge of approximately CAD $33.1 million in Q3 of 2016  * Kimco Realty Corp.and Krcx North Holdings, Llc announce Redemption of Canadian-Denominated series 3 and series 4 notes totaling $350 million  Source text for Eikon:  Further company coverage:    (Bengaluru Newsroom: +1-646-223-8780) ",2016-07-26,KIM,"Tue Jul 26, 2016 | 4:32pm EDT","BRIEF-Kimco Realty Krcx North Holdings, Llc announce Redemption Of Canadian-Denominated Series 3 and series 4 notes totaling $350 million",http://www.reuters.com//article/idUSASC08YEL?type=companyNews
10,"  July 27 Kimco Realty Corp* Kimco Realty Corp sees FY FFO per share $1.34 - $1.42 $1.42* Kimco Realty Corp Sees Fy FFO As Adjusted $1.48-$1.52 per share* Subsequent to Q2, Kimco announced an early debt repayment initiative* Establishment of valuation allowance to result in non-cash charge against net income,ffo of about $66 million,$41 million, respectively, in q3 * Kimco realty reports second quarter 2016 results* Q2 FFO per share $0.38* Q2 adjusted FFO per share $0.37 excluding items * Will recognize one-time charge of about $48 million related to early extinguishment of debt during q3 of 2016* Plans to merge Kimco Realty Services, Inc. into Kimco, the REIT * In conjunction with merger, Kimco will establish valuation allowance against certain deferred tax assets currently on balance sheet* Q2 FFO per share view $0.38 -- Thomson Reuters I/B/E/S* FY2016 FFO per share view $1.56 -- Thomson Reuters I/B/E/S* Sees fy net income of $0.86 to $0.94 per diluted share  Source text for Eikon:  Further company coverage:    (Bengaluru Newsroom: +1-646-223-8780)",2016-07-27,KIM,"Wed Jul 27, 2016 | 5:15pm EDT",BRIEF-Kimco Realty Corp sees FY FFO per share $1.34 - $1.42,http://www.reuters.com//article/idUSASC08YTN?type=companyNews
11,"  July 27 Kimco Realty CorpKimco Announces Key Strategic Initiatives To Further Strengthen The Company's Long-Term Financial Outlook* Says plan includes prepaying $428 million of secured and unsecured U.S. Debt due in 2017* As a result of planned transactions, Kimco expects to realize recurring annualized cost savings of approximately $29 million* Time charges against net income available to common stockholders of about $114 million * One-Time charges are expected to reduce net income and FFO by about $0.27/diluted share,$0.21/diluted share, respectively, in Q3 2016* Term financial outlook* Says implementation of several strategic initiatives to enhance company's capital structure * Plan includes redeeming two outstanding series of Canadian-dollar-denominated notes totaling cad $350 million due in 2018 and 2020* Says plan includes merging company's primary taxable REIT subsidiary into Kimco * There will be no impact to ffo as adjusted as a result of these one-time charges* Says plans to merge Kimco Realty Services, Inc. into Kimco* Company expects to incur a prepayment charge of approximately $22 million in Q3 of 2016* Time non-cash charge against net income and FFO of $66 million and $41 million, respectively, in Q3 of 2016* Anticipates funding prepayment of debt by utilizing $1.75 billion revolving credit facility as well as through sale of additional assets  Source text for Eikon:  Further company coverage:    (Bengaluru Newsroom: +1-646-223-8780)",2016-07-27,KIM,"Wed Jul 27, 2016 | 4:31pm EDT",BRIEF-Kimco Announces Key Strategic Initiatives To Further Strengthen The Company's Long-Term Financial Outlook,http://www.reuters.com//article/idUSASC08YPW?type=companyNews
12,"  Aug 9 Kimco Realty Corp* Kimco Realty announces pricing of $500 million 2.800 pct notes due 2026  * Offering is expected to settle on August 18, 2016  Source text for Eikon:  Further company coverage: ",2016-08-09,KIM,"Tue Aug 9, 2016 | 6:18pm EDT",BRIEF-Kimco Realty announces pricing of $500 mln 2.800 pct notes due 2026,http://www.reuters.com//article/idUSASC0921R?type=companyNews
13,"  (The following statement was released by the rating agency) NEW YORK, August 09 (Fitch) Fitch Ratings has assigned a 'BBB+' rating to the  senior unsecured notes due 2026 issued by Kimco Realty Corporation (NYSE: KIM).  Net proceeds are expected to be used for the redemption of the $290.9 million  aggregate principal amount of outstanding 5.70% senior notes due May 1, 2017  (the 2017 notes), with the remainder, if any, to be used for general corporate  purposes. A full list of Fitch's current ratings on KIM follows at the end of  this release. KEY RATING DRIVERS The ratings reflect Kimco's large, diversified portfolio, its generally  consistent and conservative credit metrics over the past five years and its  demonstrated strong access to capital. Kimco has made progress reducing the  elevated leverage after the Kimstone transaction.  RESTORING HEADLINE METRICS Kimco has reduced leverage over the past few quarters with 5.4x leverage for  both the quarter and trailing 12 months (TTM) ended June 30, 2016, respectively.  This compares to 6.3x immediately after the close of the Kimstone transaction  (for the quarter ended March 31, 2015). In February 2015, Kimco acquired  Blackstone's 67% interest in an unconsolidated joint venture (Kimstone) for $925  million including assumed debt. When including 50% of preferred stock in total  debt, KIM's leverage was 5.9x for both the quarter and TTM ended June 30, 2016.  Fitch defines leverage as debt minus readily available cash to recurring  operating EBITDA including Fitch's assumption for recurring cash distributions  from joint venture operations.  Fitch expects Kimco will reduce leverage further over the next few years as the  issuer is targeting net debt / EBITDA as adjusted (on its calculations) of 5x -  5.5x versus its calculation of 5.7x at June 30, 2016.  Kimco's liquidity is sufficient at 1.6x for the period July 1, 2016 - Dec. 31,  2017 pro forma for the note issuance. Fitch views Kimco as having above-average  access to capital through-the-cycle, which is a key qualitative factor  supporting the ratings.  Fitch calculates liquidity coverage as sources (unrestricted cash, availability  under the $1.75 billion unsecured revolving credit facility, estimated proceeds  from ATM issuance subsequent to the end of 1Q16 and retained cash flow from  operations after dividends) divided by uses (debt maturities, development  expenditures and recurring maintenance capital expenditures).  Fitch projects that Kimco's fixed charge coverage (FCC) will remain strong  around 3x through 2017, consistent with recent periods (3.2x and 3x for the  quarter and TTM ended June 30, 2016). Fitch defines FCC as recurring operating  EBITDA including Fitch's estimate of recurring cash distributions from joint  venture operations less straight-line rent and recurring maintenance capital  expenditures to interest and preferred stock dividends. DURABLE OPERATING CASHFLOWS FROM ENVIRONMENT & DIVERSIFICATION The scale, diversification and lease staggering of Kimco's portfolio provide for  generally durable cash flows from operations. Approximately 8.6% of leases  mature on average in 2016 through 2018 and only 3.2% on average assuming tenant  extension options are exercised before considering month-to-month leases.  Leasing spreads in the U.S. same-space portfolio remained strong in 2015 and  2Q16 at 11.1% and 16.2%, respectively as compared to 8.8% in 2014. Limited new supply for shopping centers and a generally accommodative economic  backdrop have supported positive growth as measured by same-store net operating  income (SSNOI) and same-store occupancy. Fitch assumes SSNOI will grow 3.5% in  2016 before the effects of tenant defaults and 1.7% in 2017 as compared to 3.1%  in 2Q16, 3.1% in 2015 and 3.3% in 2014 for the U.S. same-space portfolio. ADEQUATE CONTINGENT LIQUIDITY Kimco maintains adequate contingent liquidity in the form of unencumbered assets  which covered unsecured debt (UA / UD) net of readily available cash by 2.4x at  a stressed 8% cap rate. Kimco's UA/UD ratio has steadily increased over the past  few years as it replaced non-income producing/non-real estate assets with income  producing unencumbered assets, and as unencumbered assets in joint ventures were  consolidated or purchased outright. Fitch also estimates Kimco will retain approximately $75 million to $150 million  per year of cashflow from operations based on its dividend payout ratio (80.8%  of adjusted funds from operations for the TTM ended June 30, 2016).  Kimco's payout ratio is consistent with the median in Fitch's rated universe.  INCREASING DEVELOPMENT EXPOSURE Kimco has increased its development exposure after curtailing its activities  during the last downturn and focusing on redevelopment and expansion projects  until recently during this recovery. At June 30, 2016, unfunded development  costs remaining (including redevelopment) comprised 2.7% of gross assets which  remains manageable but is increasingly focused on development projects.  STABLE OUTLOOK The Stable Outlook reflects Fitch's expectation that the issuer's long-term  capitalization target is unchanged and that it will restore leverage back to the  mid-5x range. The Outlook also reflects the accommodative operating environment  for the sector being offset in part by increasing development exposure.  PREFERRED STOCK NOTCHING The two-notch differential between Kimco's IDR and its preferred stock rating is  consistent with Fitch's criteria for corporate entities with an IDR of 'BBB+'.  Based on Fitch's criteria report, 'Treatment and Notching of Hybrids in  Nonfinancial Corporate and REIT Credit Analysis,' dated Feb. 29, 2016, the  company's preferred stock is deeply subordinated and has loss absorption  elements that would likely result in poor recoveries in the event of a corporate  default. KEY ASSUMPTIONS Fitch's key assumptions within the rating case for KIM include: --SSNOI growth of 3.5% in 2016 and 1.7% in 2017 before tenant defaults; --General and administrative expenses growth to approximate 12%-13% of recurring  operating EBITDA; --Recurring maintenance capital expenditures grow to approximate 11%-12% of  recurring operating EBITDA; --Development expenditures of approximately $260 million and redevelopment  expenditures of $225 million through 2017; --Fitch has not explicitly assumed any net transactional activity in 2016 or  2017, noting that volume over the past three years has generally balanced  acquisitions and dispositions; --Unsecured debt issuances of $600 million in 2016 and 2017 to repay secured and  unsecured maturities (including the rated issuance). RATING SENSITIVITIES Fitch does not envision positive momentum on Kimco's ratings and/or Outlook;  however, the following factors may have a positive impact: --Fitch's expectation of FCC sustaining above 2.5x (coverage was 3.2x for 2Q16); --Fitch's expectation of net debt-to-recurring operating EBITDA sustaining below  5x (leverage was 5.4x for the TTM ended June 30, 2016). The following factors may have a negative impact on Kimco's ratings and/or  Outlook: --Fitch's expectation of FCC sustaining below 2x;  --Fitch's expectation of leverage sustaining above 6.5x. FULL LIST OF RATING ACTIONS Fitch currently rates KIM as follows:  Kimco Realty Corporation --Issuer Default Rating 'BBB+'; --Unsecured revolving credit facility 'BBB+'; --Senior unsecured term loan 'BBB+'; --Senior unsecured notes 'BBB+'; --Preferred stock 'BBB-'. Kimco North Trust III: --Senior unsecured guaranteed notes 'BBB+'.  Contact:  Primary Analyst Daniel Kornblau Associate Director +1-646-582-4946 Fitch Ratings, Inc. 33 Whitehall Street New York, NY 10004 Secondary Analyst Britton Costa, CFA Director +1-212-908-0524 Committee Chairperson Michael Weaver Managing Director +1-312-368-3156 Media Relations: Sandro Scenga, New York, Tel: +1 212-908-0278, Email:  sandro.scenga@fitchratings.com. Relevant Committee Date: Oct. 8, 2015 Additional information is available on www.fitchratings.com Summary of Financial Statement Adjustments - Financial statement adjustments  that depart materially from those contained in the published financial  statements of the relevant rated entity or obligor are disclosed below: --Historical and projected recurring operating EBITDA is adjusted to add back  non-cash stock based compensation and include operating income from discontinued  operations; --Fitch has adjusted recurring operating EBITDA by $125 million per year to  reflect estimated recurring cash distributions from joint venture operations;  --Fitch has adjusted the historical and projected net debt by assuming the  issuer requires $25 million to $50 million of cash for working capital purposes  which is otherwise unavailable to repay debt. Applicable Criteria  Corporate Rating Methodology - Including Short-Term Ratings and Parent and  Subsidiary Linkage (pub. 17 Aug 2015) here Treatment and Notching of Hybrids in Non-Financial Corporate and REIT Credit  Analysis (pub. 29 Feb 2016) here Additional Disclosures  Solicitation Status  here Endorsement Policy  here   ail=31 ALL FITCH CREDIT RATINGS ARE SUBJECT TO CERTAIN LIMITATIONS AND DISCLAIMERS.  PLEASE READ THESE LIMITATIONS AND DISCLAIMERS BY FOLLOWING THIS LINK:  here. IN ADDITION, RATING  DEFINITIONS AND THE TERMS OF USE OF SUCH RATINGS ARE AVAILABLE ON THE AGENCY'S  PUBLIC WEBSITE 'WWW.FITCHRATINGS.COM'. PUBLISHED RATINGS, CRITERIA AND  METHODOLOGIES ARE AVAILABLE FROM THIS SITE AT ALL TIMES. FITCH'S CODE OF  CONDUCT, CONFIDENTIALITY, CONFLICTS OF INTEREST, AFFILIATE FIREWALL, COMPLIANCE  AND OTHER RELEVANT POLICIES AND PROCEDURES ARE ALSO AVAILABLE FROM THE 'CODE OF  CONDUCT' SECTION OF THIS SITE. FITCH MAY HAVE PROVIDED ANOTHER PERMISSIBLE  SERVICE TO THE RATED ENTITY OR ITS RELATED THIRD PARTIES. DETAILS OF THIS  SERVICE FOR RATINGS FOR WHICH THE LEAD ANALYST IS BASED IN AN EU-REGISTERED  ENTITY CAN BE FOUND ON THE ENTITY SUMMARY PAGE FOR THIS ISSUER ON THE FITCH  WEBSITE.   ",2016-08-09,KIM,"Tue Aug 9, 2016 | 11:32am EDT",Fitch Rates Kimco's Senior Unsecured Bonds due 2026 'BBB+',http://www.reuters.com//article/idUSFit969961?type=companyNews
14,  Aug 9 Kimco Realty Corp : * Files for potential notes offering; size not disclosed - SEC filing  Source text for Eikon:  Further company coverage:  ,2016-08-09,KIM,"Tue Aug 9, 2016 | 9:19am EDT",BRIEF-Kimco Realty files for potential notes offering,http://www.reuters.com//article/idUSFWN1AQ0D0?type=companyNews
15,"  Aug 23 Kimco Realty Corp* Kimco Realty announces redemption price for its 5.70 percent senior notes due 2017  * Redemption price of $1,033.90 for each $1,000 principal amount of its 5.70 percent senior notes due 2017  Source text for Eikon:  Further company coverage: ",2016-08-23,KIM,"Tue Aug 23, 2016 | 5:32pm EDT",BRIEF-Kimco realty announces redemption price for 5.70 pct senior notes,http://www.reuters.com//article/idUSFWN1B40DJ?type=companyNews
16,  Sept 6 Kimco Realty Corp* Kimco Realty Acquires Remaining Interest In Four Property joint venture portfolio for $170.7m  * Company also announces purchase of Kentlands Market Square  Source text for Eikon:  Further company coverage: ,2016-09-06,KIM,"Tue Sep 6, 2016 | 9:30am EDT",BRIEF-Kimco Realty acquires remaining interest in Four-Property Joint Venture portfolio for $170.7m,http://www.reuters.com//article/idUSFWN1BI0BT?type=companyNews
