,Article,Date,Symbol,Time,Title,Url
58,"  * 3rd-qtr revenue $1.47 bln vs est. $1.48 bln* Revenue in girls' toys category falls 28 pct* Games category revenue declines 8 pct* Shares fall as much as 8.2 pct   (Adds analysts comments, details from conference call; updates shares)By Nayan DasOct 19 Toymaker Hasbro Inc reported lower-than-expected quarterly revenue, hurt by a strong dollar and lower sales of its games and toys for girls.Shares of the company, which makes Monopoly board game and My Little Pony toys, fell as much as 8.2 percent on Monday. Toymakers including Hasbro and Barbie doll maker Mattel Inc  have seen declining sales of toys for girls as children increasingly opt for gadgets and tablets.Revenue in Hasbro's games category fell 8 percent in the third quarter, due to weak demand for its ""Magic: The Gathering"" and other games.Revenue in the toys for girls category fell 28 percent, the fourth straight quarter of decline, as demand for My Little Pony and Furby toys weakened.Games and toys for girls together account for nearly half of Hasbro's total revenue. Oppenheimer & Co Inc analyst Sean McGowan said the fall in sales of girls' toys was a concern.""If the weakness in girls' toys is the result of competitive shifts, then there isn't much to be done,"" he said. ""Other than heavy promotion or an acquisition, there is not much that Hasbro, or any other toy company, can do to change a product's performance in the short term.""Morningstar analyst Jaime Katz said retailers were being more cautious and stocking inventory closer to the holiday shopping season, pushing toymakers' sales into the fourth quarter from the third quarter. Although Hasbro's sales of toys for boys jumped 24 percent, the rise was driven by demand for toys based on the latest films in the ""Star Wars"" and ""Jurassic World"" series. ""Jurassic World"" released in June, while ""Star Wars: The Force Awakens"" is scheduled for launch in December.The company will release new toys under brands such as FurReal Friends in the current quarter as these sell better as holiday items, Chief Executive Brian Goldner said.Hasbro's net revenue was flat at $1.47 billion in the quarter ended Sept. 27, missing the average analyst estimate of $1.48 billion, according to Thomson Reuters I/B/E/S. Excluding the impact of a strong dollar, revenue rose 9 percent.Net income attributable to Hasbro rose 15 percent to $207.6 million, or $1.64 per share.Excluding items, Hasbro earned $1.58 per share, beating the average analyst estimate of $1.52.Hasbro's shares were down 7.3 percent at $72.08 in late morning trading. Up to Friday's close, the stock had risen more than 41 percent this year.     (Reporting by Nayan Das in Bengaluru, additional reporting by Sruthi Ramakrishnan and Abhijith G; Editing by Kirti Pandey)",2015-10-19,MAT,"Mon Oct 19, 2015 | 11:15am EDT","UPDATE 2-Hasbro revenue misses as sales of games, girls' toys fall further",http://www.reuters.com//article/hasbro-results-idUSL3N12J3RX20151019?type=companyNews
59,"  COPENHAGEN Oct 20 Some children may not get their Christmas wishes fulfilled this year as LEGO's factories, although running at full speed, may not be able to make enough plastic bricks to keep up with demand from toy stores in Europe.The Danish company has become the world's largest toymaker by sales, overtaking U.S. Barbie-maker Mattel, thanks partly to toys linked to movies, including ""The Lego Movie.""But difficulties in forecasting demand accurately means some orders may not be filled on time.""We will not be able to deliver all of the orders coming from customers in the remainder of the year,"" spokesman Roar Trangbaek told Reuters. He declined to specify which lines of toys or which European countries would be affected. Trangbaek said the company would be able to deliver the orders it had already received but may have trouble filling new orders later this year.""It is really extraordinary and it has exceeded both ours and our customers' forecasts,"" Trangbaek said when asked why the company had not foreseen the surge in demand. The Danish company's sales grew by 18 percent in the first half of this year to 14 billion Danish crowns ($2.1 billion), putting it ahead of Mattel and Monopoly-board maker Hasbro , whose revenues came in at $1.9 bln and $1.5 bln respectively.""We are running our factories at maximum capacity and will do everything we can to meet demand,"" Trangbaek said. The unlisted company, owned by the family of founder Ole Kirk Kristiansen, invested more than 3 billion crowns in plants and equipment last year to make more toys. Before Christmas last year, there were some shortages in some countries last year including Denmark and Canada.The company is building a factory in Jiaxing in China, 100 kilometres from Shanghai, which is expected to be up and running in 2017 and should produce most of the Lego toys for Asia in the future. LEGO already has factories in Denmark, Hungary, Czech Republic and Mexico.($1 = 6.5693 Danish crowns)   (Reporting by Teis Jensen. Editing by Jane Merriman)",2015-10-20,MAT,"Tue Oct 20, 2015 | 12:32pm EDT",LEGO may run short of bricks before Christmas,http://www.reuters.com//article/lego-christmas-idUSL8N12K1D520151020?type=companyNews
60,"  (Recasts with photos)COPENHAGEN Jan 13 Dissident Chinese artist Ai Weiwei published photos of himself with Lego hanging off his moustache and beard on Wednesday, celebrating the toymaker's decision to back down on rules that blocked his bulk order of bricks.Lego said on Tuesday it had dropped restrictions on large orders after facing a storm of criticism for declining his request for pieces for a large public work in Australia in October.Ai, known for his criticism of China's rights record, had accused the Danish toymaker of censorship and set up collection points for people to send him bricks.Lego said at the time it had a long-running policy of not fulfilling bulk orders or donating bricks if they knew they would be used as part of a ""political agenda"". But it said in a statement on Tuesday it would stop asking people why they wanted its products.It did not refer directly to Ai's order, but acknowledged that the rules ""could result in misunderstandings or be perceived as inconsistent"". Customers wanting to build public displays out of Lego bricks would now only have to make it clear that the company did not endorse the project, it added.The free speech campaigner published photos of himself with Lego bricks hanging off his hair, moustache and beard on his Instagram and Facebook accounts. The Instagram post included a grinning emoji symbol, but no further comment. ""So sweet, congratulations,"" wrote one supporter on Facebook.It was not immediately clear if Ai would now repeat his order and press on with his Lego project. He has used the multi-coloured building blocks before to build portraits of other dissidents, including Nelson Mandela.Chinese authorities confiscated Ai's passport in 2011 and detained him for 81 days, only returning the document in July last year.Owned by the founding family Lego is the world's largest toymaker by sales having recently overtaken U.S. Barbie-maker Mattel and Monopoly-board maker Hasbro.     (Reporting by Ole Mikkelsen; Editing by Andrew Heavens and Raissa Kasolowsky)",2016-01-13,MAT,"Wed Jan 13, 2016 | 6:29am EST",UPDATE 2-China's Ai Weiwei bedecks beard with Lego bricks after firm backs down,http://www.reuters.com//article/lego-aiweiwei-idUSL8N14X1U320160113?type=companyNews
61,"  COPENHAGEN Jan 13 Lego has dropped restrictions on bulk orders of its toy bricks after facing a storm of criticism for refusing to sell thousands of them to dissident Chinese artist Ai Weiwei.Ai, known for his criticism of China's rights record, accused the Danish toymaker of censorship in October for declining an order that he wanted for a new work.Lego said at the time it had a long-running policy of not fulfilling bulk orders or donating bricks if they knew they would be used as part of a ""political agenda"".But the decision was condemned by rights groups and triggered an online campaign collecting donations of bricks for the artist and free speech campaigner. Lego said in a statement on Tuesday it would stop asking people why they wanted its bricks.It did not refer directly to the Weiwei order, but acknowledged that the rules ""could result in misunderstandings or be perceived as inconsistent"". Customers wanting to build public displays out of Lego bricks would now only have to make it clear that the company did not endorse the project, it added. Chinese authorities confiscated Ai's passport in 2011 and detained him for 81 days, only returning the document in July last year.He has used Lego bricks before to build portraits of other dissidents, including Nelson Mandela.Owned by the founding family Lego is the world's largest toymaker by sales having recently overtaken U.S. Barbie-maker Mattel and Monopoly-board maker Hasbro.     (Reporting by Ole Mikkelsen; Editing by Andrew Heavens)",2016-01-13,MAT,"Wed Jan 13, 2016 | 4:52am EST",Lego changes rules to calm storm over Ai Weiwei brick order,http://www.reuters.com//article/lego-aiweiwei-idUSL8N14X1AC20160113?type=companyNews
62,"   By Subrat Patnaik  Mattel Inc (MAT.O) reported a surprise rise in quarterly net sales, its first increase in over two years, as sales of its Barbie dolls recovered and demand rose for its Hot Wheels toys.Mattel shares rose 6 percent in extended trading on Monday.The toymaker launched its traditionally Caucasian Barbie doll in a variety of skin tones, hairstyles and outfits last year to appeal to a larger demography. The company also rolled out Barbies in three new body shapes - tall, curvy and petite - last week to attract young girls, who increasingly prefer electronic toys and tablets to dolls. Mattel has been changing its marketing and advertising strategy to position its dolls as more than a pretty face, with campaigns such as ""You Can Be Anything"" highlighting the potential of girls in various professional fields. The efforts seem to be paying off, with sales of Barbie dolls rising 0.5 percent in the fourth quarter after falling in double-digit percentages in the prior eight quarters.Mattel also reported strong sales of its Hot Wheels toys, with the release of ""Stars Wars: The Force Awakens"" film driving demand for its Star Wars-licensed toys such as ""Jedi Starfighter Starship"" and ""Millennium Falcon Starship"".Sales in the Wheels category, which includes Hot Wheels toys, rose 17 percent. Mattel's net sales inched up 0.3 percent to $2 billion in the quarter ended Dec. 31. Analysts on average had expected net sales to fall 4.2 percent to $1.91 billion, according to Thomson Reuters I/B/E/S.The toymaker's net income surged 43.6 percent to $215.2 million, or 63 cents per share, beating the average analyst estimate of 61 cents per share.  Its advertising and promotion expenses fell 8.2 percent, while selling and administrative costs declined 7.4 percent. ""We beat our 2015 cost savings goal by about $30 million,"" Chief Executive Christopher Sinclair said on a conference call. ""We continue to be on track to deliver at the high end of our two-year savings target of $250 million to $300 million."" The El Segundo, California-based company's shares were trading at $28.35 after the bell. The stock fell about 12 percent in 2015.  (Reporting by Subrat Patnaik in Bengaluru; Editing by Kirti Pandey)",2016-02-01,MAT,"Mon Feb 1, 2016 | 6:12pm EST",Mattel surprises with sales rise as Barbie gets makeover,http://www.reuters.com//article/us-mattel-results-idUSKCN0VA3J4?type=companyNews
63,"   By Subrat Patnaik  Mattel Inc (MAT.O) reported a surprise rise in quarterly net sales, its first increase in over two years, as sales of its Barbie dolls recovered and demand rose for its Hot Wheels toys.Mattel shares rose 6 percent in extended trading on Monday.The toymaker launched its traditionally Caucasian Barbie doll in a variety of skin tones, hairstyles and outfits last year to appeal to a larger demography. The company also rolled out Barbies in three new body shapes - tall, curvy and petite - last week to attract young girls, who increasingly prefer electronic toys and tablets to dolls. Mattel has been changing its marketing and advertising strategy to position its dolls as more than a pretty face, with campaigns such as ""You Can Be Anything"" highlighting the potential of girls in various professional fields. The efforts seem to be paying off, with sales of Barbie dolls rising 0.5 percent in the fourth quarter after falling in double-digit percentages in the prior eight quarters.Mattel also reported strong sales of its Hot Wheels toys, with the release of ""Stars Wars: The Force Awakens"" film driving demand for its Star Wars-licensed toys such as ""Jedi Starfighter Starship"" and ""Millennium Falcon Starship"".Sales in the Wheels category, which includes Hot Wheels toys, rose 17 percent. Mattel's net sales inched up 0.3 percent to $2 billion in the quarter ended Dec. 31. Analysts on average had expected net sales to fall 4.2 percent to $1.91 billion, according to Thomson Reuters I/B/E/S.The toymaker's net income surged 43.6 percent to $215.2 million, or 63 cents per share, beating the average analyst estimate of 61 cents per share.  Its advertising and promotion expenses fell 8.2 percent, while selling and administrative costs declined 7.4 percent. ""We beat our 2015 cost savings goal by about $30 million,"" Chief Executive Christopher Sinclair said on a conference call. ""We continue to be on track to deliver at the high end of our two-year savings target of $250 million to $300 million."" The El Segundo, California-based company's shares were trading at $28.35 after the bell. The stock fell about 12 percent in 2015.  (Reporting by Subrat Patnaik in Bengaluru; Editing by Kirti Pandey)",2016-02-01,MAT,"Mon Feb 1, 2016 | 6:12pm EST",UPDATE 2-Mattel surprises with sales rise as Barbie gets makeover,http://www.reuters.com//article/mattel-results-idUSL3N15G5H3?type=companyNews
64,"  Feb 1 Feb 1 Mattel Inc :* Q4 earnings per share $0.63; Q4 adjusted earnings per share $0.67 including items; Q4 net sales of $2 billion versus. $1.99 billion* Q4 worldwide gross sales for Mattel girls & boys brands were $1.14 billion, up 1 percent in constant currency* Q4 worldwide gross sales for the Barbie brand were $327.6 million, up 8 percent in constant currency * Q4 worldwide gross sales for Fisher-Price brands were $626.2 million, up 13 percent in constant currency* Q4 gross sales for American girl brands were $271.8 million, down 14 percent in constant currency * Q4 worldwide gross sales for Wheels category were $271.8 million, up 26 percent in constant currency * Inventories as of Dec 31, 2015 was $587.5 million versus. $870.8 million as of Sept. 30, 2015* Source text for Eikon:* Further company coverage:",2016-02-01,MAT,"Mon Feb 1, 2016 | 4:29pm EST",BRIEF-Mattel reports Q4 earnings per share $0.63,http://www.reuters.com//article/idUSB8N11D02Y?type=companyNews
65,"  Feb 1 Mattel Inc posted a surprise increase in quarterly net sales, its first rise in more than two years, as sales of its Barbie dolls recovered and demand rose for its Hot Wheels toys.Sales of Barbie dolls rose 0.5 percent to $327.6 million in the fourth quarter, after falling steadily for two years. Mattel's net income rose to $215.2 million, or 63 cents per share, in the quarter ended Dec. 31 from $149.9 million, or 44 cents per share, a year earlier. Net sales increased 0.3 percent to $2 billion. Analysts on average had expected net sales to fall 4.2 percent to $1.91 billion, according to Thomson Reuters I/B/E/S.   (Reporting by Subrat Patnaik in Bengaluru; Editing by Kirti Pandey)",2016-02-01,MAT,"Mon Feb 1, 2016 | 4:08pm EST",Toymaker Mattel's quarterly sales rise after 2 years of fall,http://www.reuters.com//article/mattel-results-idUSL3N15G598?type=companyNews
66,"  * Chinese factory activity contracts at fastest pace since 2012* Google, Mattel to report after the close* Twitter jumps after rumors of private equity deal* Indexes down: Dow 0.59 pct, S&P 0.56 pct, Nasdaq 0.47 pct   (Updates to early afternoon)By Tanya AgrawalFeb 1 U.S. stocks were lower on Monday as weak Chinese economic data exacerbated concerns about a global slowdown and oil prices resumed their slide.The data from China showed that the world's second-largest economy's manufacturing sector contracted in January at the fastest pace since 2012.Oil prices fell about 6 percent after the China data added to worries about demand and an OPEC source played down talk of an emergency meeting to stem the decline. Oil prices have fallen more than 70 percent since mid-2014.Adding to the cautious note, data on Monday showed that U.S. consumer spending was unchanged in December and manufacturing activity continued to contract in January.""The consumer spending numbers are a concern,"" said Randy Frederick, managing director of trading and derivatives for Charles Schwab in Austin, Texas. ""We keep hearing that there is pent-up consumer demand that we are going to see down the line but we've seen little evidence of that.""Consumer spending accounts for more than two-thirds of U.S. economic activity and is seen as a bright spot in an economy affected by weak export growth and unsold merchandise.The reports follow a weak reading of the GDP, which showed that the U.S. economy expanded at an anemic rate in the fourth quarter.Investors will keep an eye on the monthly employment numbers later this week to gauge the strength of the labor market. At 12:32 p.m. ET (1733 GMT) the Dow Jones industrial average  was down 96.39 points, or 0.59 percent, at 16,369.91, the S&P 500 was down 10.87 points, or 0.56 percent, at 1,929.37 and the Nasdaq Composite index was down 21.52 points, or 0.47 percent, at 4,592.43.Eight of the 10 major S&P sectors were lower, with the energy index's 3 percent fall leading the decliners. Oil majors Exxon and Chevron were down about 2.5 percent.Slammed by collapsing oil prices, stocks have had a volatile start to the year with traders expecting the Fed to scale back the number of rate hikes this year.Coming off the worst January since 2009, the S&P 500 is already down more than 5 percent for the year. Traders are pricing in only a 17 percent chance that the Fed will raise rates in March, according to CME Group's FedWatch.Investors will pay close attention to Fed vice-chairman Stanley Fischer's speech on monetary policy at 1 p.m. ET. Fourth-quarter corporate reporting season is well under way, with S&P 500 companies on average expected to post a 4.1 percent drop in earnings, according to Thomson Reuters I/B/E/S.Internet giant Alphabet, which reports after the close, was up 0.5 percent at $765.48. Toy maker Mattel  will also report after the close.Alere jumped 45.2 percent to $54 after Abbott Laboratories agreed to buy the diagnostics company for $5.8 billion. Abbott was little changed at $37.82.Chipotle Mexican Grill was up 5.1 percent at $476.11 after E. coli outbreaks that affected the burrito chain's customers last year appeared to be over.Twitter was up 8.5 percent at $18.23 after rumors of a private equity deal.Yahoo was down 1.4 percent at $29.11 after the WSJ reported the company is set to reveal cost-cutting plans that include a reduction of 15 percent of its workforce.Declining issues outnumbered advancing ones on the NYSE by 1,953 to 1,043. On the Nasdaq, 1,712 issues fell and 1,000 advanced.The S&P 500 index showed 20 new 52-week highs and four new lows, while the Nasdaq recorded 19 new highs and 79 new lows.   (Reporting by Tanya Agrawal; Editing by Don Sebastian)",2016-02-01,MAT,"Mon Feb 1, 2016 | 12:45pm EST","US STOCKS-Wall St lower on weak China data, fall in oil prices",http://www.reuters.com//article/usa-stocks-idUSL3N15G52E?type=companyNews
67,"  U.S. toymakers Mattel Inc (MAT.O) and Hasbro Inc (HAS.O) have held talks about a possible merger, Bloomberg reported on Thursday, citing people familiar with the matter.Mattel's shares rose as much as 8.2 percent to a 16-month high of $34.36, before easing to trade up 1.6 percent in late afternoon trading. Hasbro was up 1.3 percent.Mattel makes Barbie dolls and Hot Wheels cars, while Hasbro makes Disney Princess dolls and action figures based on Star Wars among other franchises. The companies had a combined market capitalization of more than $20 billion as of Wednesday's close.Hasbro approached Mattel about a potential transaction late last year, and the companies have held talks about a deal since then, Bloomberg said citing the people.The talks may not lead to a deal, Bloomberg reported, adding that details on how a deal might be structured could not be immediately learned. Hasbro spokeswoman Julie Duff and Mattel spokesman Alex Clark said the companies do not comment on rumors or market speculation.This is not the first time the companies have held merger talks. In 1996, Mattel had offered to buy Hasbro for about $5.2 billion, but withdrew the offer, citing an intolerable climate at the time. In recent years, the companies have vied for lucrative contracts.Hasbro won a license to make Walt Disney Co's (DIS.N) Disney Princess dolls, including those based on the hit movie ""Frozen"". Mattel on Monday reported a surprise rise in holiday-quarter sales, its first increase in over two years, boosted in part by recovering sales at its 56-year old Barbie brand.Hasbro is scheduled to report its holiday-quarter results on Monday. (Reporting by Subrat Patnaik and Siddharth Cavale in Bengaluru; Editing by Savio D'Souza and Saumyadeb Chakrabarty)",2016-02-04,MAT,"Fri Feb 5, 2016 | 10:45am EST","UPDATE 2-Toymakers Mattel, Hasbro held talks on possible merger-Bbg",http://www.reuters.com//article/hasbro-ma-mattel-talks-idUSL3N15J5N7?type=companyNews
68,"  U.S. toymakers Mattel Inc (MAT.O) and Hasbro Inc (HAS.O) have held talks about a possible merger, Bloomberg reported on Thursday, citing people familiar with the matter.Mattel's shares rose as much as 8.2 percent to a 16-month high of $34.36, before easing to trade up 1.6 percent in late afternoon trading. Hasbro was up 1.3 percent.Mattel makes Barbie dolls and Hot Wheels cars, while Hasbro makes Disney Princess dolls and action figures based on Star Wars among other franchises. The companies had a combined market capitalization of more than $20 billion as of Wednesday's close.Hasbro approached Mattel about a potential transaction late last year, and the companies have held talks about a deal since then, Bloomberg said citing the people.The talks may not lead to a deal, Bloomberg reported, adding that details on how a deal might be structured could not be immediately learned. Hasbro spokeswoman Julie Duff and Mattel spokesman Alex Clark said the companies do not comment on rumors or market speculation.This is not the first time the companies have held merger talks. In 1996, Mattel had offered to buy Hasbro for about $5.2 billion, but withdrew the offer, citing an intolerable climate at the time. In recent years, the companies have vied for lucrative contracts.Hasbro won a license to make Walt Disney Co's (DIS.N) Disney Princess dolls, including those based on the hit movie ""Frozen"". Mattel on Monday reported a surprise rise in holiday-quarter sales, its first increase in over two years, boosted in part by recovering sales at its 56-year old Barbie brand.Hasbro is scheduled to report its holiday-quarter results on Monday. (Reporting by Subrat Patnaik and Siddharth Cavale in Bengaluru; Editing by Savio D'Souza and Saumyadeb Chakrabarty)",2016-02-05,MAT,"Fri Feb 5, 2016 | 10:45am EST","Toymakers Mattel, Hasbro held talks on possible merger: Bloomberg",http://www.reuters.com//article/us-hasbro-m-a-mattel-talks-idUSKCN0VD2DX?type=companyNews
