,Article,Date,Symbol,Time,Title,Url
57,"   By Douwe Miedema | WASHINGTON  WASHINGTON MetLife, the largest U.S. insurer, will make a final plea on Monday to a group of U.S. regulators determined to subject it to tougher oversight as they probe which firms could pose a risk to the larger financial system.MetLife will meet behind closed doors the heads of the agencies grouped together in the Financial Stability Oversight Council (FSOC), who want the Federal Reserve to oversee MetLife's business and force it to meet higher capital standards.Metlife, unlike counterparts AIG and Prudential which have already been deemed ""systemic"" by FSOC, has vigorously fought the tag.After FSOC in September proposed to add MetLife to that group, the insurer's chief executive Steven Kandarian hit back. He issued a statement saying MetLife was a source of strength during the 2008 financial crisis and that the insurer was ""not ruling out any of the available remedies.""But observers say MetLife faces an uphill battle, especially after an international body of regulators had already deemed MetLife systemic on a global level in July 2013.""MetLife has a strong case on the substance ... but the FSOC is not likely to listen,"" said Phillip Swagel, a professor at the University of Maryland School of Public Policy who was a senior Treasury official during the recent credit crisis.FSOC is housed within the Treasury Department, which also chairs the group, and is comprised of the leaders of all the major U.S. financial regulators.After hearing from MetLife on Monday, the first such in-person meeting between the insurer and the top regulators after months of staff-level talks, regulators will have 60 days for a final decision. MetLife can challenge the decision in court.Metlife declined to comment. SHADOW INSURANCE The 2010 Dodd-Frank Wall Street reform act automatically designated banks with more than $50 billion in assets as ""systemically important financial institutions.""But it gave the risk council the power to also tap financial firms that are not banks, if they are so big and risky that their activities could destabilize U.S. markets. To date, the regulators who make up FSOC have not spoken publicly about MetLife. However, public documents justifying their designations of AIG and Prudential, and FSOC's annual report, shed light on their concerns.The watchdogs worry insurers have their fingers in too many risky activities even after the credit crisis, and that they are no longer just straightforward providers of traditional life or car insurance policies.One issue likely to be weighed is captive reinsurance, an accounting practice through which life insurers can lower their reserves, or funds set aside to pay claims. In captive reinsurance, life insurance companies transfer risk to entities affiliated with their business in overseas jurisdictions or U.S. states with light-touch rules, which allows them to free up regulatory capital.Benjamin Lawsky, the New York Superintendent for Financial Services, has stopped issuing licenses for such activity, which he called ""shadow insurance,"" while Vermont and Delaware still actively court the business. In an apparent effort to reduce some scrutiny, MetLife last year announced it would merge three of its life insurance companies and a Bermuda-based captive reinsurance unit into one U.S.-based company, to ""address regulatory concerns about the use of captive reinsurance.""Another point regulators have looked into is securities lending. Insurers hold huge portfolios of stocks and bonds that they often lend out, typically to broker-dealers or hedge funds, backed by collateral, in return for a small fee.This is generally seen as a low-risk activity, but played a key role in the near-collapse of AIG, which was reinvesting much of its collateral in often complex and risky instruments that rapidly lost their value when the crisis hit.Insurers say such risky behavior is a thing of the past, yet they continue to lend out considerable amounts of securities. MetLife's securities lending portfolio ended 2013 at $28 billion, according to Moody's Investors Service.Lastly, regulators are wary about a possible run on an insurer much in the same way as on a bank. The industry is fiercely contesting this perception, saying their business model is different, and funding more stable.But the Federal Insurance Office, a Treasury unit that monitors the industry, last year pointed out that AIG was not the only U.S. insurer in trouble. Insurers Hartford Financial Services Group and Lincoln National Corp both received taxpayer aid during the crisis. (Reporting by Douwe Miedema; Editing by Karey Van Hall and Richard Chang)",2014-11-03,MET,"Mon Nov 3, 2014 | 1:07am EST",MetLife to meet skeptical regulators in bid to escape rules,http://www.reuters.com//article/us-insurance-regulations-metlife-idUSKBN0IN0A520141103?type=companyNews
58,"   By Douwe Miedema | WASHINGTON  WASHINGTON Nov 3 MetLife, the largest U.S. insurer, will make a final plea on Monday to a group of U.S. regulators determined to subject it to tougher oversight as they probe which firms could pose a risk to the larger financial system.MetLife will meet behind closed doors the heads of the agencies grouped together in the Financial Stability Oversight Council (FSOC), who want the Federal Reserve to oversee MetLife's business and force it to meet higher capital standards.Metlife, unlike counterparts AIG and Prudential  which have already been deemed ""systemic"" by FSOC, has vigorously fought the tag.After FSOC in September proposed to add MetLife to that group, the insurer's chief executive Steven Kandarian hit back. He issued a statement saying MetLife was a source of strength during the 2008 financial crisis and that the insurer was ""not ruling out any of the available remedies.""But observers say MetLife faces an uphill battle, especially after an international body of regulators had already deemed MetLife systemic on a global level in July 2013.""MetLife has a strong case on the substance ... but the FSOC is not likely to listen,"" said Phillip Swagel, a professor at the University of Maryland School of Public Policy who was a senior Treasury official during the recent credit crisis.FSOC is housed within the Treasury Department, which also chairs the group, and is comprised of the leaders of all the major U.S. financial regulators.After hearing from MetLife on Monday, the first such in-person meeting between the insurer and the top regulators after months of staff-level talks, regulators will have 60 days for a final decision. MetLife can challenge the decision in court. Metlife declined to comment.SHADOW INSURANCE The 2010 Dodd-Frank Wall Street reform act automatically designated banks with more than $50 billion in assets as ""systemically important financial institutions."" But it gave the risk council the power to also tap financial firms that are not banks, if they are so big and risky that their activities could destabilize U.S. markets.To date, the regulators who make up FSOC have not spoken publicly about MetLife. However, public documents justifying their designations of AIG and Prudential, and FSOC's annual report, shed light on their concerns.The watchdogs worry insurers have their fingers in too many risky activities even after the credit crisis, and that they are no longer just straightforward providers of traditional life or car insurance policies.One issue likely to be weighed is captive reinsurance, an accounting practice through which life insurers can lower their reserves, or funds set aside to pay claims. In captive reinsurance, life insurance companies transfer risk to entities affiliated with their business in overseas jurisdictions or U.S. states with light-touch rules, which allows them to free up regulatory capital.Benjamin Lawsky, the New York Superintendent for Financial Services, has stopped issuing licenses for such activity, which he called ""shadow insurance,"" while Vermont and Delaware still actively court the business.In an apparent effort to reduce some scrutiny, MetLife last year announced it would merge three of its life insurance companies and a Bermuda-based captive reinsurance unit into one U.S.-based company, to ""address regulatory concerns about the use of captive reinsurance.""Another point regulators have looked into is securities lending. Insurers hold huge portfolios of stocks and bonds that they often lend out, typically to broker-dealers or hedge funds, backed by collateral, in return for a small fee.This is generally seen as a low-risk activity, but played a key role in the near-collapse of AIG, which was reinvesting much of its collateral in often complex and risky instruments that rapidly lost their value when the crisis hit.Insurers say such risky behavior is a thing of the past, yet they continue to lend out considerable amounts of securities. MetLife's securities lending portfolio ended 2013 at $28 billion, according to Moody's Investors Service.Lastly, regulators are wary about a possible run on an insurer much in the same way as on a bank. The industry is fiercely contesting this perception, saying their business model is different, and funding more stable.But the Federal Insurance Office, a Treasury unit that monitors the industry, last year pointed out that AIG was not the only U.S. insurer in trouble. Insurers Hartford Financial Services Group and Lincoln National Corp both received taxpayer aid during the crisis.   (Reporting by Douwe Miedema; Editing by Karey Van Hall and Richard Chang)",2014-11-03,MET,"Mon Nov 3, 2014 | 1:00am EST",MetLife to meet skeptical regulators in bid to escape rules,http://www.reuters.com//article/insurance-regulations-metlife-idUSL1N0SP1W320141103?type=companyNews
59,"  (Adds background, details on who will attend meetings)By Sarah N. LynchWASHINGTON Nov 5 The U.S. council of regulators that polices for destabilizing market risks is holding a series of private meetings with the financial industry to improve the process for designating large non-bank firms ""systemic,"" the U.S. Treasury confirmed Wednesday.The Financial Stability Oversight Council is holding a series of closed-door meetings, including several on Nov. 12, when industry groups will get to vent frustrations with the process the council uses to determine which firms pose high risks and should face heightened oversight.Some lawmakers and trade groups have complained the process is opaque and that firms do not have adequate time to contest a designation.The FSOC is a council of regulators chaired by the Treasury secretary and comprised of the heads of the top financial regulators, including the Federal Reserve and the Securities and Exchange Commission.It was created by the 2010 Dodd-Frank Wall Street reform law and has the power to designate large firms ""systemic"" - a tag that involves strict supervision by the Fed and higher capital requirements. The FSOC has already designated General Electric Co's  GE Capital, Prudential Financial Inc and American International Group Inc.It recently proposed designating Metlife Inc, which is fiercely opposing the move. The council has also explored the asset management sector for potential risks.The FSOC has taken steps to address some concerns, and earlier this year adopted new standards such as providing more details from its closed-door meetings. FSOC officials including Treasury Secretary Jack Lew have said they are looking for further ways to improve the systemic designation process.A Treasury spokeswoman said upcoming discussions with stakeholders are ""consistent"" with the council's prior commitment to explore further changes.The Treasury has divided the Nov. 12 meetings into three separate groups, according to several sources familiar with the matter. The first meeting will be with five major trade groups that earlier this year submitted a petition to the FSOC calling for changes in the process so companies under consideration can be notified sooner and have more options to contest a designation.The FSOC has a three-stage process to designate firms, but companies complain they do not get adequate data or notice to let them contest it or understand it.Those groups were the American Council of Life Insurers, the American Financial Services Association, the Association of Institutional Investors and the asset management group of the Securities and Financial Markets Association.The second meeting will be attended by other interested parties, such as the U.S. Chamber of Commerce and the Investment Company Institute, while the third will involve academics or experts from think tanks.All participants were asked to come to the meeting prepared to discuss ways to improve transparency, the designation process and how companies are notified, and what things FSOC should consider each year when it re-evaluates whether companies should remain designated.   (Editing by Karey Van Hall, Doina Chiacu and Eric Walsh)",2014-11-05,MET,"Wed Nov 5, 2014 | 3:51pm EST",UPDATE 1-U.S. risk council to meet with Wall St over designation concerns,http://www.reuters.com//article/financial-regulations-risk-idUSL1N0SV37L20141105?type=companyNews
60,"  (Adds Metlife, Castle Harbour, Houlihan Lokey, Oriel)Dec 10 The following financial services industry appointments were announced on Wednesday. To inform us of other job changes, email moves@thomsonreuters.com.METLIFE INC The largest U.S. life insurer appointed Esther Lee chief marketing officer and executive vice president, effective Jan. 12, 2015.CASTLE HARBOUR SECURITIES The financial services provider appointed former Citigroup Inc executive Eric Daniel to co-manage its new global convertible bond fund. HOULIHAN LOKEY The investment bank appointed Richard Lee as a managing director to its dispute resolution and financial expert opinions team within the financial advisory services division. ORIEL ASSET MANAGEMENT The financial services company appointed Jamie Ward as a fund manager responsible for providing analysis and research for the IWI Oriel UK fund, the company said.MEDIOBANCA  The bank has hired Philippe Deneux from Barclays Plc  to be its new head of France and Benelux, as part of an expansion in the region that will see additional hires announced over the coming months.SALAMANCA GROUP HOLDINGS LTD The merchant banking and operational risk management business appointed Kati Watson senior trust manager and team head of its trust and fiduciary office based in Geneva.AMP CAPITAL The investment manager appointed Michael Hamilton investment director and Andrew Kirby senior associate in its infrastructure equity team in New York.    (Compiled by Anet Josline Pinto and Yashaswini Swamynathan in Bengaluru)",2014-12-10,MET,"Wed Dec 10, 2014 | 4:30pm EST","MOVES- Metlife, Castle Harbour, Houlihan Lokey, Oriel",http://www.reuters.com//article/financial-moves-idUSL3N0TU3W020141210?type=companyNews
61,"  Dec 10 Metlife Inc appointed Esther Lee as executive vice president and chief marketing office, effective Jan. 12, 2015.Lee will lead the global brand and marketing division, managing global marketing, advertising and promotion. She joins MetLife from AT&T Inc, where she was senior vice president, brand marketing, advertising and sponsorship.  Lee will report to Chief Executive Steven Kandarian.   (Reporting by Yashaswini Swamynathan in Bengaluru)",2014-12-10,MET,"Wed Dec 10, 2014 | 2:28pm EST",MOVES-Metlife names Esther Lee as chief marketing officer,http://www.reuters.com//article/metlife-moves-estherlee-idUSL3N0TU4EH20141210?type=companyNews
62,"  (The following statement was released by the rating agency) CHICAGO, December 15 (Fitch) Fitch Ratings has affirmed all existing ratings  assigned to MetLife, Inc. (MetLife) and its subsidiaries, including the 'AA-'  Insurer Financial Strength (IFS) ratings assigned to certain domestic life  insurance companies and the 'A' Issuer Default Rating (IDR) assigned to MetLife.  The Rating Outlook for MetLife and its subsidiaries is Stable. KEY RATING DRIVERS The affirmation of MetLife's ratings reflects Fitch's view that the company's  strong balance sheet fundamentals, excellent financial flexibility, and very  strong market positions in several major insurance products lines and markets in  the U.S. and select international markets, are consistent with rating  expectations. Fitch believes that the company's large scale, very strong brand  name, and large and diverse distribution capabilities provide significant  competitive advantages. Fitch's primary rating concerns include MetLife's above-average, albeit  moderating, exposure to the variable annuity business; above average investment  risk; and continued macroeconomic challenges associated with the ongoing low  interest rate environment.  MetLife's strong balance sheet fundamentals reflect the company's strong  risk-adjusted capitalization and favorable liquidity profile. Fitch notes that  the statutory capitalization of MetLife's U.S. and Japanese insurance operations  are considered strong and in line with rating expectations. The company's  domestic life insurance subsidiaries (excluding American Life Insurance Company  and Delaware American Life Insurance Company) reported combined statutory total adjusted capital of  approximately $24 billion and risk-based capital of 430% at year-end 2013.  Although the company does not provide intra-year RBC estimates, Fitch notes that  the company's domestic life insurance subsidiaries reported combined statutory  net operating gain of approximately $2.7 billion in the first three quarters of  2014 and an estimated growth in total adjusted capital of $1.3 billion, or 5.6%.  MetLife's Japanese insurance subsidiary represents the company's largest  insurance business outside the U.S. The Japanese subsidiary reported a statutory  solvency margin ratio significantly above 800% at year-end 2013, which is above  both rating expectations and levels achieved by most Japanese peers.  The company's financial leverage was approximately 25% at Sept. 30, 2014, which  is at the high end of Fitch's rating expectations. Financial leverage has  declined from a recent high of approximately 30% in the third quarter of 2010,  shortly before its acquisition of ALICO. MetLife's GAAP interest coverage has improved significantly over the past five  years due primarily to solid growth in operating earnings. Interest expense has  also been slowly declining since 2011. Fitch expects MetLife's GAAP fixed charge  coverage ratio to be between 7x and 8x for full year 2014 on a normalized basis  on fairly stable earnings performance.  Despite the ongoing low interest rate environment, MetLife has experienced  significant improvement in operating earnings, bolstered in part by growing  asset-based fees driven by attractive capital market performance, relatively  stable interest margins, which have benefited from active management of  crediting rates and interest rate hedges, as well as international acquisition  activity, particularly its acquisition of ALICO in the fourth quarter 2010.  Fitch expects GAAP ROE to remain in the area of 12% in 2014 as continued growth  in fee income and solid earnings from International operations are at least  partially offset by pressure from low interest rates. MetLife's equity market exposure is primarily attributable to its investment in  alternative investments and the large, albeit declining size of its variable  annuity business. Fitch notes that the company's variable annuity hedging  program is robust and performed well during the financial crisis. However, the  hedging of variable annuity risk requires the company to make policyholder  behavior assumptions that may prove inaccurate. Deviations from pricing and  hedging assumptions could have a material negative impact on MetLife's capital  and earnings in a severe, albeit unexpected, scenario. On Sept. 4, 2014, the Financial Stability Oversight Board (FSOC) announced that  it had voted to preliminarily designate MetLife a non-bank systematically  important financial institution (SIFI), which could result in more stringent  oversight by the Federal Reserve. MetLife subsequently requested a hearing to  contest the decision before it becomes final. Although the specifics of the  enhanced supervision to which non-bank SIFIs will be subject have not been  finalized, it is likely that it will include higher capital requirements. Should  MetLife's efforts to avoid SIFI designation ultimately prove unsuccessful, Fitch  expects such a designation to be credit neutral. RATING SENSITIVITIES Key rating drivers that could lead to an upgrade of MetLife's ratings include  NAIC risk-based capital ratio above 450%, financial leverage below 25%, and GAAP  fixed charge coverage ratio above 9x. Key rating drivers that could lead to a downgrade of MetLife's ratings include  NAIC risk-based capital ratio below 350%, financial leverage above 30%, and GAAP  fixed charge coverage ratio below 5x. Fitch affirms the following ratings with a Stable Outlook: MetLife, Inc.  --Long-term IDR at 'A'; --Short-term IDR at 'F1'; --5% senior notes due 2015 at 'A-';  --6.75% senior notes due 2016 at 'A-';  --1.756% senior notes due 2017 at 'A-'; --1.903% senior Notes due 2017 'A-'; --6.817% senior notes due 2018 at 'A-';  --7.717% senior notes due 2019 at 'A-';  --5.25% sterling senior notes due 2020 at 'A-'; --4.75% senior notes due 2021 at 'A-';  --3.048% senior notes due 2022 at 'A-'; --4.368% senior notes due 2023 'A-'; --5.375% senior notes due 2024 at 'A-'; --3.6% senior notes due 2024 at 'A-'; --6.5% senior notes due 2032 at 'A-';  --6.375% senior notes due 2034 at 'A-';  --5.7% senior notes due 2035 at 'A-';  --5.875% senior notes due 2041 at 'A-';  --4.125% senior notes due 2042 at 'A-'; --4.875% senior notes due 2043 at 'A-'; --6.4% junior subordinated debentures due December 2036 at 'BBB'; --10.75% junior subordinated debentures due August 2039 at 'BBB'; --4.721% senior notes due 2044 'A-'; --Floating-rate preferred stock, series A at 'BBB';  --Fixed-rate preferred stock series B at 'BBB'; --Commercial paper at 'F1'. MetLife Funding, Inc.  --Commercial paper at 'F1+'. MetLife Capital Trust IV  --7.875% trust securities at 'BBB'. MetLife Capital Trust X  --9.25% trust securities at 'BBB'. Metropolitan Life Insurance Company --IFS at 'AA-'; --IDR at 'A+'; --Surplus notes at 'A'; --Short-term IDR at 'F1+'. MetLife Insurance Company USA General American Life Insurance Company New England Life Insurance Company --IFS at 'AA-'. Metropolitan Life Global Funding I  --Medium-term note program at 'AA-'. MetLife Institutional Funding II --Medium-term note program at 'AA-'. MetLife Short Term Funding LLC --Commercial paper program rated 'F1+'. Contact: Primary Analyst Bradley S. Ellis, CFA Director +1-312-368-2089 Fitch Ratings, Inc. 70 W. Madison Street Chicago, IL 60602 Secondary Analyst Douglas L. Meyer, CFA Managing Director +1-312-368-2061 Committee Chairperson James B. Auden, CFA Managing Director +1-312-368-3148 Media Relations: Brian Bertsch, New York, Tel: +1 212-908-0549, Email:  brian.bertsch@fitchratings.com. Additional information is available at 'www.fitchratings.com'. Applicable Criteria and Related Research:  --'Insurance Rating Methodology' (September 2014). Applicable Criteria and Related Research:  Insurance Rating Methodology here Additional Disclosure  Solicitation Status  here ALL FITCH CREDIT RATINGS ARE SUBJECT TO CERTAIN LIMITATIONS AND DISCLAIMERS.  PLEASE READ THESE LIMITATIONS AND DISCLAIMERS BY FOLLOWING THIS LINK:  here. IN ADDITION, RATING  DEFINITIONS AND THE TERMS OF USE OF SUCH RATINGS ARE AVAILABLE ON THE AGENCY'S  PUBLIC WEBSITE 'WWW.FITCHRATINGS.COM'. PUBLISHED RATINGS, CRITERIA AND  METHODOLOGIES ARE AVAILABLE FROM THIS SITE AT ALL TIMES. FITCH'S CODE OF  CONDUCT, CONFIDENTIALITY, CONFLICTS OF INTEREST, AFFILIATE FIREWALL, COMPLIANCE  AND OTHER RELEVANT POLICIES AND PROCEDURES ARE ALSO AVAILABLE FROM THE 'CODE OF  CONDUCT' SECTION OF THIS SITE. FITCH MAY HAVE PROVIDED ANOTHER PERMISSIBLE  SERVICE TO THE RATED ENTITY OR ITS RELATED THIRD PARTIES. DETAILS OF THIS  SERVICE FOR RATINGS FOR WHICH THE LEAD ANALYST IS BASED IN AN EU-REGISTERED  ENTITY CAN BE FOUND ON THE ENTITY SUMMARY PAGE FOR THIS ISSUER ON THE FITCH  WEBSITE.   ",2014-12-15,MET,"Mon Dec 15, 2014 | 12:47pm EST",Fitch Affirms MetLife's Ratings; Outlook Stable,http://www.reuters.com//article/fitch-affirms-metlifes-ratings-outlook-s-idUSFit86934020141215?type=companyNews
