,Article,Date,Symbol,Time,Title,Url
135,"   By Lauren Tara LaCapra | NEW YORK, March 31  NEW YORK, March 31 A federal judge's ruling that MetLife Inc is not important enough to warrant special regulatory scrutiny has opened the door for other non-bank financial firms to try and unshackle themselves from the designation of ""too big to fail.""Those that stand to benefit from Wednesday's decision include insurers Prudential Financial Inc and American International Group Inc, as well as General Electric Co's GE Capital and asset managers like BlackRock Inc , Fidelity Investments and The Vanguard Group Inc.Metlife, Prudential, AIG and GE Capital are the only four non-banks that have been deemed systemically important financial institutions, or SIFIs, by the Financial Stability Oversight Council. BlackRock, Fidelity and Vanguard have not been assigned systemic importance, but analysts and regulatory experts say they are large enough to merit consideration.It is difficult to assess whether any of these firms can avoid a ""too big to fail"" classification forever because the criteria are fluid and SIFI assessments start fresh every year. As such, even MetLife's victory may be short-lived.The Financial Stability Oversight Council, known as FSOC, is comprised of members from 15 regulatory bodies, 10 of which have a vote on matters including SIFI designations. The council was created as part of the 2010 Dodd-Frank financial reform law. Its SIFI designations are meant to add an extra layer of oversight on firms that could cause a system-wide financial crisis if they get into trouble, because of how large and interconnected they are.FSOC has been plagued by criticism about opaqueness nearly since its birth, even as it has taken steps to address complaints.In 2014 the U.S. Government Accountability Office, a nonpartisan watchdog, criticized FSOC's ""lack of full transparency,"" saying FSOC did not always disclose public documents or explain the rationale for SIFI designations. Republican lawmakers have also lashed out at FSOC for not sharing enough information.The council has taken corrective measures, both in its public disclosures and in the way it interacts with companies. At an event last year, GE Capital Chief Executive Keith Sherin called GE Capital's designation as a systemically important institution ""very clear"" and ""very understandable."" In a statement on Thursday, a spokesman for the Treasury Department, which chairs FSOC, said the council also has a ""clear process"" for removing SIFI designations. It includes discussions between FSOC staff and company officials, as well as independent analysis of changes within companies or across markets, he said.Overall, the council aims to determine whether ""a firm's distress could destabilize the financial system,"" he said.Size is certainly one factor in determining which firms are ""too big to fail,"" but it is not the only one, regulatory experts say. For instance, AIG's near failure in 2008 created a system-wide panic not because it was large, but because of its connections to dozens of other firms through derivatives trades.But while complexity and interconnectivity may be even more important than size, defining precisely what those words mean is not an easy task. One big question posed by analysts and regulatory experts is whether FSOC would consider mutual fund firms systemically risky because investors could rush to redeem their shares at the same time. ENDLESS LITIGATION? U.S. District Judge Rosemary Collyer's opinion in the MetLife case is currently sealed. But in her order, she pointed to arguments that FSOC's assessment of MetLife was flawed, that some of its assumptions were ""arbitrary and capricious"" and that it did not give enough consideration to how the SIFI designation would affect MetLife financially.It is not clear whether FSOC will appeal the decision, but regardless of how the litigation proceeds MetLife may not be out of the woods. FSOC makes its determinations on an annual basis, and can simply designate MetLife as a SIFI again in its next iteration. That could set up a scenario where MetLife and the council are in an endless legal battle - which is partly why other firms declined to pursue litigation the way MetLife did.AIG's chief executive said in a television interview on Thursday that the insurer is considering whether to dispute its designation in light of the MetLife ruling.Coincidentally, GE Capital asked FSOC on Thursday to de-designate it because it had taken steps to shrink and simplify. The company has been planning to do this for some time, after exiting businesses, selling assets and shrinking its balance sheet by more than half to get out from under the SIFI designation.BlackRock, Vanguard and Fidelity representatives declined to comment on the MetLife decision.Some analysts said GE's strategy was a wiser one than MetLife's, because rather than fighting a powerful group of regulators in court, it adapted to become ""not-too-big-to-fail"" in response to FSOC's analysis of its business model.""GE Capital no longer poses a major threat to U.S. financial stability,"" said RBC Capital Markets analyst Deane Dray, ""and we believe the federal review is almost a formality at this point.""(Additional reporting by Lisa Lambert and Sarah N. Lynch in Washington, Sruthi Shankar in Bengaluru and Trevor Hunnicutt in New York; Editing by Leslie Adler)",2016-03-31,MET,"Thu Mar 31, 2016 | 5:56pm EDT",MetLife ruling bolsters other firms arguing systemic unimportance,http://www.reuters.com//article/usa-banks-size-idUSL2N1730UZ?type=companyNews
136,"   By Lisa Lambert | WASHINGTON  WASHINGTON Insurer MetLife Inc (MET.N) won a major regulatory and legal battle on Wednesday when a federal judge struck down the U.S. government's determination that it is ""too big to fail.""MetLife had argued in court that the Financial Stability Oversight Council (FSOC), made up of the heads of the country's financial regulatory agencies, used a secretive and flawed process when in 2014 it designated the company as a systemically important financial institution. The designation meant regulators believed a collapse of the insurer could devastate the U.S. financial system just as much as failure of a major bank, and triggered possible requirements for it to hold more capital and for stricter oversight.""From the beginning, MetLife has said that its business model does not pose a threat to the financial stability of the United States,"" the company's chief executive, Steven Kandarian, said in a statement. A representative for the U.S. Treasury said the agency  disagreed with the decision and would vigorously defend the council’s designations process.""FSOC conducted a rigorous analysis of MetLife, including extensive engagement with the company, and determined that material financial distress at MetLife could pose ... a threat to the financial system,"" said spokesman Adam Hodge. The ruling by the judge, U.S. District Judge Rosemary Collyer, is currently sealed, but parts may be made public next month, according to Wednesday's order, which also said the federal government may appeal.During a hearing last month, Collyer expressed concerns about the process and the analyses that the council, which includes the Treasury secretary and Federal Reserve chair, uses to make designations. [nL2N15P0TZ] In the order, Collyer granted three of the reasons, or counts, that MetLife gave when it argued against the designation. The company had said there were flaws in how the FSOC assessed its vulnerabilities, that some of the FSOC's assumptions and speculations were arbitrary and capricious, and that the FSOC had not given enough consideration of the designation's economic effects on MetLife.WELCOMED BY WALL STREET     MetLife, the largest U.S. life insurer, said earlier this year it was considering breaking up its business to shed the designation.Its shares ended up more than 5 percent on the news, at $44.73. Those of other insurers designated systemically important, Prudential Financial Inc (PRU.N) and American International Group Inc (AIG.N), also rose.  ""It's a major win for companies placed under this designation. It's a very large blow for the FSOC. But FSOC can appeal,"" said Raymond James analyst Steven Schwartz. ""It's not over until it's over.""Deutsche Bank Markets Research analyst Yaron Kinar wrote in a note that because of potential appeals the company's status may not ""be finalized for some time"" and ""we'd expect the company to continue down the path of separating its U.S. retail business despite the ruling."" Asset managers greeted the decision as good news with the potential to soften future regulation that their industry has been expecting. Earlier this month, the FSOC said it was discussing how to address the risks that their products could pose to financial stability. [nL2N16T22N]   The nonprofit, nonpartisan group Better Markets said, however, Collyer's decision threatens ""the entire structure that protects the country and its taxpayers from future financial crashes caused by nonbanks."" The 2010 Dodd-Frank Wall Street reform law authorized regulators to designate nonbank companies as ""systemically important,"" largely in response to the $182 billion government bailout AIG received during the 2008 financial crisis. White House spokesman Josh Earnest declined to comment on the decision, but said crisis-era bailouts showed ""it's not just banks on Wall Street that could potentially shake the foundation of our financial system.""""And if we're serious - and the president certainly is -about following through on a commitment to make sure that taxpayers are never in that position again, we need to make sure that our regulators ... can exercise, at least, some authority over nonbank institutions,"" he said at a White House briefing.MetLife sued last year, saying the FSOC had not followed its own guidance and essentially changed the rules to ensure the designation was made.The government argued its process was fair and a collapse by the insurer, with its many financial ties, products and contracts, would indeed hurt the financial system. It said it was open with the company during a 17-month process that included a meeting with the full council. [nL2N15P0TZ]At the same time, criticism of the council has mounted in the financial sector and on Capitol Hill, where Republicans say regulators should operate more openly. Securities and Exchange  Commissioner Michael Piwowar, also a Republican, has blasted the council, saying it should be renamed the ""Firing Squad On Capitalism."" [nL1N13X257] (Additional reporting by Sweta Singh in New York and Sarah N. Lynch and Roberta Rampton in Washington)",2016-03-31,MET,"Thu Mar 31, 2016 | 2:23pm EDT",U.S. judge strikes down MetLife designation of 'too big to fail',http://www.reuters.com//article/us-usa-metlife-idUSKCN0WW1RW?type=companyNews
137,"  A judge's ruling that MetLife Inc (MET.N) is not ""too big to fail"" opens up an opportunity for insurer American International Group Inc (AIG.N) to seek an exemption from the tag, AIG Chief Executive Peter Hancock said on CNBC on Thursday.However, Hancock said AIG was ""reserving judgment"" for now.AIG's near collapse in 2008 and its $182 billion bailout by the U.S. government was the driving force behind the inclusion of certain non-bank financial companies, including AIG, as ""systemically important financial institutions"" (SIFIs).The SIFI designation means regulators believe a collapse of the company could devastate the U.S. financial system just as much as the failure of a major bank and comes with increased regulatory oversight and capital requirements. Hancock, who said ""the whole world was somewhat surprised"" by the MetLife ruling, noted that AIG had shrunk its balance sheet, giving it a strong case to get its SIFI tag removed.AIG's mortgage insurance unit, United Guaranty Corp, filed for an initial public offering on Wednesday as part of AIG's plan to become smaller. The company also plans to sell its broker-dealer network. Activist investor Carl Icahn, who is AIG's fifth largest shareholder, has been pushing the insurer to become smaller and simpler to allow it to shed its label as a non-bank SIFI.General Electric Co's (GE.N) GE Capital, another non-bank, formally asked the U.S. government on Thursday to stop designating it a SIFI. Shares of AIG, which have fallen 12 percent so far this year, were little changed at $54.55 in premarket trading. (Reporting By Sudarshan Varadhan in Bengaluru; Editing by Ted Kerr)",2016-03-31,MET,"Thu Mar 31, 2016 | 9:32am EDT",AIG CEO says MetLife 'too big to fail' ruling an opportunity,http://www.reuters.com//article/us-aig-regulations-idUSKCN0WX1L5?type=companyNews
138,"  A judge's ruling that MetLife Inc (MET.N) is not ""too big to fail"" opens up an opportunity for insurer American International Group Inc (AIG.N) to seek an exemption from the tag, AIG Chief Executive Peter Hancock said on CNBC on Thursday.However, Hancock said AIG was ""reserving judgment"" for now.AIG's near collapse in 2008 and its $182 billion bailout by the U.S. government was the driving force behind the inclusion of certain non-bank financial companies, including AIG, as ""systemically important financial institutions"" (SIFIs).The SIFI designation means regulators believe a collapse of the company could devastate the U.S. financial system just as much as the failure of a major bank and comes with increased regulatory oversight and capital requirements. Hancock, who said ""the whole world was somewhat surprised"" by the MetLife ruling, noted that AIG had shrunk its balance sheet, giving it a strong case to get its SIFI tag removed.AIG's mortgage insurance unit, United Guaranty Corp, filed for an initial public offering on Wednesday as part of AIG's plan to become smaller. The company also plans to sell its broker-dealer network. Activist investor Carl Icahn, who is AIG's fifth largest shareholder, has been pushing the insurer to become smaller and simpler to allow it to shed its label as a non-bank SIFI.General Electric Co's (GE.N) GE Capital, another non-bank, formally asked the U.S. government on Thursday to stop designating it a SIFI. Shares of AIG, which have fallen 12 percent so far this year, were little changed at $54.55 in premarket trading. (Reporting By Sudarshan Varadhan in Bengaluru; Editing by Ted Kerr)",2016-03-31,MET,"Thu Mar 31, 2016 | 9:32am EDT","UPDATE 2-AIG CEO says MetLife ""too big to fail"" ruling an opportunity",http://www.reuters.com//article/aig-regulations-idUSL3N17347L?type=companyNews
139,"  March 31 A judge's ruling that MetLife Inc  is not a ""too big to fail"" opens up an opportunity for American International Group Inc to also apply for exemption, AIG Chief Executive Peter Hancock said in an interview on CNBC on Thursday. Hancock said, however, that AIG was ""reserving judgment"" on whether to apply for exemption for now.            (Reporting By Sudarshan Varadhan in Bengaluru; Editing by Ted Kerr)  ",2016-03-31,MET,"Thu Mar 31, 2016 | 8:24am EDT",AIG CEO says MetLife ruling an opportunity for AIG,http://www.reuters.com//article/aig-regulations-idUSL3N17344Y?type=companyNews
140,"  March 31 (Reuters) -* AIG CEO Peter Hancock on Metlife ruling-i think the whole world was somewhat surprised- CNBC * AIG CEO to CNBC on applying for removal of SIFI designation:""certainly opens up the opportunity""; but reserving judgement for now * AIG CEO Hancock on SIFI - we prefer to work with our regulators - CNBC * AIG CEO Hancock on SIFI says has a strong case, has reduced  leverage - CNBC      (Bengaluru Newsroom)",2016-03-31,MET,"Thu Mar 31, 2016 | 8:24am EDT",BRIEF-AIG CEO Peter Hancock on Metlife ruling-i think the whole world was somewhat surprised- CNBC,http://www.reuters.com//article/idUSFWN1730FL?type=companyNews
141,"   By Lisa Lambert | WASHINGTON  WASHINGTON Federal regulators' decision to designate insurer MetLife Inc (MET.N) as ""too big to fail"" was ""arbitrary and capricious,"" the U.S. judge who struck down the determination last month wrote in an opinion that was unsealed on Thursday.The U.S. government plans to appeal the court decision, a Treasury spokesman said in a statement late on Thursday.Treasury Secretary Jack Lew said he strongly disagreed with the decision and the government would vigorously defend the work of the Financial Stability Oversight Council (FSOC), made up of several U.S. regulatory agency chiefs, which designated MetLife as a systemically important financial institution in 2014.The label has been given to four nonbank companies that the government considers would pose a risk to the financial system if they collapsed. MetLife, the largest U.S. life insurer, has said it was considering breaking up its business to shed the designation, which triggers more regulation.""This decision leaves one of the largest and most highly interconnected financial companies in the world subject to even less oversight than before the financial crisis,"" Lew said in a statement earlier on Thursday. ""I am confident that we will prevail.""  MetLife sued the U.S. government last year, saying FSOC used a secretive, flawed process in determining that it could hurt the U.S. financial system if it faces financial distress. On March 30, U.S. District Judge Rosemary Collyer rescinded the designation, but her opinion was put under seal until Thursday. FSOC said in its designation that the insurer could cause significant damage to the U.S. economy ""but never explained how it would result,"" Collyer wrote.""That assumption reflected a change in policy, one that was neither acknowledged nor explained in the final determination, and which was therefore arbitrary and capricious,"" she wrote.She added that during the designation process, FSOC ignored two of its own definitions of ""material financial distress"" and ""threat to the financial stability of the United States."" ""FSOC also focused exclusively on the presumed benefits of its designation and ignored the attendant costs, which is itself unreasonable,"" Collyer wrote. ""FSOC's unacknowledged departure from its guidance and express refusal to consider cost require the court to rescind the final determination.""Authority to designate U.S. nonbank companies as ""too big to fail"" is part of the Dodd-Frank Wall Street reform law passed after the 2008 financial crisis.Last week lender GE Capital, a unit of General Electric Co (GE.N), asked to have its designation removed, saying it had shrunk to the point where it would not pose a threat to the financial system if it experiences distress. Prudential Financial Inc (PRU.N), another insurer, said it was ""evaluating what is in the best interests of the company and our stakeholders.""American International Group Inc (AIG.N), which also has the label, received a $182 billion U.S. government bailout to avoid collapse in the thick of the financial crisis. AIG declined to comment on Collyer's decision.Lew said FSOC takes ""a deliberative and data-driven approach, relying on a careful analysis of available information, including intensive engagement with each company"" it designates.""In overturning the conclusions of experienced financial regulators, the court imposed new requirements that Congress never enacted, and contradicted key policy lessons from the financial crisis,"" he added. (Additional reporting by Sarah N. Lynch and Eric Walsh in Washington; Editing by Matthew Lewis, Richard Chang and Diane Craft)",2016-04-07,MET,"Thu Apr 7, 2016 | 8:01pm EDT","UPDATE 4-MetLife's 'too big to fail' tag is 'arbitrary, capricious' -U.S. judge",http://www.reuters.com//article/usa-metlife-idUSL2N17A1A8?type=companyNews
142,"  WASHINGTON, April 7 The U.S. government will appeal a district court's decision to rescind the designation by a government regulator of insurer MetLife Inc as ""too big to fail,"" a Treasury Department spokesman said on Thursday.   (Reporting by Eric Walsh)   ",2016-04-07,MET,"Thu Apr 7, 2016 | 7:39pm EDT",U.S. to appeal court decision to rescind Metlife's 'too big to fail' tag,http://www.reuters.com//article/usa-metlife-appeal-idUSL2N17A2DJ?type=companyNews
143,"  WASHINGTON, April 7 Obama administration sources familiar with the lawsuit over the designation of MetLife as ""too big to fail"" said on Thursday they believe that a U.S. government appeal of the decision in the case is likely.Last month, a U.S. judge rescinded the federal government's designation of the major insurer as ""systemically important,"" saying the government's decision was ""arbitrary and capricious.""  U.S. Treasury Secretary Jack Lew on Thursday said the government would vigorously defend its authority to label nonbank firms, saying ""the court imposed new requirements that Congress never enacted, and contradicted key policy lessons from the financial crisis.""   (Reporting by Lisa Lambert; Editing by David Gregorio) ",2016-04-07,MET,"Thu Apr 7, 2016 | 2:09pm EDT",U.S. seen appealing MetLife exemption from 'too big to fail',http://www.reuters.com//article/usa-metlife-appeal-idUSL2N17A1FN?type=companyNews
144,"  WASHINGTON, April 7 U.S. Treasury Secretary Jack Lew on Thursday criticized a federal court for striking down as ""arbitrary and capricious"" a decision by regulators to subject MetLife to toughened regulation as a ""systemically important"" financial firm. ""In overturning the conclusions of experienced financial regulators, the court imposed new requirements that Congress never enacted, and contradicted key policy lessons from the financial crisis,"" Lew said in a written statement.   (Reporting by Timothy Ahmann; Editing by Andrea Ricci)  ",2016-04-07,MET,"Thu Apr 7, 2016 | 1:09pm EDT",U.S. Treasury chief assails court opinion on Metlife,http://www.reuters.com//article/usa-metlife-treasury-idUSL2N17A19W?type=companyNews
145,"   By Lisa Lambert  Federal regulators' decision to designate major insurer Metlife as ""too big to fail"" was ""arbitrary and capricious,"" the U.S. judge who struck down the determination last month wrote in an opinion that was unsealed on Thursday.MetLife sued the U.S. government, saying the Financial Stability Oversight Council (FSOC), made up of the heads of the country's financial regulatory agencies, used a secretive and flawed process when in 2014 it designated the company as a systemically important financial institution. On March 30, U.S. District Judge Rosemary Collyer rescinded the designation, but her opinion was put under seal until Thursday.FSOC had said in its designation that the insurer could cause significant damage to the U.S. economy if it experienced financial distress, Collyer wrote. ""The final designation assumed such damage but never explained how it would result,"" she wrote. ""That assumption reflected a change in policy, one that was neither acknowledged nor explained in the final determination, and which was therefore arbitrary and capricious."" ",2016-04-07,MET,"Thu Apr 7, 2016 | 11:49am EDT",U.S. judge: designating Metlife systemically important 'arbitrary and capricious',http://www.reuters.com//article/usa-metlife-idUSL2N17A13U?type=companyNews
146,"  WASHINGTON, April 7 Federal regulators' decision to designate major insurer Metlife as ""too big to fail"" was ""arbitrary and capricious,"" the U.S. judge who struck down the determination last month wrote in an opinion that was unsealed on Thursday.MetLife sued the U.S. government, saying the Financial Stability Oversight Council (FSOC), made up of the heads of the country's financial regulatory agencies, used a secretive and flawed process when in 2014 it designated the company as a systemically important financial institution.On March 30, U.S. District Judge Rosemary Collyer rescinded the designation, but her opinion was put under seal until Thursday. FSOC had said in its designation that the insurer could cause significant damage to the U.S. economy if it experienced financial distress, Collyer wrote. ""The final designation assumed such damage but never explained how it would result,"" she wrote. ""That assumption reflected a change in policy, one that was neither acknowledged nor explained in the final determination, and which was therefore arbitrary and capricious."" (Reporting by Lisa Lambert; Editing by Chizu Nomiyama)",2016-04-07,MET,"Thu Apr 7, 2016 | 11:40am EDT","U.S. judge: designating Metlife systemically important ""arbitrary and capricious""",http://www.reuters.com//article/usa-metlife-idUSL2N17A10X?type=companyNews
147,"   By Lisa Lambert | WASHINGTON  WASHINGTON The U.S. government on Friday appealed a court decision that major insurer MetLife cannot be considered ""too big to fail"" in the United States Court of Appeals for the District of Columbia, according to a filing. U.S. Treasury Secretary Jack Lew had said he strongly disagreed with the decision and the government would vigorously defend the work of the Financial Stability Oversight Council (FSOC), made up of several U.S. regulatory agency chiefs, which designated MetLife as a systemically important financial institution in 2014. The designation triggers additional oversight and capital requirements. ""We plan to vigorously defend Judge Collyer's carefully reasoned opinion,"" said Chris Stern, a spokesman for MetLife. MetLife sued the U.S. government last year, saying FSOC used a secretive, flawed process in determining that it could hurt the U.S. financial system if it faces financial distress. On March 30, U.S. District Judge Rosemary Collyer rescinded the designation.",2016-04-08,MET,"Fri Apr 8, 2016 | 1:54pm EDT",U.S. government appeals court decision in MetLife 'too big to fail' case,http://www.reuters.com//article/usa-metlife-appeal-idUSL2N17B1ET?type=companyNews
