,Article,Date,Symbol,Time,Title,Url
9,"  (Adds details)By Andrea ShalalWASHINGTON, Sept 24 Lockheed Martin Corp  said on Thursday that U.S. officials have approved its $9 billion takeover of Black Hawk helicopter maker Sikorsky Aircraft from United Technologies Corp.In a filing with the U.S. Securities and Exchange Commission, the company said authorities in Japan and South Korea had also approved the deal, but it was waiting for other regulatory approvals.Multiple sources familiar with the matter said Lockheed was now likely to close the acquisition well before the end of the year, as initially expected.When it announced the deal on July 20, Lockheed said it did not anticipate major hurdles, and expected to close the transaction by late in the fourth quarter of 2015 or early 2016. The regulatory process has moved along more smoothly than expected, said the sources, who declined to be identified because they were not authorized to speak publicly.The U.S. Justice Department led the review, with input from the Pentagon and other federal agencies. The deal must still win regulatory approval from the European Union, China and a host of other countries where one or both companies have business interests.""Things are tracking well,"" said one source.The acquisition would open key foreign markets for Lockheed, which has annual revenues of $45 billion, and already dwarfs its nearest competitors, the defense businesses of Boeing Co  and Northrop Grumman Corp. Lockheed is also reviewing the sale or spinoff of $6 billion in businesses in its Information Systems & Government Services unit.If the Sikorsky deal is approved, Lockheed has said it plans to fold the company into its Mission Systems & Training (MST) operation, creating a division with about $15 billion in annual revenues.The services businesses it plans to keep will also become part of MST.Sikorsky will be Lockheed's largest acquisition since it bought Loral Corp's defense electronics business for $9.1 billion in 1996, and merged with Martin Marietta in 1994 in a $10 billion deal.   (Editing by Alden Bentley and Jeffrey Benkoe)",2015-09-24,MLM,"Thu Sep 24, 2015 | 8:48am EDT",UPDATE 1-Lockheed says U.S. approves its $9 bln takeover of Sikorsky,http://www.reuters.com//article/sikorsky-ma-lockheed-idUSL1N11U0Q220150924?type=companyNews
10,"  May 5 Martin Marietta Materials Inc* Q1 earnings per share $0.69* Q1 earnings per share view $0.36 -- Thomson Reuters I/B/E/S* Sees 2016 consolidated net sales $3.5 billion - $3.7 billion * Sees 2016 capital expenditures $350 million -  $350 million * Full-Year EBITDA guidance to $1.00 billion to $1.05 billion* Qtrly consolidated net sales $734.0 million versus  $631.9 million * Fy2016 earnings per share view $6.68, revenue view $3.58 billion -- Thomson Reuters I/B/E/S* Q1 revenue view $657.5 million -- Thomson Reuters I/B/E/S  Source text for Eikon:  Further company coverage:    (Reporting By Siddharth Cavale)",2016-05-05,MLM,"Thu May 5, 2016 | 9:20am EDT",BRIEF-Martin Marietta reports Q1 EPS $0.69,http://www.reuters.com//article/idUSASC08N8O?type=companyNews
11,"  Aug 2 Martin Marietta Materials Inc* And bottom-line growth for a record second quarter* Qtrly consolidated net sales $915.4 million versus $850.2 million * Fy2016 revenue view $3.70 billion -- Thomson Reuters I/B/E/S * Q2 earnings per share $1.90 * Q2 earnings per share view $2.00, revenue view $946.7 million -- Thomson Reuters I/B/E/S* Sees FY 2016 Consolidated Net Sales In Range Of $3.5 - $3.7 Bln   Source text for Eikon:  Further company coverage:    (Bengaluru Newsroom +1-646-223-8780)",2016-08-02,MLM,"Tue Aug 2, 2016 | 8:17am EDT",BRIEF-Martin Marietta Q2 earnings per share $1.90,http://www.reuters.com//article/idUSASC08ZXG?type=companyNews
12,"  Sept 30 (Reuters) -* Martin Marietta Materials says co, unit Martin Marietta Funding LLC entered into amendment to credit agreement with suntrust bank as of Apr 19, 2013 * Martin Marietta says credit and security agreement was extended and, as amended, is scheduled to terminate on September 27, 2017 - SEC filing  * Martin Marietta Materials Inc says effective with seventh amendment to credit and security agreement, the facility limit was increased to $300 million  Source - bit.ly/2d1RPi3",2016-09-30,MLM,"Fri Sep 30, 2016 | 3:15pm EDT","BRIEF-Martin Marietta - Co, unit enter into amendment to credit agreement",http://www.reuters.com//article/idUSFWN1C60TE?type=companyNews
13,"  Nov 1 Martin Marietta Materials Inc* Says for public sector, continued modest growth is expected in 2016* Qtrly consolidated net sales $ 1.038 billion  $ 1.005 billion * Martin marietta delivers record third-quarter performance * Q3 earnings per share $2.49 * Q3 earnings per share view $2.61 -- Thomson Reuters I/B/E/S  Source text for Eikon:  Further company coverage:",2016-11-01,MLM,"Tue Nov 1, 2016 | 8:18am EDT",BRIEF-Martin Marietta Materials	Q3 earnings per share $2.49,http://www.reuters.com//article/idUSASC09EOV?type=companyNews
