,Article,Date,Symbol,Time,Title,Url
71,"  (Adds outlook, estimate)Nov 5 Canadian fertilizer and farm retail dealer Agrium Inc  reported a nearly 9 percent rise in quarterly profit, helped by lower costs.However, the company on Thursday narrowed its forecast for 2015 profit to $7.10 to $7.40 per share from $7.00-$7.50. Weaker currencies in fertilizer-buying markets such as Brazil and India are weighing down prices, leading rivals Potash Corp of Saskatchewan and Mosaic Co to curb potash production amid falling sales and profits.Agrium has focused on lowering operational costs and has benefited from low costs of natural gas, a key ingredient in nitrogen fertilizer production. Expenses fell nearly 10 percent to $505 million in the third quarter ended Sept. 30, from a year earlier. The company's net earnings from continuing operations rose 9 percent to $99 million, or 72 cents per share.Sales fell 13.6 percent to $2.52 billion.   (Reporting by Rod Nickel in Winnipeg, Manitoba and Sneha Banerjee in Bengaluru; Editing by Maju Samuel)",2015-11-05,MOS,"Thu Nov 5, 2015 | 7:50am EST",UPDATE 1-Fertilizer maker Agrium's profit rises nearly 9 pct,http://www.reuters.com//article/agrium-results-idUSL3N1304U920151105?type=companyNews
72,"   By Rod Nickel  The suspension of production at an eastern Canadian mine may lead Potash Corp of Saskatchewan Inc to shelve plans to build a new West Coast shipping terminal with partners Mosaic Co and Agrium Inc, Potash Chief Executive Jochen Tilk said on Thursday.Canpotex Ltd, owned by the three companies, has been considering construction of the terminal at Prince Rupert, British Columbia. Potash said on Tuesday it would shut its newest mine, Picadilly, in New Brunswick, due to weak market conditions. The company also said its storage and loading facilities at Saint John, New Brunswick, with capacity of handling 2.5 million tonnes annually, could now be used by Canpotex. It ships potash offshore that Potash Corp, Mosaic and Agrium produce in the western province of Saskatchewan.The decision allows Canpotex to ""indefinitely defer"" a decision on the C$900 million Prince Rupert terminal, Tilk told a CIBC investor conference in Whistler, British Columbia.""We certainly dont anticipate making that decision in the next 10 years, so were very good with our port facilities on the West Coast and on the East Coast,"" he said. Canpotex has made no final decision about the Prince Rupert terminal, said Chief Executive Ken Seitz.With port facilities in New Brunswick now available, Canpotex is reviewing its supply-chain strategy, he said. The review will include looking at the Prince Rupert terminal's feasibility, with a decision likely this year, Seitz said. Tilk also said Potash Corps board of directors would discuss the companys dividend next week. Analysts have speculated that Potash will reduce its dividend. (Reporting by Rod Nickel in Winnipeg, Manitoba; Editing by Meredith Mazzilli and Tom Brown)",2016-01-21,MOS,"Thu Jan 21, 2016 | 6:17pm EST",UPDATE 1-Potash Corp mine closure may shelve Canpotex port plans -CEO,http://www.reuters.com//article/potashcorp-ports-idUSL2N155360?type=companyNews
73,"  (Adds portfolio manager comment; updates prices)* TSX ends up 192.75 points, or 1.63 percent, at 12,035.86* Half of TSX's 10 main groups rise; 3 gainers for every fallerBy Alastair SharpTORONTO, Jan 21 Canada's main stock index gained on Thursday, interrupting a sustained down trend, as energy stocks surged and oil prices rebounded from near 12-year lows.Canadian Natural Resources, one of the country's biggest oil and gas producers, jumped 8.4 percent to C$24.82, while pipeline company Enbridge Inc gained 8.3 percent to C$44.66. The overall group rose 5.2 percent. ""The big story is a pop back in energy,"" said John Stephenson, president at Stephenson & Company Capital Management. ""Then (European Central Bank Governor) Mario Draghi was very positive on the likely actions of the ECB, so that was a big plus for markets, so as a result we have got a bit of relief in our otherwise downward trend.""The ECB's Draghi hinted of additional stimulus measures as early as March, citing concerns over China and emerging markets, volatility in financial and commodity markets and geopolitical risks.Canadian banks and consumer stocks also rose, while miners and railways weighed. Potash Corp fell 3.3 percent to C$22.80, after the fertilizer producer said it may defer plans to build a new West Coast shipping terminal with partners Mosaic Co and Agrium Inc. Agrium shares lost 1.5 percent to C$123.52.The Toronto Stock Exchange's S&P/TSX composite index  ended up 192.75 points, or 1.63 percent, at 12,035.86.Half of its 10 main groups were higher, with advancers outnumbering decliners by less than 3 to 1. The index hit its lowest level since August 2012 on Wednesday and is down almost 10 percent since Christmas.Depressed crude oil prices have weighed on the resource-linked market, including fears that Canadian banks will take a hit to profit in 2016, as more corporate loans sour, oil and gas capital raising dries up and job losses take a toll on banks' consumer arms.Canadian Pacific Railway Ltd fell 0.9 percent to C$149.84, paring much sharper early losses after it missed profit expectations on lower freight volumes.Bombardier fell 9.2 percent to C$1.09 after United Airlines agreed to buy 40 small planes from Boeing Co, a blow for the Canadian plane and train maker, which has sought a major customer to give momentum to its fledgling CSeries jets.Royal Bank of Canada advanced 1.8 percent to C$66.83 after British insurer Aviva said it would buy RBC's general insurance arm for C$582 million ($403 million).     (Additional reporting by Fergal Smith; Editing by W Simon and Chris Reese)",2016-01-21,MOS,"Thu Jan 21, 2016 | 4:41pm EST","CANADA STOCKS-TSX bucks downtrend, rises as energy stocks bounce",http://www.reuters.com//article/canada-stocks-idUSL2N1552VM?type=companyNews
74,"   By Rod Nickel  Jan 21 Potash Corp of Saskatchewan's   decision this week to suspend production at an Eastern Canadian mine may lead to it shelving plans to build a new West Coast shipping terminal with partners Mosaic Co and Agrium Inc, Potash Chief Executive Jochen Tilk said on Thursday.Canpotex Ltd, owned by the three companies, has been considering construction of the terminal at Prince Rupert, British Columbia.Potash said on Tuesday it would shut its newest mine, Picadilly, in New Brunswick, due to weak market conditions. The company also said its storage and loading facilities at Saint John, New Brunswick, with capacity of handling 2.5 million tonnes annually, could now be used by Canpotex.It ships potash offshore that Potash Corp, Mosaic and Agrium produce in the western province of Saskatchewan. The decision allows Canpotex to ""indefinitely defer"" a decision on the C$900 million Prince Rupert terminal, Tilk said at a CIBC investor conference in Whistler, British Columbia.""We certainly don't anticipate making that decision in the next 10 years, so we're very good with our port facilities on the West Coast and on the East Coast,"" he said. Potash spokeswoman Denita Stann said after Tilk's comments that he was speaking about options available to Canpotex and that it had not concluded any decision.Canpotex could not be immediately reached.Tilk also said Potash Corp's board of directors would discuss the company's dividend next week. Analysts have speculated that Potash will reduce its dividend.   (Reporting by Rod Nickel in Winnipeg, Manitoba; Editing by Meredith Mazzilli)",2016-01-21,MOS,"Thu Jan 21, 2016 | 3:44pm EST",Potash Corp mine closure may lead to shelving Canpotex port plans -CEO,http://www.reuters.com//article/potashcorp-ports-idUSL2N1552GX?type=companyNews
75,"  WINNIPEG, Manitoba U.S.-based fertilizer producer Mosaic Co said on Wednesday it would cut output of phosphates by up to 400,000 tonnes with rotating plant shutdowns in the first quarter, due to weak demand.Fertilizer producers have seen profits hit by falling prices, triggered in part by weak currencies in importing countries such as Brazil.""The long-term positive outlook for phosphates has not changed, but we are adjusting our production levels to match immediate demand and manage our margins,"" said Mosaic Chief Executive Officer Joc O'Rourke, in a statement.Most of Mosaic's phosphate operations are in Florida. In October, Mosaic laid off 8 percent of its workforce at a Canadian potash mine and last month Potash Corp of Saskatchewan said it would shut in its newest potash mine, in eastern Canada. Mosaic shares rose slightly on the New York Stock Exchange after normal trading hours. During the session, they had spiked 8.3 percent in a short-covering rally in some mining stocks.Mosaic is the world's largest producer of finished phosphate products and North America's second-biggest potash producer.  (Reporting by Rod Nickel in Winnipeg, Manitoba; Editing by David Gregorio)",2016-02-03,MOS,"Wed Feb 3, 2016 | 5:31pm EST",Fertilizer maker Mosaic cuts phosphate production,http://www.reuters.com//article/us-mosaic-phosphates-idUSKCN0VC2T3?type=companyNews
76,"   By Kanika Sikka and Rod Nickel  U.S. fertilizer company Mosaic Co (MOS.N), grappling with falling prices and profits, is looking for acquisitions that could be bargain-priced in a weak commodity sector. The world's largest producer of finished phosphate products on Thursday forecast lower selling prices for potash and phosphate in the current quarter. The Plymouth, Minnesota-based company also reported fourth-quarter profit that fell less than expected, and announced a $75 million share repurchase program.Its shares jumped nearly 5 percent in early trading on the New York Stock Exchange.Chief Executive Joc O'Rourke said the company is interested in acquisitions related to either potash or phosphate, but would weigh any opportunities against the benefits of further repurchases of its stock, which has fallen about 50 percent over the past year.""The down parts of the (commodity) cycle do present opportunities,"" Chief Financial Officer Rich Mack said on a call with analysts. ""If there is something that is extraordinarily compelling, it's something that we could act on."" Fertilizer producers' profits have been hit by falling prices, largely due to weak currencies in countries such as Brazil and low grain prices. Falling currency values against the U.S. dollar have lowered production costs 17 percent in Canada, where Mosaic's largest potash mines are located, but the savings amount to 41 percent in Belarus, where potash rival Belaruskali operates, Mosaic said.It expects phosphate prices to fall as much as 14.6 percent to $350 per ton in the current quarter and potash prices to fall as much as 21 percent. Mosaic forecast global phosphate shipments in 2016 of 65 million to 67 million tonnes, up from 64.4 million last year, according to BMO Nesbitt Burns. Potash shipments look slightly lower this year at 58 million to 60 million tonnes, down from 60.7 million in 2015.The company said last week that it would cut output of phosphates by up to 400,000 tonnes in the first quarter, due to weak demand.Adjusted earnings per share was 53 cents, compared with average analysts' estimates of 44 cents per share, according to Thomson Reuters I/B/E/S. Fourth-quarter net earnings fell to $155 million, or 44 cents per share, in the fourth quarter ended Dec. 31, from $360.7 million, or 97 cents per share, a year earlier.Net sales fell 9 percent to $2.16 billion. (Reporting by Rod Nickel in Winnipeg, Manitoba and Kanika Sikka in Bengaluru; Editing by Sriraj Kalluvila, Shounak Dasgupta and Dan Grebler)",2016-02-11,MOS,"Thu Feb 11, 2016 | 10:48am EST",Mosaic looks for bargain buys as fertilizer sector slumps,http://www.reuters.com//article/us-mosaic-results-idUSKCN0VK13E?type=companyNews
77,"   By Kanika Sikka and Rod Nickel  U.S. fertilizer company Mosaic Co (MOS.N), grappling with falling prices and profits, is looking for acquisitions that could be bargain-priced in a weak commodity sector. The world's largest producer of finished phosphate products on Thursday forecast lower selling prices for potash and phosphate in the current quarter. The Plymouth, Minnesota-based company also reported fourth-quarter profit that fell less than expected, and announced a $75 million share repurchase program.Its shares jumped nearly 5 percent in early trading on the New York Stock Exchange.Chief Executive Joc O'Rourke said the company is interested in acquisitions related to either potash or phosphate, but would weigh any opportunities against the benefits of further repurchases of its stock, which has fallen about 50 percent over the past year.""The down parts of the (commodity) cycle do present opportunities,"" Chief Financial Officer Rich Mack said on a call with analysts. ""If there is something that is extraordinarily compelling, it's something that we could act on."" Fertilizer producers' profits have been hit by falling prices, largely due to weak currencies in countries such as Brazil and low grain prices. Falling currency values against the U.S. dollar have lowered production costs 17 percent in Canada, where Mosaic's largest potash mines are located, but the savings amount to 41 percent in Belarus, where potash rival Belaruskali operates, Mosaic said.It expects phosphate prices to fall as much as 14.6 percent to $350 per ton in the current quarter and potash prices to fall as much as 21 percent. Mosaic forecast global phosphate shipments in 2016 of 65 million to 67 million tonnes, up from 64.4 million last year, according to BMO Nesbitt Burns. Potash shipments look slightly lower this year at 58 million to 60 million tonnes, down from 60.7 million in 2015.The company said last week that it would cut output of phosphates by up to 400,000 tonnes in the first quarter, due to weak demand.Adjusted earnings per share was 53 cents, compared with average analysts' estimates of 44 cents per share, according to Thomson Reuters I/B/E/S. Fourth-quarter net earnings fell to $155 million, or 44 cents per share, in the fourth quarter ended Dec. 31, from $360.7 million, or 97 cents per share, a year earlier.Net sales fell 9 percent to $2.16 billion. (Reporting by Rod Nickel in Winnipeg, Manitoba and Kanika Sikka in Bengaluru; Editing by Sriraj Kalluvila, Shounak Dasgupta and Dan Grebler)",2016-02-11,MOS,"Thu Feb 11, 2016 | 10:48am EST",UPDATE 2-Mosaic looks for bargain buys as fertilizer sector slumps,http://www.reuters.com//article/mosaic-results-idUSL3N15Q2GL?type=companyNews
78,"  Feb 11 U.S. fertilizer company Mosaic Co , the world's largest producer of finished phosphate products, reported a quarterly profit that more than halved due to lower prices.The company's net earnings fell to $155 million, or 44 cents per share, in the fourth quarter ended Dec. 31, from $360.7 million, or 97 cents per share, a year earlier.  Net sales fell 9 percent to $2.16 billion.   (Reporting by Rod Nickel in Winnipeg, Manitoba and Kanika Sikka in Bengaluru; Editing by Sriraj Kalluvila) ",2016-02-11,MOS,"Thu Feb 11, 2016 | 7:04am EST",Fertilizer company Mosaic's quarterly profit halves,http://www.reuters.com//article/mosaic-results-idUSL3N15Q2E0?type=companyNews
79,  April 6 Mosaic Co * Says CEO James O' Rourke's 2015 total compensation was $5.7 million versus $5.9 million in 2014 - SEC filing  Source text for Eikon:  Further company coverage:    (Bengaluru Newsroom: +1-646-223-8780)  ,2016-04-06,MOS,"Wed Apr 6, 2016 | 6:24am EDT",BRIEF-Mosaic says CEO James O' Rourke's 2015 total compensation was $5.7 mln vs $5.9 mln in 2014,http://www.reuters.com//article/idUSFWN17909I?type=companyNews
80,"   By Nichola Groom  Solar Mosaic Inc, a former crowdfunding startup that reinvented itself as a provider of home solar loans, said on Wednesday it had secured $200 million in funding that will support at least 5,000 rooftop installations.Germany's DZ Bank and New York state's NY Green Bank provided the warehouse financing to the Oakland, California-based company, which goes by Mosaic.The announcement marks the largest funding to date for Mosaic, which in the last two years has grown into the nation's top loan provider for residential solar installations, Chief Executive Billy Parish said in an interview.The company offers its loans through some of the top U.S. solar installers, including Vivint Solar, SunPower Corp and NRG Energy Inc.Mosaic's average loan amount is $30,000, Parish said. The loans can be structured to be paid over 10, 15, 20 or 25 years, with interest rates between 2.49 percent and 7.99 percent. Customers are saving 15 percent on their electricity bills, on average, he added.Founded five years ago, Mosaic first grabbed headlines as a scrappy solar financing company that raised money from retail investors who put up as little as $25 to fund commercial solar projects.By 2014, however, the company had shifted its focus to the fast-growing residential sector and raising funds from institutional investors. Two years later, Mosaic said it aims to originate $1 billion in home solar loans in the next year.The U.S. residential solar market has grown dramatically over the last decade thanks mainly to financing schemes like leases and power purchase agreements pioneered by SolarCity Corp and Sunrun Inc. In the last three years, however, loans have grown in popularity. With a loan, a homeowner owns the rooftop solar system outright and can claim generous federal tax credits. With a lease or PPA, the system is owned by a third party, such as a bank, that claims the tax credit.Mosaic has made strides in an area of the market in which SolarCity, the top U.S. solar installer, has stumbled. The company recently stopped offering the loan product it introduced in 2014 after it received criticism for its complex payment structure, which fluctuated depending on the amount of energy the system produced. It also had a lengthy 30-year term.SolarCity could still emerge as a formidable competitor, however. A company spokesman, Jonathan Bass, said SolarCity's next generation of loans would have multiple term options and a fixed payment schedule. (Reporting by Nichola Groom in Los Angeles; Editing by Matthew Lewis)",2016-04-27,MOS,"Wed Apr 27, 2016 | 1:59pm EDT",Mosaic raises $200 million for U.S. home solar loans,http://www.reuters.com//article/us-solarmosaic-funding-idUSKCN0XO2BJ?type=companyNews
81,"   By Nichola Groom  Solar Mosaic Inc, a former crowdfunding startup that reinvented itself as a provider of home solar loans, said on Wednesday it had secured $200 million in funding that will support at least 5,000 rooftop installations.Germany's DZ Bank and New York state's NY Green Bank provided the warehouse financing to the Oakland, California-based company, which goes by Mosaic.The announcement marks the largest funding to date for Mosaic, which in the last two years has grown into the nation's top loan provider for residential solar installations, Chief Executive Billy Parish said in an interview.The company offers its loans through some of the top U.S. solar installers, including Vivint Solar, SunPower Corp and NRG Energy Inc.Mosaic's average loan amount is $30,000, Parish said. The loans can be structured to be paid over 10, 15, 20 or 25 years, with interest rates between 2.49 percent and 7.99 percent. Customers are saving 15 percent on their electricity bills, on average, he added.Founded five years ago, Mosaic first grabbed headlines as a scrappy solar financing company that raised money from retail investors who put up as little as $25 to fund commercial solar projects.By 2014, however, the company had shifted its focus to the fast-growing residential sector and raising funds from institutional investors. Two years later, Mosaic said it aims to originate $1 billion in home solar loans in the next year.The U.S. residential solar market has grown dramatically over the last decade thanks mainly to financing schemes like leases and power purchase agreements pioneered by SolarCity Corp and Sunrun Inc. In the last three years, however, loans have grown in popularity. With a loan, a homeowner owns the rooftop solar system outright and can claim generous federal tax credits. With a lease or PPA, the system is owned by a third party, such as a bank, that claims the tax credit.Mosaic has made strides in an area of the market in which SolarCity, the top U.S. solar installer, has stumbled. The company recently stopped offering the loan product it introduced in 2014 after it received criticism for its complex payment structure, which fluctuated depending on the amount of energy the system produced. It also had a lengthy 30-year term.SolarCity could still emerge as a formidable competitor, however. A company spokesman, Jonathan Bass, said SolarCity's next generation of loans would have multiple term options and a fixed payment schedule. (Reporting by Nichola Groom in Los Angeles; Editing by Matthew Lewis)",2016-04-27,MOS,"Wed Apr 27, 2016 | 1:59pm EDT",Mosaic raises $200 million for U.S. home solar loans,http://www.reuters.com//article/solarmosaic-funding-idUSL2N17S1OG?type=companyNews
82,"  U.S. fertilizer company Mosaic Co (MOS.N) forecast higher phosphate and potash sales for the current quarter after it reported higher-than-expected first quarter sales.The company's net sales fell 21.7 percent in the first quarter to $1.67 billion, but beat the average analyst estimate of $1.56 billion.Mosaic's Brazil unit said in March that the country's fertilizer sales had doubled in the first 10 weeks, compared with the volume seen in a similar period in 2015, with sales reaching 7.5 million tonnes considering deals from all suppliers.Plymouth, Minnesota-based Mosaic forecast current-quarter phosphate sales of 2.3 million to 2.6 million tonnes, higher than the 2.2 million tonnes it sold in the first quarter. The company said it expected potash sales of 1.9 million to 2.2 million tonnes in the current quarter, higher than the 1.5 million tonnes it sold in the first quarter.Larger rival Potash Corp of Saskatchewan (POT.TO) (POT.N) last month reported an 80 percent drop in profit and cut its full-year profit forecast on weak demand and lower prices. Mosaic, which cut 8 percent of its workforce at a Canadian mine in October, on Wednesday lowered its 2016 capital expenditures to the range of $800 million to $900 million from its previous estimate of $0.9 billion to $1.1 billion.Net profit attributable to the world's largest producer of finished phosphate products fell nearly 13 percent to $256.8 million, or 73 cents per share, in the first quarter ended March 31 from a year earlier. Excluding items, it earned 14 cents per share, in line with analysts' average estimate, according to Thomson Reuters I/B/E/S. (Reporting by Manish Parashar in Bengaluru and Rod Nickel in Winnipeg, Manitoba; Editing by Maju Samuel)",2016-05-04,MOS,"Wed May 4, 2016 | 7:20am EDT",Fertilizer company Mosaic's sales beat estimates,http://www.reuters.com//article/us-mosaic-results-idUSKCN0XV121?type=companyNews
83,"  May 4 Mosaic Co* The mosaic company reports first quarter 2016 results* Q1 earnings per share $0.73* Q1 sales $1.7 billion versus $2.1 billion* Net sales in phosphates segment were $909 million for q1, down from $1.2 billion last year* Q1 phosphate sales volumes 2.2 million tonnes versus 2.3 million tonnes last year* ""while outlook for first half of 2016 is muted, we see stronger markets and anticipate better results in second half""* Total sales volumes for phosphates segment are expected to range from 2.3 to 2.6 million tonnes for q2 of 2016* Mosaic's realized dap price, fob plant, is estimated to range from $335 to $355 per tonne for q2 of 2016 * Sees 2016 potash sales volumes range to 7.5 to 8.0 million tonnes* Mosaic's q2 potash gross margin rate in segment is expected to be in mid-to-high teens, excluding crt* Mosaic co sees phosphates sales volumes range to 9 to 9.75 million tonnes in 2016, down from a range of 9 to 10 million tonnes* Total sales volumes for international distribution segment are expected to range from 1.4 to 1.6 million tonnes for q2 of 2016* Qtrly phosphate operating earnings were negatively impacted by lower phosphate prices, as well as related production curtailments * Expect conditions to improve during second half of 2016, with global phosphate shipments accelerating and profitability improving* Qtrly shipment volumes were at low end of our expectations and we operated our facilities at reduced rates* Net sales in potash segment totaled $394 million for q1, down from $653 million last year* Q1 diammonium phosphate (dap) average selling price per tonne $355 per tonne versus $458 per tonne last year * Total sales volumes for potash segment are expected to range from 1.9 to 2.2 million tonnes for q2* Sees 2016 capital expenditures range to $800 to $900 million , down from $0.9 to $1.1 billion* Mosaic's q2 realized mop price, fob plant, is estimated to range from $180 to $200 per tonne* Phosphates segment gross margin rate in q2 estimated to be around 10 percent, and operating rate is expected to be approximately 80 percent* Q1 earnings per share view $0.14, revenue view $1.56 billion -- Thomson Reuters I/B/E/S* Sees 2016 international distribution sales volumes in range of 6 to 7 million tonnes* Potash market is off to a slow start in 2016 with delayed buying activity, particularly in china and india* Qtrly adjusted earnings per share $0.14  Source text for Eikon:  Further company coverage:    (Bengaluru Newsroom: +1-646-223-8780)",2016-05-04,MOS,"Wed May 4, 2016 | 6:46am EDT",BRIEF-The Mosaic Company Q1 earnings per share $0.73,http://www.reuters.com//article/idUSASC08MKO?type=companyNews
