,Article,Date,Symbol,Time,Title,Url
0,"  The U.S. Department of Justice has approved Mosaic Co's (MOS.N) $1.4 billion purchase of CF Industries' (CF.N) Florida phosphate business, Mosaic said on Wednesday.The deal, which still requires other regulatory approvals, gives Mosaic, the world's biggest producer of phosphate fertilizer products, a bigger hold on North American sales, and some analysts speculated that it may raise competition concerns.The price includes $200 million to cover the closure and long-term care of phosphogypsum stacks, a radioactive by-product of phosphate production, under CF's current Florida operations. Minnesota-based Mosaic, which operates other phosphate facilities nearby, would acquire the South Pasture phosphate mine and plant, a phosphate manufacturing plant and ammonia terminal and warehouse facilities. Once the deal closes, Illinois-based CF will focus on nitrogen production. Mosaic and CF shares dipped slightly after normal trading hours.(Reporting by Rod Nickel in Winnipeg, Manitoba; Editing by Nick Zieminski)",2014-01-15,MOS,"Wed Jan 15, 2014 | 5:00pm EST",U.S. Justice Department clears Mosaic-CF Industries deal,http://www.reuters.com//article/us-mosaic-cfindustries-doj-idUSBREA0E1NB20140115?type=companyNews
1,"  Jan 15 The U.S. Department of Justice has approved Mosaic Co's $1.4 billion purchase of CF Industries' Florida phosphate business, Mosaic said on Wednesday.The deal, which still requires other regulatory approvals, gives Mosaic, the world's biggest producer of phosphate fertilizer products, a bigger hold on North American sales, and some analysts speculated that it may raise competition concerns.The price includes $200 million to cover the closure and long-term care of phosphogypsum stacks, a radioactive by-product of phosphate production, under CF's current Florida operations. Minnesota-based Mosaic, which operates other phosphate facilities nearby, would acquire the South Pasture phosphate mine and plant, a phosphate manufacturing plant and ammonia terminal and warehouse facilities. Once the deal closes, Illinois-based CF will focus on nitrogen production. Mosaic and CF shares dipped slightly after normal trading hours.",2014-01-15,MOS,"Wed Jan 15, 2014 | 4:59pm EST",U.S. Justice Department clears Mosaic-CF Industries deal,http://www.reuters.com//article/mosaic-cfindustries-doj-idUSL2N0KP20K20140115?type=companyNews
2,"  By Rod Nickel     Feb 11 Mosaic Co offered an encouraging outlook and announced a big share buyback on Tuesday, buoying the U.S. fertilizer company's stock even as it reported a 79 percent plunge in quarterly profit, a sharper decline than expected.    Last summer's breakup of the Belarusian Potash Co - one of the world's two dominant potash traders - caused a sharp drop in the price of the crop nutrient potash and a slide in grain prices has also weighed down phosphate. The lower prices dragged down Mosaic's profit in the fourth quarter.     Even so, Mosaic shares jumped 3.2 percent to $48.33 in early New York trading, as it said it would buy $1 billion in shares, topping up a $2 billion buyback announced in December.     ""You've got to like that,"" said Jim Llewellyn, portfolio manager at WorldCommodity Fund, a small investor in Mosaic. ""I wouldn't worry about the earnings.""     More importantly than the earnings miss is guidance for the current quarter that looks strong, Scotiabank analyst Ben Isaacson said in a note.     Mosaic forecast first-quarter phosphate sales volumes of 2.3 to 2.6 million tonnes, down from 2.7 million tonnes a year ago. It expects to earn a realized diammonium phosphate price of $390 to $420 per tonne, topping the fourth-quarter price.     Potash sales volumes look to range between 2.3 and 2.7 million tonnes in the current first quarter, Mosaic said, up from 2 million tonnes a year earlier. The company forecast a first quarter average realized price of $245 to $275 per tonne, lower than last quarter's price.     Chief Executive Jim Prokopanko said prices are already rebounding in phosphates and potash prices look to improve later this year.     ""The atrocious lack of buying in the last quarter is the common denominator"" in an expected pickup in demand for both nutrients, Prokopanko said in a Reuters interview.     The company confirmed its forecast for record 2014 global shipments of 64 to 66 million tonnes of phosphate and 57 to 59 million tonnes of potash.     The pace of potash shipments has already picked up substantially and looks to carry into the second quarter, said Rick McLellan, Mosaic's senior vice-president, commercial.     Canpotex Ltd, the offshore sales arm of Mosaic, Potash Corp of Saskatchewan and Agrium Inc, should set a potash supply contract with Indian buyers by the end of April, Prokopanko said.     Phosphate prices have improved since late last year even without much Indian demand, but the world's biggest phosphate importer should buy a lot more in 2014, said Mike Rahm, Mosaic's vice-president of market analysis and strategic planning.      That said, the direction of grain prices and severe problems moving commodities in North America also look to influence fertilizer prices, Prokopanko said.     Frozen rivers in the United States and backlogged railways in Western Canada have left Mosaic behind on its shipping commitments, but could push up fertilizer prices, he said.     ""This is as bad as we've ever seen it ... People are going to be desperate. They'll pay higher for whatever's available.""     Mark Gulley, an analyst at BGC Financial Research, said he does not expect a return to larger potash profits any time soon because of industry over-capacity, but the prospects for phosphate are more promising.     Net earnings for the fourth quarter slid to $129 million, or 30 cents a share, the Plymouth, Minnesota-based company's second-smallest quarterly profit in four years. A year earlier, it earned $616 million, or $1.44 per share.     The results included one-time items that weakened earnings by 6 cents per share.     Revenue dropped 8 percent to $2.2 billion.     Analysts, on average, expected Mosaic to earn 42 cents a share on sales of $1.86 billion, according to Thomson Reuters I/B/E/S.     Potash Corp of Saskatchewan Inc in late January reported its smallest quarterly profit in four years and produced disappointing 2014 forecasts.      Mosaic sold a record 3.4 million tonnes of phosphate in the fourth quarter, exceeding guidance of 2.5 to 2.9 million tonnes, at an average price of $381 per tonne of diammonium phosphate, within the guidance range but a 28 percent drop year over year.      The company sold 1.9 million tonnes of potash in the quarter, hitting the top end of its guidance range of 1.5 to 1.9 million tonnes, at an average realized price of $303 per tonne. That price fell within Mosaic's guidance range but was 30 percent cheaper than a year earlier.   ",2014-02-11,MOS,"Tue Feb 11, 2014 | 12:14pm EST","UPDATE 3-Mosaic rises on outlook, buyback even as profit plunges",http://www.reuters.com//article/mosaic-results-idUSL2N0LG0HI20140211?type=companyNews
3,"  Feb 11 Mosaic Co Chief Executive Jim Prokopanko said on Tuesday he expects Canpotex Ltd, the offshore sales arm of Mosaic, Potash Corp of Saskatchewan and Agrium Inc to set a potash supply contract with Indian buyers by the end of April. The price may be around $325 to $330 per tonne, Prokopanko said in an interview with Reuters. The price range is based on the usual premium over Canpotex's China's contract, but Prokopanko said that may change as spot prices increase.  ",2014-02-11,MOS,"Tue Feb 11, 2014 | 11:11am EST",Mosaic CEO sees India potash contract by end April,http://www.reuters.com//article/mosaic-india-idUSL2N0LG14L20140211?type=companyNews
4,"   By Rod Nickel  U.S. fertilizer company Mosaic Co (MOS.N) reported a 79 percent plunge in quarterly profit on Tuesday as prices fell.A slide in grain prices and last summer's breakup of the Belarusian Potash Co caused a sharp drop in the price of the crop nutrients potash and phosphate.Net earnings for the fourth quarter slid to $129 million, or 30 cents per share, the company's second-smallest quarterly profit in four years. A year earlier, it earned $616 million, or $1.44 per share. Revenue dropped 8 percent to $2.2 billion. The results included one-time items that weakened earnings by 6 cents per share.Analysts, on average, expected Mosaic to earn 42 cents a share on sales of $1.86 billion, according to Thomson Reuters I/B/E/S. The Plymouth, Minnesota-based company also said it will buy back $1 billion of its shares, topping up a $2 billion repurchase program announced in December.(Reporting by Rod Nickel in Winnipeg, Manitoba; Editing by Jeffrey Benkoe)",2014-02-11,MOS,"Tue Feb 11, 2014 | 10:13am EST",Fertilizer maker Mosaic fourth quarter profit plunges 79 percent,http://www.reuters.com//article/us-mosaic-results-idUSBREA1A0VM20140211?type=companyNews
5,"  U.S.-based fertilizer company Mosaic Co (MOS.N), which operates potash mines in western Canada and phosphate facilities in the United States, is facing unprecedented transportation backlogs in North America, Chief Executive Officer Jim Prokopanko said on Tuesday.Frigid temperatures and heavy snow have hampered railway movement of commodities, he said on a conference call with analysts to discuss quarterly results.  (Reporting by Rod Nickel in Winnipeg, Manitoba; Editing by Jeffrey Benkoe) ",2014-02-11,MOS,"Tue Feb 11, 2014 | 10:13am EST",Fertilizer maker Mosaic sees huge North America transport snags,http://www.reuters.com//article/us-mosaic-transportation-idUSBREA1A19B20140211?type=companyNews
6,"  Feb 11 U.S.-based fertilizer company Mosaic Co , which operates potash mines in western Canada and phosphate facilities in the United States, is facing unprecedented transportation backlogs in North America, Chief Executive Officer Jim Prokopanko said on Tuesday. Frigid temperatures and heavy snow have hampered railway movement of commodities, he said on a conference call with analysts to discuss quarterly results.  ",2014-02-11,MOS,"Tue Feb 11, 2014 | 10:12am EST",Fertilizer maker Mosaic sees huge N. America transport snags,http://www.reuters.com//article/mosaic-transportation-idUSL2N0LG0TR20140211?type=companyNews
7,"  Feb 11 U.S. fertilizer company Mosaic Co  reported a 79 percent plunge in quarterly profit on Tuesday as prices fell. Net earnings for the fourth quarter slid to $129 million, or 30 cents per share, from $616 million, or $1.44 per share a year ago, while revenue dropped 8 percent to $2.2 billion.  ",2014-02-11,MOS,"Tue Feb 11, 2014 | 7:09am EST",Fertilizer maker Mosaic's 4th-quarter profit plunges 79 pct,http://www.reuters.com//article/mosaic-results-idUSL2N0LF0TS20140211?type=companyNews
8,"  March 17 Mosaic Co said on Monday that it has completed its $1.4-billion purchase of CF Industries'  phosphate business. The deal includes assets in Florida such as a phosphate mine, plant, and a phosphate manufacturing facility.  ",2014-03-17,MOS,"Mon Mar 17, 2014 | 12:03pm EDT",Mosaic closes $1.4 bln purchase of CF Industries' phosphate business,http://www.reuters.com//article/mosaic-cf-industries-idUSL2N0ME0US20140317?type=companyNews
9,"   By Rod Nickel  Mosaic Co (MOS.N) Chief Executive Jim Prokopanko has been diagnosed with cancer, but plans to continue in his role, the U.S. fertilizer company said on Thursday.Prokopanko is undergoing chemotherapy and said in a statement that he will work a regular schedule as CEO but limit his travel during the coming months.""While this is a serious matter, the good news is that I'm feeling well and my doctors have informed me that I was diagnosed at an early stage,"" he said. The company provided no details on the type of cancer Prokopanko is suffering from. Mosaic, the world's biggest producer of finished phosphate products and a major potash miner, on Monday completed its $1.4 billion acquisition of CF Industries' (CF.N) phosphate business. It is carrying out roughly $3 billion worth of share buybacks.Mosaic's management will continue to advance the strategic direction set by Prokopanko and the board, Chairman Robert Lumpkins said. Shares of the Plymouth, Minnesota-based company dipped 0.4 percent after normal trading hours in New York. The stock had finished slightly higher in regular NYSE at $49.04.(Reporting by Rod Nickel in Winnipeg, Manitoba; Editing by David Gregorio and Leslie Adler)",2014-03-20,MOS,"Thu Mar 20, 2014 | 4:38pm EDT","Mosaic CEO has cancer, plans to stay on job",http://www.reuters.com//article/us-mosaic-ceo-idUSBREA2J26E20140320?type=companyNews
10,"  (Adds quote, company details and share activity)By Rod NickelMarch 20 Mosaic Co Chief Executive Jim Prokopanko has been diagnosed with cancer, but plans to continue in his role, the U.S. fertilizer company said on Thursday.Prokopanko is undergoing chemotherapy and said in a statement that he will work a regular schedule as CEO but limit his travel during the coming months. ""While this is a serious matter, the good news is that I'm feeling well and my doctors have informed me that I was diagnosed at an early stage,"" he said. The company provided no details on the type of cancer Prokopanko is suffering from.Mosaic, the world's biggest producer of finished phosphate products and a major potash miner, on Monday completed its $1.4 billion acquisition of CF Industries' phosphate business.  It is carrying out roughly $3 billion worth of share buybacks. Mosaic's management will continue to advance the strategic direction set by Prokopanko and the board, Chairman Robert Lumpkins said.Shares of the Plymouth, Minnesota-based company dipped 0.4 percent after normal trading hours in New York. The stock had finished slightly higher in regular NYSE at $49.04.   (Reporting by Rod Nickel in Winnipeg, Manitoba; Editing by David Gregorio and Leslie Adler)",2014-03-20,MOS,"Thu Mar 20, 2014 | 4:31pm EDT","UPDATE 1-Mosaic CEO has cancer, plans to stay on job",http://www.reuters.com//article/mosaic-ceo-idUSL2N0MH1OC20140320?type=companyNews
11,"  March 20 Mosaic Co Chief Executive Jim Prokopanko has been diagnosed with cancer, but plans to continue in his role, the U.S. fertilizer company said on Thursday. Prokopanko is undergoing chemotherapy and said in a statement that he will limit his travel during the coming months.   (Reporting by Rod Nickel in Winnipeg, Manitoba; Editing by David Gregorio)  ",2014-03-20,MOS,"Thu Mar 20, 2014 | 4:10pm EDT","Mosaic CEO has cancer, plans to stay on job",http://www.reuters.com//article/mosaic-ceo-idUSL2N0MH1NV20140320?type=companyNews
12,"   By Rod Nickel | WINNIPEG, Manitoba, March 25  WINNIPEG, Manitoba, March 25 U.S.-based fertilizer company Mosaic Co said on Tuesday that it has laid off 51 workers at its Canadian potash operations, as the industry struggles to recover from low prices and weak demand.Spokesman Rob Litt said the layoffs are spread out among Mosaic's operations in the western province of Saskatchewan, which include three potash mines and an office for the potash segment. The laid-off workers mostly held office positions and none are union members. Mosaic issued the layoffs on Monday.""Current market conditions required that we review our options to remain competitive while continuing to operate responsibly,"" Litt said in an email. ""We remain committed to our investments in Saskatchewan, the sustainability of our operations and the communities where we operate."" Global demand for potash, a key crop nutrient, has grown more slowly than expected in recent years even as miners like Mosaic, Potash Corp of Saskatchewan and Agrium Inc  expanded their Saskatchewan capacity. In December, Potash Corp said it would slash its workforce by 18 percent, or more than 1,000 jobs, including 570 positions in its potash operations.Mosaic shares gained 1.1 percent in New York to $48.94 in morning trading.   (Reporting by Rod Nickel in Winnipeg, Manitoba; Editing by Sofina Mirza-Reid)",2014-03-25,MOS,"Tue Mar 25, 2014 | 10:20am EDT",Mosaic lays off 51 Canadian potash staff on industry woes,http://www.reuters.com//article/mosaic-redundancies-canada-idUSL1N0MM0P420140325?type=companyNews
13,"  (Adds Twitter, Mosaic, Cargill, Archer Daniels, Campari, Updates Eurobank, Sinopec, Motorola, United Spirits, Aaron's, Riverbed)April 15 The following bids, mergers, acquisitions and disposals were reported by 2000 GMT on Tuesday:** BlackBerry Ltd said on Tuesday it bought a minority stake in privately held healthcare IT firm NantHealth, a move that offers a glimpse into the type of niche markets the smartphone maker is targeting as it attempts to engineer a turnaround.** Barcode printer maker Zebra Technologies Corp  said it would buy Motorola Solutions Inc's enterprise business, which makes rugged mobile computers, tablets and barcode scanners, for $3.45 billion in its biggest deal ever.** Spanish telecoms operator Telefonica has offered to lease spectrum and access to its network to rivals in a bid to win European Union approval for its planned purchase of KPN's  E-Plus unit in Germany, three sources said on Tuesday.** Hedge fund Elliott Management reaffirmed its $3.36 billion offer for network gear maker Riverbed Technology Inc  after being rebuffed twice, saying it remained ""extremely interested"" in acquiring the company.** U.S. agribusiness Cargill Inc expects the merger of its flour mill operations with those of ConAgra Foods Inc to be finalized in six to eight weeks after it clears a longstanding regulatory hurdle, Cargill Executive Chairman Greg Page said on Tuesday.** Aaron's Inc, a rent-to-own furniture and electronics retailer, rejected a $2.3 billion takeover offer from a major shareholder and instead bought a web-based retail credit financing firm for about $700 million to provide customers with easier payment terms.** Archer Daniels Midland Co on Tuesday said it would move ahead with attempts to sell its global chocolate business after extensive negotiations to sell its chocolate and cocoa operations fell apart.** Google Inc  has acquired solar-powered drone maker Titan Aerospace as the Web search giant ramps up plans to deliver wireless Internet access to remote parts of the world.** U.S. fertilizer producer Mosaic Co said on Tuesday it would buy Archer Daniels Midland Co's  fertilizer distribution business in Brazil and Paraguay for $350 million.** YouTube network Maker Studios said on Monday a majority of shareholders had approved its purchase by Walt Disney Co , making clear it was not for sale to Relativity Media, which made a surprise bid of up to $1.1 billion for the company. ** Italian drinks maker Campari said on Tuesday it was buying a Sicilian spirits company, had 250 million euros ($346 million) to invest in further deals this year and planned to spend even more on acquisitions in 2015.** A consortium that includes Singapore tycoon Ong Beng Seng and Wheelock Properties (Singapore) Ltd offered on Tuesday to buy Hotel Properties Ltd for S$3.50 per share, valuing the company at around S$1.8 billion ($1.4 billion).** Twitter Inc said it bought social data provider Gnip to provide enhanced data analytics capabilities to its business customers.** TIAA-CREF, an insurer and asset manager focusing on workers at non-profit organizations, said it would acquire fund manager Nuveen Investments for $6.25 billion, seeking to expand its mutual fund and municipal bond offerings.** Hungary's central bank will acquire a controlling stake in interbank clearing company Giro Zrt, further tightening its grip on the financial system. ** Deutsche Telekom secured European Union antitrust approval on Tuesday for its 546-million-euro acquisition of telecoms provider GTS Central Europe to give it control of a fiber optic network in eastern Europe.** Diageo, the world's biggest spirits maker, has launched a $1.9 billion bid to nearly double its stake in United Spirits Ltd, offering a rich price in the hope that India's increasingly wealthy consumers will drink more alcohol..** DSW Inc is entering the Canadian footwear retail market by acquiring a 44 percent stake in one of Canada's largest shoes and accessories retailer, Town Shoes Ltd, for C$68 million ($62.05 million), the two retailers said.** Kazakh copper miner Kazakhmys said on Tuesday it had agreed to buy the Koksay copper deposit in southeast Kazakhstan from CCC Mining Construction B.V., for $260 million in cash.** China further strengthened its position in oil-rich Kazakhstan on Tuesday with its state firm Sinopec  paying $1.2 billion to buy out Russia's No.2 oil producer Lukoil  from a venture there. ** Brazil's state development bank, BNDES, says it plans to spend up to 3 billion reais ($1.35 billion) on stakes in buyout investment vehicles and share offerings by small- and mid-sized companies to help foster new funding sources in local capital markets.** An Australian private company has agreed to buy the long-idle Avebury nickel mine in Tasmania from China's MMG Ltd  for A$40 million ($37.65 million), saying operations were again profitable as global nickel prices rise.** International investors are to invest 1.3 billion euros in Eurobank to become the bailed-out Greek bank's biggest shareholders in another sign of growing market confidence in Greece.** Canadian private equity firm Onex Corp and entertainment company Cineplex Inc have together emerged as the leading contender to buy restaurant and arcade chain Dave & Buster's Inc, the Wall Street Journal reported, citing people familiar with the matter.** Italian eyewear group Luxottica said it had signed a 10-year licensing agreement with U.S. luxury-goods company Michael Kors Holdings Limited.** Generic drugmaker Akorn Enterprises Inc has won U.S. antitrust approval to buy rival Hi-Tech Pharmacal Inc  on condition that it sell three generic prescription eye medications and two generic topical anesthetics, the Federal Trade Commission said on Monday.** Aleris Corp said it may sell its recycling and specification alloys businesses, a sign that one of the world's biggest secondary aluminum alloy makers will focus on higher-margin rolled products and extrusion markets.** A consortium of eight anchor investors have committed to buy 25-30 percent of Euronext ahead of a market listing expected to value the company at 1-1.5 billion euros, three sources familiar with the matter said on Tuesday.($1 = 1.25 Singapore dollars)($1 = 1.06 Australian dollars)($1 = 1.10 Canadian dollars)($1 = 2.23 Brazilian real)($1 = 0.72 euros)   (Compiled by Neha Dimri and Shubhankar Chakravorty in Bangalore)",2014-04-15,MOS,"Tue Apr 15, 2014 | 4:01pm EDT",Deals of the day- Mergers and acquisitions,http://www.reuters.com//article/deals-day-idUSL3N0N727520140415?type=companyNews
14,"  (Updates with details on deal, background)April 15 U.S. fertilizer producer Mosaic Co  said on Tuesday it will buy Archer Daniels Midland Co's  fertilizer distribution business in Brazil and Paraguay for $350 million.Mosaic will acquire four blending and warehousing facilities in Brazil, one such facility in Paraguay and additional warehousing and logistics service capabilities. The deal is subject to regulatory approvals.The acquisition gives Mosaic ""a critical distribution platform in one of the world's fastest growing agricultural regions,"" Chief Executive Officer James Prokopanko said in a statement. ADM said it had been ""difficult for this business to consistently meet our return objectives"". Brazil is one of the world's biggest fertilizer importers due to nutrient-deficient soil and its huge annual crops of corn, soybeans and sugar cane. However, it can be difficult to move crops and nutrients because Brazil's transportation system is prone to bottlenecks.The acquisition of ADM's distribution business will accelerate Mosaic's growth plans in Brazil and ""replace a substantial amount of planned internal investments"" in the country, Mosaic said. As part of the deal, Mosaic agreed to supply ADM's fertilizer needs in Brazil and Paraguay for five years.Last year, Bunge Ltd completed the sale of its Brazilian fertilizer operations to Yara International  for $750 million in a move to streamline its agribusiness dealings. Through a long-term agreement with Yara, Bunge continues to supply fertilizer to farmers in Brazil.   (Reporting by Rod Nickel in Winnipeg, Manitoba, and Tom Polansek in Chicago; editing by Peter Galloway)",2014-04-15,MOS,"Tue Apr 15, 2014 | 1:27pm EDT","UPDATE 1-Mosaic to buy ADM fertilizer distribution business in Brazil, Paraguay",http://www.reuters.com//article/mosaic-adm-idUSL2N0N718W20140415?type=companyNews
15,"  U.S. fertilizer producer Mosaic Co (MOS.N) said on Tuesday that it will buy Archer Daniels Midland Co's (ADM.N) fertilizer distribution business in Brazil and Paraguay for $350 million.Mosaic would acquire four blending and warehousing facilities in Brazil, one such facility in Paraguay and additional warehousing and logistics service capabilities. The deal is subject to regulatory approvals.  (Reporting by Rod Nickel in Winnipeg, Manitoba) ",2014-04-15,MOS,"Tue Apr 15, 2014 | 12:53pm EDT","Mosaic to buy ADM's Brazil, Paraguay fertilizer distribution business",http://www.reuters.com//article/us-mosaic-adm-idUSBREA3E1EF20140415?type=companyNews
16,"  April 15 U.S. fertilizer producer Mosaic Co  said on Tuesday that it will buy Archer Daniels Midland Co's fertilizer distribution business in Brazil and Paraguay for $350 million.Mosaic would acquire four blending and warehousing facilities in  Brazil, one such facility in Paraguay and additional warehousing and logistics service capabilities. The deal is subject to regulatory approvals.  (Reporting by Rod Nickel in Winnipeg, Manitoba) ",2014-04-15,MOS,"Tue Apr 15, 2014 | 12:51pm EDT","Mosaic to buy ADM's Brazil, Paraguay fertilizer distribution business",http://www.reuters.com//article/mosaic-adm-idUSL2N0N717Z20140415?type=companyNews
