,Article,Date,Symbol,Time,Title,Url
28,"  * Q3 net profit $265.3 mln, up 29 pct from year earlier* Acquisitions to weigh on earnings in short term -CEO* Profit recovery after 2005 ThinkPad buy took two yearsBy Paul CarstenBEIJING, Feb 13 Lenovo Group Ltd  leader Yang Yuanqing says the Chinese technology giant will draw on cost-cutting lessons learned when it bought IBM Corp's  ThinkPad laptop unit to turn losses into profit at businesses acquired for $5.2 billion last month.Reporting third-quarter profit jumped 29 percent, Lenovo's chief executive warned the drive to turn around the Motorola handset business it bought from Google Inc and the computer server unit it bought from IBM will squeeze earnings in the short term.For Yang, the pain may only last ""a couple of quarters"" after the deals close, he said, and is worth it: though October-December personal computer sales were strong, the aggressive acquisitions are a key plank in Lenovo's search for future sources of growth as the broader desktop PC market shrinks and computer users go mobile.""In the short term (the deals) will have a negative impact on performance,"" Yang said in a telephone interview after the earnings were announced. Lenovo, the world's biggest maker of PCs, later specified it will likely take three to five quarters to turn around the Motorola phone business.Analysts say it may take the company at least that long to turn around its acquisitions. Heavyweights like Samsung Electronics Co and Apple Inc, dominant in global smartphones, will also provide stiff competition as Lenovo seeks to build up the Motorola business.""I'm expecting a slowdown in the underlying, organic business,"" said Jean-Louis Lafayeedney, a Hong Kong-based technology analyst at JI Asia, an affiliate of Societe Generale. ""It will be at least a year before Lenovo can turn around growth,"" he said, speaking before Yang's comments. DEJA VU Investors might be experiencing dj vu. Motorola Mobility and the IBM x86 server unit currently lose money - Motorola alone lost more than $1 billion in 2013 - just as ThinkPad did when it became the Chinese company's way into businesses across the United States in 2005.After the ThinkPad deal, Lenovo's net income dropped sharply and only recovered after almost two years. To bring the new acquisitions into the fold, Lenovo plans to revive its tactic of integrating ThinkPad through cost-cutting, lower material costs and merging the business with its own supply chain.Lenovo will sell Motorola handsets and IBM servers through the same channels it uses for its own low-margin smartphones and its PC business, Yang said in a post-earnings call, without elaborating on financial targets.Lenovo said it plans to re-introduce the Motorola brand to its home country - a smartphone market now beginning to become saturated - as well as expanding to emerging markets. A key part of its strategy for IBM's low-end servers is to surf on Lenovo's presence in China, where it said server demand remains strong.But the sheer size of these deals - the price tag is close to half of Lenovo's market value - will weigh on the company for some time. Analysts don't expect the deals to be finalised until the third quarter of 2014 at the very earliest. ""They did not have a choice, they had to acquire a business to take their smartphones to the developed markets,"" said Lafayeedney. ""They cannot waste the kind of time needed to grow organically into developed markets,"" the analyst said, speaking before the October-December earnings were announced.AHEAD OF ESTIMATES Lenovo on Thursday reported net income of $265.3 million for the October-December quarter, ended before the acquisitions splurge. That was well above the $204.9 million it posted a year earlier, as well as a $247.2 million consensus forecast on Thomson Reuters Starmine SmartEstimate.Although Lenovo is the world's fourth-biggest manufacturer of smartphones by shipments as of the quarter ended December, according to data firm IDC, the company is still dependent on China for the vast majority of its sales.Of the 13.9 million handsets Lenovo shipped in that quarter according to IDC, Lenovo said on Thursday only 2 million, or 14 percent, of those were sold outside China.Yang told analysts in a conference call the smartphone unit does not yet contribute a lot to the overall profit of Lenovo, particularly in China, where margins are slimmer than in other markets. Overall China smartphone shipments fell for the first time in more than two years in the quarter ended December, declining 4.3 percent quarter-on-quarter to 90.8 million handsets, according to IDC.The speed and scale of the buying spree - partly paid for by issuing new shares - spooked some investors. Earlier this month Lenovo shares tumbled 16 percent in one day after a report said the company was interested in buying Sony Corp's Vaio PC division.Lenovo shares have dropped 8.7 percent since the start of the year, compared with the Hong Kong index's loss of 4.82 percent. By close of trading on Thursday, the stock was down 0.58 percent, while the index was off 0.54 percent.",2014-02-13,MSI,"Thu Feb 13, 2014 | 5:38am EST","UPDATE 2-For Lenovo, ThinkPad turnaround provides blueprint for Motorola handset future",http://www.reuters.com//article/lenovo-q3-results-idUSL3N0LH3UU20140213?type=companyNews
29,"   By Ellen Wulfhorst | MANCHESTER, New Hampshire  MANCHESTER, New Hampshire Sipping his breakfast coffee in a cozy booth at Chez Vachon, a New Hampshire cafe favored by political junkies and a regular stop for aspirants on the campaign trail to the White House, Bill McEvoy debated the presidential future of Republican Chris Christie.""If they can prove that he lied, then he's out,"" said McEvoy, 71, referring to the so-called Bridgegate scandal that has dogged Christie for weeks and raised questions about whether his administration orchestrated massive traffic jams as political payback.Short of that, McEvoy said, ""I think he can come out of it looking good.""While Christie has seen support tumble in national polls since the controversy erupted, interviews with more than two dozen voters and party activists in New Hampshire, Iowa and South Carolina - the initial proving grounds for presidential candidates - suggest he may yet be able to overcome the scandal.What many said they want from Christie is time and attention, a display of hands-on, retail politicking ahead of the first caucus in Iowa and the first two primaries, in New Hampshire and in South Carolina.In Iowa, A.J. Spiker, chairman of the state Republican Party, compared Christie to Mitt Romney, who was criticized for health-care reforms he helped pass as governor of Massachusetts.Conservatives denounced ""Romneycare"" as a prototype for President Obama's health-care policy, yet Romney won the Iowa caucus and the 2012 Republican presidential nomination.""People can do well here - if they come and they work the state and they talk to the people,"" Spiker said. ""I would say if Romney can overcome 'Romneycare,' if everything we know about the bridge scandal is public, then Christie should be able to overcome that.""Besides, he added, the Iowa caucus is roughly two years away. ""A lot happens in two years,"" he said.EMBARRASSED AND HUMILIATED  Christie has denied knowledge of the closure of three traffic lanes at the busy George Washington Bridge five months ago, which blew up into a scandal in January with the release of emails showing some of his aides and appointees may have orchestrated the snarl as political payback against a local mayor.State and federal officials are investigating the incident.While a contrite Christie held a nearly two-hour-long news conference soon after news of the scandal broke, claiming lack of knowledge about the plot and describing himself as embarrassed and humiliated by his staff, the imbroglio has dented his political standing.Only 22 percent of voters in an NBC News/Wall Street Journal survey held a favorable view of Christie in late January, down from 33 percent in October.A poll by the University of New Hampshire showed that a third of the state's Republican primary voters were less likely to vote for Christie because of the scandal. But nearly all of the rest said it had little impact on their view. An early proving ground in the presidential race, New Hampshire has accurately picked the Democratic and Republican winning nominees in three-quarters of the contests in the last 50 years.Candidates campaigning in the state are exposed to grueling media attention and pointed questions from voters who demand face time during informal stops at local businesses such as Manchester's bustling Chez Vachon.That may benefit Christie, whose straight-forward, no-nonsense style has made him a national political force and will likely play well with New Hampshire voters, said Alan Glassman, chairman of the Belknap County Republican Committee""There's an astuteness on their part,"" Glassman said of his fellow state Republicans. ""They can tell whether somebody's trying to pull the wool over their eyes.""Another political aficionado at Chez Vachon was retired trucker Henry Fitts, who boasts of never missing a chance to vote. At 71, he has seen plenty from his seat at the landmark diner and says he thinks the tempest will teach Christie to be a better candidate and help tamp down his reputation as a bully. ""I think he's going to come out cleaner than previously,"" said Fitts. ""He's going to look a lot more sensitive when it's all done.""New Hampshire's primary is often fueled by the state's large bloc of independents, who can vote in either party's primary.After Iowa and New Hampshire, Christie, if he runs, would next move to South Carolina, the first contest of the primary season held in a southern state.South Carolina's scorecard is nearly perfect in choosing the Republican nominee. The winner there has gone on to claim the party nomination every time, with one exception, since the state's primary began in 1980.Candidates there face a formidable force of social and religious conservatives, which may prove to be a bigger challenge for Christie than overcoming a traffic scandal 700 miles to the north, local voters said.""I do not like him as a candidate for president,"" said Debbie Jones, 60, who lives on Isle of Palms and is active in the county Republican Party.""It has nothing to do with Bridgegate, but everything to do with being another of the Republicans who don't follow conservative beliefs and follow our Constitution,"" she said.(This story was refiled to remove extraneous word in third from last paragraph)(Additional reporting by Harriet McLeod in Charleston, South Carolina; Editing by Gunna Dickson)",2014-02-21,MSI,"Fri Feb 21, 2014 | 4:22pm EST","From a tainted Christie, Republican voters demand time and attention",http://www.reuters.com//article/us-usa-politics-christie-idUSBREA1K1UZ20140221?type=companyNews
30,"  Motorola Mobility has named Rick Osterloh as its chief operating officer, reporting to the Motorola Operating Board at Google Inc until its acquisition by Lenovo Group Ltd is completed.The appointment was made public on Wednesday on Motorola's official blog by Jonathan Rosenberg, who will continue in his role as Google liaison and adviser to Motorola through the transition period. (r.reuters.com/buj48v)Lenovo agreed to buy Google's Motorola handset division for $2.91 billion in January, in what was China's largest-ever tech deal. ""We're confident in his (Osterloh's) ability to not only manage a smooth transition at Motorola from Google to Lenovo but, also to lead the business forward for continued growth,"" said Liu Jun, EVP, Mobile Business Group, Lenovo. Osterloh, who was responsible for the delivery of software and operation of the Android platform at Motorola, joined the company seven years ago and left for a 2-year stint in between at Skype. (Reporting by Arnab Sen in Bangalore; Editing by Gopakumar Warrier)",2014-04-10,MSI,"Thu Apr 10, 2014 | 2:09am EDT",Motorola Mobility names Rick Osterloh as COO ahead of Lenovo buy,http://www.reuters.com//article/us-motorolamobility-coo-idUSBREA390C020140410?type=companyNews
31,"  April 10 Motorola Mobility has named Rick Osterloh as its chief operating officer, reporting to the Motorola Operating Board at Google Inc until its acquisition by Lenovo Group Ltd is completed.The appointment was made public on Wednesday on Motorola's official blog by Jonathan Rosenberg, who will continue in his role as Google liaison and adviser to Motorola through the transition period. (r.reuters.com/buj48v) Lenovo agreed to buy Google's Motorola handset division for $2.91 billion in January, in what was China's largest-ever tech deal. ""We're confident in his (Osterloh's) ability to not only manage a smooth transition at Motorola from Google to Lenovo but, also to lead the business forward for continued growth,"" said Liu Jun, EVP, Mobile Business Group, Lenovo. Osterloh, who was responsible for the delivery of software and operation of the Android platform at Motorola, joined the company seven years ago and left for a 2-year stint in between at Skype.   (Reporting by Arnab Sen in Bangalore; Editing by Gopakumar Warrier)",2014-04-10,MSI,"Thu Apr 10, 2014 | 2:05am EDT",Motorola Mobility names Rick Osterloh as COO ahead of Lenovo buy,http://www.reuters.com//article/motorolamobility-coo-idUSL3N0N21L120140410?type=companyNews
32,"  (Adds Twitter, Mosaic, Cargill, Archer Daniels, Campari, Updates Eurobank, Sinopec, Motorola, United Spirits, Aaron's, Riverbed)April 15 The following bids, mergers, acquisitions and disposals were reported by 2000 GMT on Tuesday:** BlackBerry Ltd said on Tuesday it bought a minority stake in privately held healthcare IT firm NantHealth, a move that offers a glimpse into the type of niche markets the smartphone maker is targeting as it attempts to engineer a turnaround.** Barcode printer maker Zebra Technologies Corp  said it would buy Motorola Solutions Inc's enterprise business, which makes rugged mobile computers, tablets and barcode scanners, for $3.45 billion in its biggest deal ever.** Spanish telecoms operator Telefonica has offered to lease spectrum and access to its network to rivals in a bid to win European Union approval for its planned purchase of KPN's  E-Plus unit in Germany, three sources said on Tuesday.** Hedge fund Elliott Management reaffirmed its $3.36 billion offer for network gear maker Riverbed Technology Inc  after being rebuffed twice, saying it remained ""extremely interested"" in acquiring the company.** U.S. agribusiness Cargill Inc expects the merger of its flour mill operations with those of ConAgra Foods Inc to be finalized in six to eight weeks after it clears a longstanding regulatory hurdle, Cargill Executive Chairman Greg Page said on Tuesday.** Aaron's Inc, a rent-to-own furniture and electronics retailer, rejected a $2.3 billion takeover offer from a major shareholder and instead bought a web-based retail credit financing firm for about $700 million to provide customers with easier payment terms.** Archer Daniels Midland Co on Tuesday said it would move ahead with attempts to sell its global chocolate business after extensive negotiations to sell its chocolate and cocoa operations fell apart.** Google Inc  has acquired solar-powered drone maker Titan Aerospace as the Web search giant ramps up plans to deliver wireless Internet access to remote parts of the world.** U.S. fertilizer producer Mosaic Co said on Tuesday it would buy Archer Daniels Midland Co's  fertilizer distribution business in Brazil and Paraguay for $350 million.** YouTube network Maker Studios said on Monday a majority of shareholders had approved its purchase by Walt Disney Co , making clear it was not for sale to Relativity Media, which made a surprise bid of up to $1.1 billion for the company. ** Italian drinks maker Campari said on Tuesday it was buying a Sicilian spirits company, had 250 million euros ($346 million) to invest in further deals this year and planned to spend even more on acquisitions in 2015.** A consortium that includes Singapore tycoon Ong Beng Seng and Wheelock Properties (Singapore) Ltd offered on Tuesday to buy Hotel Properties Ltd for S$3.50 per share, valuing the company at around S$1.8 billion ($1.4 billion).** Twitter Inc said it bought social data provider Gnip to provide enhanced data analytics capabilities to its business customers.** TIAA-CREF, an insurer and asset manager focusing on workers at non-profit organizations, said it would acquire fund manager Nuveen Investments for $6.25 billion, seeking to expand its mutual fund and municipal bond offerings.** Hungary's central bank will acquire a controlling stake in interbank clearing company Giro Zrt, further tightening its grip on the financial system. ** Deutsche Telekom secured European Union antitrust approval on Tuesday for its 546-million-euro acquisition of telecoms provider GTS Central Europe to give it control of a fiber optic network in eastern Europe.** Diageo, the world's biggest spirits maker, has launched a $1.9 billion bid to nearly double its stake in United Spirits Ltd, offering a rich price in the hope that India's increasingly wealthy consumers will drink more alcohol..** DSW Inc is entering the Canadian footwear retail market by acquiring a 44 percent stake in one of Canada's largest shoes and accessories retailer, Town Shoes Ltd, for C$68 million ($62.05 million), the two retailers said.** Kazakh copper miner Kazakhmys said on Tuesday it had agreed to buy the Koksay copper deposit in southeast Kazakhstan from CCC Mining Construction B.V., for $260 million in cash.** China further strengthened its position in oil-rich Kazakhstan on Tuesday with its state firm Sinopec  paying $1.2 billion to buy out Russia's No.2 oil producer Lukoil  from a venture there. ** Brazil's state development bank, BNDES, says it plans to spend up to 3 billion reais ($1.35 billion) on stakes in buyout investment vehicles and share offerings by small- and mid-sized companies to help foster new funding sources in local capital markets.** An Australian private company has agreed to buy the long-idle Avebury nickel mine in Tasmania from China's MMG Ltd  for A$40 million ($37.65 million), saying operations were again profitable as global nickel prices rise.** International investors are to invest 1.3 billion euros in Eurobank to become the bailed-out Greek bank's biggest shareholders in another sign of growing market confidence in Greece.** Canadian private equity firm Onex Corp and entertainment company Cineplex Inc have together emerged as the leading contender to buy restaurant and arcade chain Dave & Buster's Inc, the Wall Street Journal reported, citing people familiar with the matter.** Italian eyewear group Luxottica said it had signed a 10-year licensing agreement with U.S. luxury-goods company Michael Kors Holdings Limited.** Generic drugmaker Akorn Enterprises Inc has won U.S. antitrust approval to buy rival Hi-Tech Pharmacal Inc  on condition that it sell three generic prescription eye medications and two generic topical anesthetics, the Federal Trade Commission said on Monday.** Aleris Corp said it may sell its recycling and specification alloys businesses, a sign that one of the world's biggest secondary aluminum alloy makers will focus on higher-margin rolled products and extrusion markets.** A consortium of eight anchor investors have committed to buy 25-30 percent of Euronext ahead of a market listing expected to value the company at 1-1.5 billion euros, three sources familiar with the matter said on Tuesday.($1 = 1.25 Singapore dollars)($1 = 1.06 Australian dollars)($1 = 1.10 Canadian dollars)($1 = 2.23 Brazilian real)($1 = 0.72 euros)   (Compiled by Neha Dimri and Shubhankar Chakravorty in Bangalore)",2014-04-15,MSI,"Tue Apr 15, 2014 | 4:01pm EDT",Deals of the day- Mergers and acquisitions,http://www.reuters.com//article/deals-day-idUSL3N0N727520140415?type=companyNews
33,"   By Abhirup Roy  Barcode printer maker Zebra Technologies Corp said it would buy Motorola Solutions Inc's enterprise business, which makes rugged mobile computers, tablets and barcode scanners, for $3.45 billion in its biggest deal ever.The deal will allow Zebra, whose products help companies such as Amazon Inc track inventory and supply chains, to enhance its portfolio through a range of Internet-connected devices.Zebra's shares fell 11 percent to $60.77 on the Nasdaq on concerns the company's borrowings to fund the deal would be as big as its market value of $3.44 billion as of Monday's close.Zebra will finance the deal through a combination of $200 million cash on hand and $3.25 billion in debt, comprising a credit facility and issuance of debt securities.""It's an aggressive play by Zebra to fortify their position in the entire AIDC (automatic identification and data capture)space,"" Northcoast Research analyst Keith Housum said.""It's a good long-term play but in the short term, I think it's going to be challenging,"" Housum said, noting the large debt and the fact that the enterprise business has struggled to grow organically in the past two years.The business, which accounts for about a third of Motorola Solutions' total revenue, has suffered as clients delay orders and cut spending.Zebra, however, said it expected the deal to add to earnings immediately after closing at the end of this year.After the sale, Motorola Solutions will be left with its core government and public safety business. It will also retain its iDEN products portfolio, which is a part of its enterprise business. ""Upon closing of the transaction, we intend to return the proceeds to our shareholders in a timely fashion,"" Motorola Solutions Chief Executive Greg Brown said in a statement.Morgan Stanley, the financial adviser to Zebra, is providing a financing commitment for the debt.Goldman, Sachs & Co and JP Morgan Securities LLC are Motorola Solutions' financial advisers.About 4,500 Motorola Solutions' employees will join Zebra's workforce of about 2,600 as of January 25. Zebra's rivals in its printing business include Hewlett-Packard, Epson and Lexmark, while Ubisense and AeroScout are among its competitors in the location tracking products business.In October, Zebra launched Zatar, a Web-based software that allows companies to deploy and manage devices and sensors connected to the Internet, also called the ""internet of things."" (link.reuters.com/tyn58v)Zebra acquired Hart Systems, which provides Web-based inventory management software to the retail industry, in December.Global merger and acquisition activity has surged this year, mainly in the technology industry. Deals worth about $618.4 billion have been completed, with a third of those in the technology, media and telecom sector, according to Thomson Reuters data.QUARTERLY RESULTS  Motorola Solutions estimated its quarterly results below analysts' expectations, saying volumes in its North America government business were lower than expected and some orders in its enterprise business were delayed.The company estimated an adjusted profit of 50 cents per share and sales of about $1.8 billion for the first quarter ended March.Analysts on average were expecting a profit of 51 cents per share on revenue of $1.88 billion, according to Thomson Reuters I/B/E/S.Motorola Solutions' shares were down 1.3 percent at $62.92 in afternoon trading on the New York Stock Exchange.Zebra estimated an adjusted profit of 88-91 cents per share and sales of $287 million-$289 million for the first quarter.Analysts on average were expecting adjusted earnings of 83 cents per share on sales of $281.6 million.Both Motorola Solutions and Zebra are scheduled to report their results in May.(Additional reporting by Soham Chatterjee and Patturaja Murugaboopathy in Bangalore; Editing by Kirti Pandey)",2014-04-15,MSI,"Tue Apr 15, 2014 | 1:33pm EDT",Zebra Tech to buy Motorola Solutions' enterprise business,http://www.reuters.com//article/us-motorola-solu-zebra-tech-idUSBREA3E0NL20140415?type=companyNews
