,Article,Date,Symbol,Time,Title,Url
76,"  Thomson Reuters May 15, 2015 - Corporate Meetings for US companies for Week ahead.         S&P 500 Earnings - MONTH AHEAD     Dividends                            Non S&P 500 - Weekly             Federal Reserve events               ConferenceCall/Webcast - Weekly  Meetings - Weekly                                Xtra users can see more details on conference calls & webcasts by hovering your mouse  over the RIC, right click, no click on Related Co Data, now click on Co Events.             ** For events after May 18 please click on                    - - - - - - - - - - - - - - - - - - - - - - - - - - - - - - - - - - - - - DATE       GMT      SYMBOL       EVENT TITLE  15 May     01:00        Bank of Marin BanAnnual Shareholders Meeting 15 May     13:00           Clear Channel Outdoor Inc Annual Shareholders Meeting 15 May     13:00           Forum Energy Technologies Inc Annual Shareholders Meeting 15 May     13:00           Newfield Exploration Co Annual Shareholders Meeting 15 May     13:30           Aetna Inc Annual Shareholders Meeting 15 May                     Campus Crest Communities Inc Annual Shareholders Meeting 15 May     12:00          BioAmber Inc Annual Shareholders Meeting 15 May     12:00            Western Union Co Annual Shareholders Meeting 15 May     12:00           WEX Inc Annual Shareholders Meeting 15 May     12:30           Intercontinental Exchange Inc Annual Shareholders Meeting 15 May     14:00           American Water Works Company Inc Annual Shareholders Meeting 15 May     14:00        Chefs Warehouse Inc Annual Shareholders Meeting 15 May     14:00           Macquarie Infrastructure Extraordinary Shareholders Meeting 15 May     14:00         Memorial Resource Development Annual Shareholders Meeting 15 May     14:00           Progressive Annual Shareholders Meeting 15 May     14:00           Tanger Factory Outlet Centers Inc Annual Shareholders Meeting 15 May     14:00           Terex Annual Shareholders Meeting 15 May     14:00           Westlake Chemical Annual Shareholders Meeting 15 May     14:30           John Bean Technologies Annual Shareholders Meeting 15 May     14:30           Quest Diagnostics Inc Annual Shareholders Meeting 15 May     15:00          Banc of California Inc Annual Shareholders Meeting 15 May     15:00            CF Industries Inc Annual Shareholders Meeting 15 May     15:00          Cypress Semiconductor Annual Shareholders Meeting 15 May     15:00           Dril-Quip Inc Annual Shareholders Meeting 15 May     15:00           J C Penney Company Inc Annual Shareholders Meeting 15 May     15:00             Macys Inc Annual Shareholders Meeting 15 May     15:00        QCR Inc Annual Shareholders Meeting 15 May     15:00        Rosetta Resources Inc Annual Shareholders Meeting 15 May     15:00           Transocean Ltd Annual Shareholders Meeting 15 May     15:00           Waste Connections Inc Annual Shareholders Meeting 15 May     15:00        West Annual Shareholders Meeting 15 May     15:30           CBRE Group Inc Annual Shareholders Meeting 15 May     17:00        Commercial Vehicle Group Inc Annual Shareholders Meeting 15 May     18:00        Seattle Genetics Inc Annual Shareholders Meeting 15 May     19:00          Roundy's Inc Annual Shareholders Meeting 16 May     22:00        First Interstate Bancsystem Inc Annual Shareholders Meeting 16 May     14:00           Dillard's Inc Annual Shareholders Meeting 16 May     15:00           American Works at NAIC's BetterInvesting National Convention 17 May     22:00            Laclede Group Inc at American Gas Forum 17 May                     Alliant Energy at American Gas Forum 17 May                     Atmos Energy at American Gas Forum 17 May                     Avista at American Gas Forum 17 May                     Black Hills at American Gas Forum 17 May                     Chesapeake Utilities at American Gas Forum 17 May                      Consolidated Edison Inc at American Gas Forum 17 May                  Delta Natural Gas Company Inc at American Gas Forum 17 May                      Eversource Energy at American Gas Forum 17 May                     Integrys Energy Group Inc at American Gas Forum 17 May                      Laclede Group Inc at American Gas Forum 17 May                     MDU Resources Group Inc at American Gas Forum 17 May                  MGE Energy Inc at American Gas Forum 17 May                     National Fuel Gas Co at American Gas Forum 17 May                     New Jersey Resources at American Gas Forum 17 May                      NiSource Inc at American Gas Forum 17 May                     Piedmont Natural Gas Company Inc at American Gas Forum 17 May                     Questar at American Gas Forum 17 May                     Sempra Energy at American Gas Forum 17 May                     South Jersey Industries Inc at American Gas Forum 17 May                     Southwest Gas at American Gas Forum 17 May                      Spectra Energy at American Gas Forum 17 May                      TECO Energy Inc at American Gas Forum 17 May                     UGI at American Gas Forum 17 May                     UIL at American Gas Forum 17 May                     Unitil at American Gas Forum 17 May                     Vectren at American Gas Forum 17 May                     WGL Inc at American Gas Forum 17 May                     Wisconsin Energy at American Gas Forum 17 May                     Xcel Energy Inc at American Gas Forum 17 May     21:15           Chesapeake Utilities at American Gas Forum 18 May     13:00           3M Co at Electrical Products Group Conf 18 May     13:00        Infinity Pharmaceuticals Inc at UBS Global Healthcare Conf 18 May     13:00          Targa Resources Annual Shareholders Meeting 18 May     13:00           Tenet Healthcare at UBS Global Healthcare Conf 18 May     13:20          Care.com Inc at JPMorgan Conf 18 May     13:20        Cavium Inc at JPMorgan Conf 18 May     13:20           EMC at JPMorgan Conf 18 May     13:20            MasterCard Inc at JPMorgan Conf 18 May     13:20           Neustar Inc at JPMorgan Conf 18 May     13:20          T-Mobile US Inc at JPMorgan Conf 18 May     13:20        Virtusa at JPMorgan Conf 18 May     13:30        Akebia Therapeutics Inc at UBS Global Healthcare Conf 18 May     13:30        Bank of The Ozarks Inc Annual Shareholders Meeting 18 May     13:30           Cambrex at UBS Global Healthcare Conf 18 May     13:30        Esperion Therapeutics Inc at UBS Global Healthcare Conf 18 May     22:00        Geron Annual Shareholders Meeting 18 May     22:00        International Bancshares Annual Shareholders Meeting 18 May                  AcelRx Pharmaceuticals Inc at UBS Global Healthcare Conf 18 May                     Ameren at American Gas Forum 18 May                  Bruker at UBS Global Healthcare Conf 18 May                     CenterPoint Energy Inc at American Gas Forum 18 May                    Civitas Solutions Inc at UBS Global Healthcare Conf 18 May                     CMS Energy at American Gas Forum (One-on-One Meeting) 18 May                     DTE Energy Co at American Gas Forum (One on One Meetings) 18 May                     Empire District Electric Co at American Gas Forum 18 May                  Gas Natural Inc at American Gas Forum 18 May                      Intralinks Inc at JPMorgan Conf 18 May                     NCR at JPMorgan Conf 18 May                     NorthWestern at American Gas Forum:One-on-One Meeting 18 May                     Oasis Petroleum Inc at UBS Global Oil and Gas Conf 18 May                     ONE Gas Inc at American Gas Forum - One-on-One Meetings 18 May                     PG&E at American Gas Forum 18 May                     Public Service Enterprise Group Inc at American Gas Forum 18 May                  RTI Surgical Inc at UBS Global Healthcare Conf 18 May                    U.S. Physical Therapy Inc at UBS Global Healthcare Conf 18 May     11:30           Honeywell International Inc at Electrical Products Group Conf 18 May     12:00             AT&T Inc at JPMorgan Conf 18 May     12:00         VWR at UBS Global Healthcare Conf 18 May     12:30        Ophthotech at UBS Global Healthcare Conf 18 May     12:40        Viacom Inc at JPMorgan Conf 18 May     14:00        Cogent Communications Inc at JPMorgan Conf 18 May     14:00       Comcast at JPMorgan Conf 18 May     14:00            Consolidated Edison Inc Annual Shareholders Meeting 18 May     14:00        CoStar Group Inc at JPMorgan Conf 18 May     14:00        Cree Inc at JPMorgan Conf 18 May     14:00           Danaher at Electrical Products Group Conf 18 May     14:00      Genesis Healthcare at UBS Global Healthcare Conf 18 May     14:00           Global Payments Inc at JPMorgan Conf 18 May     14:00        NetScout Systems Inc at JPMorgan Conf 18 May     14:00        OraSure Technologies Inc at UBS Global Healthcare Conf 18 May     14:00           PerkinElmer Inc at UBS Global Healthcare Conf 18 May     14:00        Prothena PLC at UBS Global Healthcare Conf 18 May     14:00         Texas Instruments Inc at JPMorgan Conf 18 May     14:00        Ultimate Software Group Inc Annual Shareholders Meeting 18 May     14:30           Actavis PLC at UBS Global Healthcare Conf 18 May     14:30        Integra LifeSciences at UBS Global Healthcare Conf 18 May     14:30           Universal Health Services Inc at UBS Global Healthcare Conf 18 May     14:40        ANSYS Inc at JPMorgan Conf 18 May     14:40           CenturyLink Inc at JPMorgan Conf 18 May     14:40          Facebook Inc at JPMorgan Conf 18 May     14:40        Maxim Integrated Products Inc at JPMorgan Conf 18 May     14:40        Synaptics Inc at JPMorgan Conf 18 May     14:40          TriNet Group Inc at JPMorgan Conf 18 May     14:45           Stanley Black & Decker Inc at Electrical Products Group Conf 18 May     15:00           AMN Healthcare Services Inc at UBS Global Healthcare Conf 18 May     15:00        LDR Holding at UBS Global Healthcare Conf 18 May     15:00           Waters at UBS Global Healthcare Conf 18 May     15:20           Box Inc at JPMorgan Conf 18 May     15:20           Diebold Inc at JPMorgan Conf 18 May     15:20           International Business Machines at JPMorgan Conf 18 May     15:20        Orbotech Ltd at JPMorgan Conf 18 May     15:20        Qualys Inc at JPMorgan Conf 18 May     15:20        Sinclair Broadcast Group Inc at JPMorgan Conf 18 May     15:30        Achillion Pharmaceuticals Inc at UBS Global Healthcare Conf 18 May     15:30        PAREXEL International at UBS Global Healthcare Conf 18 May     15:30          Perrigo Company PLC at UBS Global Healthcare Conf 18 May     15:30           Roper Technologies Inc at Electrical Products Group Conf 18 May     16:00            Consolidated Edison Inc at American Gas Forum 18 May     16:00        Grand Canyon Education Inc Annual Shareholders Meeting 18 May     16:00           MDU Resources Group Inc at American Gas Forum 18 May     16:00           Omnicom Group Inc Annual Shareholders Meeting 18 May     16:00           Questar at American Gas Forum 18 May     16:00           South Jersey Industries Inc at American Gas Forum 18 May     16:30           WESCO International Inc at Electrical Products Group Conf 18 May     16:45           DTE Energy Co at American Gas Forum 18 May     16:45           National Fuel Gas Co at American Gas Forum 18 May     16:45           Northwest Natural Gas Co at American Gas Forum 18 May     17:00        Epizyme Inc at UBS Global Healthcare Conf 18 May     17:00           Health Care REIT Inc at UBS Global Healthcare Conf 18 May     17:00        IPC Healthcare Inc at UBS Global Healthcare Conf 18 May     17:00        Veracyte Inc Annual Shareholders Meeting 18 May     17:15           Eaton PLC at Electrical Products Group Conf 18 May     17:30        Alimera Sciences Inc at UBS Global Healthcare Conf 18 May     17:30        AngioDynamics Inc at UBS Global Healthcare Conf 18 May     17:30           CMS Energy at American Gas Forum 18 May     17:30        K2M Group Inc at UBS Global Healthcare Conf 18 May     17:30        Medivation Inc at UBS Global Healthcare Conf 18 May     17:30           ONE Gas Inc at American Gas Forum 18 May     17:30        PacWest BanAnnual Shareholders Meeting 18 May     17:30        PacWest BanCourt Meeting 18 May     17:30           Unitil at American Gas Forum 18 May     18:00        Halozyme Therapeutics Inc at UBS Global Healthcare Conf 18 May     18:00           Rockwell Automation Inc at Electrical Products Group Conf 18 May     18:10           American Tower at JPMorgan Conf 18 May     18:10            Broadridge Financial Solutions Inc at JPMorgan Conf 18 May     18:10          Everyday Health Inc at JPMorgan Conf 18 May     18:10        Medidata Solutions Inc at JPMorgan Conf 18 May     18:10        Paychex Inc at JPMorgan Conf 18 May     18:15           NorthWestern at American Gas Forum 18 May     18:15           Southwest Gas at American Gas Forum 18 May     18:15            TECO Energy Inc at American Gas Forum 18 May     18:15           WGL Inc at American Gas Forum 18 May     18:30           Aetna Inc at UBS Global Healthcare Conf 18 May     18:30        Biospecifics Technologies at UBS Global Healthcare Conf 18 May     18:45           SPX at Electrical Products Group Conf 18 May     18:50        Dealertrack Technologies Inc at JPMorgan Conf 18 May     18:50           Freescale Semiconductor Ltd at JPMorgan Conf 18 May     18:50        HomeAway Inc at JPMorgan Conf 18 May     18:50          HubSpot Inc at JPMorgan Conf 18 May     18:50           Interpublic Group of Companies Inc at JPMorgan Conf 18 May     18:50           WEX Inc at JPMorgan Conf 18 May     19:00        AMAG Pharmaceuticals Inc at UBS Global Healthcare Conf 18 May     19:30           Alliance Data Systems at JPMorgan Conf 18 May     19:30         Foundation Medicine Inc at UBS Global Healthcare Conf 18 May     19:30           Gannett Co Inc at JPMorgan Conf 18 May     19:30        LogMeIn Inc at JPMorgan Conf 18 May     19:30           RingCentral Inc at JPMorgan Conf 18 May     19:30        ShoreTel Inc at JPMorgan Conf 18 May     19:30           VeriFone Systems Technology, Media and Telecom Conf 18 May     19:30           West Pharmaceutical Services Inc at UBS Global Healthcare Conf 18 May     08:00       Nexus AG Annual Shareholders Meeting 18 May     20:00        Insmed Inc at UBS Global Healthcare Conf 18 May     20:00            Spectra Energy at American Gas Forum 18 May     20:00           UIL at American Gas Forum 18 May     20:00           Vectren at American Gas Forum 18 May     20:10        CyrusOne Inc at JPMorgan Conf 18 May     20:10        EnerNOC Inc at JPMorgan Conf 18 May     20:10          Guidewire Software Inc at JPMorgan Conf 18 May     20:10           Heartland Payment Systems Inc at JPMorgan Conf 18 May     20:10        iRobot at JPMorgan Conf 18 May     20:10          Model N Inc at JPMorgan Conf 18 May     20:10          Tribune Media Co at JPMorgan Conf 18 May     20:30        LegacyTexas Financial Group Inc Annual Shareholders Meeting 18 May     20:45           AGL Resources Inc at American Gas Forum 18 May     20:45           Black Hills at American Gas Forum 18 May     21:00           Motorola Solutions Inc Annual Shareholders Meeting 18 May     21:30           UGI at American Gas Forum            FOR ALL AMERICAN HOLIDAYS      FOR AN INDEX OF ALL DIARIES            If you have any questions or comments on the Corporate diary, please e-mail:     diaries@thomsonreuters.com   ",2015-05-15,MSI,"Fri May 15, 2015 | 8:56am EDT",DIARY-U.S. MEETINGS/WEEK AHEAD,http://www.reuters.com//article/diary-us-meetings-week-idUSL3N0Y662Z20150515?type=companyNews
77,"  BEIJING/HONG KONG Lenovo Group Ltd (0992.HK), the world's biggest PC maker by sales, said on Thursday its annual net profit rose 1 percent to $829 million, slightly below analyst expectations, as intense competition in the Chinese smartphone market eroded margins.Analysts had forecast a net profit of $857 million. Revenue during the 2014/15 financial year rose 20 percent to $46.3 billion as Lenovo expanded its share of the shrinking PC market to one-fifth. In the fourth-quarter alone, revenue rose 21 percent to $11.3 billion.Lenovo said PC sales, by far the group's largest business,  rose across all geographic regions but targeted Europe in particular as an area of potential growth. PC sales to businesses rose 3 percent year-on-year despite a 3 percent drop in the broader market, it added.Speaking to reporters in Hong Kong on Thursday, Yang acknowledged Lenovo's smartphone business was flagging on its home turf, a slowing market characterized by intense competition and razor-thin margins.Industry analyst group IDC said last week smartphone shipments in the world's most populous country shrank for the first time in six years as the market became saturated. Yang said the company needed to improve profitability in China after the smartphone division's performance crimped Lenovo's overall operating margin in China.""We have encountered bigger challenges in China during the past few years,"" Yang said. ""Our advantage was at the carriers sales channels in the past, but now we need to rebuild our retail and online sales channels.""Lenovo, whose phones are selling well in markets outside China, recently launched a sub-brand called ShenQi that is sold only online in a bid to attract young, price- and fashion-conscious buyers and ward off Internet-based rivals like Xiaomi Inc XTC.UL. Lenovo has been expanding into enterprise computing and smartphones to offset the decline in PC sales globally. The Beijing-based firm closed in October its $2.1 billion acquisition of IBM's low-end server unit and also its $2.9 billion purchase of Motorola.The company said both the IBM unit and Motorola were ""on track to deliver their targets"", with Motorola, which re-entered the Chinese market in January, set to turn profitable within 4 to 6 months. The American handset maker accounted for 7.8 million out of Lenovo's total 18.7 million mobile units sold during the quarter.Yang also downplayed reports that the U.S. Navy would replace its IBM low-end servers out of cybersecurity concerns following the unit's transfer to a Chinese owner. He said the matter could be resolved and would not affect Lenovo's business. ""Lenovo is trusted and respected worldwide and our PC business has also expanded globally including in the U.S. government and army. We haven't heard such complaints...We are willing to communicate with the U.S. government to solve problems.""After beating earnings expectations in consecutive quarters, Lenovo shares have risen nearly 50 percent to HK $13.6 in the past 12 months, outpacing the 23 percent gain in the broader market. (Reporting by Gerry Shih in Biejing and Yimou Lee in Hong Kong; Editing by Miral Fahmy/Mark Heinrich)",2015-05-21,MSI,"Thu May 21, 2015 | 7:32am EDT","Lenovo annual profit up 1 percent, missing forecasts, amid China smartphone competition",http://www.reuters.com//article/us-lenovo-results-idUSKBN0O60ED20150521?type=companyNews
78,"  * FY 2014/15 net profit $829 mln* Motorola, IBM purchases weigh on profit* FY revenue up 20 pct to $4.6 bln   (Adds details and CEO comments)BEIJING/HONG KONG, May 21 Lenovo Group Ltd , the world's biggest PC maker by sales, said on Thursday its annual net profit rose 1 percent to $829 million, slightly below analyst expectations, as intense competition in the Chinese smartphone market eroded margins.Analysts had forecast a net profit of $857 million.Revenue during the 2014/15 financial year rose 20 percent to $46.3 billion as Lenovo expanded its share of the shrinking PC market to one-fifth. In the fourth-quarter alone, revenue rose 21 percent to $11.3 billion.Lenovo said PC sales, by far the group's largest business,  rose across all geographic regions but targeted Europe in particular as an area of potential growth. PC sales to businesses rose 3 percent year-on-year despite a 3 percent drop in the broader market, it added. Speaking to reporters in Hong Kong on Thursday, Yang acknowledged Lenovo's smartphone business was flagging on its home turf, a slowing market characterised by intense competition and razor-thin margins.Industry analyst group IDC said last week smartphone shipments in the world's most populous country shrank for the first time in six years as the market became saturated.Yang said the company needed to improve profitability in China after the smartphone division's performance crimped Lenovo's overall operating margin in China. ""We have encountered bigger challenges in China during the past few years,"" Yang said. ""Our advantage was at the carriers sales channels in the past, but now we need to rebuild our retail and online sales channels.""Lenovo, whose phones are selling well in markets outside China, recently launched a sub-brand called ShenQi that is sold only online in a bid to attract young, price- and fashion-conscious buyers and ward off Internet-based rivals like Xiaomi Inc.Lenovo has been expanding into enterprise computing and smartphones to offset the decline in PC sales globally. The Beijing-based firm closed in October its $2.1 billion acquisition of IBM's low-end server unit and also its $2.9 billion purchase of Motorola. The company said both the IBM unit and Motorola were ""on track to deliver their targets"", with Motorola, which re-entered the Chinese market in January, set to turn profitable within 4 to 6 months. The American handset maker accounted for 7.8 million out of Lenovo's total 18.7 million mobile units sold during the quarter.Yang also downplayed reports that the U.S. Navy would replace its IBM low-end servers out of cybersecurity concerns following the unit's transfer to a Chinese owner. He said the matter could be resolved and would not affect Lenovo's business.""Lenovo is trusted and respected worldwide and our PC business has also expanded globally including in the U.S. government and army. We haven't heard such complaints...We are willing to communicate with the U.S. government to solve problems.""After beating earnings expectations in consecutive quarters, Lenovo shares have risen nearly 50 percent to HK $13.6 in the past 12 months, outpacing the 23 percent gain in the broader market.(Reporting by Gerry Shih in Biejing and Yimou Lee in Hong Kong; Editing by Miral Fahmy/Mark Heinrich)",2015-05-21,MSI,"Thu May 21, 2015 | 7:31am EDT","UPDATE 2-Lenovo annual profit up 1 pct, missing forecasts, amid China smartphone competition",http://www.reuters.com//article/lenovo-results-idUSL3N0YC23R20150521?type=companyNews
79,"  BEIJING May 21 Lenovo Group Ltd, the world's leading PC maker, said on Thursday its annual net profit rose one percent to $829 million, below analysts expectations, after completing two major acquisitions.Analysts had forecast a net profit of $857 million. Revenue during the 2014/15 financial year to March 31 also rose 20 percent to $46.3 billion. In the fourth-quarter, revenue rose 21 percent to $11.3 billion, slightly lower than expectations of $11.98 billion, according to Thomson Reuters SmartEstimate.  In October, the Beijing-based firm closed its $2.1 billion acquisition of IBM's low-end server unit and also its $2.9 billion purchase of Motorola. It has also been expanding into enterprise computing and consumer smartphones in anticipation of a long-term decline in PC sales.   (Reporting by Gerry Shih; Editing by Miral Fahmy)",2015-05-21,MSI,"Thu May 21, 2015 | 12:44am EDT","Lenovo annual profit up 1 pct, misses forecasts, on IBM, Motorola deals",http://www.reuters.com//article/lenovo-results-idUSL1N0YC04U20150521?type=companyNews
80,"  (Corrects to Motorola Mobility from Motorola Solutions Inc in last item in June 1 compilation)June 1 The following are the top stories on the New York Times business pages. Reuters has not verified these stories and does not vouch for their accuracy.* The founder of Men's Wearhouse is officially unveiling zTailors, a website and app that connect customers with on-demand tailors who make house calls. (nyti.ms/1AE9NS5) * Flibanserin, which aims to restore lost libido in women, has been twice rejected by the FDA, which cited limited effectiveness as well as side effects. The drug will go before agency advisers again on Thursday. (nyti.ms/1d8nqxD) * After clearing the Senate last month, the bill to give the U.S. President Barack Obama fast-track authority for the Trans-Pacific Partnership will meet skepticism from Democrats and the Republicans'. (nyti.ms/1RDyemU) * Saudi Arabia is less concerned about the price of crude oil in the global markets and more concerned about delivering fuel to its growing economy. The change is upending the traditional market dynamics that have influenced the direction of oil prices for decades. (nyti.ms/1I3gMUn)* Years after Motorola Mobility, the mobile device company, became a corporate victim of a price-fixing scheme, the Supreme Court might take up the case. (nyti.ms/1M2kFdu)   (Compiled by Zara Mascarenhas in Bengaluru)",2015-06-02,MSI,"Tue Jun 2, 2015 | 5:05pm EDT",CORRECTED-PRESS DIGEST- New York Times business news - June 1,http://www.reuters.com//article/press-digest-nyt-idUSL3N0YN1TX20150602?type=companyNews
