,Article,Date,Symbol,Time,Title,Url
55,"   By Mary Wisniewski | CHICAGO  CHICAGO Chicago Mayor Rahm Emanuel asked Illinois lawmakers on Tuesday to reform sentencing for low-level drug offenses, which would include ticketing rather than arresting people caught with small amounts of marijuana.Emanuel said decriminalization of possession of less than eight grams of marijuana in the third-largest U.S. city since 2012 has kept non-violent offenders out of courts and jails and reduced paperwork, freeing up police officers to deal with violent crimes.Emanuel and Chicago Police Superintendent Garry McCarthy were addressing a joint, bipartisan committee of state lawmakers that is holding preliminary hearings to overhaul the Illinois criminal code to address problems with prison overcrowding and mandatory minimum sentencing rules.The mayor and police chief also recommended that possession of less than one gram of controlled substances such as cocaine be a misdemeanor rather than a felony. The plea for softer drug laws is part of Emanuel and McCarthy's strategy to also push lawmakers to adopt harsher sentences for gun crimes. Chicago officials say illegal guns are a major factor in the city's high number of murders.Emanuel said on Tuesday that the change statewide would save tax dollars that can be used on crime prevention programs.""It doesn't make sense that one arrest for a very small amount of a controlled substance can lead to a lifetime of struggles, sending people in and out of prison and putting up barriers to getting a job or finding a place to live,"" he said at the hearing in Chicago. Sixteen states plus the District of Columbia have decriminalized marijuana possession and two states have legalized retail sales, according to NORML, a group lobbying to legalize the drug.""It's consistent with both Democratic and Republican efforts at the state levels to reduce prison populations,"" NORML executive director Allen St. Pierre said of Emanuel's proposal.  A May 2014 Roosevelt University study of the implementation of the marijuana decriminalization ordinance in Chicago was critical of the city police, finding they were still more likely to arrest people caught with small amounts of pot than ticket them.McCarthy and Emanuel told lawmakers that the city has reduced arrests by 14 percent over the past three years, and that the number of burglaries - a crime often related to drug problems - and other crimes has also gone down in the same time period. (Additional reporting by Fiona Ortiz; Editing by Doina Chiacu and Mohammad Zargham)",2014-09-23,MSI,"Tue Sep 23, 2014 | 3:32pm EDT",Chicago Mayor Emanuel proposes decriminalizing pot in Illinois,http://www.reuters.com//article/us-usa-marijuana-illinois-idUSKCN0HI23020140923?type=companyNews
56,"  BEIJING Oct 30 China's Lenovo Group Ltd  said Thursday it has closed its $2.91 bln acquisition of the Motorola handset unit from Google Inc, paving the way for a fresh assault on the U.S. smartphone market.The purchase comes as Lenovo, the world's leading PC maker, ramps up its effort to diversify its business and establish itself as a smartphone maker with global appeal.  Google acquired the iconic smartphone brand and its prized patent portfolio in 2012 for $12.5 billion but struggled to reverse Motorola's years-long decline. Under the Lenovo deal, Google will retain a significant portion of Motorola's patents.   (Reporting by Gerry Shih) ",2014-10-30,MSI,"Thu Oct 30, 2014 | 6:18am EDT",Lenovo closes $2.91 bln acquisition of Motorola unit from Google,http://www.reuters.com//article/lenovo-motorola-idUSB9N0RQ02L20141030?type=companyNews
57,"  Motorola Solutions Inc reported a better-than-expected quarterly profit as it slashed costs, and the maker of walkie-talkies and radio systems raised its share buyback authorization by $5 billion.Motorola Solutions has about $600 million remaining from its earlier $7 billion buyback program, and the new authorization takes the total to $12 billion since July 2011.The company's total operating expenses from continuing operations fell 9 percent in the quarter ended Sept. 27, Chief Financial Officer Gino A. Bonanotte said on a conference call.Motorola said it expected to cut costs by more than $200 million in 2014 and was on track to save $300 million by the end of 2015.The company's shares rose 2.8 percent to $66.50 in early trading on the New York Stock Exchange on Tuesday.Motorola, which completed the sale of its enterprise business to Zebra Technologies Corp for $3.45 billion in October, forecast a 1-3 percent fall in fourth-quarter sales due to weak government spending. Sales to government agencies such as fire and police departments accounted for 69 percent of Motorola Solutions' sales in 2013.The rest came from its enterprise business, which makes rugged mobile computers, tablets and barcode scanners.Motorola Solutions' net income fell to $147 million, or 59 cents per share, in the quarter 27 from $307 million, or $1.16 per share, a year earlier. Excluding items, the company earned 62 cents per shareRevenue fell 5.3 percent to $1.44 billion. Analysts on average had expected a profit of 41 cents per share on revenue of $1.39 billion.Motorola Solutions is not related to smartphone maker Motorola Mobility, which is now owned by China's Lenovo Group Ltd.Up to Monday's close, the company's stock had fallen about 4 pct this year.    (Reporting By Arathy S Nair and Anya George Tharakan in Bangalore; Editing by Ted KerrEditing by Robin Paxton)",2014-11-04,MSI,"Tue Nov 4, 2014 | 10:27am EST",Motorola Solutions raises buyback program by $5 billion,http://www.reuters.com//article/us-motorola-solu-results-idUSKBN0IO13P20141104?type=companyNews
58,"  Nov 4 Motorola Solutions Inc, which makes walkie-talkies and radio systems, reported a 5.3 percent fall in quarterly revenue due to lower sales in North America and the Asia-Pacific region.The company's net income fell to $147 million, or 59 cents per share, for the third quarter ended Sept. 27 from $307 million, or $1.16 per share, a year earlier.  Revenue fell to $1.44 billion from $1.52 billion.   (Reporting By Arathy S Nair and Anya George Tharakan in Bangalore; Editing by Robin Paxton) ",2014-11-04,MSI,"Tue Nov 4, 2014 | 7:18am EST",Motorola Solutions reports lower Q3 revenue,http://www.reuters.com//article/motorola-solu-results-idUSL4N0SU52E20141104?type=companyNews
59,"   By Michael Gold | TAIPEI  TAIPEI Chips from Taiwan's MediaTek Inc were mostly passed over by the big phone brands a decade ago, with the likes of Nokia and Motorola commanding legions of in-house engineers who could advise on electronics and circuitry. Fast-forward to the age of the smartphone. The market is heaving with Chinese smartphone makers out to grab share from Apple Inc and Samsung Electronics Co Ltd with low-priced handsets. Sparking the boom in budget smartphones is MediaTek, now a $23 billion go-to chip designer favored by margin-conscious phone makers. MediaTek pioneered bundling low-cost chips with recommendations on hardware such as lenses and speakers. This ""system-on-chip"" approach saves phone makers the cost of finding and testing parts to match the chips they buy. That in turn allows them to cut prices and, in the past year, seize 10 percentage points of market share from leader Samsung.Thanks in large part to system-on-chip, the average price of a smartphone should fall to $267 by 2018 from $314 now, showed data from researcher IDC. That compared with a U.S. starting price of $749 for the latest Apple iPhone 6 Plus.MediaTek says system-on-chip has won it the patronage of every phone brand bar Samsung and Apple. It helped low-priced smartphone maker Xiaomi Technology Co Ltd become the industry's No.3 in just three years, and is tipped for similar success with Google Inc's Android One in India.""You can think about MediaTek as having a franchise business model, like McDonald's,"" Chief Financial Officer David Ku told Reuters. ""McDonald's gives you all the equipment you need, and the initial cost for you is lower.""MediaTek's system-on-chip strategy has helped the company's market value rise 125 percent to T$715.8 billion ($23.39 billion) in less than three years.The strategy involves collaborating with almost 200 Chinese component makers and handset assemblers to supply MediaTek's smartphone customers with parts compatible with its chips. MediaTek built up its supplier network in the feature phone era. At that time, it says, larger rivals sold chips to big phone makers which would employ thousands of engineers to find and test components such as screens for the chips to operate.""They weren't really interested in doing business with MediaTek,"" Ku said of phone makers.To differentiate, MediaTek began recommending hardware for its chips and targeting companies with limited means of sourcing and testing components independently. That lowered the barrier to enter the phone business, reduced costs and helped handsets reach the market quicker.""The smartphone ecosystem compared with the feature phone ecosystem is very similar, if not the same,"" said Ku. ""It's all well-connected pipes. It doesn't matter what product you pump in."" FABLESS CHIPMAKER MediaTek adds reference designs to basic chip architecture, enabling components to work together. It contracts fabs - or chip factories - to make the chips, which it sells to phone makers along with a list of compatible sensors, microphones and other hardware.It is the list that saves customers money, helping them make smartphones more affordable - particularly in emerging markets such as China, which accounts for 70 to 80 percent of MediaTek sales.Thrifty handset buyers have helped MediaTek sales rise at least 40 percent each month this year, culminating in October's 56 percent. For the full year, it estimates sales of 350 million smartphone ""chipsets"" from just 10 million in 2011. That would amount to 30 percent of the global market, showed Reuters calculations. Fubon Research analyst Carlos Peng estimated nearer 50 percent when excluding chipsets from the likes of Qualcomm Inc and Samsung that are primarily destined for high-priced smartphones.MediaTek's sales spurt is largely due to ""revolutionary"" growth in the value of silicon per handset in function-heavy smartphones versus their far simpler feature phone predecessors, said analyst Rick Hsu at Daiwa Capital Markets in Taipei.""It was a virtually 100 percent increase in silicon value,"" Hsu said. ""It spurred demand for a lot of peripheral chips.""Growth is unlikely to be as marked in the ongoing transition to fourth-generation Long-Term Evolution (4G LTE) connectivity. MediaTek may even struggle with the emergence of 4G in China as it trails Qualcomm in the technology, analysts say.""The first couple of years of LTE could be very much like the early days of 3G (in 2008-2010), or when MediaTek had to play 'catch-up',"" Yuanta Securities analyst George Chang wrote in a research note. That ""usually leads to pricing erosion.""($1 = 30.5970 Taiwan dollar) (Editing by Miyoung Kim and Christopher Cushing)",2014-11-16,MSI,"Sun Nov 16, 2014 | 5:00pm EST",Little-known Taiwanese chip designer spawns low-priced smartphone boom,http://www.reuters.com//article/us-mediatek-mobilephone-idUSKCN0J00Z620141116?type=companyNews
60,"   By Michael Gold | TAIPEI  TAIPEI Nov 17 Chips from Taiwan's MediaTek Inc  were mostly passed over by the big phone brands a decade ago, with the likes of Nokia and Motorola commanding legions of in-house engineers who could advise on electronics and circuitry.Fast-forward to the age of the smartphone.The market is heaving with Chinese smartphone makers out to grab share from Apple Inc and Samsung Electronics Co Ltd with low-priced handsets. Sparking the boom in budget smartphones is MediaTek, now a $23 billion go-to chip designer favoured by margin-conscious phone makers.MediaTek pioneered bundling low-cost chips with recommendations on hardware such as lenses and speakers. This ""system-on-chip"" approach saves phone makers the cost of finding and testing parts to match the chips they buy. That in turn allows them to cut prices and, in the past year, seize 10 percentage points of market share from leader Samsung.Thanks in large part to system-on-chip, the average price of a smartphone should fall to $267 by 2018 from $314 now, showed data from researcher IDC. That compared with a U.S. starting price of $749 for the latest Apple iPhone 6 Plus.MediaTek says system-on-chip has won it the patronage of every phone brand bar Samsung and Apple. It helped low-priced smartphone maker Xiaomi Technology Co Ltd become the industry's No.3 in just three years, and is tipped for similar success with Google Inc's Android One in India.""You can think about MediaTek as having a franchise business model, like McDonald's,"" Chief Financial Officer David Ku told Reuters. ""McDonald's gives you all the equipment you need, and the initial cost for you is lower."" MediaTek's system-on-chip strategy has helped the company's market value rise 125 percent to T$715.8 billion ($23.39 billion) in less than three years.The strategy involves collaborating with almost 200 Chinese component makers and handset assemblers to supply MediaTek's smartphone customers with parts compatible with its chips.MediaTek built up its supplier network in the feature phone era. At that time, it says, larger rivals sold chips to big phone makers which would employ thousands of engineers to find and test components such as screens for the chips to operate.""They weren't really interested in doing business with MediaTek,"" Ku said of phone makers. To differentiate, MediaTek began recommending hardware for its chips and targeting companies with limited means of sourcing and testing components independently. That lowered the barrier to enter the phone business, reduced costs and helped handsets reach the market quicker.""The smartphone ecosystem compared with the feature phone ecosystem is very similar, if not the same,"" said Ku. ""It's all well-connected pipes. It doesn't matter what product you pump in.""FABLESS CHIPMAKER MediaTek adds reference designs to basic chip architecture, enabling components to work together. It contracts fabs - or chip factories - to make the chips, which it sells to phone makers along with a list of compatible sensors, microphones and other hardware. It is the list that saves customers money, helping them make smartphones more affordable - particularly in emerging markets such as China, which accounts for 70 to 80 percent of MediaTek sales.Thrifty handset buyers have helped MediaTek sales rise at least 40 percent each month this year, culminating in October's 56 percent. For the full year, it estimates sales of 350 million smartphone ""chipsets"" from just 10 million in 2011.That would amount to 30 percent of the global market, showed Reuters calculations. Fubon Research analyst Carlos Peng estimated nearer 50 percent when excluding chipsets from the likes of Qualcomm Inc and Samsung that are primarily destined for high-priced smartphones.MediaTek's sales spurt is largely due to ""revolutionary"" growth in the value of silicon per handset in function-heavy smartphones versus their far simpler feature phone predecessors, said analyst Rick Hsu at Daiwa Capital Markets in Taipei.""It was a virtually 100 percent increase in silicon value,"" Hsu said. ""It spurred demand for a lot of peripheral chips.""Growth is unlikely to be as marked in the ongoing transition to fourth-generation Long-Term Evolution (4G LTE) connectivity. MediaTek may even struggle with the emergence of 4G in China as it trails Qualcomm in the technology, analysts say.""The first couple of years of LTE could be very much like the early days of 3G (in 2008-2010), or when MediaTek had to play 'catch-up',"" Yuanta Securities analyst George Chang wrote in a research note. That ""usually leads to pricing erosion.""  ($1 = 30.5970 Taiwan dollar)   (Editing by Miyoung Kim and Christopher Cushing)",2014-11-16,MSI,"Sun Nov 16, 2014 | 4:00pm EST",Little-known Taiwanese chip designer spawns low-priced smartphone boom,http://www.reuters.com//article/mediatek-mobilephone-idUSL3N0T023Z20141116?type=companyNews
61,"   By Jonathan Stempel  A federal appeals court rejected Motorola Mobility LLC's bid to sue several Asian suppliers under U.S. antitrust law for fixing prices of mobile phone displays sold to its foreign units.    Wednesday's decision by the 7th U.S. Circuit Court of Appeals in Chicago may lessen protections against inflated prices for U.S. consumers who buy cellphones, computers and other products whose components are made outside the country.Circuit Judge Richard Posner said Motorola could not invoke U.S. antitrust law because the ""immediate victims"" had been non-U.S. subsidiaries that had bought most of the liquid crystal display screens that carried inflated prices.While Motorola, a unit of China's Lenovo Group Ltd, claimed it paid the defendants more than $5 billion during a conspiracy that ran from 1996 to 2006, only 1 percent of the components were shipped to the United States.""Motorola's foreign subsidiaries were injured in foreign commerce  in dealings with other foreign companies,"" Posner wrote for a three-judge panel.""To give Motorola rights to take the place of its foreign companies and sue on their behalf under U.S. antitrust law would be an unjustified interference with the right of foreign nations to regulate their own economies,"" he added.The defendants include AU Optronics Corp, Chunghwa Picture Tubes Ltd, HannStar Display Corp, LG Display Co, Samsung Electronics Co, Samsung SDI Co, Panasonic Corp's Sanyo unit, Sharp Corp and Toshiba Corp.Some LCD makers have pleaded guilty to U.S. criminal price-fixing charges. Wednesday's decision limits the scope of Motorola's separate, civil lawsuit, which also alleged violations of state antitrust and consumer protection laws. The civil case had also drawn concern from the court that Motorola was trying to obtain U.S. antitrust protections even as it shifted tax burdens to other countries. Motorola, which is based in Chicago, denied that accusation, saying it repatriated foreign profits and paid U.S. taxes.UNFRIENDED  ""The court's opinion basically says that Motorola can't have it both ways,"" said Robert Wick, a partner at Covington & Burling who represents Samsung Electronics and argued the defendants' case before the 7th Circuit on Nov. 13. ""Motorola can't be a foreign company for purposes of manufacturing phones, but a U.S. company when it comes to asserting antitrust claims.""Motorola spokesman Will Moss said: ""We disagree with the decision, and are considering our options.""Posner said Motorola and its customers were only ""indirect"" purchasers of the LCD screens, and that Motorola's claims were barred under a 1982 law limiting antitrust claims against non-U.S. companies to conduct directly linked to domestic commerce.Of the screens shipped to non-U.S. factories, 42 percent were used in products sold in the United States, and 57 percent in products sold elsewhere. The U.S. Department of Justice and Federal Trade Commission had submitted a brief urging that U.S. antitrust law did cover the price-fixing conspiracy.But Posner said the government stopped short of saying Motorola deserved antitrust damages, and merely sought assurance that U.S. efforts to obtain criminal and civil sanctions against foreign companies for antitrust violations would not be impeded.""Motorola has lost its best friend,"" Posner said, referring to the government.A Justice Department spokesman said the government is pleased the court recognized the ""propriety"" of its efforts to protect U.S. consumers from non-U.S. price-fixing cartels.Lenovo bought Motorola Mobility for $2.91 billion in October from Google Inc, which had purchased the company two years earlier.The case is Motorola Mobility LLC v. AU Optronics Corp, et al, 7th U.S. Circuit Court of Appeals, No. 14-8003. (Reporting by Jonathan Stempel in New York; Additional reporting by Dan Levine in San Francisco and Lawrence Hurley in Washington, D.C.; Editing by Jeffrey Benkoe, Lisa Von Ahn and Richard Chang)",2014-11-26,MSI,"Wed Nov 26, 2014 | 4:49pm EST",U.S. court rejects Motorola Mobility price-fixing appeal,http://www.reuters.com//article/us-lenovo-motorolamobility-pricefixing-l-idUSKCN0JA1XJ20141126?type=companyNews
62,"  * Net profit $253 mln vs $200 mln analyst f'casts* Motorola contribution helps mobile sales leap 109 pct* PC shipments up 5 pct   (Adds CEO comments and details on results, strategy)By Gerry ShihBEIJING, Feb 3 Lenovo Group Ltd, the world's leading PC maker, said on Tuesday its third-quarter revenue rose 31 percent to $14.1 billion, beating investor expectations, as its mobile division sales more than doubled following its acquisition of Motorola.The results, released before the Hong Kong Stock Exchange opened Tuesday, sent Lenovo shares 5.7 percent higher in morning trade to HK$10.76, compared with a 0.36 percent fall on the broader Hang Seng index. Lenovo paid $2.91 billion for Motorola, the U.S. handset brand with a long sales history in the United States and Europe, as part of an effort to diversify away from the shrinking PC market.Lenovo's results took into account two months of Motorola's performance - the acquisition closed Oct 31 - and the company said Motorola sold more than 10 million handsets during the quarter for the first time.Chief Executive Yang Yuanqing told Reuters the acquisition will set Lenovo apart from Chinese rivals Xiaomi Inc and Huawei Technologies Co Ltd, as competition intensifies between them for the title of No. 3 global smartphone maker behind Samsung Electronics Co Ltd and Apple Inc. ""We're not the same as the other Chinese players because now we have become a global player,"" Yang said.Xiaomi, in particular, has swept aside Lenovo in China but has largely avoided Western markets due to fears of intellectual property challenges.Yang pledged to fight back against Xiaomi in China by adopting its rival's Internet distribution model. Lenovo in May signed a deal with e-commerce site JD.com and announced a subsidiary last month to sell smartphones and wearables exclusively online. Under Lenovo, Motorola will re-enter the Chinese market and be distributed primarily online, Yang said.Total sales from the mobile division leapt 109 percent to $3.39 billion, or a quarter of the company's sales.Lenovo said net profit was $253 million, down from $265 million a year prior due to ballooning expenses associated with closing two major acquisitions. The Beijing-based company also acquired IBM's low-end server unit for $2.1 billion.The results beat expectations of $13.71 billion in revenue and $200 million in net profit, according to analysts polled by Thomson Reuters SmartEstimates.Lenovo continued to consolidate its hold on the PC market, reaching a record 20 percent share during the quarter with sales of $9.15 billion. Shipments rose 5 percent compared with a 3 percent decline in the broader industry, with growth particularly strong in Eastern Europe.   (Reporting by Gerry Shih; Editing by Stephen Coates)",2015-02-03,MSI,"Mon Feb 2, 2015 | 10:39pm EST","UPDATE 2-Lenovo quarterly revenue jumps 31 pct, tops expectations",http://www.reuters.com//article/lenovo-results-idUSL4N0VD02920150203?type=companyNews
63,"  Motorola Solutions Inc (MSI.N), a maker of walkie-talkies and radio systems, reported better-than-expected quarterly revenue and forecast a smaller-than-expected fall in sales in the current quarter, helped by increasing demand in North America.Revenue was little changed at $1.82 billion, but beat analysts' average estimate of $1.78 billion, driven mainly by a 4 percent year-on-year increase in North American sales.""The business continues to show signs of improvement, driven by growth in North America and significantly higher backlog,"" Chief Executive Greg Brown said in a statement.The company said it expected sales in North America to continue to grow in the first quarter, but warned of a slowdown in Europe.Motorola Solutions forecast a 2-4 percent fall in sales for the first quarter of 2015 compared with a year earlier, which translates to sales of about $1.73 billion-$1.76 billion.Analysts on average were expecting first-quarter sales of $1.27 billion, according to Thomson Reuters I/B/E/S. However, the company forecast an adjusted profit from continuing operations of 22-27 cents per share, well below the average analyst estimate of 46 cents.Motorola Solutions has grown more dependant on government spending after selling its enterprise business to Zebra Technologies Corp (ZBRA.O) last year. The enterprise business makes rugged mobile computers, tablets and barcode scanners. The company said it managed to cut its operating expenses by more than $200 million by the end of 2014 and expected further cost saving of about $150 million this year.Motorola Solutions said operating expenses fell 17 percent to $431 million in the fourth quarter ended Dec. 31, mainly due to staff reductions.Net income attributable to the company fell to $201 million, or 87 cents per share, in the quarter, from $343 million, or $1.31 per share, a year earlier. Excluding items, the company earned $1.25 per share, above the average analyst estimate of $1.12 per share.Motorola Solutions is not related to smartphone maker Motorola Mobility, which is now owned by China's Lenovo Group Ltd (0992.HK). (Reporting By Arathy S Nair in Bengaluru; Editing by Maju Samuel and Simon Jennings)",2015-02-04,MSI,"Wed Feb 4, 2015 | 9:24am EST","Motorola Solutions revenue, forecast beat on strong N. America sales",http://www.reuters.com//article/us-motorola-solu-results-idUSKBN0L81BV20150204?type=companyNews
