,Article,Date,Symbol,Time,Title,Url
14,"  Data storage equipment maker NetApp Inc said Tom Georgens had stepped down as chairman and chief executive.George Kurian, NetApp's executive vice-president of product operations, will replace Georgens as CEO.Lead independent director Mike Nevens has been elected chairman. The company reported fourth-quarter results below analysts' estimates in May, hurt by lower sales to original equipment manufacturers. NetApp had also said it was cutting about 500 jobs.   (Reporting by Anya George Tharakan in Bengaluru; Editing by Maju Samuel)",2015-06-01,NTAP,"Mon Jun 1, 2015 | 4:33pm EDT",NetApp CEO Tom Georgens steps down,http://www.reuters.com//article/us-netapp-moves-ceo-idUSKBN0OH3BF20150601?type=companyNews
15,"  June 1 Data storage equipment maker NetApp Inc  said Tom Georgens had stepped down as chairman and chief executive.George Kurian, NetApp's executive vice-president of product operations, will replace Georgens as CEO. Lead independent director Mike Nevens has been elected chairman. The company reported fourth-quarter results below analysts' estimates in May, hurt by lower sales to original equipment manufacturers. NetApp had also said it was cutting about 500 jobs.     (Reporting by Anya George Tharakan in Bengaluru; Editing by Maju Samuel)",2015-06-01,NTAP,"Mon Jun 1, 2015 | 4:22pm EDT",NetApp CEO Tom Georgens steps down,http://www.reuters.com//article/netapp-moves-ceo-idUSL3N0YN55220150601?type=companyNews
16,"  Data storage equipment maker NetApp Inc (NTAP.O) reported better-than-expected quarterly adjusted profit and revenue as its focus on cloud-based storage products starts to pay off.Shares of the company, which is in the middle of a restructuring, jumped 7.1 percent in extended trading on Wednesday as the company also forecast current-quarter profit and revenue above estimates.NetApp, which faces strong competition from EMC Corp EMC.N and newer flash-based storage vendors such as Nimble Storage Inc NMBL.O, has been trying to boost growth by focusing on high-margin cloud-based products as businesses cut spending on hardware storage systems.""Our first fiscal quarter marks the beginning of a new chapter for NetApp,"" said Chief Executive George Kurian, who  took over the top job from Tom Georgens in June.The company has overhauled its cloud product Data Ontap, which protects and manages data at both its customers' data centers and cloud vendors such as Amazon.com Inc (AMZN.O). NetApp said in May it would lay off 500 employees as part of a restructuring plan to turn around slowing growth.NetApp said it expects adjusted profit of 55-60 cents per share on revenue of $1.40 billion to $1.50 billion in the second quarter.Analyst on average were expecting a profit of 46 cents per share on revenue of $1.39 billion, according to Thomson Reuters I/B/E/S. For the first quarter, the company posted a loss of 10 cents per share due to special items such as stock-based compensation expense and restructuring charges.Excluding those items, the company earned 29 cents per share, beating the average analyst estimate of 23 cents per share. Revenue fell 10.3 percent to $1.34 billion in the first quarter ended July 31, but topped analysts' average expectation of $1.32 billion.NetApp's shares closed at $29.78 on the Nasdaq on Wednesday. They have lost 28 percent in the past year. (Reporting By Lehar Maan in Bengaluru; Editing by Saumyadeb Chakrabarty)",2015-08-19,NTAP,"Wed Aug 19, 2015 | 5:31pm EDT",NetApp results beat estimates as cloud focus pays off,http://www.reuters.com//article/us-netapp-results-idUSKCN0QO26E20150819?type=companyNews
17,"  (Adds share, details, background)Aug 19 Data storage equipment maker NetApp Inc  reported better-than-expected quarterly adjusted profit and revenue as its focus on cloud-based storage products starts to pay off.Shares of the company, which is in the middle of a restructuring, jumped 7.1 percent in extended trading on Wednesday as the company also forecast current-quarter profit and revenue above estimates.NetApp, which faces strong competition from EMC Corp  and newer flash-based storage vendors such as Nimble Storage Inc , has been trying to boost growth by focusing on high-margin cloud-based products as businesses cut spending on hardware storage systems.""Our first fiscal quarter marks the beginning of a new chapter for NetApp,"" said Chief Executive George Kurian, who  took over the top job from Tom Georgens in June. The company has overhauled its cloud product Data Ontap, which protects and manages data at both its customers' data centers and cloud vendors such as Amazon.com Inc.NetApp said in May it would lay off 500 employees as part of a restructuring plan to turn around slowing growth. NetApp said it expects adjusted profit of 55-60 cents per share on revenue of $1.40 billion to $1.50 billion in the second quarter.Analyst on average were expecting a profit of 46 cents per share on revenue of $1.39 billion, according to Thomson Reuters I/B/E/S. For the first quarter, the company posted a loss of 10 cents per share due to special items such as stock-based compensation expense and restructuring charges.Excluding those items, the company earned 29 cents per share, beating the average analyst estimate of 23 cents per share.Revenue fell 10.3 percent to $1.34 billion in the first quarter ended July 31, but topped analysts' average expectation of $1.32 billion.NetApp's shares closed at $29.78 on the Nasdaq on Wednesday. They have lost 28 percent in the past year.   (Reporting By Lehar Maan in Bengaluru; Editing by Saumyadeb Chakrabarty)",2015-08-19,NTAP,"Wed Aug 19, 2015 | 5:29pm EDT",UPDATE 1-NetApp results beat estimates as cloud focus pays off,http://www.reuters.com//article/netapp-results-idUSL3N10U5C420150819?type=companyNews
18,"  Aug 19 Data storage equipment maker NetApp Inc  reported better-than-expected quarterly adjusted profit and revenue as its focus on cloud-based storage products starts to pay off.Revenue fell 10.3 percent to $1.34 billion in the first quarter ended July 31, but topped analysts' average expectation of $1.32 billion. Excluding items, it earned 29 cents per share, beating the average analyst estimate of 23 cents per share, according to Thomson Reuters I/B/E/S.  NetApp reported a net loss of $30 million, or 10 cents per share, compared with a profit of $88 million, or 27 cents per share, a year earlier.    (Reporting By Lehar Maan in Bengaluru; Editing by Saumyadeb Chakrabarty)",2015-08-19,NTAP,"Wed Aug 19, 2015 | 4:19pm EDT",NetApp first-quarter results beat analysts' estimates,http://www.reuters.com//article/netapp-results-idUSL3N10U5A820150819?type=companyNews
19,  Nov 17 Gemalto NV : * Gemalto partners with Netapp to deliver integrated cloud storage and data security solution for Amazon Web Services customers  Source text for Eikon:  Further company coverage:    (Gdynia Newsroom)  ,2015-11-17,NTAP,"Tue Nov 17, 2015 | 1:07am EST",BRIEF-Gemalto partners with Netapp to deliver cloud and data security solution,http://www.reuters.com//article/idUSFWN13B0B220151117?type=companyNews
20,"  Nov 18 Data storage equipment maker NetApp Inc  reported a 6.4 percent fall in quarterly revenue, as demand for products in its core storage business fell.Net income fell to $114 million, or 39 cents per share, in the second quarter ended Oct. 30, from $160 million, or 49 cents per share, a year earlier.  Revenue fell to $1.45 billion from $1.54 billion.     (Reporting by Anya George Tharakan in Bengaluru; Editing by Sriraj Kalluvila) ",2015-11-18,NTAP,"Wed Nov 18, 2015 | 4:08pm EST",NetApp revenue falls 6.4 pct,http://www.reuters.com//article/netapp-results-idUSL3N13D57F20151118?type=companyNews
21,"  Data storage equipment maker NetApp Inc (NTAP.O) said it would buy SolidFire, a flash-storage systems maker, for $870 million in cash.The deal is expected to close in the fiscal fourth quarter, the company said on Monday.     (Reporting by Supantha Mukherjee in Bengaluru)",2015-12-21,NTAP,"Mon Dec 21, 2015 | 4:32pm EST",NetApp to buy flash storage maker SolidFire for $870 million,http://www.reuters.com//article/us-solidfire-m-a-netapp-idUSKBN0U42JA20151221?type=companyNews
22,"  Dec 21 Data storage equipment maker NetApp Inc  said it would buy SolidFire, a flash-storage systems maker, for $870 million in cash. The deal is expected to close in the fiscal fourth quarter, the company said on Monday.    (Reporting by Supantha Mukherjee in Bengaluru)  ",2015-12-21,NTAP,"Mon Dec 21, 2015 | 4:16pm EST",NetApp to buy flash storage maker SolidFire for $870 mln,http://www.reuters.com//article/solidfire-ma-netapp-idUSL3N14A53D20151221?type=companyNews
23,"  NetApp Inc (NTAP.O), a data storage equipment maker, reported lower-than-expected quarterly revenue, hurt by weak demand for its storage products, and said it would cut about 12 percent of its workforce.Shares of the company, which also forecast fourth-quarter earnings well below analysts' estimates, were down 2.8 percent at $22.90 in extended trading.NetApp said it expected a profit of between 55 cents and 60 cents per share for the current quarter. Analysts on average were expecting a profit of 72 cents, according to Thomson Reuters I/B/E/S.Net income fell to $153 million, or 52 cents per share, in the third quarter ended Jan. 29 from $177 million, or 56 cents per share, a year earlier. Excluding items, the company earned 70 cents per share. The company's products revenue fell 19.3 percent to $750 million in the third quarter.    Total revenue fell 10.6 percent to $1.39 billion.Analysts estimated a profit 68 cents per share on revenue of $1.45 billion. NetApp had about 12,810 employees as of April 24, 2015, according to a regulatory filing. (Reporting By Arathy S Nair in Bengaluru; Editing by Saumyadeb Chakrabarty and Anil D'Silva)",2016-02-17,NTAP,"Wed Feb 17, 2016 | 5:11pm EST",NetApp revenue misses estimates; to cut jobs,http://www.reuters.com//article/us-netapp-urgent-idUSKCN0VQ2R4?type=companyNews
24,"  NetApp Inc (NTAP.O), a data storage equipment maker, reported lower-than-expected quarterly revenue, hurt by weak demand for its storage products, and said it would cut about 12 percent of its workforce.Shares of the company, which also forecast fourth-quarter earnings well below analysts' estimates, were down 2.8 percent at $22.90 in extended trading.NetApp said it expected a profit of between 55 cents and 60 cents per share for the current quarter. Analysts on average were expecting a profit of 72 cents, according to Thomson Reuters I/B/E/S.Net income fell to $153 million, or 52 cents per share, in the third quarter ended Jan. 29 from $177 million, or 56 cents per share, a year earlier. Excluding items, the company earned 70 cents per share. The company's products revenue fell 19.3 percent to $750 million in the third quarter.    Total revenue fell 10.6 percent to $1.39 billion.Analysts estimated a profit 68 cents per share on revenue of $1.45 billion. NetApp had about 12,810 employees as of April 24, 2015, according to a regulatory filing. (Reporting By Arathy S Nair in Bengaluru; Editing by Saumyadeb Chakrabarty and Anil D'Silva)",2016-02-17,NTAP,"Wed Feb 17, 2016 | 5:11pm EST",UPDATE 1-NetApp revenue misses estimates; to cut jobs,http://www.reuters.com//article/netapp-results-idUSL3N15W5GE?type=companyNews
25,"  (Refiles to correct Reuters media packaging slug)Feb 17 Data storage equipment maker NetApp Inc  reported a 10.6 percent fall in quarterly revenue due to weak demand for its storage products, and said it would cut its workforce by 12 pct. Net income fell to $153 million, or 52 cents per share, in the third quarter ended Jan. 29, from $177 million, or 56 cents per share, a year earlier.  Revenue fell to $1.39 billion from $1.55 billion.   (Reporting By Arathy S Nair in Bengaluru; Editing by Saumyadeb Chakrabarty)",2016-02-17,NTAP,"Wed Feb 17, 2016 | 5:06pm EST",REFILE-NetApp revenue falls 10.6 pct; to cut 12 pct jobs,http://www.reuters.com//article/netapp-results-idUSL3N15W5C3?type=companyNews
26,"  March 15 Netapp Inc* on march 9, co, Google Inc entered agreement of purchase and sale and joint escrow instructions * Total purchase price for property is $250 million  * purchase agreement relates to sale of properties and related land in Sunnyvale, California  Source text for Eikon:  Further company coverage:",2016-03-15,NTAP,"Tue Mar 15, 2016 | 6:10pm EDT",BRIEF-Netapp and Google Inc entered agreement of purchase and sale and joint escrow instructions,http://www.reuters.com//article/idUSFWN16N0EO?type=companyNews
27,"  March 30 Netapp Inc * CFO Ronald J. Pasek's  annual base salary will be $550,000 - sec filing  Source text for Eikon:  Further company coverage:    (Bengaluru Newsroom: +1 646 223 8780)  ",2016-03-30,NTAP,"Wed Mar 30, 2016 | 9:04am EDT","BRIEF-Netapp CFO Ronald Pasek's annual base salary will be $550,000 - sec filing",http://www.reuters.com//article/idUSFWN1720FT?type=companyNews
28,"  March 30 Netapp Inc :* Ron Pasek joins netapp as executive vice president, chief financial officer * Appointment of Ron Pasek as executive vice president, chief financial officer  * Jeffrey Bergmann will now resume his previous role as vice president of corporate finance  Source text for Eikon:  Further company coverage:    (Bengaluru Newsroom: +1 646 223 8780)",2016-03-30,NTAP,"Wed Mar 30, 2016 | 8:08am EDT",BRIEF-Ron Pasek joins Netapp as CFO,http://www.reuters.com//article/idUSASC08IVU?type=companyNews
29,"  May 26 Netapp Inc* Q1 earnings per share view $0.45, revenue view $1.26 billion -- Thomson Reuters I/B/E/S* Company will increase Q1 fiscal year 2017 dividend by 6 pct to $0.19 per share* NetApp reports fourth quarter and fiscal year 2016 results * Q4 non-gaap earnings per share $0.55* Q4 gaap loss per share $0.03 * Q4 revenue $1.38 billion versus I/B/E/S view $1.4 billion* Q4 earnings per share view $0.58 -- Thomson Reuters I/B/E/S * Sees Q1 2017 non-gaap earnings per share $0.34 to $0.39* Sees Q1 2017 gaap earnings per share $0.13 to $0.18* Sees Q1 2017 revenue $1.2 billion to $1.35 billion  Source text for Eikon:  Further company coverage:",2016-05-25,NTAP,"Wed May 25, 2016 | 4:54pm EDT",BRIEF-NetApp posts Q4 non-gaap EPS of $0.55,http://www.reuters.com//article/idUSASC08RB4?type=companyNews
30,"  May 26 NetApp Inc* Smith's appointment brings number of NetApp board members to 10, 9 of whom are independent  * NetApp appoints Steve Smith to board of directors  Source text for Eikon:  Further company coverage: ",2016-05-25,NTAP,"Wed May 25, 2016 | 4:52pm EDT",BRIEF-NetApp appoints Steve Smith to board of directors,http://www.reuters.com//article/idUSASC08RAX?type=companyNews
31,"  Aug 17 Netapp Inc* Netapp reports first quarter fiscal year 2017 results* Q1 GAAP earnings per share $0.23* Sees Q2 2017 non-GAAP earnings per share $0.51 to $0.56 * Sees Q2 2017 revenue $1.265 billion to $1.415 billion* Q1 non-GAAP earnings per share $0.46 * Q1 earnings per share view $0.36 -- Thomson Reuters I/B/E/S* Sees Q2 2017 GAAP earnings per share $0.31 to $0.36 * Q1 revenue $1.29 billion versus I/B/E/S view $1.26 billion* Q1 earnings per share view $0.36, revenue view $1.26 billion -- Thomson Reuters I/B/E/S* Q2 earnings per share view $0.54, revenue view $1.33 billion -- Thomson Reuters I/B/E/S  Source text for Eikon:  Further company coverage:",2016-08-17,NTAP,"Wed Aug 17, 2016 | 4:21pm EDT",BRIEF-Netapp reports Q1 GAAP earnings per share $0.23,http://www.reuters.com//article/idUSASC093HW?type=companyNews
32,"  Aug 17 NetApp Inc* NetApp inc says Jean joins NetApp from IBM, where, most recently, she was global vice president for IBM cloud marketing  * NetApp names Jean English chief marketing officer  Source text for Eikon:  Further company coverage: ",2016-08-17,NTAP,"Wed Aug 17, 2016 | 4:11pm EDT",BRIEF-NetApp names Jean English chief marketing officer,http://www.reuters.com//article/idUSFWN1AY0T3?type=companyNews
33,  Oct 19 NetApp Inc :* Netapp names William H. Miller chief information officer  * Says Bill Miller appointed CIO  Source text for Eikon:  Further company coverage: ,2016-10-19,NTAP,"Wed Oct 19, 2016 | 8:14am EDT",BRIEF-NetApp names William H. Miller chief information officer,http://www.reuters.com//article/idUSASC09BRZ?type=companyNews
34,"  Nov 16 Netapp Inc -* Q3 earnings per share view $0.65, revenue view $1.36 billion -- Thomson Reuters I/B/E/S* Q2 non-gaap earnings per share $0.60* Q2 revenue $1.34 billion versus I/B/E/S view $1.36 billion * Sees Q3 2017 non-gaap earnings per share $0.72 to $0.77* Sees Q3 2017 revenue $1.325 billion to $1.475 billion * Netapp reports second quarter fiscal year 2017 results * Q2 gaap earnings per share $0.38* Q2 earnings per share view $0.54 -- Thomson Reuters I/B/E/S* Sees Q3 2017 gaap earnings per share $0.41 to $0.46  Source text for Eikon:  Further company coverage:",2016-11-16,NTAP,"Wed Nov 16, 2016 | 4:13pm EST",BRIEF-Netapp reports Q2 earnings per share $0.38,http://www.reuters.com//article/idUSASC09JDL?type=companyNews
