,Article,Date,Symbol,Time,Title,Url
105,"  (Adds details on corporate governance dispute)WASHINGTON Nov 3 Mylan received U.S. antitrust approval for its hostile bid for Irish-based generic drugmaker Perrigo Co under the condition Mylan sells seven drugs to Alvogen Group Inc, the Federal Trade Commission said on Tuesday.Netherlands-based Mylan made an offer for Perrigo in April, which was rejected, and went hostile in September. Perrigo shareholders have until Nov. 13 to accept its tender offer. Under Irish law, Mylan needs 80 percent of shareholders' votes to take control of Perrigo. In a letter to shareholders on Tuesday, Perrigo Chief Executive Joseph Papa reiterated his opposition to a deal with Mylan, calling its offer ""grossly inadequate"" and accusing Mylan of ""poor corporate governance practices.""Mylan has been criticized for using a type of poison pill available under Dutch law called ""stichting"" to fend off an offer by Teva this year. It was also criticized for giving the chairman of the board of directors the power to essentially veto shareholders' decision to fire him or her. Mylan Executive Chairman Robert Coury reiterated on Tuesday that if the deal with Perrigo goes through that Mylan would allow shareholders to vote to scrap both practices. He also said that he was ""very confident"" that Perrigo shareholders would side with Mylan. ""We are delighted to have received FTC clearance, making our offer for Perrigo now unconditional other than the one final step, which now rests solely in the hands of Perrigo shareholders,"" he said.The seven drugs that Mylan has agreed to sell are bromocriptine mesylate (diabetes and Parkinson's disease), clindamycin phosphate/benzoyl peroxide (acne), liothyronine sodium (thyroid ailments) polyethylene glycol 3350 (a laxative), acyclovir (herpes), hydromorphone hydrochloride (pain) and scopolamine (nausea).   (Reporting by Diane Bartz; Editing by Sandra Maler and Cynthia Osterman)",2015-11-04,PRGO,"Tue Nov 3, 2015 | 7:03pm EST",UPDATE 2-FTC approves Mylan's hostile bid for Perrigo with conditions,http://www.reuters.com//article/perrigo-mylan-ftc-idUSL1N12Y2H120151104?type=companyNews
106,"   By Greg Roumeliotis and Carl O'Donnell  Perrigo Company Plc (PRGO.N), the Irish-based generic drugmaker trying to fend off a hostile bid by Mylan NV (MYL.O), held unsuccessful talks to acquire Endo International Plc (ENDP.O) in an all-stock deal, according to people familiar with the matter.The negotiations show how Perrigo has been on the M&A prowl seeking to present its shareholders with an alternative to a deal with Mylan, as well as its willingness to walk away if it cannot reach terms that it considers to be attractive.The talks earlier this fall, first reported on by the Wall Street Journal, were advanced enough for major issues such as the role of Endo's chief executive Rajiv De Silva and how the companies could be integrated to have been addressed, the people said on Thursday.But Perrigo ended the talks when Endo asked for too much stock for its shareholders, representing a larger premium than what Perrigo was willing to offer, the people said.  Perrigo concluded that it would generate better returns by sticking with its disciplined approach to M&A, which it believes has generated a lot of value over the years, the people added. Perrigo also considered other smaller acquisitions, the people said. It will look at several acquisition targets of all sizes if Mylan's tender offer, which ends on Friday, fails, the people added. The sources asked not to be identified because the deliberations were confidential. Perrigo declined to comment, while Endo did not immediately respond to a request for comment.Mylan, which first made a bid for Perrigo in April, went hostile in September, offering $75 in cash and 2.3 of its shares for each Perrigo share held. This translates into $176 per share based on Mylan's current share price of $44 per share. Perrigo shares were trading at around $163 in early Thursday afternoon trading in New York.  While the tender offer expires on Friday, Perrigo shareholders who do not tender will have two more weeks to accept Mylan's offer if the minimum acceptance threshold of more than 50 percent of Perrigo ordinary shares is reached.Perrigo reported a better-than-expected profit for the third quarter last month, and said it would lay off 6 percent of its global workforce and buy back shares worth $2 billion. (Reporting by Greg Roumeliotis and Carl O'Donnell in New York; Editing by Chris Reese)",2015-11-12,PRGO,"Thu Nov 12, 2015 | 12:40pm EST",Mylan-targeted Perrigo held merger talks with Endo: sources,http://www.reuters.com//article/us-endo-m-a-perrigo-idUSKCN0T129220151112?type=companyNews
107,"   By Greg Roumeliotis and Carl O'Donnell  Nov 12 Perrigo Company Plc, the Irish-based generic drugmaker trying to fend off a hostile bid by Mylan NV, held unsuccessful talks to acquire Endo International Plc in an all-stock deal, according to people familiar with the matter.The negotiations show how Perrigo has been on the M&A prowl seeking to present its shareholders with an alternative to a deal with Mylan, as well as its willingness to walk away if it cannot reach terms that it considers to be attractive.The talks earlier this fall, first reported on by the Wall Street Journal, were advanced enough for major issues such as the role of Endo's chief executive Rajiv De Silva and how the companies could be integrated to have been addressed, the people said on Thursday. But Perrigo ended the talks when Endo asked for too much stock for its shareholders, representing a larger premium than what Perrigo was willing to offer, the people said.Perrigo concluded that it would generate better returns by sticking with its disciplined approach to M&A, which it believes has generated a lot of value over the years, the people added. Perrigo also considered other smaller acquisitions, the people said. It will look at several acquisition targets of all sizes if Mylan's tender offer, which ends on Friday, fails, the people added.The sources asked not to be identified because the deliberations were confidential. Perrigo declined to comment, while Endo did not immediately respond to a request for comment. Mylan, which first made a bid for Perrigo in April, went hostile in September, offering $75 in cash and 2.3 of its shares for each Perrigo share held. This translates into $176 per share based on Mylan's current share price of $44 per share. Perrigo shares were trading at around $163 in early Thursday afternoon trading in New York.While the tender offer expires on Friday, Perrigo shareholders who do not tender will have two more weeks to accept Mylan's offer if the minimum acceptance threshold of more than 50 percent of Perrigo ordinary shares is reached.Perrigo reported a better-than-expected profit for the third quarter last month, and said it would lay off 6 percent of its global workforce and buy back shares worth $2 billion.     (Reporting by Greg Roumeliotis and Carl O'Donnell in New York; Editing by Chris Reese)",2015-11-12,PRGO,"Thu Nov 12, 2015 | 12:17pm EST",Mylan-targeted Perrigo held merger talks with Endo -sources,http://www.reuters.com//article/endo-ma-perrigo-idUSL8N1375YS20151112?type=companyNews
108,"  * 40 pct Perrigo shares tendered; below 50 pct threshold* Mylan shares rise as much as 14.4 pct* Perrigo shares fall as much as 10 pct   (Adds analysts comments, background; updates shares)By Ankur BanerjeeNov 13 Perrigo Co Plc's shareholders rejected Mylan NV's $26 billion hostile bid, ending the Netherlands-based generic drug maker's seven-month pursuit of its smaller rival.Mylan's offer expired on Friday with just 40 percent of Perrigo shares tendered, below the required minimum 50 percent, ensuring victory for Perrigo Chief Executive Joseph Papa.Mylan shares rose as much as 14.4 percent, while Perrigo shares fell as much as 10 percent.Perrigo can re-enter the M&A arena with much less uncertainty, increasing the odds of a mid-sized to large deal, Jefferies analyst David Steinberg wrote in a note.Reuters reported on Thursday that the Dublin-based company had held talks with Endo International Plc, another Ireland-based drugmaker. Healthcare deals worth a record $477 billion had been announced by the end of October, according to Thomson Reuters data, as companies consolidate to cut costs and gain scale.Perrigo, with a large portfolio of consumer products, infant formulas and over-the-counter generic topical drugs, has long been seen as a takeover target.To convince investors to rebuff Mylan's offer, Perrigo had announced job cuts and a $2 billion share buyback plan last month.Perrigo said on Friday it would immediately start buying back shares, helping pull its stock off a more than one-year low. MYLAN MOVING ON Mylan Executive Chairman Robert Coury, who snubbed an offer from Teva Pharmaceutical Industries Ltd to pursue Perrigo, said the company was ready to move on.Mylan is well-positioned to ""quickly execute on the next strategic, value-enhancing opportunities,"" some of which it has already identified, Coury said in a statement. Raymond James analyst Elliot Wilbur, however, said he did not expect an immediate deal.""Mylan won't necessarily be immediately opening up its checkbook for the next company it can buy and instead will step back, take a breather, and focus on the companies or assets it should buy,"" he wrote in a note.Mylan shares were up 13.4 percent at $48.98 in afternoon trading, while Perrigo shares were down 7 percent at $145.50.Mylan first made its interest in Perrigo public in April and went hostile in September, offering $75 plus 2.3 of its shares for each Perrigo share held.Based on Mylan's Thursday close, the offer worked out to about $174.36 per share for Perrigo.(Reporting by Ankur Banerjee in Bengaluru; Editing by Ted Kerr and Kirti Pandey)",2015-11-13,PRGO,"Fri Nov 13, 2015 | 1:23pm EST",UPDATE 3-Perrigo shareholders snub drugmaker Mylan's $26 bln hostile bid,http://www.reuters.com//article/perrigo-company-ma-mylan-nl-idUSL3N1384O520151113?type=companyNews
109,"  Drugmaker Mylan NV's (MYL.O) $26 billion hostile bid for Perrigo Co Plc (PRGO.N) failed on Friday, putting an end to the ongoing saga, which started more than seven months ago.Netherlands-based Mylan has made a number of attempts to buy Perrigo but was unsuccessful in securing at least half of Perrigo outstanding shares in a tender offer, which expired Friday, 8.00 a.m. ET.Through Thursday's close, Mylan's stock had lost about 37 percent of its value since it made public its offer to acquire Perrigo on April 8. Changes to Mylan stock price account for part of the change in total deal value.Following is a summary of key events highlighting the course of the offer:April 8, 2015: Mylan offers to buy Perrigo for about $29 billion in cash and stock in a move that some analysts suggested was an effort to help fend off a $40 billion acquisition by larger rival Teva Pharmaceuticals Industries (TEVA.TA) April 24, 2015: Mylan goes hostile with a sweetened bid of $60 plus 2.2 Mylan shares, valuing Perrigo at $31 billion; Perrigo rejects offerApril 29, 2015: Perrigo rejects Mylan's second raised bid of $75 and 2.3 Mylan shares for every Perrigo share, or $34.1 billionJuly 23, 2015: Dutch foundation linked to Mylan adopts poison pill in efforts to block takeover by Teva, citing potential job losses July 27, 2015: Teva drops its hostile pursuit of Mylan, decides to buy Allergan Plc's (AGN.N) generic business in a deal worth $40.5 billionAug. 13, 2015: Mylan lowers the percentage of Perrigo shares it needs to control the company to just over 50 percent from its original plan of 80 percentSept. 14, 2015: Mylan launches a tender offer in a move to lure Perrigo investors to support its take-over efforts Sept. 17, 2015: Perrigo recommends shareholders to reject Mylan's tender offer, which was set to expire on Nov. 13, saying it substantially undervalued the companyOct. 22, 2015: Perrigo announces its plans to lay off 6 percent of its global workforce and buy back shares worth $2 billionNov. 13, 2015: Mylan fails $26 billion bid in tender offer as it was unable to secure at least half of Perrigo's shares (Compiled by Samantha Kareen Nair; Editing by Anil D'Silva)",2015-11-13,PRGO,"Fri Nov 13, 2015 | 12:35pm EST",Mylan fails in $26 billion takeover bid for Perrigo,http://www.reuters.com//article/us-mylan-nl-perrigo-company-timeline-idUSKCN0T221W20151113?type=companyNews
110,"  Nov 13 Drugmaker Mylan NV's $26 billion hostile bid for Perrigo Co Plc failed on Friday, putting an end to the ongoing saga, which started more than seven months ago.Netherlands-based Mylan has made a number of attempts to buy Perrigo but was unsuccessful in securing at least half of Perrigo outstanding shares in a tender offer, which expired Friday, 8.00 a.m. ET.Through Thursday's close, Mylan's stock had lost about 37 percent of its value since it made public its offer to acquire Perrigo on April 8. Changes to Mylan stock price account for part of the change in total deal value.Following is a summary of key events highlighting the course of the offer:April 8, 2015: Mylan offers to buy Perrigo for about $29 billion in cash and stock in a move that some analysts suggested was an effort to help fend off a $40 billion acquisition by larger rival Teva Pharmaceuticals Industries April 24, 2015: Mylan goes hostile with a sweetened bid of $60 plus 2.2 Mylan shares, valuing Perrigo at $31 billion; Perrigo rejects offerApril 29, 2015: Perrigo rejects Mylan's second raised bid of $75 and 2.3 Mylan shares for every Perrigo share, or $34.1 billion July 23, 2015: Dutch foundation linked to Mylan adopts poison pill in efforts to block takeover by Teva, citing potential job lossesJuly 27, 2015: Teva drops its hostile pursuit of Mylan, decides to buy Allergan Plc's generic business in a deal worth $40.5 billionAug. 13, 2015: Mylan lowers the percentage of Perrigo shares it needs to control the company to just over 50 percent from its original plan of 80 percent Sept. 14, 2015: Mylan launches a tender offer in a move to lure Perrigo investors to support its take-over effortsSept. 17, 2015: Perrigo recommends shareholders to reject Mylan's tender offer, which was set to expire on Nov. 13, saying it substantially undervalued the companyOct. 22, 2015: Perrigo announces its plans to lay off 6 percent of its global workforce and buy back shares worth $2 billionNov. 13, 2015: Mylan fails $26 billion bid in tender offer as it was unable to secure at least half of Perrigo's shares     (Compiled by Samantha Kareen Nair; Editing by Anil D'Silva)",2015-11-13,PRGO,"Fri Nov 13, 2015 | 12:33pm EST",TIMELINE-Mylan fails in $26 bln takeover bid for Perrigo,http://www.reuters.com//article/mylan-nl-perrigo-company-timeline-idUSL3N13853820151113?type=companyNews
111,"  Nov 13 Mylan NV said on Friday that 40 percent of Perrigo Co Plc's shares were tendered in its $26 billion hostile takeover offer, falling short of the goal of 50 percent.With the deadline for the offer expiring at 8 a.m. ET (1300 GMT) on Friday, Mylan said 58 million Perrigo ordinary shares had been validly tendered. Netherlands-based Mylan made its first public offer for Dublin-based Perrigo in April and pursued a hostile takeover when it was rejected. Mylan's offer of $75 plus 2.3 Mylan shares was worth about $174.36 per share, based on Mylan's Thursday close of $43.20,   or about $26 billion for all outstanding Perrigo shares. (Reporting by Ankur Banerjee in Bengaluru; Editing by Ted Kerr)",2015-11-13,PRGO,"Fri Nov 13, 2015 | 8:50am EST","Mylan says 40 percent of Perrigo shares tendered, misses goal",http://www.reuters.com//article/perrigo-company-ma-mylan-nl-idUSL3N1384ND20151113?type=companyNews
112,"   By Greg Roumeliotis  Generic drug maker Mylan NV's (MYL.O) $26 billion hostile bid for peer Perrigo Company Plc (PRGO.N) looked unlikely to succeed late on Thursday, a few hours before it was set to expire, according to people familiar with the matter.If confirmed, the outcome would represent a major victory for Perrigo's defiant Chief Executive Joseph Papa, and a bitter blow to Mylan's Executive Chairman Robert Coury, who snubbed an acquisition offer from Teva Pharmaceutical Industries Ltd (TEVA.TA) to pursue Perrigo. Around 40 percent of Perrigo's ordinary shares had been tendered ten hours before the tender offer was due to expire on Friday, significantly short of Mylan's acceptance threshold of more than 50 percent, the people said.While more shares could still be tendered, many large institutional investors would have tendered their shares at this stage if they were going to accept the offer, the people added.  The sources declined to be identified because the tally is not yet official. Perrigo declined to comment, while representatives for Mylan did not immediately respond to requests for comment.Mylan, which first made a bid for Perrigo in April, went hostile in September, offering $75 in cash and 2.3 of its shares for each Perrigo share. The deal's rejection will now focus investors' attention on Perrigo's standalone strategy. Papa has said he is open to dealmaking, and sources familiar with the matter said earlier on Thursday Perrigo had held merger talks with Endo International Plc (ENDP.O) earlier in the fall.Perrigo reported a better-than-expected profit for the third quarter last month, and said it would lay off 6 percent of its global workforce and buy back shares worth $2 billion. Mylan had used a Dutch poison pill-style defense to fight a $40 billion takeover by Teva, arguing that a deal was ""without sound industrial logic or cultural fit"" and that it would face regulatory hurdles.Coury said last week that, while the purchase of Perrigo was good for both companies, Mylan could survive without it. He pointed to the very strong market position of EpiPen, Mylan's biggest-selling branded product, which treats emergency anaphylactic reactions to allergens. (Reporting by Greg Roumeliotis in New York; Editing by Miral Fahmy)",2015-11-13,PRGO,"Thu Nov 12, 2015 | 11:45pm EST",Mylan's tender offer for Perrigo unlikely to succeed: sources,http://www.reuters.com//article/us-perrigo-m-a-mylan-idUSKCN0T20C020151113?type=companyNews
113,"  (Updates sourcing, adds more details)By Greg RoumeliotisNov 12 Generic drug maker Mylan NV's $26 billion hostile bid for peer Perrigo Company Plc looked unlikely to succeed late on Thursday, a few hours before it was set to expire, according to people familiar with the matter.If confirmed, the outcome would represent a major victory for Perrigo's defiant Chief Executive Joseph Papa, and a bitter blow to Mylan's Executive Chairman Robert Coury, who snubbed an acquisition offer from Teva Pharmaceutical Industries Ltd  to pursue Perrigo.Around 40 percent of Perrigo's ordinary shares had been tendered ten hours before the tender offer was due to expire on Friday, significantly short of Mylan's acceptance threshold of more than 50 percent, the people said. While more shares could still be tendered, many large institutional investors would have tendered their shares at this stage if they were going to accept the offer, the people added.The sources declined to be identified because the tally is not yet official. Perrigo declined to comment, while representatives for Mylan did not immediately respond to requests for comment. Mylan, which first made a bid for Perrigo in April, went hostile in September, offering $75 in cash and 2.3 of its shares for each Perrigo share.The deal's rejection will now focus investors' attention on Perrigo's standalone strategy. Papa has said he is open to dealmaking, and sources familiar with the matter said earlier on Thursday Perrigo had held merger talks with Endo International Plc earlier in the fall. Perrigo reported a better-than-expected profit for the third quarter last month, and said it would lay off 6 percent of its global workforce and buy back shares worth $2 billion.Mylan had used a Dutch poison pill-style defense to fight a $40 billion takeover by Teva, arguing that a deal was ""without sound industrial logic or cultural fit"" and that it would face regulatory hurdles.Coury said last week that, while the purchase of Perrigo was good for both companies, Mylan could survive without it. He pointed to the very strong market position of EpiPen, Mylan's biggest-selling branded product, which treats emergency anaphylactic reactions to allergens.    (Reporting by Greg Roumeliotis in New York; Editing by Miral Fahmy)",2015-11-13,PRGO,"Thu Nov 12, 2015 | 11:37pm EST",UPDATE 1-Mylan's tender offer for Perrigo unlikely to succeed -sources,http://www.reuters.com//article/perrigo-ma-mylan-idUSL1N13808M20151113?type=companyNews
114,"  Nov 12 Generic drug maker Mylan NV's  $26-billion hostile bid for peer Perrigo Company Plc  looked unlikely to succeed, a few hours before it was set to expire, a person familiar with the matter said.Close to 40 percent of Perrigo's ordinary shares had been tendered ten hours before the tender offer was due to expire on Friday, significantly short of Mylan's acceptance threshold of more than 50 percent, the person said. While more shares could still be tendered, many large institutional investors would have tendered their shares at this stage if they were going to accept the offer, the person added.  The source asked not to be identified because the tally is not yet official. Representatives for Mylan and Perrigo did not immediately respond to requests for comment.   (Reporting by Greg Roumeliotis in New York; Editing by Clarence Fernandez)",2015-11-13,PRGO,"Thu Nov 12, 2015 | 11:01pm EST",Mylan's tender offer for Perrigo unlikely to succeed -source,http://www.reuters.com//article/perrigo-ma-mylan-idUSL1N13808320151113?type=companyNews
115,"  Nov 16 Generic Drugmaker Mylan NV plans to buy back shares worth up to $1 billion, after Perrigo Co Plc'S shareholders spurned its $26 billion hostile bid.The buyback program expires on Aug. 27, 2016, Mylan said in a statement on Monday.  Perrigo shareholders rejected Mylan's bid on Friday, ending the Netherlands-based generic drug maker's seven-month pursuit of its smaller rival.    (Reporting by Rosmi Shaji in Bengaluru; Editing by Savio D'Souza) ",2015-11-16,PRGO,"Mon Nov 16, 2015 | 11:53am EST",Mylan to buy back $1 bln in stock,http://www.reuters.com//article/mylan-nl-buyback-idUSL3N13B50H20151116?type=companyNews
116,"  AstraZeneca (AZN.L) said on Monday it had finalised plans to divest its Crohn’s disease drug Entocort by selling U.S. rights to the medicine to Perrigo (PRGO.N) for $380 million.The move is part of an ""externalization"" drive by the British drugmaker, which is selling non-core products to help it fill a short-term revenue gap caused by older products going off product, while investing in a pipeline of new medicines.Entocort had U.S. sales of $89 million in the first nine months of 2015. The deal, which is expected to complete by the end of 2015, follows AstraZeneca's sale of rights to Entocort outside the United States in July to Tillotts Pharma, part of the Zeria Group. AstraZeneca said its earnings per share outlook for the year, which was upgraded at third-quarter results earlier this month, would not change as a result of the Perrigo transaction.  (Reporting by Ben Hirschler; editing by Jason Neely)",2015-11-23,PRGO,"Mon Nov 23, 2015 | 2:30am EST",AstraZeneca sells U.S. drug rights to Perrigo for $380 million,http://www.reuters.com//article/us-astrazeneca-m-a-perrigo-idUSKBN0TC0GE20151123?type=companyNews
117,"  Nov 23 AstraZeneca said on Monday it had finalised plans to divest its Crohn's disease drug Entocort by selling U.S. rights to the medicine to Perrigo for $380 million.The move is part of an ""externalisation"" drive by the British drugmaker, which is selling non-core products to help it fill a short-term revenue gap caused by older products going off product, while investing in a pipeline of new medicines. Entocort had U.S. sales of $89 million in the first nine months of 2015. The deal, which is expected to complete by the end of 2015, follows AstraZeneca's sale of rights to Entocort outside the United States in July to Tillotts Pharma, part of the Zeria Group. AstraZeneca said its earnings per share outlook for the year, which was upgraded at third-quarter results earlier this month, would not change as a result of the Perrigo transaction.   (Reporting by Ben Hirschler; editing by Jason Neely)",2015-11-23,PRGO,"Mon Nov 23, 2015 | 2:25am EST",AstraZeneca sells U.S. drug rights to Perrigo for $380 mln,http://www.reuters.com//article/astrazeneca-ma-perrigo-idUSL8N13I0OU20151123?type=companyNews
118,"  Nov 23 Astrazeneca Plc :* Astrazeneca enters into agreement with Perrigo for rights to Entocort  in us * Perrigo will pay Astrazeneca $380 million upon completion of transaction * Transaction does not include transfer of any Astrazeneca employees or facilities * Transaction is expected to complete by end of 2015, subject to customary closing conditions  Source text for Eikon:  Further company coverage:    (Bengaluru Newsroom + 91 80 6749 1136)",2015-11-23,PRGO,"Mon Nov 23, 2015 | 2:22am EST","BRIEF-Astrazeneca, Perrigo sign deal for US rights to Entocort",http://www.reuters.com//article/idUSFWN13F04C20151123?type=companyNews
