,Article,Date,Symbol,Time,Title,Url
30,"  (Adds Dow Chemical, Roberto Cavalli, Audience Inc, WuXi PharmaTech Cayman, United Finance Co; updates OmniVision Technologies)April 30 The following bids, mergers, acquisitions and disposals were reported by 2000 GMT on Thursday:** Perrigo Co Ltd rejected a sweetened takeover offer from Mylan NV, while Teva Pharmaceutical Industries Ltd said it remains committed to acquiring Mylan, in a high stakes battle of major generic drugmakers.** Royal Dutch Shell is still looking for targets after agreeing to buy rival BG for $70 billion but has not got the resources to perform another mega-deal, Chief Financial Officer Simon Henry said.** Bermuda-based Axis Capital Holdings said it continued to believe a merger with reinsurer PartnerRe  was in the best interests of its shareholders. In January, the two companies agreed on an $11 billion deal meant to close in the second half of this year.** OmniVision Technologies Inc, a maker of chips for smartphone and tablet cameras, agreed to be taken private by a group of Chinese investors for about $1.9 billion in cash.** Dow Chemical Co said it would sell its AgroFresh unit, which makes chemicals that keep farm produce fresh, for $860 million as part of a plan to divest less-lucrative units.** Italian private equity fund Clessidra acquired control of fashion house Roberto Cavalli on Thursday for an undisclosed sum, concluding one of the longest running courtships in the luxury goods industry.** Audio-chip maker Audience Inc, which has struggled since losing Apple Inc as its No. 1 customer in 2012, agreed to a distress sale to hearing-aid component maker Knowles Corp in a cash-and-stock deal valued at $85 million.** WuXi PharmaTech Cayman Inc, a contract R&D services provider, said it had received a proposal to be taken private by a consortium led by its chief executive and Ally Bridge Group Capital Partners. The offer values the China-based company at about $3.23 billion and represents a 16.5 percent premium to its closing price on Wednesday, according to Thomson Reuters calculations.** National Bank of Oman has offered to buy fellow domestic lender United Finance Co, challenging a potential merger with Bank Nizwa in the country's cluttered banking sector.** An investor in John Menzies has called on the Scottish company to consider splitting up, believing its distribution and aviation services businesses would be worth more apart. ** Cloud software company Salesforce.com Inc is working with financial advisers to help it field takeover offers after being approached by a potential acquirer, Bloomberg said, citing people with knowledge of the matter.** Eurocement Holding AG, Holcim Ltd's  second-largest shareholder, said it supports the Swiss cement maker's planned merger with France's Lafarge SA.** Abu Dhabi Investment Authority (ADIA) has agreed to buy a 50 percent stake in three Hong Kong hotels from a group led by New World Development Co Ltd in a HK$18.5 billion ($2.4 billion) deal, the sovereign wealth fund's biggest Asian property investment.** The bidding for a controlling stake in Hewlett-Packard Co's data-networking business in China, worth more than $2 billion, has thrown up a rare tussle between two Chinese state-backed firms who are wrangling over which has Beijing's backing.** Australian telecommunications firm iiNet Ltd gave prospective buyer TPG Telecom Ltd three days to lift an indicative takeover bid after another rival, M2 Group Ltd , launched a A$1.6 billion ($1.28 billion) counteroffer. ** ClickSoftware Technologies said it signed a deal to be bought by private funds managed by Francisco Partners Management for $438 million in cash.** Titanium miner Kenmare Resources Plc   received a watered-down share offer from Australia's Iluka Resources Ltd, valuing the Irish company at about 189 million pounds ($292.5 million), and said that it was talking to Iluka.** Newmont Mining Corp said it has tentatively agreed to sell its Waihi gold mining operation in New Zealand to OceanaGold Corp for about $106 million plus a 1 percent net smelter royalty on a recent discovery near the mine.** Tencent Holdings Ltd, the dominant social networking and online entertainment company in China, has agreed to buy 14.6 percent of mobile game developer Glu Mobile Inc  for $126 million to expand in the U.S. gaming market.** Russia's Eurasia Drilling said it had agreed to extend a deadline on a proposed deal to sell a stake to international oilfield services firm Schlumberger from to April 30 to May 31. ** British property search website Zoopla said it was buying price comparison service uSwitch for 160 million pounds ($247 million), to offer deals on home energy to the millions of customers that visit its websites and mobile apps.** Bank of Cyprus said it had disposed of its holding in Marfin Diversified Strategy Fund to Dorchester Capital Secondaries Offshore III, for approximately $92 million.** Swiss firm Kaba and Germany's Dorma Holding said they plan to merge to form a top-three player in the building security and ""access products"" market, a category including door locks and keys.** PostNL, the Netherlands-based postal company, said it had ended talks with LDC on expanding PostNL's ""Whistl"" subsidiary in Britain to include broader ""end-to-end"" services.** Ukrainian miner Ferrexpo is considering a potential sale of its entire stake in Brazilian iron ore production company Ferrous Resources.** Japan Tobacco said it had agreed to buy Florida-based e-cigarette maker Logic Technology Development LLC as it aims to become a global leader in the nascent, but fast-growing, market.** China's Yangzijiang Shipbuilding Holdings Ltd  is considering a possible investment in troubled peer China Huarong Energy Co Ltd, formerly known as China Rongsheng, its executive chairman said.** Brazilian homebuilder Gafisa SA said in a securities filing that it had been approached by groups of investors interested in taking a stake in one or two of the company's divisions.** Greece's government is considering selling stakes in its two largest ports as a concession to reach an agreement with its lenders and unlock bailout funds, a government official said.($1 = 1.2519 Australian dollars)  ($1 = 6.1989 Chinese yuan)  ($1 = 7.7504 Hong Kong dollars)  ($1 = 0.6482 pounds)   (Compiled by Yashaswini Swamynathan and Manya Venkatesh in Bengaluru)",2015-04-30,PRGO,"Thu Apr 30, 2015 | 4:02pm EDT",Deals of the day- Mergers and acquisitions,http://www.reuters.com//article/deals-day-idUSL4N0XR4WX20150430?type=companyNews
31,"   By Bill Berkrot  Generic drugmaker Mylan NV (MYL.O), at the center of a high-stakes, three-way takeover battle, said on Tuesday it is fully committed to acquiring Ireland-based Perrigo Co (PRGO.N) and believes it can complete the deal by year end.Mylan, on a conference call with analysts, said it is legally committed to take its offer directly to Perrigo shareholders under Irish takeover rules. As proposed, the deal would give current Perrigo shareholders 39 percent of the combined company.Mylan also reported slightly higher-than-expected first-quarter profit.""We remain steadfast in our legally binding commitment to acquire Perrigo and have taken numerous concrete steps to lay out a clear and certain path towards completion,"" Mylan Chief Executive Heather Bresch said in a statement.In making its case for a combination with Perrigo, Mylan said the merger would give it massive global manufacturing and supply chain presence, add to earnings, and make it a ""stronger, larger and more diverse business"" with ""significant free cash flow.""Mylan also said it would expect to realize at least $800 million in cost savings by the end of year four after completion of the deal. ""I don't think we will disappoint on what we deliver on a short-term, mid-term and long-term basis,"" Bresch said.Perrigo, which would give Mylan over-the-counter consumer and nutritional products and a line of generic topical medicines, last week rejected a sweetened $34 billion offer from Mylan.At the same time, Mylan is attempting to fend off a takeover by Israel-based Teva Pharmaceutical Industries (TEVA.TA), the world's largest generic drugmaker, which earlier on Tuesday said it was moving ahead with plans to acquire Mylan contingent on the Perrigo deal not being completed. Teva proposed to acquire Mylan for $82 per share, or about $43 billion, in cash and stock. Mylan, in rejecting the offer, said it ""grossly undervalued"" the company. Mylan, on its call, said it would not discuss board matters or the Teva approach or answer questions related to Teva.Excluding items, such as acquisition costs for a deal with Abbott Laboratories (ABT.N) that enabled it to redomicile in Europe, Mylan earned 70 cents per share, topping analysts' average expectations by a penny, according to Thomson Reuters I/B/E/S.Mylan maintained its full-year forecast of adjusted earnings of $4 to $4.30 per share and revenue of $9.6 billion to $10.1 billion. It forecast second-quarter adjusted earnings of 86 cents to 90 cents per share. Revenue of $1.87 billion for the quarter fell short of Wall Street estimates of $2.06 billion. The company said foreign exchange rates resulting from the impact of a strong dollar on overseas sales clipped revenue by $93 million. The former Pittsburgh-based company, now headquartered in the Netherlands, posted a net profit of $56.6 million, or 13 cents per share, compared with $115.9 million, or 29 cents a share, a year ago.Mylan shares slipped to $72.60 in extended trading from a Nasdaq close at $72.89. (Reporting by Bill Berkrot; Editing by Steve Orlofsky)",2015-05-05,PRGO,"Tue May 5, 2015 | 6:24pm EDT","Mylan says can close Perrigo deal by year end, reports profit",http://www.reuters.com//article/us-mylan-results-idUSKBN0NQ28L20150505?type=companyNews
32,"  (Add company comment from conference call, Q2 EPS forecast, share price)By Bill BerkrotMay 5 Generic drugmaker Mylan NV, at the center of a high-stakes, three-way takeover battle, said on Tuesday it is fully committed to acquiring Ireland-based Perrigo Co and believes it can complete the deal by year end.Mylan, on a conference call with analysts, said it is legally committed to take its offer directly to Perrigo shareholders under Irish takeover rules. As proposed, the deal would give current Perrigo shareholders 39 percent of the combined company.Mylan also reported slightly higher-than-expected first-quarter profit.""We remain steadfast in our legally binding commitment to acquire Perrigo and have taken numerous concrete steps to lay out a clear and certain path towards completion,"" Mylan Chief Executive Heather Bresch said in a statement.In making its case for a combination with Perrigo, Mylan said the merger would give it massive global manufacturing and supply chain presence, add to earnings, and make it a ""stronger, larger and more diverse business"" with ""significant free cash flow."" Mylan also said it would expect to realize at least $800 million in cost savings by the end of year four after completion of the deal.""I don't think we will disappoint on what we deliver on a short-term, mid-term and long-term basis,"" Bresch said.Perrigo, which would give Mylan over-the-counter consumer and nutritional products and a line of generic topical medicines, last week rejected a sweetened $34 billion offer from Mylan. At the same time, Mylan is attempting to fend off a takeover by Israel-based Teva Pharmaceutical Industries, the world's largest generic drugmaker, which earlier on Tuesday said it was moving ahead with plans to acquire Mylan contingent on the Perrigo deal not being completed.Teva proposed to acquire Mylan for $82 per share, or about $43 billion, in cash and stock. Mylan, in rejecting the offer, said it ""grossly undervalued"" the company.Mylan, on its call, said it would not discuss board matters or the Teva approach or answer questions related to Teva. Excluding items, such as acquisition costs for a deal with Abbott Laboratories that enabled it to redomicile in Europe, Mylan earned 70 cents per share, topping analysts' average expectations by a penny, according to Thomson Reuters I/B/E/S.Mylan maintained its full-year forecast of adjusted earnings of $4 to $4.30 per share and revenue of $9.6 billion to $10.1 billion. It forecast second-quarter adjusted earnings of 86 cents to 90 cents per share.Revenue of $1.87 billion for the quarter fell short of Wall Street estimates of $2.06 billion. The company said foreign exchange rates resulting from the impact of a strong dollar on overseas sales clipped revenue by $93 million.The former Pittsburgh-based company, now headquartered in the Netherlands, posted a net profit of $56.6 million, or 13 cents per share, compared with $115.9 million, or 29 cents a share, a year ago.Mylan shares slipped to $72.60 in extended trading from a Nasdaq close at $72.89.     (Reporting by Bill Berkrot; Editing by Steve Orlofsky)",2015-05-05,PRGO,"Tue May 5, 2015 | 6:22pm EDT","UPDATE 2-Mylan says can close Perrigo deal by year end, reports profit",http://www.reuters.com//article/mylan-results-idUSL1N0XW2XR20150505?type=companyNews
33,  May 5   Mylan Sees q2 adjusted eps $0.86 to $0.90* Mylan says perrigo acquisition would create $800 million in synergies by year 4 after closing * Says Mylan and Perrigo are highly complementary businesses  * Mylan says confident it can close perrigo deal by year end   Further company coverage:    (Reporting By Bill Berkrot),2015-05-05,PRGO,"Tue May 5, 2015 | 5:51pm EDT",BRIEF-Mylan confident it can close Perrigo deal by year end,http://www.reuters.com//article/idUSL1N0XW34920150505?type=companyNews
34,"  May 5 Generic drugmaker Mylan NV, at the center of a high-stakes, three-way takeover battle, on Tuesday reported slightly higher-than-expected first-quarter profit and said it was ""steadfast"" in its commitment to acquire Ireland-based Perrigo Co.Excluding items, such as acquisition costs for a deal with Abbott Laboratories that enabled it to redomicile in Europe, Mylan earned 70 cents per share. Analysts on average expected 69 cents, according to Thomson Reuters I/B/E/S.The former Pittsburgh-based company, now headquartered in the Netherlands, posted a net profit of $56.6 million, or 13 cents per share, compared with a net profit of $115.9 million, or 29 cents a share, a year ago. Perrigo last week rejected a sweetened $34 billion offer from Mylan. At the same time, Mylan is attempting to fend off a takeover by Israel-based Teva Pharmaceutical Industries , the world's largest generic drugmaker, which earlier on Tuesday said it was moving ahead with plans to acquire Mylan contingent on the Perrigo deal not being completed.  (Reporting by Bill Berkrot; Editing by Steve Orlofsky)",2015-05-05,PRGO,"Tue May 5, 2015 | 4:25pm EDT","Mylan reports profit, maintains commitment to acquire Perrigo",http://www.reuters.com//article/mylan-results-idUSL1N0XV2YM20150505?type=companyNews
35,"  Mylan NV's Chairman Robert Coury said he may sweeten the company's offer for Perrigo Co Plc by adding terms that will reduce risk to Perrigo's shareholders, sources told Bloomberg on Monday.People familiar with the matter said that Coury laid out scenarios that could play out in the future and had even suggested that a Mylan-Perrigo combination could be an attractive target for Pfizer Inc, Bloomberg said.   This comes after Reuters reported comments from Coury last week on how Mylan would consider buying Israeli pharma firm Teva Pharmaceutical Industries down the line.Mylan is attempting to buy over-the-counter drugmaker Perrigo for $34 billion in an unsolicited offer that is expected to turn into a hostile one. Teva, meanwhile, made an unsolicited $40 billion bid for Mylan last month, which the latter rejected. Teva said last week it will move ahead with its plans to acquire Mylan if the Perrigo deal is not completed.At the meetings, Coury also brought up the idea that Mylan could make a deal with Novartis AG's generic business unit, Sandoz, people told Bloomberg. Mylan and Novartis could not be reached outside of regular business hours.  (Reporting by Amrutha Penumudi in Bengaluru; Editing by Lisa Shumaker)",2015-05-12,PRGO,"Mon May 11, 2015 | 9:48pm EDT",Mylan chairman said to consider Perrigo sweeteners to make deal: Bloomberg,http://www.reuters.com//article/us-mylan-nl-m-a-perrigo-company-idUSKBN0NX04C20150512?type=companyNews
36,"  May 11 Mylan NV's Chairman Robert Coury said he may sweeten the company's offer for Perrigo Co Plc  by adding terms that will reduce risk to Perrigo's shareholders, sources told Bloomberg on Monday.People familiar with the matter said that Coury laid out scenarios that could play out in the future and had even suggested that a Mylan-Perrigo combination could be an attractive target for Pfizer Inc, Bloomberg said.       (bloom.bg/1PD2z1S)This comes after Reuters reported comments from Coury last week on how Mylan would consider buying Israeli pharma firm Teva Pharmaceutical Industries down the line. Mylan is attempting to buy over-the-counter drugmaker Perrigo for $34 billion in an unsolicited offer that is expected to turn into a hostile one. Teva, meanwhile, made an unsolicited $40 billion bid for Mylan last month, which the latter rejected. Teva said last week it will move ahead with its plans to acquire Mylan if the Perrigo deal is not completed. At the meetings, Coury also brought up the idea that Mylan could make a deal with Novartis AG's generic business unit, Sandoz, people told Bloomberg.Mylan and Novartis could not be reached outside of regular business hours.    (Reporting by Amrutha Penumudi in Bengaluru; Editing by Lisa Shumaker)",2015-05-12,PRGO,"Mon May 11, 2015 | 9:47pm EDT",Mylan chairman said to consider Perrigo sweeteners to make deal -Bloomberg,http://www.reuters.com//article/mylan-nl-ma-perrigo-company-idUSL1N0Y303920150512?type=companyNews
37,"  Mylan NV's (MYL.O) largest stakeholder, Abbott Laboratories (ABT.N), said it would back Mylan's proposed acquisition of Perrigo Co Plc (PRGO.N), potentially helping Mylan fend off interest from Teva Pharmaceutical Industries Ltd (TEVA.TA).Abbott, which has a 14.5 percent stake in Mylan, said on Tuesday that it supported Mylan's ""standalone strategy"" and believed acquiring Perrigo would add value for shareholders.Mylan's latest offer for Perrigo, worth $34.1 billion, is widely seen as an attempt to fend off Teva, the world's biggest maker of generic drugs.Perrigo rejected Mylan's sweetened offer in late April, around the same time Mylan rejected an offer of $40 billion from Teva, saying it grossly undervalued the company. Last year, Mylan said it would buy Abbott's branded specialty and generics business in developed markets outside the United States in a $5.3 billion deal that would bolster its product line and cut its tax bill.The deal gave Mylan an array of Abbott brands with sales of almost $2 billion, while Abbott received 105 million shares of the combined company, renamed Mylan NV. Mylan's shares were down 2.1 percent at $72 in early trading. Perrigo's shares were up about 3 percent at $188.62, while Teva's stock was little changed. (Corrects to ""off"" from ""of"" in first paragraph) (Reporting by Amrutha Penumudi in Bengaluru; Editing by Joyjeet Das and Simon Jennings)",2015-06-16,PRGO,"Tue Jun 16, 2015 | 5:12pm EDT",Abbott to vote for Mylan's acquisition of Perrigo,http://www.reuters.com//article/us-perrigo-m-a-mylanabbott-idUSKBN0OW1OG20150616?type=companyNews
38,"  (Corrects to ""off"" from ""of"" in first paragraph)June 16 Mylan NV's largest stakeholder, Abbott Laboratories, said it would back Mylan's proposed acquisition of Perrigo Co Plc, potentially helping Mylan fend off interest from Teva Pharmaceutical Industries Ltd .Abbott, which has a 14.5 percent stake in Mylan, said on Tuesday that it supported Mylan's ""standalone strategy"" and believed acquiring Perrigo would add value for shareholders.Mylan's latest offer for Perrigo, worth $34.1 billion, is widely seen as an attempt to fend off Teva, the world's biggest maker of generic drugs. Perrigo rejected Mylan's sweetened offer in late April, around the same time Mylan rejected an offer of $40 billion from Teva, saying it grossly undervalued the company. Last year, Mylan said it would buy Abbott's branded specialty and generics business in developed markets outside the United States in a $5.3 billion deal that would bolster its product line and cut its tax bill.The deal gave Mylan an array of Abbott brands with sales of almost $2 billion, while Abbott received 105 million shares of the combined company, renamed Mylan NV. Mylan's shares were down 2.1 percent at $72 in early trading. Perrigo's shares were up about 3 percent at $188.62, while Teva's stock was little changed.(Reporting by Amrutha Penumudi in Bengaluru; Editing by Joyjeet Das and Simon Jennings)",2015-06-16,PRGO,"Tue Jun 16, 2015 | 11:28am EDT",REFILE-UPDATE 1-Abbott to vote for Mylan's acquisition of Perrigo,http://www.reuters.com//article/perrigo-ma-mylanabbott-idUSL3N0Z249D20150616?type=companyNews
39,"  TEL AVIV, June 23 Mylan NV chief financial officer John Sheehan will arrive in Israel on Wednesday for a meeting with the head of the Tel Aviv Stock Exchange to discuss a possible listing of its shares if it succeeds in buying Perrigo Co, an industry source said.Mylan has offered to acquire Perrigo for $34 billion in an attempt to fend off a bid from Israel's Teva Pharmaceutical Industries, the world's biggest generic drugmaker. Perrigo has rejected Mylan's offer.Perrigo's shares are listed on the Tel Aviv Stock Exchange since it acquired Israeli drugmaker Agis Industries in 2005.The source, who asked not to be named, said on Tuesday Mylan's shares would replace Perrigo in Tel Aviv just as Perrigo's shares replaced Agis when it was acquired.In addition to a meeting with Yossi Beinart, the chief executive of the stock exchange, Sheehan may also meet with institutional investors in Israel who own shares in Perrigo. A spokeswoman for Mylan in Israel declined to comment, while a spokeswoman for the bourse also declined to comment.The Tel Aviv Stock Exchange, which is seeking to stem falling trading volumes in recent years, is eager to ensure it does not lose Perrigo, which is one of the most active shares on the Israeli bourse. Teva last week raised its stake in Mylan to the 4.61 percent needed for it to legally challenge Mylan's rejection of Teva's hostile takeover offer under Dutch law.Mylan rebuffed a $40 billion bid from Teva in April, saying it grossly undervalued the company. Mylan reincorporated in the Netherlands last year, where it set up a legal structure called a stichting -- Dutch for ""foundation"",  which can be used as a kind of poison-pill defence against hostile takeovers.Mylan's top shareholder, Abbott Laboratories, has already come out in support of the company's rejection of Teva by backing Mylan's proposed acquisition of Perrigo. Abbott holds a 14.5 percent stake in Mylan.Teva said on Friday it would limit its stake to less than 5 percent before Mylan's extraordinary general meeting (EGM) on the Perrigo transaction if Mylan held the EGM before September.       (Reporting by Tova Cohen; Editing by Luke Baker and Mark Potter)",2015-06-23,PRGO,"Tue Jun 23, 2015 | 8:16am EDT",Mylan CFO to meet Tel Aviv bourse chief to discuss listing - source,http://www.reuters.com//article/mylan-nl-perrigo-company-israel-idUSL8N0Z926E20150623?type=companyNews
40,"  TEL AVIV Drugmaker Mylan NV's (MYL.O) chief financial officer John Sheehan said on Wednesday the company would like to join the Tel Aviv Stock Exchange (TASE) if it succeeds in buying Perrigo Co (PRGO.N).Mylan, which has its primary listing in the United States, has offered to acquire Perrigo for $34 billion. This is widely seen as an attempt to protect itself from a bid from Israel's Teva Pharmaceutical Industries (TEVA.TA), the world's biggest generic drugmaker.Sheehan was in Israel to meet Yossi Beinart, chief executive of the stock exchange. ""Mylan believes that the Israeli market is important to Mylan and the pharmaceutical industry generally and would therefore be pleased to join TASE as one of the largest publicly traded companies following the consummation of the Perrigo acquisition,"" he said in a statement after the meeting. Perrigo's shares have been listed on TASE since it acquired Israeli drugmaker Agis Industries in 2005.  TASE is seeking to stem falling trading volumes in recent years. Sheehan's comments could reassure the exchange, which is eager to ensure it does not lose Perrigo, the second-biggest company by market value on the bourse behind Teva.  (Reporting by Tova Cohen; Editing by Steven Scheer and Pravin Char)",2015-06-24,PRGO,"Wed Jun 24, 2015 | 9:21am EDT",Mylan eyes Tel Aviv listing if Perrigo deal goes ahead,http://www.reuters.com//article/us-mylan-nl-perrigo-company-israel-idUSKBN0P41M420150624?type=companyNews
