,Article,Date,Symbol,Time,Title,Url
59,"  BRUSSELS Aug 19 The following are mergers under review by the European Commission and a brief guide to the EU merger process:APPROVALS AND WITHDRAWALS -- Dutch building materials distributor PontMeyer, which is part of Deli Building Supplies B.V., to acquire Dutch holding company DBS (notified July 15/approved Aug. 20)--Irish pharmaceutical company Perrigo, which is to be acquired by Dutch pharmaceutical firm Mylan, to acquire a number of consumer health products belonging to British pharmaceutical company GSK (notified July 22/approved Aug. 21)NEW LISTINGS -- British private equity firm Equistone Partners Europe to acquire German apparel retailer TriStyle Mode (notified Aug. 20/deadline Sep. 24/simplified)EXTENSIONS AND OTHER CHANGES -- U.S. drinks can maker Ball Corp to acquire British rival Rexam Plc (notified June 15/deadline extended to Dec. 9 from Nov. 25)FIRST-STAGE REVIEWS BY DEADLINE AUG 26 -- Varo Energy, a joint venture between the world's top oil trader Vitol and private equity firm Carlyle Group , is expanding its reach in Europe through a merger with Dutch-based storage and trading company Argos (notified July 22/ deadline Aug. 26)AUG 28 -- U.S. real estate services provider DTZ to acquire U.S. peer Cushman & Wakefield (notified July 24/deadline Aug. 28)SEPT 1 -- British engineering company GKN to acquire Dutch company Fokker Technologies (notified July 28/deadline Sept. 1/simplified)-- British support services provider DCC Group to acquire French gas company Butagaz from Anglo Dutch oil company Royal Dutch Shell (notified July 28/deadline Sept. 1/simplified)-- U.S. grains company Archer Daniels Midland Co to acquire starch producer Eaststarch (notified July 28/deadline Sept. 1/simplified)SEPT 2 -- Anglo-Dutch oil major Royal Dutch Shell to acquire BG Group (notified July 29/deadline Sept. 2)-- South African paper maker Mondi  to acquire some assets from portfolio company Walki (notified July 29/deadline Sept. 2)SEPT 4 -- Private equity firms 3i Group and AMP Capital Investors to acquire joint control of offshore emergency and rescue services provider Esvagt (notified July 31/deadline Sept. 4/simplified) SEPT 7 -- Austrian bank Raiffeisen Zentralbank Osterreich  to acquire sole control of Austrian pension fund Valida Holding (notified Aug. 3/deadline Sept. 7/simplified)-- Mahindra World City Developers and Japan's Sumitomo Corp to set up a joint venture (notified Aug. 3/deadline Sept. 7/simplified)SEPT 8 -- Evo Payments International, Raiffeisen Bank Polska  and Czech lender Raiffeisenbank to jointly control two new subsidiaries with merchant acquiring and acquiring processing services transferred from the two banks (notified Aug. 4/deadline Sept. 8/simplified)SEPT 9 -- U.S. grain trader Archer Daniel Midland to acquire Belgian vegetable oil distributor AOR NV (notified Aug. 5/deadline Sept. 9)-- German retailer REWE to acquire some travel units from Swiss travel operator Kuoni Reisen (notified Aug. 5/deadline Sept. 9/simplified)SEPT 10 -- Buyout group KKR to acquire majority stake in German fibre-optic network operator Deutsche Glasfaser (notified Aug. 6/deadline Sept. 10/simplified) SEPT 11 -- U.S. investment firm Apollo Global Management to acquire majority control of Slovenian bank Nova KBM (notified Aug. 7/deadline Sept. 11/simplified)-- U.S. conglomerate General Electric to acquire most of French engineering group Alstom's power equipment business (notified Jan. 19/deadline extended for third time to Sept. 11 from Aug. 21)SEPT 14 -- Singapore-listed palm oil processor Wilmar International  and Italian oil products company Fox Petrolifera Italiana SpA to set up a joint venture (notified Aug. 10/deadline Sept. 14/simplified)-- BPIFrance and Springwater Capital LLC to acquire joint control of French paper producer Delion France (notified Aug. 10/deadline Sept. 14/simplified)-- Naxicap Partners and Fonds Avenir Automobile to acquire joint control of French car parts maker Defta Group (notified Aug. 10/deadline Sept. 14/simplified)SEPT 16 -- Norwegian telecoms company Telenor and Swedish peer TeliaSonera to combine their Danish mobile businesses (notified Feb. 27/deadline extended to Oct. 7 from Sept. 16 after the companies offered commitments)-- Private equity firm CVC Capital Partners to acquire energy company PKP Energetyka (notified Aug. 12/deadline Sept. 16/simplified)-- Private equity firms Advent International, Bain Capital and Clessidra to jointly acquire Italian banking services company ICBPI (notified Aug. 12/deadline Sept. 16)-- Chinese state-owned food firms Bright Food Group Co Ltd to acquire Spanish holding company Invermik SA (notified Aug. 12/deadline Sept. 16/simplified) SEPT 17 -- Kuwait Investment Authority (KIA) and Spanish energy group Gas Natural to acquire joint control of Global Power Generation (notified Aug. 13/deadline Sept. 17/simplified)-- Buyout group KKR to acquire German cutlery and coffee-machine maker WMF together with Austrian holding company FIBA (notified Aug.13/deadline Sept. 17)SEPT 18 -- U.S. distressed investment fund Apollo to acquire majority stake in steel trader Stemcor (notified Aug. 14/deadline Sept. 18/simplified)-- Japanese insurer Tokio Marine Holdings Inc to buy U.S. specialty insurer HCC Insurance Holdings Inc  (notified Aug. 14/deadline Sept. 18/simplified)-- Groupe Acticall to acquire customer relationship management company Sitel (notified Aug. 14/deadline Sept. 18/simplified)-- Dutch chipmaker NXP to acquire U.S. peer Freescale (notified July 31, deadline extended to Sept. 18 from Sept. 4 after NXP offered concessions)SEPT 21 -- Pfizer to acquire British drugmaker GlaxoSmithKline's menACWY meningitis vaccine business (notified Aug. 17/deadline Sept. 21)-- Cable telecoms company Liberty Global's Belgian subsidiary Telenet to buy mobile network operator Base from Dutch group KPN (notified Aug. 17/deadline Sept. 21)-- European private equity group Cinven to buy majority stake in German laboratory operator Synlab from BC Partners (notified Aug. 17/deadline Sept. 21/simplified)JAN 13 -- U.S. packages delivery company FedEx to acquire Dutch peer TNT (notified July /deadline extended to Jan. 13 from Dec. 8 after the companies asked for more time)SUSPENDED -- Oilfield services provider Halliburton to buy rival Baker Hughes in a stock and cash transaction (notified July 23/deadline suspended after the companies provided insufficient information)-- SOCAR, Azerbaijan's state energy company, to buy stakes in Greek natural gas grid operator DESFA from Greek natural gas utility DEPA (notified Oct. 1/deadline suspended on Jan. 21)GUIDE TO EU MERGER PROCESS DEADLINES: The European Commission has 25 working days after a deal is  filed for a first-stage review. It may extend that by 10 working days to 35 working days, to consider either a company's proposed remedies or an EU member state's request to handle the case.Most mergers win approval but occasionally the Commission  opens a detailed second-stage investigation for up to 90  additional working days, which it may extend to 105 working  days.SIMPLIFIED: Under the simplified procedure, the Commission announces the clearance of uncontroversial first-stage mergers without giving any reason for its decision. Cases may be reclassified as non-simplified - that is, ordinary first-stage reviews - until they are approved.   (Compiled by Foo Yun Chee)",2015-08-21,PRGO,"Fri Aug 21, 2015 | 8:22am EDT",EU mergers and takeovers (Aug 21),http://www.reuters.com//article/eu-mergers-idUSL5N10U21O20150821?type=companyNews
60,"  BRUSSELS Aug 21 The European Commission cleared on Friday U.S. drugmaker Perrigo's acquisition of certain assets from Britain's GSK.The Commission, in its role as the competition regulator in the 28-member European Union, said GSK would sell certain products such as cold and flu drugs, cold sore and pain treatment products to Perrigo.  ""The proposed acquisition would raise no competition concerns because of the limited overlaps and the presence of other strong players on all markets,"" the Commission said.   (Reporting by Robert-Jan Bartunek; Editing by Greg Mahlich) ",2015-08-21,PRGO,"Fri Aug 21, 2015 | 6:20am EDT",EU Commission clears Perrigo to buy GSK units,http://www.reuters.com//article/gsk-ma-perrigo-company-idUSL5N10W1M820150821?type=companyNews
61,"   By Bill Berkrot and Caroline Humer | NEW YORK  NEW YORK Perrigo Co Plc's (PRGO.N) chief executive expressed confidence on Tuesday that his company's shareholders will reject rival generic drugmaker Mylan NV's hostile takeover attempt, and said the offer is not close to what it would take to get a deal done.Mylan (MYL.O) shareholders are set to vote on Friday on whether the company should move forward with the Perrigo bid, whose value has declined with the recent market sell-off. If more than half vote ""yes,"" Mylan plans to take its cash and stock offer directly to Perrigo shareholders. Mylan has said that if just over 50 percent of Perrigo shareholders tender their shares, it will take control of the Dublin-based company. It had aimed for 80 percent of shareholders but lowered that to the bare minimum of just over 50 percent to gain control, an option under Irish takeover laws.""Based on what I've heard from shareholders they are not going to get 80 percent of Perrigo shareholders to tender their shares and they are not going to get 50 percent of Perrigo shareholders tendering their shares. I do not believe they are going to get to either threshold,"" Perrigo CEO Joseph Papa said in a telephone interview.He shrugged off the Aug. 28 vote by Mylan shareholders. ""If they get their vote, they get their vote.""  It is unclear if more than 50 percent of Mylan shareholders will back the deal. Abbott Laboratories (ABT.N), Mylan's largest shareholder with a stake of more than 14 percent, and hedge fund Paulson & Co, which owns just under 5 percent, have said they back the deal. Influential proxy advisory firm ISS weighed in against it.Mylan, whose shares closed at $49.11 on Tuesday, said in a press release on Tuesday that it believes its deal will gain   approval from both its shareholders and Perrigo shareholders.  With the recent plunge in world markets, shares of both Perrigo and Netherlands-based Mylan have suffered, lowering the overall value of the offer for Perrigo to about $192 per share from about $205. ""That's not even close,"" Papa said, referring to what it would take for the Perrigo board to recommend the deal it has unanimously rejected. ""I have no problem to use words substantially undervaluing us as a company,” said Papa, whose company's shares closed at $178 on the New York Stock Exchange on Tuesday. ""There's no logical reason to go forward here. It will reduce the price to earnings multiple of Perrigo. Our PE multiple is substantially higher than the PE multiple of the Mylan company.""Earlier this month, Mylan CEO Heather Bresch called its offer ""fair and compelling"" and said it was not looking to alter the terms. Papa said he does not believe the recent sell-off in the Chinese and other markets will hurt Perrigo's business. The company sells over-the-counter (OTC) consumer products, generic topical medicines, and animal health products.""OTC drugs, where we have about 75 percent of our sales, are going to do extraordinarily well despite what happens with economies of China or Asia or anywhere else in the world,"" Papa said.Asked if the market correction might make small acquisitions more attractive, Papa said, ""I do think there will be more opportunities."" (Editing by Matthew Lewis)",2015-08-25,PRGO,"Tue Aug 25, 2015 | 5:13pm EDT",Perrigo CEO expects shareholders to reject Mylan bid,http://www.reuters.com//article/us-perrigo-company-m-a-mylan-nl-idUSKCN0QU2HF20150825?type=companyNews
62,"  Aug 25 Irish Takeover Panel* Ruled Perrigo's Aug 13 statement ""Mylan already proposed a dilutive deal that substantially undervalues Perrigo"" breached rule  * Perrigo's statement breached rule 19.3(a) as it was unclear that term ""dilutive"" described effect on Mylan shareholders  Source text for Eikon: ",2015-08-25,PRGO,"Tue Aug 25, 2015 | 11:12am EDT",BRIEF-Irish Takeover Panel says Perrigo's Aug 13 statement breached rule,http://www.reuters.com//article/idUSFWN11001S20150825?type=companyNews
63,"   By Caroline Humer | NEW YORK  NEW YORK Mylan NV (MYL.O) shareholders on Friday backed the drugmaker's hostile bid for Perrigo Co (PRGO.N), allowing it to launch a tender offer for the company's shares in the next few weeks.Mylan said that it had the support from investors representing a majority of shares, passing the threshold it needed to go directly to Perrigo shareholders. The company is now looking for holders of more than 50 percent of Perrigo's shares to take part in the tender offer.Mylan, a generic drugmaker, offered to buy Perrigo in April for cash and stock then worth $205 per share. Perrigo, which makes over-the-counter and generic medicines, has consistently rejected the offer as too low and says that it will do better on its own.Perrigo, based in Dublin, Ireland, said on Friday that it is confident that fewer than 50 percent of its shares will be tendered to Mylan. That Mylan investors backed the deal does not necessarily mean that enough Perrigo shareholders will do so, said Erik Gordon, a business professor at the University of Michigan.""The Perrigo acquisition makes sense for Mylan. The Perrigo resistance is the hard part. The benefits to its stockholders are less obvious,"" Gordon said. The offer is now worth about $193 per share, or $28 billion, based on Mylan's latest share price of $51.49. Perrigo shares closed on Thursday at $188.19.The vote was held at a shareholder meeting in the Netherlands, where Mylan is based. Mylan said that of votes cast at the meeting, about two-thirds backed the deal. Proxy advisory firm ISS had advised Mylan investors to vote against the deal, while two of ISS's competitors recommended the deal for Mylan shareholders. Two large Mylan shareholders representing about 20 percent of the shares, Abbott Laboratories Inc (ABT.N) and Paulson & Co, backed Mylan. ""We continue to think that a deal here is far from likely though largely priced into both stocks,"" RBC Capital Markets analyst Randall Stanicky said in a research note. (Reporting by Caroline Humer; Editing by Steve Orlofsky)",2015-08-28,PRGO,"Fri Aug 28, 2015 | 9:37am EDT","Mylan shareholders back Perrigo takeover, tender offer up next",http://www.reuters.com//article/us-perrigo-company-m-a-mylan-idUSKCN0QX1C520150828?type=companyNews
64,"  (Adds outside reaction)By Caroline HumerNEW YORK Aug 28 Mylan NV shareholders on Friday backed the drugmaker's hostile bid for Perrigo Co , allowing it to launch a tender offer for the company's shares in the next few weeks.Mylan said that it had the support from investors representing a majority of shares, passing the threshold it needed to go directly to Perrigo shareholders. The company is now looking for holders of more than 50 percent of Perrigo's shares to take part in the tender offer.Mylan, a generic drugmaker, offered to buy Perrigo in April for cash and stock then worth $205 per share. Perrigo, which makes over-the-counter and generic medicines, has consistently rejected the offer as too low and says that it will do better on its own. Perrigo, based in Dublin, Ireland, said on Friday that it is confident that fewer than 50 percent of its shares will be tendered to Mylan.That Mylan investors backed the deal does not necessarily mean that enough Perrigo shareholders will do so, said Erik Gordon, a business professor at the University of Michigan. ""The Perrigo acquisition makes sense for Mylan. The Perrigo resistance is the hard part. The benefits to its stockholders are less obvious,"" Gordon said.The offer is now worth about $193 per share, or $28 billion, based on Mylan's latest share price of $51.49. Perrigo shares closed on Thursday at $188.19. The vote was held at a shareholder meeting in the Netherlands, where Mylan is based. Mylan said that of votes cast at the meeting, about two-thirds backed the deal.Proxy advisory firm ISS had advised Mylan investors to vote against the deal, while two of ISS's competitors recommended the deal for Mylan shareholders. Two large Mylan shareholders representing about 20 percent of the shares, Abbott Laboratories Inc and Paulson & Co, backed Mylan.""We continue to think that a deal here is far from likely though largely priced into both stocks,"" RBC Capital Markets analyst Randall Stanicky said in a research note.   (Reporting by Caroline Humer; Editing by Steve Orlofsky)",2015-08-28,PRGO,"Fri Aug 28, 2015 | 9:34am EDT","UPDATE 2-Mylan shareholders back Perrigo takeover, tender offer up next",http://www.reuters.com//article/perrigo-company-ma-mylan-idUSL1N1130GD20150828?type=companyNews
65,"  NEW YORK Aug 28 Mylan NV shareholders on Friday backed the drugmaker's hostile bid for Perrigo Co , allowing it to launch a tender offer for the company's shares in the next few weeks. Mylan said that more than two-thirds of shareholders had backed the vote. It needed more than half of them to do so in order to pursue the takeover.   (Reporting by Caroline Humer)  ",2015-08-28,PRGO,"Fri Aug 28, 2015 | 7:42am EDT",Mylan says shareholders back Perrigo takeover,http://www.reuters.com//article/perrigo-company-ma-mylan-idUSL1N1130FV20150828?type=companyNews
66,"  (Adds Legumex Walker; Updates Mylan)Sept 14 The following bids, mergers, acquisitions and disposals were reported by 2000 GMT on Monday:** Mylan NV said it launched a tender offer to acquire fellow generic drugmaker Perrigo Co Plc for about $27 billion - an offer Perrigo has rejected so far.** Oil Search Ltd rebuffed an $8 billion takeover proposal from Australia's biggest energy company Woodside Petroleum Ltd as far too cheap, although it left the door open to higher offers.** Solera Holdings Inc, which provides technology services to insurance companies, said it agreed to be acquired by an affiliate of private-equity firm Vista Equity Partners for $3.74 billion in cash.** China Railway Group Ltd  said it would absorb the assets of subsidiary China Railway Erju Co Ltd  as part of wider efforts to streamline the government's sprawling railway sector. ** Spanish bank Sabadell SA is considering making a bid for an 18 billion euro ($20.4 billion) mortgage portfolio held by British nationalized banks Northern Rock and Bradford & Bingley, a source familiar with the process said.** Trinity Mirror Plc, publisher of the Daily Mirror and Sunday Mirror, said it was in talks to buy out the shares it does not already own in rival Local World Holdings Ltd.** Canada's Legumex Walker Inc said it had agreed to sell its legume crop processing plants and expects to sell its U.S. canola-crushing facility, allowing it to wind down the company. ** Raiffeisen Bank International AG's Czech unit has agreed to buy Citibank's local credit-card and retail banking businesses, the banks said.** Poland's No.3 power group Enea SA offered 1.48 billion zlotys ($398.3 million) to buy a majority of its main coal supplier Bogdanka, as part of a strategy envisaging 17 billion zloty investments by 2020. ** South African fashion retailer Truworths International Ltd said it was in talks with closely held British shoe chain Office.** Tele Columbus AG Germany's third-largest cable network operator, said on Sunday it has agreed to buy rival pepcom GmbH to create a combined company reaching 3.7 million homes, in a deal valued at 608 million euros ($689 million), including debt.** Credit Suisse Group AG intends to sell its U.S. private bank and slash its prime brokerage business under a strategy being developed by new Chief Executive Tidjane Thiam, Swiss newspaper Schweiz am Sonntag reported on Sunday.** India's JK Tyre & Industries Ltd has agreed to buy Kesoram Industries Ltd's tyre manufacturing unit in northern India for 22 billion rupees ($332.2 million), according to an exchange filing.($1 = 0.6470 pounds)  ($1 = 0.8821 euros)  ($1 = 66.2310 Indian rupees)  ($1 = 3.7159 zlotys)   (Compiled by Anet Josline Pinto in Bengaluru)",2015-09-14,PRGO,"Mon Sep 14, 2015 | 4:02pm EDT",Deals of the day- Mergers and acquisitions,http://www.reuters.com//article/deals-day-idUSL4N11K3GY20150914?type=companyNews
67,"  Mylan NV (MYL.O) said it launched a tender offer on Monday to acquire fellow generic drugmaker Perrigo Co Plc (PRGO.N) for about $27 billion - an offer Perrigo has rejected so far.Mylan Chief Executive Robert Coury said he was confident a majority of Perrigo shareholders would support the offer of $75 in cash and 2.3 Mylan shares for each share held.Perrigo urged shareholders to take no action, pending a board review.The board will assess Netherlands-based Mylan's offer and advise shareholders within 10 days, Perrigo said in a statement.  Perrigo is domiciled in Ireland. Under Irish law, an owner needs 80 percent of votes to squeeze out minority investors. Perrigo shareholders would own about 40 percent of the combined company upon completion of the transaction.Perrigo and Mylan's shares were little changed in early trading.  (Reporting by Amrutha Penumudi in Bengaluru; Editing by Anil D'Silva)",2015-09-14,PRGO,"Mon Sep 14, 2015 | 10:18am EDT",Mylan launches tender offer for Perrigo,http://www.reuters.com//article/us-perrigo-company-m-a-idUSKCN0RE1E520150914?type=companyNews
68,"  (Adds Perrigo's response)Sept 14 Mylan NV said it launched a tender offer on Monday to acquire fellow generic drugmaker Perrigo Co Plc for about $27 billion - an offer Perrigo has rejected so far.Mylan Chief Executive Robert Coury said he was confident a majority of Perrigo shareholders would support the offer of $75 in cash and 2.3 Mylan shares for each share held. Perrigo urged shareholders to take no action, pending a board review.The board will assess Netherlands-based Mylan's offer and advise shareholders within 10 days, Perrigo said in a statement. Perrigo is domiciled in Ireland. Under Irish law, an owner needs 80 percent of votes to squeeze out minority investors. Perrigo shareholders would own about 40 percent of the combined company upon completion of the transaction.Perrigo and Mylan's shares were little changed in early trading.   (Reporting by Amrutha Penumudi in Bengaluru; Editing by Anil D'Silva)",2015-09-14,PRGO,"Mon Sep 14, 2015 | 10:18am EDT",UPDATE 1-Mylan launches tender offer for Perrigo,http://www.reuters.com//article/perrigo-company-ma-idUSL4N11K4DM20150914?type=companyNews
69,"  Sept 14 Mylan NV said it launched a tender offer to acquire fellow generic drugmaker Perrigo Co Plc  for about $27 billion - an offer Perrigo has rejected.Perrigo shareholders will receive $75 in cash and 2.3 Mylan shares for each share held.Mylan Chief Executive Robert Coury said the company was confident a majority of Perrigo shareholders would support the offer. Perrigo CEO Joseph Papa wrote to Coury last week, again rejecting the deal and saying he was confident that shareholders would not accept the offer from Mylan, which is based in the Netherlands. Perrigo is domiciled in Ireland. Under Irish law, an owner needs 80 percent of votes to squeeze out minority investors. Perrigo shareholders would own about 40 percent of the combined company upon completion of the transaction.   (Reporting by Amrutha Penumudi in Bengaluru; Editing by Anil D'Silva)",2015-09-14,PRGO,"Mon Sep 14, 2015 | 9:06am EDT",Mylan launches tender offer for Perrigo,http://www.reuters.com//article/perrigo-company-ma-idUSL4N11K48820150914?type=companyNews
