,Article,Date,Symbol,Time,Title,Url
0,"  March 14 Quanta Services Inc :* Quanta services announces CEO transition chief operating officer Earl ""Duke"" Austin named chief executive officer * President and chief executive officer Jim O'Neil , has stepped down  * Reaffirms its growth strategy & full-year guidance  Source text for Eikon:  Further company coverage:",2016-03-14,PWR,"Mon Mar 14, 2016 | 5:40pm EDT",BRIEF-Quanta Services names Earl Duke Austin as chief executive officer,http://www.reuters.com//article/idUSASC08GM6?type=companyNews
1,  March 23 Quanta Services Inc * Quanta services appoints doyle beneby & david mcclanahan to board of directors  Source text for Eikon:  Further company coverage:    (Bengaluru Newsroom: +1-646-223-8780)  ,2016-03-23,PWR,"Wed Mar 23, 2016 | 4:33pm EDT",BRIEF-Quanta appoints Doyle Beneby and David Mcclanahan to board,http://www.reuters.com//article/idUSASC08I37?type=companyNews
2,  May 5 Quanta Services Inc* Quanta services reports 2016 first quarter results* Sees FY 2016 adjusted non-GAAP earnings per share $1.61 to $1.81 from continuing operations* Sees FY 2016 earnings per share $1.30 to $1.50 from continuing operations* Q1 adjusted non-GAAP earnings per share $0.23 from continuing operations * Q1 earnings per share $0.13 from continuing operations* Sees FY 2016 revenue $7.5 billion to $8.0 billion * Q1 revenue $1.71 billion versus I/B/E/S view $1.74 billion* Q1 earnings per share view $0.26 -- Thomson Reuters I/B/E/S * Q1 loss per share $0.08* On track to achieve full year outlook diluted EPS from continuing operations of $0.13* Says expects revenues for full year 2016 to range between $7.5 billion and $8.0 billion* Quarter-End backlog increases to $10.1 billion  Source text for Eikon:  Further company coverage:    (Bengaluru Newsroom: +1 646 223 8780),2016-05-05,PWR,"Thu May 5, 2016 | 6:58am EDT",BRIEF-Quanta Services reports Q1 loss $0.08/shr,http://www.reuters.com//article/idUSASC08N42?type=companyNews
3,"  May 5 Dycom Industries Inc* Dycom industries, inc. Files amended complaint against quanta services, inc. For breach of contract* Filed an amended complain against quanta for violating parties' 2012 stock purchase agreement * Dycom seeks injunctive relief barring quanta from further engaging in prohibited competition * Dycom also alleges under applicable law, quanta is ""indefinitely barred"" from actively soliciting customers of businesses it sold * Complaint alleges that quanta intentionally violated, and continues to violate, several contractual covenants  Source text for Eikon:  Further company coverage:    (Bengaluru Newsroom: +1-646-223-8780)",2016-05-05,PWR,"Thu May 5, 2016 | 6:54am EDT",BRIEF-Dycom Industries files amended complaint against Quanta Services,http://www.reuters.com//article/idUSFWN1820K1?type=companyNews
4,"  Aug 4 Quanta Services Inc :* Q2 adjusted non-GAAP earnings per share $0.18 from continuing operations* Sees FY 2016 adjusted non-GAAP earnings per share $1.52 to $1.67 from continuing operations* Sees FY 2016 earnings per share $1.20 to $1.35 from continuing operations * Expects a meaningful increase in revenues, margins and earnings during second half of 2016, as compared to H1 2016 * Q2 earnings per share $0.11 from continuing operations* Sees FY 2016 revenue $7.75 billion to $8.0 billion * Qtrly revenues $1.79 billion versus $ 1.87 billion* Fy2016 earnings per share view $1.67, revenue view $7.70 billion -- Thomson Reuters I/B/E/S  Source text for Eikon:  Further company coverage:",2016-08-04,PWR,"Thu Aug 4, 2016 | 6:19am EDT",BRIEF-Quanta Services Q2 adjusted earnings $0.18/shr from continuing operations,http://www.reuters.com//article/idUSFWN1AL0HP?type=companyNews
5,"  Nov 3 Quanta Services Inc :* FY2016 earnings per share view $1.56, revenue view $7.76 billion -- Thomson Reuters I/B/E/S* ""long-term outlook for quanta's business is positive""* Quanta services reports 2016 third quarter results* Sees FY 2016 adjusted non-gaap earnings per share $1.51 to $1.56 from continuing operations * Q3 adjusted non-gaap earnings per share $0.55 from continuing operations* Q3 earnings per share $0.47 from continuing operations * Q3 revenue $2.04 billion versus i/b/e/s view $2.08 billion* Q3 earnings per share view $0.55 -- Thomson Reuters I/B/E/S * Sees fy 2016 earnings per share $1.17 to $1.22 from continuing operations* Sees fy 2016 revenue $7.65 billion to $7.75 billion* Q3 adjusted earnings per share $0.55  Source text for Eikon:  Further company coverage:",2016-11-03,PWR,"Thu Nov 3, 2016 | 6:24am EDT",BRIEF-Quanta Services Q3 adjusted EPS $0.55,http://www.reuters.com//article/idUSASC09FOS?type=companyNews
