,Article,Date,Symbol,Time,Title,Url
20,"   By Mike Stone and Devika  Krishna Kumar | NEW YORK  NEW YORK Acquisition-hungry energy companies are back on the prowl.Dealmakers have recovered from the shock of Britain's ""Brexit"" vote last month to leave the European Union and have resumed buying oil and gas fields in choice locations in Canada and the United States, restocking their inventories on a bet that a two-year slump in the price of oil has abated.""Buyers are increasingly confident in a stable to slowly increasing oil price - as are their funding sources, whether private equity funds or public market investors,"" said Bobby Tudor, chief executive of Tudor, Pickering, Holt & Co, an oil and gas investment bank.Oil prices CLc1 have held steady at or above $45 a barrel for a majority of the last two months and touched a 2016 high above $51, ahead of the British referendum.Tudor said buyers were banking on it eventually settling at around $60 a barrel, giving them confidence about buying drilling acreage in some of the nation's shale heartlands.U.S. oil and gas producer Diamondback Energy Inc (FANG.O) last week said it would spend $560 million buying leases on oil-rich land in the Southern Delaware Basin, within the Permian Basin, the top U.S. oilfield, where initial production results have been strong and costs are coming down.A day later, U.S. energy company Laredo Petroleum Inc (LPI.N) said it would spend $125 million buying acreage in the Midland Basin, also part of the Permian.These deals mark a resumption in buying after Brexit caused a temporary lull in acquisitions.Before the British referendum on June 23, buyers and sellers had grown comfortable with the idea that oil had rebounded from 12-year lows. That conviction helped to unclog the acquisition pipeline after a long-dormant period in which deals were offered but failed to materialize.About $5.1 billion of U.S. and Canadian properties traded hands in June, the largest dollar amount in more than a year according to PLS Inc, global M&A database for such deals.Acreage deals create confidence and open the door to acquisitions of entire companies, so long as oil remains relatively steady, according to nearly a dozen dealmakers interviewed by Reuters.More acreage deals are in the works, including ones that involve large exploration and production (E&P) companies such as Anadarko Petroleum Corp (APC.N) and Southwestern Energy Co  (SWN.N), according to people familiar with the matter. Restructuring bankers and attorneys anticipate that exploration and production companies that have emerged from bankruptcy, like Magnum Hunter Resources, or are going through the process, like Ultra Petroleum Corp [UPLMQ.PK], will be merger and acquisition targets for other oil and gas companies because they are financially healthy, having eliminated much of their debt.Magnum Hunter and Ultra Petroleum did not immediately respond to requests for comment.Publicly traded companies are warming up to deals now, a change from when deals were mainly stagnant or acreage was sold to private equity firms in small transactions. Traditional E&P companies dominated acquisition activity in the second quarter, representing 69 percent and 76 percent of total transactions and deal value, respectively, Fitch Ratings said in a report on Thursday.PRICE AND PRIME LOCATIONS The key dynamic that has developed and allowed buyers and sellers to get back to cutting deals is price.  Greater stability around the price of oil has enabled both sides to negotiate, where previously expectations of further falls kept them apart.Leading into the spate of deals in June was a nine-week period of relatively low oil volatility, when prices rose about 20 percent and traded between about $40 and $50 a barrel.  Transactions in June occurred at prices about 10 percent higher than the far forward crude price for three years out CLc36, according to bankers. That implies that buyers and sellers could agree upon a price of about $60 per barrel, the bankers said.That forward price has now returned to its pre-Brexit levels of about $54 a barrel, enabling deals once again.Another key ingredient for completed deals was their location. Many of the sales occurred in areas with the highest margins where pumping at about $50 per barrel is profitable. The acreage most sought-after is in Texas' Permian Basin and in Oklahoma's STACK area (Sooner Trend Anadarko Basin Canadian and Kingfisher Counties), popular because of their easy-to-extract rock formations and relatively low break-even prices.     In June, Marathon Oil Corp (MRO.N) said it would spend about $888 million to acquire STACK acreage and Devon Energy Corp (DVN.N) said it would sell Texas acreage to Pioneer Natural Resources (PXD.N) and an undisclosed buyer for $858 million.HOPING FOR HIGHER OIL PRICES     While there could be hurdles such as resurgent output and deceleration in demand growth over the next few months, many producers are more bullish on the prices of oil long-term.""Investors have become overly bearish on oil as concerns over rising U.S. rig activity and high fuel inventories raised doubts about the rebalancing of the market. We think those concerns are unwarranted,"" ANZ said in a note.""We think any further decline in prices will accelerate the supply closures again and set the stage for an even stronger price recovery in 2017.""On Friday, U.S. oil prices ended the week 1 percent higher. [O/R]        Acreage inventory is being offered for sale, including 180,000 acres of West Virginia holdings currently belonging to Southwestern Energy Co (SWN.N), people familiar with the deal said. Southwestern declined to comment.     Anadarko is marketing 86,000 net acres in East Texas, one person familiar with the deal said, adding that the deal could fetch as much as $1 billion. A spokesman for Anadarko declined to comment.  (Editing by Carmel Crimmins and Matthew Lewis)",2016-07-18,SWN,"Mon Jul 18, 2016 | 1:24am EDT",North American oil deals trickle back after Brexit shock,http://www.reuters.com//article/us-usa-energy-deals-idUSKCN0ZY0AY?type=companyNews
21,"   By Mike Stone and Devika  Krishna Kumar | NEW YORK  NEW YORK Acquisition-hungry energy companies are back on the prowl.Dealmakers have recovered from the shock of Britain's ""Brexit"" vote last month to leave the European Union and have resumed buying oil and gas fields in choice locations in Canada and the United States, restocking their inventories on a bet that a two-year slump in the price of oil has abated.""Buyers are increasingly confident in a stable to slowly increasing oil price - as are their funding sources, whether private equity funds or public market investors,"" said Bobby Tudor, chief executive of Tudor, Pickering, Holt & Co, an oil and gas investment bank.Oil prices CLc1 have held steady at or above $45 a barrel for a majority of the last two months and touched a 2016 high above $51, ahead of the British referendum.Tudor said buyers were banking on it eventually settling at around $60 a barrel, giving them confidence about buying drilling acreage in some of the nation's shale heartlands.U.S. oil and gas producer Diamondback Energy Inc (FANG.O) last week said it would spend $560 million buying leases on oil-rich land in the Southern Delaware Basin, within the Permian Basin, the top U.S. oilfield, where initial production results have been strong and costs are coming down.A day later, U.S. energy company Laredo Petroleum Inc (LPI.N) said it would spend $125 million buying acreage in the Midland Basin, also part of the Permian.These deals mark a resumption in buying after Brexit caused a temporary lull in acquisitions.Before the British referendum on June 23, buyers and sellers had grown comfortable with the idea that oil had rebounded from 12-year lows. That conviction helped to unclog the acquisition pipeline after a long-dormant period in which deals were offered but failed to materialize.About $5.1 billion of U.S. and Canadian properties traded hands in June, the largest dollar amount in more than a year according to PLS Inc, global M&A database for such deals.Acreage deals create confidence and open the door to acquisitions of entire companies, so long as oil remains relatively steady, according to nearly a dozen dealmakers interviewed by Reuters.More acreage deals are in the works, including ones that involve large exploration and production (E&P) companies such as Anadarko Petroleum Corp (APC.N) and Southwestern Energy Co  (SWN.N), according to people familiar with the matter. Restructuring bankers and attorneys anticipate that exploration and production companies that have emerged from bankruptcy, like Magnum Hunter Resources, or are going through the process, like Ultra Petroleum Corp [UPLMQ.PK], will be merger and acquisition targets for other oil and gas companies because they are financially healthy, having eliminated much of their debt.Magnum Hunter and Ultra Petroleum did not immediately respond to requests for comment.Publicly traded companies are warming up to deals now, a change from when deals were mainly stagnant or acreage was sold to private equity firms in small transactions. Traditional E&P companies dominated acquisition activity in the second quarter, representing 69 percent and 76 percent of total transactions and deal value, respectively, Fitch Ratings said in a report on Thursday.PRICE AND PRIME LOCATIONS The key dynamic that has developed and allowed buyers and sellers to get back to cutting deals is price.  Greater stability around the price of oil has enabled both sides to negotiate, where previously expectations of further falls kept them apart.Leading into the spate of deals in June was a nine-week period of relatively low oil volatility, when prices rose about 20 percent and traded between about $40 and $50 a barrel.  Transactions in June occurred at prices about 10 percent higher than the far forward crude price for three years out CLc36, according to bankers. That implies that buyers and sellers could agree upon a price of about $60 per barrel, the bankers said.That forward price has now returned to its pre-Brexit levels of about $54 a barrel, enabling deals once again.Another key ingredient for completed deals was their location. Many of the sales occurred in areas with the highest margins where pumping at about $50 per barrel is profitable. The acreage most sought-after is in Texas' Permian Basin and in Oklahoma's STACK area (Sooner Trend Anadarko Basin Canadian and Kingfisher Counties), popular because of their easy-to-extract rock formations and relatively low break-even prices.     In June, Marathon Oil Corp (MRO.N) said it would spend about $888 million to acquire STACK acreage and Devon Energy Corp (DVN.N) said it would sell Texas acreage to Pioneer Natural Resources (PXD.N) and an undisclosed buyer for $858 million.HOPING FOR HIGHER OIL PRICES     While there could be hurdles such as resurgent output and deceleration in demand growth over the next few months, many producers are more bullish on the prices of oil long-term.""Investors have become overly bearish on oil as concerns over rising U.S. rig activity and high fuel inventories raised doubts about the rebalancing of the market. We think those concerns are unwarranted,"" ANZ said in a note.""We think any further decline in prices will accelerate the supply closures again and set the stage for an even stronger price recovery in 2017.""On Friday, U.S. oil prices ended the week 1 percent higher. [O/R]        Acreage inventory is being offered for sale, including 180,000 acres of West Virginia holdings currently belonging to Southwestern Energy Co (SWN.N), people familiar with the deal said. Southwestern declined to comment.     Anadarko is marketing 86,000 net acres in East Texas, one person familiar with the deal said, adding that the deal could fetch as much as $1 billion. A spokesman for Anadarko declined to comment.  (Editing by Carmel Crimmins and Matthew Lewis)",2016-07-18,SWN,"Mon Jul 18, 2016 | 1:24am EDT",North American oil deals trickle back after Brexit shock,http://www.reuters.com//article/usa-energy-deals-idUSL4N19T4AK?type=companyNews
22,"  July 21 Southwestern Energy Co :* Net production totaled 225 BCFE in Q2 of 2016, down less than anticipated from 245 BCFE in Q2 of 2015* Reinitiated drilling with first rig this week in northeast appalachia; intends to increase company-wide rig count to 5 by Q3 end* NGL and oil production guidance for 2016 is raised to 865 to 875 BCFE, an increase of about 5% over previous 2016 guidance* Southwestern Energy announces second quarter 2016 results, improved guidance, outcomes of financial strengthening efforts and resumption of drilling and completion activity * Q2 adjusted non-gaap loss per share $0.09* Q2 loss per share $1.61* Q2 earnings per share view $-0.10 -- Thomson Reuters I/B/E/S * Raising total year production guidance range by 45 BCFE or 5% (using midpoints) to 865 BCFE to 875 BCFE* ""Plans to make incremental capital investments of up to $500 million from its July equity offering"" * Restructuring charges associated with workforce reduction, which were $11 million for e&p segment in Q2 of 2016* Sees Q3 total production 206 - 211 BCFE* Sees Q4 total production 197-202 BCFE* Qtrly operating revenues $522 million versus $764 million  Source text for Eikon:  Further company coverage:    (Bengaluru Newsroom: +1-646-223-8780)",2016-07-21,SWN,"Thu Jul 21, 2016 | 5:43pm EDT",BRIEF-Southwestern Energy Q2 adjusted non-gaap loss per share $0.09,http://www.reuters.com//article/idUSASC08XUB?type=companyNews
23,"  July 26 Western Gas announces second-quarter results* Total throughput attributable to wes for natural gas assets for q2 of 2016 averaged 3.9 bcf/d, 2% above prior quarter* Q2 earnings per share view $0.48 -- Thomson Reuters I/B/E/S * Quarter 2016 results* Qtrly net income available to limited partners $0.55 per common unit * Total throughput for crude/ngl assets for q2 of 2016 averaged 187 mbbls/d, which was 2% above prior quarter * Qtrly total revenue $428.7 million versus $466 million* Q2 revenue view $434.1 million -- Thomson Reuters I/B/E/S  Source text for Eikon:  Further company coverage:",2016-07-26,SWN,"Tue Jul 26, 2016 | 4:24pm EDT",BRIEF-Western Gas announces second-quarter 2016 results,http://www.reuters.com//article/idUSASC08YF8?type=companyNews
24,"  Oct 20 Southwestern Energy Co* Southwestern Energy Co announces 2016 third quarter operational update and financial results* Q3 adjusted non-gaap earnings per share $0.03* Q3 loss per share $1.52 * Q3 earnings per share view $0.06 -- Thomson Reuters I/B/E/S * Southwestern Energy Co - net production totaled 211 bcfe in Q3 of 2016, down from 249 bcfe in Q3 of 2015* Q3 operating revenues $651 million versus $749 million * Southwestern Energy Co - company anticipates its total company basis differential to end year at high end of its guidance, which is $0.83 per mcf* Southwestern Energy Co-to exit 2016 with about 85 drilled but uncompleted wells, returning to normal maintenance level for operations of about 60 by early 2017  Source text for Eikon:  Further company coverage:",2016-10-20,SWN,"Thu Oct 20, 2016 | 5:12pm EDT",BRIEF-Southwestern Energy announces 2016 Q3 financial results,http://www.reuters.com//article/idUSASC09C8S?type=companyNews
