,Article,Date,Symbol,Time,Title,Url,compound,neg,neu,pos
58,"   By Diane Bartz | WASHINGTON  WASHINGTON Reynolds American Inc won U.S. antitrust approval on Tuesday for its deal to buy smaller rival Lorillard in a deal that would combine the No. 2 and No. 3 U.S. cigarette companies.The Federal Trade Commission said it would allow the deal to go forward in condition that the companies sell four cigarette brands - Winston, Kool, Salem and Maverick. They will be purchased by Imperial Tobacco Group PLC.Reynolds, which makes Camel and Pall Mall cigarettes, said in July it would buy Lorillard, which makes Newport, for $27.4 billion. Altria Group, which owns Marlboro, has a 47 percent U.S. market share, followed by Reynolds at 26 percent and Lorillard at 14 percent, according to 2013 data from Euromonitor International. This is the most recent data available. The deal presented antitrust enforcers with a conundrum: Their mandate is to prevent higher prices because of mergers, but U.S. public policy aims to make cigarettes more expensive to discourage smoking.The FTC has reviewed two other major cigarette mergers in the past 20 years. In 2004, it allowed R.J. Reynolds to buy rival Brown & Williamson, without divestitures. An expert familiar with the FTC at the time said at least some commissioners opposed using agency resources to litigate to keep cigarettes cheap.In 1994, the commission sued to stop British American Tobacco's $1 billion purchase of American Tobacco. The two sides eventually settled, and the merger went forward.",2015-05-26,RAI,"Tue May 26, 2015 | 6:29pm EDT",Reynolds American wins U.S. antitrust approval to buy rival Lorillard,http://www.reuters.com//article/lorillard-reynolds-ftc-idUSL1N0YH2JS20150526?type=companyNews,-0.5567,0.042,0.922,0.035
59,"  WASHINGTON May 26 Reynolds American Inc  won U.S. antitrust approval on Tuesday for its deal to buy smaller rival Lorillard in a deal that would combine the No. 2 and No. 3 U.S. cigarette companies.The Federal Trade Commission said it would allow the deal to go forward in condition that the companies sell four cigarette brands - Winston, Kool, Salem, and Maverick. They will be purchased by Imperial Tobacco Group PLC.  Reynolds, which makes Camel and Pall Mall cigarettes, said in July it would buy Lorillard, which makes Newport, for $27.4 billion.   (Reporting by Diane Bartz; Editing by Eric Beech) ",2015-05-26,RAI,"Tue May 26, 2015 | 5:56pm EDT",Reynolds American wins antitrust approval to buy rival Lorillard,http://www.reuters.com//article/lorillard-reynolds-ftc-idUSL1N0YH2GJ20150526?type=companyNews,0.6486,0.042,0.874,0.084
60,"  (Adds Reynolds American, Actelion, Teva, Delta, Airdata, Eurotunnel, Pozen and Gazprom)June 8 The following bids, mergers, acquisitions and disposals were reported by 2000 GMT on Monday:** Switzerland's Syngenta rejected a second takeover proposal from agrochemicals firm Monsanto on Monday, saying its U.S. rival had made no attempt to seriously address regulatory concerns over the potential deal.** Reynolds American Inc cleared the final hurdle for its roughly $27.4 billion purchase of smaller rival Lorillard Inc as a federal judge approved its request to sell several cigarette brands.** Investment bank Stifel Financial Corp said it would buy Barclays Plc's U.S. wealth and investment management unit, which is the former brokerage arm of Lehman Brothers.** Shares in Actelion, Europe's biggest biotech company, jumped 10 percent to a record high on Monday after a report that Shire was considering a $19 billion takeover of the Swiss group to boost its rare diseases business.** Delta Air Lines Inc has been approached about investing in Japan's Skymark Airlines to help revive the budget carrier from bankruptcy, Delta's president Ed Bastian told reporters.** German regional wireless operator Airdata has challenged the EU's approval of Telefonica Deutschland's 8.6 billion euro ($9.6 billion) acquisition of E-Plus, saying concessions offered to allay competition concerns did not go far enough. ** Eurotunnel, the operator of the undersea rail link between England and France, is selling its Calais-to-Dover ferry business to Danish rival DFDS to end its lengthy battle with British competition authorities.** Top executives at Israeli drugmaker Teva sent an open letter to takeover target Mylan, saying they remained committed to striking a deal and reasserting that Teva's $82-per-share offer would benefit shareholders of both firms.** Specialty pharmaceuticals company Pozen Inc said on Monday it would acquire Tribute Pharmaceuticals Canada Inc  for about $144 million, in a deal that would shift its domicile to Ireland and cut its tax bill.** Russia's Gazprom is considering investments in oil and natural gas in Brazil and may bid for exploration rights in the country's 13th-Round concession auction in October, Shakarbek Osmonov, director for Brazil and Latin America, told Reuters. ** Chipmakers Integrated Silicon Solution Inc and Cypress Semiconductor Corp have failed to reach a merger agreement due to potential antitrust concerns.** Sears Holdings Corp said it plans to raise $2.6 billion from the spinoff of 235 stores into a real estate investment trust (REIT).** Airbus is ""watching with interest"" to see whether United Technologies Corp puts its Sikorsky helicopter business up for sale, the head of Airbus' U.S. division said on Monday. ** Swedish rare diseases drugmaker Swedish Orphan Biovitrum's said it had terminated discussions over a possible offer for the company. Sobi said in late April that it had received a preliminary bid proposal, with Pfizer  identified by Reuters as the potential bidder.** Private equity firm Apollo Global Management has won the bidding for Saint-Gobain's glass bottle unit Verallia with an offer valuing the business at 2.95 billion euros ($3.27 billion), the French building materials group said on Monday.** German regional wireless operator Airdata has filed a challenge with the EU General Court to Telefonica Deutschland's  8.6-billion-euro ($9.6 billion) acquisition of E-Plus.** Telecoms company O2 Czech Republic's majority owner PPF said on Monday other shareholders would get 78 crowns per share in its planned buyout offer, 58 percent above the stock's notional price set after the company spun off its infrastructure business last week.** Asia Coal Energy Ventures (ACE) raised its offer price for Asia Resource Minerals by about 37 percent on Monday, winning support of large stakeholder Nat Rothschild and moving closer to a takeover of the troubled coal miner.** Telecom Italia tower unit INWIT is interested in buying other tower assets as it seeks to play a leading role in any future sector consolidation following its listing on the Milan bourse.** Waterland Financial Holdings, a mid-sized financial holding firm, said on Monday it plans to buy an 80 percent stake in COTA Commercial Bank for T$8 billion ($258 million) via cash, in the latest acquisition in Taiwan's fragmented financial market.    ($1 = 0.8989 euros) ($1 = 31.1500 Taiwan dollars)   (Compiled by Shubhankar Chakravorty and Anya George Tharakan in Bengaluru)",2015-06-08,RAI,"Mon Jun 8, 2015 | 3:53pm EDT",Deals of the day- Mergers and acquisitions,http://www.reuters.com//article/deals-day-idUSL3N0YU34120150608?type=companyNews,0.9925,0.027,0.873,0.099
61,"   By Diane Bartz  Reynolds American Inc on Monday cleared the final hurdle for its roughly $27.4 billion purchase of smaller rival Lorillard Inc as a federal judge approved its request to sell several cigarette brands.The companies expect to close on June 12, they said in a press release.U.S. District Judge Gladys Kessler in Washington, D.C. granted an unopposed motion allowing the transfer of the Kool, Maverick, Salem and Winston brands to Imperial Tobacco Group Plc . Last month, the Federal Trade Commission approved Reynolds' purchase of Lorillard, which would combine the second- and third-largest U.S. tobacco companies, if they divested the four cigarette brands.Imperial is the fourth-largest tobacco company globally. Kessler authorized the transfer after being assured by tobacco companies that it would not affect television spots they air to correct previous deceptive advertisements. The judge is overseeing an unrelated case brought by the United States in 1999 that accused cigarette companies of being deceptive in marketing about the risks of cigarette smoking.Reynolds, which makes Camel and Pall Mall, said in July 2014 it would buy Lorillard, which makes Newport. Altria Group , which produces Marlboro cigarettes, remains the U.S. market leader.The case is U.S. v. Philip Morris USA Inc et al, U.S. District Court, District of Columbia, No. 99-02496.",2015-06-08,RAI,"Mon Jun 8, 2015 | 12:21pm EDT","Reynolds-Lorillard merger clears final hurdle, judge okays brand transfer",http://www.reuters.com//article/lorillard-ma-reynolds-amricn-idUSL1N0YU19620150608?type=companyNews,0.7783,0.03,0.904,0.066
62,"  June 8 Imperial Tobacco Group Plc :* Imperial Tobacco subsidiary receives court approval for transaction with Reynolds American Inc * United States district court for District of Columbia has now approved sale of acquired US cigarette brands to ITG Brands, LLC  * Now anticipates completing transaction on 12 June 2015, subject to satisfaction of remaining closing conditions.  Source text for Eikon:  Further company coverage:    (Bengaluru Newsroom; +44 207 542 1810)",2015-06-08,RAI,"Mon Jun 8, 2015 | 12:14pm EDT",BRIEF-Imperial Tobacco unit gets court nod for Reynolds American transaction,http://www.reuters.com//article/idUSFWN0YU07A20150608?type=companyNews,0.9337,0.0,0.804,0.196
63,"  WASHINGTON, June 8 Reynolds American Inc  on Monday cleared the final hurdle for its roughly $27.4 billion purchase of smaller rival Lorillard Inc as a federal judge approved its request to sell several cigarette brands.The companies expect to close on June 12, they said in a press release.U.S. District Judge Gladys Kessler in Washington, D.C. granted an unopposed motion allowing the transfer of the Kool, Maverick, Salem and Winston brands to Imperial Tobacco Group Plc .Last month, the Federal Trade Commission approved Reynolds' purchase of Lorillard, which would combine the second- and third-largest U.S. tobacco companies, if they divested the four cigarette brands. Imperial is the fourth-largest tobacco company globally. Kessler authorized the transfer after being assured by tobacco companies that it would not affect television spots they air to correct previous deceptive advertisements.The judge is overseeing an unrelated case brought by the United States in 1999 that accused cigarette companies of being deceptive in marketing about the risks of cigarette smoking. Reynolds, which makes Camel and Pall Mall, said in July 2014 it would buy Lorillard, which makes Newport. Altria Group , which produces Marlboro cigarettes, remains the U.S. market leader.The case is U.S. v. Philip Morris USA Inc et al, U.S. District Court, District of Columbia, No. 99-02496.       (Reporting by Diane Bartz; Editing by Alan Crosby)",2015-06-08,RAI,"Mon Jun 8, 2015 | 12:06pm EDT","Reynolds-Lorillard merger clears final hurdle, judge okays brand transfer",http://www.reuters.com//article/lorillard-ma-reynolds-amricn-idUSL1N0YU13E20150608?type=companyNews,0.7783,0.029,0.908,0.063
64,"   By Jilian Mincer | NEW YORK  NEW YORK Frustrated by the slow pace of federal action, state attorneys general are waging their own campaigns against the sale and advertising of e-cigarettes to minors.More than a dozen AGs, including those in New York, California, Indiana and Ohio, are using new state and local laws - some of which they helped craft - to put pressure on the industry at all levels, from neighborhood vape shops to big tobacco companies like Altria Group (MO.N) and Reynolds American Inc (RAI.N). Much of the campaign so far has involved threats to sue violators or appeals to a company's sense of responsibility, though some lawsuits have been filed, too.    State actions have accelerated in the wake of government data released in April, which showed that teen use of e-cigarettes tripled in 2014 alone, making them more common for youngsters than tobacco. “The key is to avoid another generation being addicted to nicotine,” Indiana Attorney General Greg Zoeller said in an interview. State attorneys general played a pivotal role during the 1990s in battling tobacco companies over conventional cigarettes. The Master Settlement Agreement (MSA), an accord reached in November 1998 between the state attorneys general of 46 states, five U.S. territories, the District of Columbia and the five largest tobacco companies, resulted in significant changes to cigarette marketing and required the tobacco industry to pay the states about $10 billion annually for the indefinite future.FEDERAL ACTION URGED Nearly a year ago, a group of AGs asked the U.S. Food and Drug Administration to take a tougher line on e-cigarettes, the risks and benefits of which are still being studied.  In April of 2014, the agency proposed banning the sale of e-cigarettes to people under the age of 18, but did not recommend prohibiting advertising, flavored products or online sales – all of which help make the devices attractive to youngsters, according to public health advocates.The FDA proposal has been under review ever since, which has meant that vaping remains legal for youths in states that haven't passed laws banning it. The agency is likely to finalize its new e-cigarette regulations later this summer, though it could be several years before the federal rules go into effect.  Federal regulations and the 1998 Master Settlement prohibit makers of conventional cigarettes from targeting youth and from advertising on television, billboards and mass transit, but the rules don’t apply to e-cigarettes.So far, however, 46 states have passed laws banning their sale to minors. Twelve of those states have also passed laws requiring child-proof packaging for e-liquids and e-cigarettes, according to the Campaign for Tobacco-Free Kids.AGs are using these laws, as well as others not directly tied to e-cigarettes, to force companies to drop ads appealing to teens, switch to child-proof packaging and spend thousands of dollars on more vigilant age verification systems for their websites and online deliveries.In June, New York Attorney General Eric Schneiderman announced settlements with four companies that were not complying with the state’s rule about child resistant packaging for nicotine liquids.  Reuters spoke with more than 10 e-cigarette and vaping companies - including Reynolds American, which sells Vuse, and Altria Group, which sells MarkTen and Green Smoke – that acknowledged they have been contacted by state law enforcers or by the National Associations of Attorneys General. Reynolds and Altria say their brands were not in violation of local laws.  COORDINATING EFFORTS Some of the AGs have coordinated their efforts. One group is pressuring certain e-cigarette manufacturers and vendors to limit ads that appeal to teens, especially on company websites and places like YouTube. Ohio Attorney General Mike DeWine, along with colleagues from several other states, sent a letter in April to privately-held manufacturer NJOY, asking it to “immediately instruct YouTube to restrict” access to its advertisements to adults. NJOY said in an April letter to DeWine that more than 90 percent of the U.S. viewers who have watched its hosted YouTube videos are at least 18, and the company said it would suspend videos if that figure fell to 85 percent or less.  NJOY, which previously settled a case with California over allegations of targeting minors and deceptive marketing, would not comment further.California has sent letters to more than 150 e-cigarette and vaping companies in recent years “to encourage voluntary compliance with applicable state and federal laws,"" including a ban on sales to youth, according to documents reviewed by Reuters. The state is also pursuing companies that sell fruit- flavored vaping liquids that appeal to teens and those that make false or misleading statements in their advertisements. One letter sent by the state asked a manufacturer to quit claiming that “electronic cigarettes are one of the safest forms of nicotine available” and that “when you exhale, you are exhaling harmless water vapor.""“Many companies have taken some or all of our recommended steps,” said Kristin Ford, a spokeswoman for Attorney General Kamala Harris.AGs are paying particular attention to sales on websites, a popular source of vaping materials for teens, who trade information about which ones require little proof of age.Jan Verleur, CEO and co-founder of electronic cigarette company VMR Products, said his company changed its age verification system in some states after being contacted by a state AG. He estimated the cost per order would increase by about 50 cents, but would not say if VMR would absorb any of that. The company makes about half its sales online.“This is bad news for the smaller players and good news for the tobacco companies, whose business model relied on mass manufacturing, not personalized products,” said Philip Gorham, an equity analyst at Morningstar who covers consumer products.    (Reporting by Jilian Mincer; Editing by Michele Gershberg and Sue Horton)",2015-07-10,RAI,"Fri Jul 10, 2015 | 6:29am EDT","Exclusive: With feds slow to act, states target e-cigarette sales to minors",http://www.reuters.com//article/us-usa-ecigarettes-minors-idUSKCN0PK0C120150710?type=companyNews,0.9362,0.041,0.902,0.057
65,"  (Adds FDA statement, Reynolds American declining to comment and comment from ITG Brands)Aug 27 The U.S. Food and Drug Administration has warned the makers of Winston, Natural American Spirit and Nat Sherman cigarettes that they cannot claim their products are ""natural"" or ""additive-free"" without regulatory approval.The FDA first gained authority to regulate cigarettes in 2009, partly in reaction to the tobacco industry's misuse of terms such as ""mild"" and ""light"" to suggest those products were less dangerous.The FDA now requires any company seeking to claim that one tobacco product is less dangerous than another to prove it with scientific evidence. The agency said the products would need to obtain a ""modified risk"" tobacco product order before they can be described as ""natural"" and ""additive-free.""""The FDA's job is to ensure tobacco products are not marketed in a way that leads consumers to believe cigarettes with descriptors like 'additive-free' and 'natural' pose fewer health risks than other cigarettes, unless the claims have been scientifically supported,"" Mitch Zeller, director of the FDA's tobacco products division, said in a statement. On Monday roughly 30 health organizations, including the American Academy of Family Physicians, the American Heart Association and the American Thoracic Society wrote to the FDA urging it to take action against Reynolds American Inc  and its subsidiary, Santa Fe Natural Tobacco Co for the marketing of Natural American Spirit cigarettes.In their letter the anti-tobacco groups noted that sales of Natural American Spirit rose 86 percent between 2009 to 2014 while sales of all cigarettes nationally declined by 17 percent. ""We are pleased that the Food and Drug Administration today has taken action to protect the American public from deception,"" said Matthew Myers, president of the Campaign for Tobacco-Free Kids.Reynolds American and Sherman's 1400 Broadway NYC Ltd, maker of Nat Sherman cigarettes, said they had received the FDA's letter but declined to comment further. ITG Brands, maker of Winston, said in a statement the company disagrees with the FDA and believes its products comply with all state and federal regulations.""Winston has been marketed with its current packaging for more than 15 years and in compliance with an agreement entered into with the U.S. Federal Trade Commission,"" said the company, which is owned by Imperial Tobacco Group Plc. ""The statement that FDA objected to currently appears only on the carton of Winston and not on the pack or advertising for the brand.""(Reporting by Toni Clarke in Washington; Additional reporting by Natalie Grover in Bengaluru; Editing by Kirti Pandey and Lisa Shumaker)",2015-08-27,RAI,"Thu Aug 27, 2015 | 3:31pm EDT",UPDATE 1-U.S. FDA warns companies over 'natural' label on cigarettes,http://www.reuters.com//article/fda-tobacco-idUSL4N1125IC20150827?type=companyNews,0.8518,0.026,0.914,0.06
66,"  Aug 27 The U.S. Food and Drug Administration said it had issued warning letters to three tobacco product manufacturers, including the maker of Natural American Spirit cigarettes, over labels claiming the products were ""additive-free"" or ""natural"".This is the first time the FDA has pulled up companies for marketing tobacco products with ""modest-risk"" claims that are not backed by scientific evidence ratified by the health regulator.The Family Smoking Prevention and Tobacco Control Act of 2009 requires a company to get its modified risk tobacco product application approved by the FDA before claiming a product poses fewer health risks than other tobacco products. The FDA said on Thursday it issued warning letters to Santa Fe Natural Tobacco Co Inc, ITG Brands LLC and Sherman's 1400 Broadway N.Y.C. Ltd. (1.usa.gov/1JojVyS) Santa Fe Natural, which makes Natural American Spirit cigarettes, is owned by Reynolds American Inc. ITG Brands makes Winston cigarettes, while Sherman's 1400 manufactures Nat Sherman cigarettes.The companies have 15 working days to respond to the regulator.    (Reporting by Natalie Grover in Bengaluru; Editing by Kirti Pandey)",2015-08-27,RAI,"Thu Aug 27, 2015 | 1:25pm EDT",FDA warns 3 tobacco product makers over labeling,http://www.reuters.com//article/fda-tobacco-idUSL4N1125AF20150827?type=companyNews,0.7735,0.054,0.851,0.095
67,"   By Toni Clarke | WASHINGTON  WASHINGTON Reynolds American Inc can no longer sell Camel Crush Bold or three other cigarette products in the United States because they may be more dangerous than similar older cigarettes, the Food and Drug Administration said on Tuesday.The 2009 Tobacco Control Act requires that new cigarettes be reviewed by the FDA before being allowed on the market. No product introduced after Feb. 15, 2007 can carry a greater health risk when measured against an earlier, ""predicate"" product.The FDA found that the four Reynolds products, Camel Crush Bold, Pall Mall Deep Set Recessed Filter, Pall Mall Deep Set Recessed Filter Menthol and Vantage Tech 13 cigarettes, have different characteristics from their predicates that raise new health questions. R.J. Reynolds Tobacco Co, a unit of Reynolds American, said in a statement on Tuesday that it strongly disagreed with the FDA ruling and that the cigarette brands were ""not substantially equivalent"" to the older ones.The FDA has received thousands of marketing applications from companies seeking to keep selling currently marketed products and from companies seeking authorization to sell brand new products. Products introduced after Feb. 15, 2007 were allowed under the 2009 law to remain on the market on a provisional basis as long as the manufacturer submitted an application by March 22, 2011. The agency has authorized 257 applications and denied 113, Mitch Zeller, director of the FDA's tobacco products division told reporters on a conference call.The Reynolds ruling is the most high-profile to date and comes three weeks after the agency told Reynolds and two of its rivals they could not claim their products are ""natural"" or ""additive-free"" without regulatory approval. Reynolds sells Natural American Spirit cigarettes through its subsidiary, Santa Fe Natural Tobacco Co. Mitch Zeller, director of the FDA's tobacco division, told reporters on a conference call that the Reynolds products included increased yields of harmful or potentially harmful constituents, higher levels of menthol and the addition of new ingredients. The company could not show that the changes do not raise new health questions, he said.In the case of Camel Crush Bold, Reynolds also failed to show that the addition of a menthol capsule in the filter did not affect consumer perception and use.The FDA said it does not intend to enforce the ban on the Reynolds products for 30 days to allow retailers to get rid of their inventory.   (Additional reporting by Rosmi Shaji in Bengaluru)",2015-09-15,RAI,"Tue Sep 15, 2015 | 5:25pm EDT",U.S. FDA orders Reynolds to stop sales of 4 cigarette brands,http://www.reuters.com//article/reynolds-amricn-fda-idUSL1N11L1G220150915?type=companyNews,-0.5341,0.069,0.871,0.061
