,Article,Date,Symbol,Time,Title,Url,compound,neg,neu,pos
23,"  * FTSE 100 down 0.4 pct* Assessment of U.S. economy by Fed's Yellen subdues markets* Imperial Tobacco down, to buy assets from Reynolds/Lorillard* Housebuilders fall, UK inflation takes surprise jump* Weak German investor morale hurts broader sentimentBy Tricia WrightLONDON, July 15 Britain's top shares fell on Tuesday, held back by housebuilders on concern UK interest rates will soon rise, and big falls from Imperial Tobacco. Imperial Tobacco sank 3 percent, making it the top FTSE 100 decliner, following news that Reynolds American would buy rival Lorillard, and sell brands to the British cigarette maker to address antitrust issues.Reynolds said it would sell its Kool, Salem and Winston and Lorillard's Maverick and blu eCigs brands and other assets to Imperial Tobacco for $7.1 billion in cash.Following the announcement concerning the asset disposals, credit rating agency Fitch revised its outlook on Imperial Tobacco to negative from stable.""Fitch views positively the enlargement of Imperial's U.S. operations but at the same time notes that failure to enhance the cash flow generation and profit growth capability of its core European business would seriously impair credit metrics,"" Fitch said. Markets were also hit by comments from U.S. Federal Reserve Chair Janet Yellen to a Senate committee to the effect that the U.S. economic recovery is incomplete, justifying a loose monetary policy for the foreseeable future.Investors had been expecting a more upbeat assessment on the economy, strategists said.""While in the short term it will be seen as a positive that the Federal Reserve don't have to raise interest rates, we do know that underlying strength in the U.S. economy is important for companies and for profitability growth, and investors are reacting,"" said Henk Potts, equity strategist at Barclays. The FTSE 100 index was down by 0.4 percent at 6,720.43 points before the end of the trading day. It was also hampered by German investor morale data, which dropped to its lowest in 1 1/2 years in July.Shares in housebuilders, volatile in recent weeks, came under pressure as a report on Tuesday showed British inflation unexpectedly rose to a five-month high in June.Barratt Developments fell 2.1 percent. Mid-caps Redrow and Taylor Wimpey fell by 3.4 percent and 2.9 percent respectively.""The feeling seems to be that interest rates could potentially go up sooner than the market expects, given the way that the inflation data was reported,"" Manoj Ladwa, head of trading at TJM Partners, said.Housebuilders sold off in mid-June when Bank of England Governor Mark Carney said rates may rise sooner than markets were predicting. They recovered towards the end of the month when the BoE imposed measures aimed at curbing house prices that turned out to be more lenient than the builders had feared.Carney said on Tuesday the central bank's forward guidance was intended to signal how interest rates might change over the medium term, not pinpoint the timing of a first hike.     (Reporting by Tricia Wright; Editing by Larry King)",2014-07-15,RAI,"Tue Jul 15, 2014 | 11:32am EDT","UK's FTSE falls, held back by housebuilders, Imperial Tobacco",http://www.reuters.com//article/markets-britain-stocks-idUSL6N0PQ4QH20140715?type=companyNews,0.9862,0.045,0.84,0.115
24,"   By Martinne Geller | LONDON  LONDON Imperial Tobacco Group Plc IMT.L plans to buy the leading U.S. e-cigarette brand blu as part of its $7.1 billion acquisition of U.S. cigarette brands, being sold as part of Reynolds American Inc's (RAI.N) $27.4 billion purchase of Lorillard Inc LO.N. Imperial's purchase, meant to address potential antitrust objections to the marriage of the United States' No. 2 and No. 3 tobacco firms, also includes Maverick, Salem as well as the international and U.S. rights to blu e-cigarettes, which control nearly half of the U.S. e-cigarette market.Analysts had not expected the blu brand to be part of Imperial's haul from the deal, plans for which were first reported by Reuters in May.""Blu was probably the sweetener that persuaded them to pick up what can probably most politely be described as third-tier brands,"" said Philip Gorham, an analyst with research firm Morningstar.After adjusting for the present value of tax benefits, expected at $1.5 billion, Imperial said the net price of $5.6 billion implied a multiple of 6.9 times the brands' core earnings or EBITDA. This was ""very much at the low end"" of multiples for tobacco deals, said Imperial Chief Executive Officer Alison Cooper on a conference call.""It's a very good deal,"" Cooper said, noting it would take Imperial from having only 3 percent of the U.S. market with its USA Gold brand to 10 percent, transforming Imperial ""from a distant No. 5 to a significant No. 3."" By contrast, Reynolds, maker of Camel cigarettes, is buying Newport-maker Lorillard for $27.4 billion, or about 13 times 2013 core earnings.  Imperial will be indemnified against any historic product liabilities, potentially an important factor given past litigation against cigarette makers. ""We're buying assets, not companies,"" said Chief Financial Officer Oliver Tant. There has also been speculation that Imperial itself could be a takeover target for the likes of British American Tobacco Plc (BATS.L) and Japan Tobacco Inc (2914.T) in a consolidation of the global tobacco industry. Yet Imperial's Cooper said she thought Reynolds' purchase of Lorillard was very specific to the U.S. market.""It's probably not translatable to anything more global,"" Cooper said.  Imperial shares were down 3.8 percent at 2635 pence at 1600 GMT. (Editing by Jane Merriman and David Holmes)",2014-07-15,RAI,"Tue Jul 15, 2014 | 11:08am EDT",Imperial Tobacco to buy US cigarette brands for $7.1 billion,http://www.reuters.com//article/us-imperial-tobacco-brands-idUSKBN0FK1A920140715?type=companyNews,0.8357,0.038,0.901,0.061
25,"  (Repeat for additional subscribers)July 15 (The following statement was released by the rating agency)Fitch Ratings has affirmed British American Tobacco  p.l.c.'s (BAT) Long-term Issuer Default Rating (IDR) and senior unsecured rating  at 'A-'. The Short-term IDR has also been affirmed at 'F2'. The Outlook is  Stable.In addition, the senior unsecured long-term rating of debt issued by BAT's  subsidiaries, British American Tobacco Holdings (The Netherlands) B.V., B.A.T.  International Finance p.l.c. and B.A.T. Capital Corporation, has been affirmed  at 'A-'. The short-term debt rating has been affirmed at 'F2'.The affirmation follows BAT's announcement that it will contribute USD4.7bn  (GBP2.7bn) capital to funding the acquisition by its associate Reynolds American  Inc (RAI) of rival US player Lorillard Inc. through a cash and equity offer. BAT  will in turn raise this from internal resources and borrowings, which Fitch  believes will keep leverage, through to at least end-2015, at a level well  beyond the maximum compatible with BAT's 'A-' rating. However, the impact of  higher leverage is, in Fitch's view, sufficiently mitigated by BAT's decision to  suspend its share buyback programme with effect from end July-2014 and by the  future benefits of a strengthened RAI, in which BAT has a 42% stake.KEY RATING DRIVERS Stronger US AssociateThe transaction will transform the US tobacco market by consolidating the number  two and number three players in the industry into a more robust competitor to  the strong leader Altria, Inc (BBB+/Stable). The new RAI will, after adjusting  for the asset disposal envisaged, enjoy a stronger market share of above 30%,  and a highly focused and easier to manage brand portfolio. It will also enjoy  substantial cost synergies resulting from the back-to-back divestment of  Lorillard's manufacturing, sales force and head office. BAT will indirectly  benefit from RAI's enhanced profitability through the likely maintenance of a  high dividend pay-out of 75% by its US associate. Share Buyback SuspensionThe imminent suspension of BAT's share buyback - which we assume to last until  at least end-2015 - helps BAT build sufficient headroom ahead of the transaction  and minimise the adverse effect from the planned USD4.7bn (GBP2.7bn) capital  disbursement. Post completion in 2015, this should help contain funds from  operations (FFO)-based net leverage to no more than 2013's 2.3x. Despite scope  for organic profit growth in 2014 we expect pre-completion leverage to remain  around 2.0x as a result of foreign currency headwinds. We project net leverage  should return to around 2.0x from 2016, on the assumption that the share buyback  remains suspended.Tight Rating Headroom The above mentioned leverage is beyond the level compatible with BAT's 'A-'.  This is mitigated by BAT's strong global market position in a consolidated and  highly cash-generative industry. The ratings are also supported by the group's  stable and substantial profits and cash flow from operations (2013: GBP4.1bn),  as reflected in our projection of a free cash flow margin of 5%-6% and a healthy  EBITDA margin of over 40% from 2014.Stable Business ProfileThe ratings continue to reflect BAT's position as a leading international  tobacco company, supported by the diversity of its portfolio of brands and of  the countries it operates in. BAT's superior geographical diversity, which Fitch  estimates to include over 50% of profits coming from high-growth emerging  markets, continues to enable it to protect profits through price increases and  cost rationalisation in an industry that is facing declining consumption and the  penetration of illicit trade. These dynamics have accelerated over the past 18  months, particularly in the European Union and Australia. RATING SENSITIVITIES Negative: Future developments that may, individually or collectively, lead to a  negative rating action include:- FFO-adjusted net leverage above 2.0x on a sustained basis (FYE13: 2.3x)- FCF (adjusted for working capital swings) falling below GBP500m as a result of  litigation or dividend distributions (FY13: GBP660m)- FFO fixed charge cover under 6.0x (FYE13: 7.0x)- A deteriorating operating profile, as evidenced by impaired organic profit  growth capability,resulting from weak pricing power and lack of cost rationalisation to offset  volume contractionPositive: Fitch does not currently expect BAT to pursue financial policies  consistent with an upgrade.",2014-07-15,RAI,"Tue Jul 15, 2014 | 9:05am EDT",RPT-Fitch Affirms British American Tobacco p.l.c. at 'A-'/'F2'; Outlook Stable,http://www.reuters.com//article/fitch-affirms-british-american-tobacco-p-idUSFit70866020140715?type=companyNews,0.9961,0.045,0.811,0.144
26,"  (Repeat for additional subscribers)July 15 (The following statement was released by the rating agency)Fitch Ratings has revised the Outlook on Imperial Tobacco Group PLC's (Imperial) Long-term Issuer Default Rating (IDR) to Negative from Stable and affirmed the IDR and senior unsecured rating at 'BBB'. The Short-term IDR has been affirmed at 'F3'. The senior unsecured ratings of the debt of Imperial's subsidiaries, Imperial Tobacco Finance PLC and Altadis Emisiones Financieras have also been affirmed at 'BBB'.The rating actions follow the announcement by Imperial that it intends to  acquire for USD7.1bn (GBP4.2bn) the assets that US tobacco companies Reynolds  American Inc. and Lorillard Inc. ('BBB'/Stable) will divest once they complete  the transaction they announced today. Fitch views positively the enlargement of  Imperial's US operations but at the same time notes that failure to enhance the  cash flow generation and profit growth capability of its core European business  would seriously impair credit metrics. The revision of the Outlook to Negative  reflects the combination of on-going challenges being faced by the existing  operations of Imperial and the anticipated increase of leverage resulting from  the acquisition.KEY RATING DRIVERS Stronger Operating ProfileThe acquisition will significantly enhance Imperial's US business, giving it a  number 3 position with a cigarette market share of 10% (currently 3%), a more  substantial portfolio that would be well diversified by pricing point, and a  national-reaching distribution platform. This should benefit Imperial's access  to shelf space and its negotiating power with retailers, as well as its existing  cigarette and cigar portfolio. Imperial will also acquire the number 1  e-cigarette brand in the US, blu. This will strengthen its ability to compete in  the EU e-cigarette market. Consequently, we expect Imperial's profitability and  diversification to grow and its reliance on the EU to reduce to approximately  55% of operating profits (63% in FY13).Weak EU MarketThe company's operating profile started to deteriorate in 2013 due to its  heavier-than-peer exposure to the declining EU tobacco market. Fragile consumer  spending in southern Europe and the increase in illicit trade affected  Imperial's consolidated volume performance to a point where price increases were  only just able to offset volume declines. In FY13 consolidated volumes dropped  by 7%, tobacco net revenues declined by 1% and total adjusted operating profit  grew by just 1% in organic terms. Performance in 1H14 worsened with tobacco net  revenue and adjusted operating profit down by 5% and volumes dropped by 8%  compared with 1H13. We therefore believe there is a risk that for some time  Imperial may not be able to defend its overall profits in this environment.Strategy to Tackle Existing BusinessManagement is enacting several initiatives to tackle these challenges and  strengthen the existing business which, if successful, would support Imperial's  credit risk profile. These include a stock optimisation and a cost  rationalisation programme, brand migration and working capital initiatives. The  major part of the 1H14 underperformance is deliberate and linked to the  implementation of the stock optimisation programme which will consequently  curtail FY14 profit growth. Management also forecasts cash inflows from its  working capital initiatives in FY15 and FY16. Execution Risks in Existing BusinessWhile these key initiatives are in support of Imperial's long-term goals, they  carry execution risks, especially when benefits will only start to feed through  fully in FY15, when completion of the acquisition is expected to take place.  Failure of these initiatives to deliver successful results and to support an  improvement of credit metrics ahead of the completion of the transaction could  lead to a downgrade.Moderate Risks to US StrategyAlthough the integration risk of the acquired assets in the US is not high, we  believe there could be some execution risk to Imperial's growth ambitions.  Imperial expects to improve profits and increase its market share over time. We  believe market share increases are achievable but there is a risk this could be  at the expense of price. In addition, Imperial will gain two menthol brands -  Kool and Salem in the US. Although menthol cigarettes enjoy a less severe volume  decline rate compared with traditional cigarettes, we note the on-going debate  over their possible ban. Leverage Beyond Rating GuidanceLease adjusted net debt/FFO rose in FY13 to 4.1x and Fitch projects leverage  could peak at above 4.5x in FY15 (at closing of acquisition) before reducing  only to approximately 3.7x in FY17, a level still above the threshold compatible  for the 'BBB' rating. Our net debt figure now includes an adjustment of  approximately GBP400m to cash in order to exclude cash held in countries from  which repatriation is slow or restricted, or that forms collateral. However,  should Imperial deliver the benefits of its different initiatives to enhance  cash flow generation and return to profit growth as planned over FY15 to FY17,  there is a chance that leverage will reduce more quickly and that the Outlook  will be revised back to Stable.Top Four Tobacco CompanyThe IDR continues to reflect Imperial's position as one of the four largest  global tobacco players (possibly moving from fourth to third place following the  transaction) and benefits from a portfolio of mid- to low-priced cigarette  brands and make-your-own products, which provides advantages in the high-price  environments of its core markets. This is despite it being less geographically  diversified than the bigger global players British American Tobacco (A-/Stable)  and Philip Morris International Inc (A/Stable). Imperial's 'BBB' IDR reflects  its size, brands and strength in the consolidated global tobacco industry, with  strong positions in the cash-generative UK, German and French markets. RATING SENSITIVITIES Negative (Downgrade to BBB-): Future developments that could lead to a negative  rating action include:-Failure by existing business to maintain at least low single digit organic  revenue growth in FY15.-Failure by existing business in executing the recovery of EBITDA margin back to  2013 level (42.5%; calculated against FY13 economic revenues of GBP14.7bn) in  FY15.-FFO net leverage remaining persistently above 3.5x even after the second full  year of closing (FY17 in our projections).-Fixed charge cover ratio below 4.0x.-Annual FCF margin dropping below 3%.Positive (revision of the Outlook to Stable): Future developments that could  lead to a positive rating action include:-FFO net leverage dropping below 3.5x.-FFO fixed charge cover ratio above 4.0x.-Evidence showing the recovery of standalone business with EBITDA margins  improving and trending towards 43%.-Sustainable FCF generation of at least GBP600m over FY14 and FY15.",2014-07-15,RAI,"Tue Jul 15, 2014 | 9:01am EDT",RPT-Fitch Revises Outlook on Imperial Tobacco Group PLC to Negative; Affirms at 'BBB',http://www.reuters.com//article/fitch-revises-outlook-on-imperial-tobacc-idUSFit70884320140715?type=companyNews,0.9989,0.066,0.769,0.165
27,"   By Alasdair Reilly | LONDON  LONDON British cigarette maker Imperial Tobacco IMT.L is set to launch loans totaling $13.1 billion to back its acquisition of selected brands and assets from Reynolds American Inc (RAI.N), the lead banks said in a statement on Friday.The deal is the second-biggest acquisition loan of the year in Europe, the Middle East and Africa, after a $14.2 billion loan for Bayer BAyGn.DE, which financed its acquisition of US-based Merck's (MRK.N) consumer care business, according to Thomson Reuters LPC data. It is also the biggest loan of the year so far for a UK company, the data shows. The jumbo financing will cover the $7.1 billion acquisition and refinance Imperial’s existing core bank borrowings, which provide working capital and funds for general corporate purposes.Imperial agreed to acquire a portfolio of U.S. cigarette brands, Winston, Maverick, Kool, Salem and U.S. and international e-cigarette brand blu from Reynolds on Tuesday after Reynolds announced its merger with Lorrilard. Imperial will also take over Lorrilard's national sales force, offices and production facilities. The financing has been underwritten equally by bookrunners and mandated lead arrangers BNP Paribas Fortis, Royal Bank of Scotland and Banco Santander. Royal Bank of Scotland is also facility agent on the transaction.The acquisition financing includes a $4.1 billion term loan with a one-year maturity and a one-year extension option; a $1.5 billion, three-year term loan and a $1.5 billion, five-year  term loan. The refinancing and working capital facilities include a 1 billion euro ($1.35 billion) revolving credit facility with a maturity of 18 months and three six-month extension options and a 2.835 billion euro, five-year revolving credit with two one-year extension options.A 500 million pounds ($854.55 million) five-year revolving credit with two one-year extension options is also included.  BBB/Baa3 rated Imperial expects to maintain an investment grade credit rating on its debt after the acquisition. The company may refinance all or some of the loans before the acquisition closes, which is expected in six to nine months. Imperial has suspended a share buy-back program of 500 million pounds a year to speed its debt repayment. Imperial's core bank facility was a 2.458 billion pounds -equivalent revolving credit that was due to mature in December 2015. The financing was originally arranged in December 2010 via bookrunners Barclays and Royal Bank of Scotland.That deal comprised a $632 million facility, a 600 million  facility and a 1.785 billion euro facility, all of which paid margins of 100 basis points (bps) over Libor/Euribor. The new loan has allowed Imperial to reduce its overall funding cost as the refinancing element was agreed at lower  pricing to the existing facilities, Imperial said on Tuesday.($1 = 0.7394 Euros)($1 = 0.5851 British Pounds) (Editing by Tessa Walsh)",2014-07-18,RAI,"Fri Jul 18, 2014 | 8:11am EDT",Imperial Tobacco set to launch $13.1 billion of loans,http://www.reuters.com//article/us-imperial-loans-idUSKBN0FN1DV20140718?type=companyNews,0.93,0.023,0.917,0.06
28,"   By Alasdair Reilly | LONDON, July 18  LONDON, July 18 British cigarette maker Imperial Tobacco is set to launch loans totalling $13.1 billion to back its acquisition of selected brands and assets from Reynolds American Inc, the lead banks said in a statement on Friday.The deal is the second-biggest acquisition loan of the year in Europe, the Middle East and Africa, after a $14.2 billion loan for Bayer, which financed its acquisition of US-based Merck's consumer care business, according to Thomson Reuters LPC data.It is also the biggest loan of the year so far for a UK company, the data shows.The jumbo financing will cover the $7.1 billion acquisition and refinance Imperial's existing core bank borrowings, which provide working capital and funds for general corporate purposes.Imperial agreed to acquire a portfolio of U.S. cigarette brands, Winston, Maverick, Kool, Salem and U.S. and international e-cigarette brand blu from Reynolds on Tuesday after Reynolds announced its merger with Lorrilard.Imperial will also take over Lorrilard's national sales force, offices and production facilities. The financing has been underwritten equally by bookrunners and mandated lead arrangers BNP Paribas Fortis, Royal Bank of Scotland and Banco Santander.Royal Bank of Scotland is also facility agent on the transaction.The acquisition financing includes a $4.1 billion term loan with a one-year maturity and a one-year extension option; a $1.5 billion, three-year term loan and a $1.5 billion, five-year  term loan. The refinancing and working capital facilities include a 1 billion euro ($1.35 billion) revolving credit facility with a maturity of 18 months and three six-month extension options and a 2.835 billion euro, five-year revolving credit with two one-year extension options.A 500 million pounds ($854.55 million) five-year revolving credit with two one-year extension options is also included.BBB/Baa3 rated Imperial expects to maintain an investment grade credit rating on its debt after the acquisition. The company may refinance all or some of the loans before the acquisition closes, which is expected in six to nine months.Imperial has suspended a share buy-back programme of 500 million pounds a year to speed its debt repayment.Imperial's core bank facility was a 2.458 billion pounds -equivalent revolving credit that was due to mature in December 2015. The financing was originally arranged in December 2010 via bookrunners Barclays and Royal Bank of Scotland.That deal comprised a $632 million facility, a 600 million  facility and a 1.785 billion euro facility, all of which paid margins of 100 basis points (bps) over Libor/Euribor.The new loan has allowed Imperial to reduce its overall funding cost as the refinancing element was agreed at lower  pricing to the existing facilities, Imperial said on Tuesday. ($1 = 0.7394 Euros) ($1 = 0.5851 British Pounds)   (Editing by Tessa Walsh)",2014-07-18,RAI,"Fri Jul 18, 2014 | 8:01am EDT",RLPC-Imperial Tobacco set to launch $13.1 bln of loans,http://www.reuters.com//article/imperial-loans-idUSL6N0PT3F720140718?type=companyNews,0.93,0.023,0.916,0.061
